closed/AMD/src/wan-2.2-t2v-a14b/miopen/gfx950100.HIP.3_5_1_fc29218849.ufdb.txt
16-21-102-78-1x1x1-16-21-102-78-1-0x0x0-1x1x1-1x1x1-0-NCDHW-FP32-F=ConvHipImplicitGemm3DGroupFwdXdlops:0.0361606,21386752,miopenConvolutionFwdAlgoImplicitGEMM;GemmFwd1x1_0_1:0.0355305,0,miopenConvolutionFwdAlgoGEMM;ConvDirectNaiveConvFwd:5.17667,0,miopenConvolutionFwdAlgoDirect
16-3-140-106-3x3x3-384-1-138-104-1-0x0x0-1x1x1-1x1x1-0-NCDHW-FP32-F=ConvHipImplicitGemm3DGroupFwdXdlops:0.0913743,25557504,miopenConvolutionFwdAlgoImplicitGEMM;GemmFwdRest:0.098793,24800256,miopenConvolutionFwdAlgoGEMM;ConvDirectNaiveConvFwd:4.40981,0,miopenConvolutionFwdAlgoDirect
192-1-412-312-1x1x1-384-1-412-312-1-0x0x0-1x1x1-1x1x1-0-NCDHW-FP32-F=ConvHipImplicitGemm3DGroupFwdXdlops:0.399101,296460288,miopenConvolutionFwdAlgoImplicitGEMM;GemmFwd1x1_0_1:0.183702,0,miopenConvolutionFwdAlgoGEMM;ConvDirectNaiveConvFwd:46.8677,0,miopenConvolutionFwdAlgoDirect
192-3-278-210-3x3x3-384-1-276-208-1-0x0x0-1x1x1-1x1x1-0-NCDHW-FP32-F=ConvHipImplicitGemm3DGroupFwdXdlops:2.17021,230648832,miopenConvolutionFwdAlgoImplicitGEMM;GemmFwdRest:3.05958,1190412288,miopenConvolutionFwdAlgoGEMM;ConvDirectNaiveConvFwd:237.713,0,miopenConvolutionFwdAlgoDirect
192-3-826-626-3x3x3-192-1-824-624-1-0x0x0-1x1x1-1x1x1-0-NCDHW-FP32-F=ConvHipImplicitGemm3DGroupFwdXdlops:9.09331,1590211584,miopenConvolutionFwdAlgoImplicitGEMM;GemmFwdRest:20.7348,10661953536,miopenConvolutionFwdAlgoGEMM;ConvDirectNaiveConvFwd:2213.31,0,miopenConvolutionFwdAlgoDirect
192-1104-832-3x3-96-1104-832-1-1x1-1x1-1x1-0-NCHW-FP32-F=ConvBinWinogradRxSf2x3g1:2.78644,0,miopenConvolutionFwdAlgoWinograd;ConvBinWinogradRxSf3x2:4.54822,0,miopenConvolutionFwdAlgoWinograd;ConvHipImplicitGemmGroupFwdXdlops:3.80265,1058807808,miopenConvolutionFwdAlgoImplicitGEMM;ConvAsmImplicitGemmGTCDynamicFwdXdlopsNHWC:3.5942,1058807808,miopenConvolutionFwdAlgoImplicitGEMM;GemmFwdRest:5.11746,6348865536,miopenConvolutionFwdAlgoGEMM;ConvDirectNaiveConvFwd:1348.3,0,miopenConvolutionFwdAlgoDirect
192-553-417-3x3-192-276-208-1-0x0-2x2-1x1-0-NCHW-FP32-F=ConvBinWinogradRxSf2x3g1:1.28637,0,miopenConvolutionFwdAlgoWinograd;ConvBinWinogradRxSf3x2:0.642961,0,miopenConvolutionFwdAlgoWinograd;ConvHipImplicitGemmGroupFwdXdlops:0.507585,222518016,miopenConvolutionFwdAlgoImplicitGEMM;ConvAsmImplicitGemmGTCDynamicFwdXdlopsNHWC:0.473102,222518016,miopenConvolutionFwdAlgoImplicitGEMM;GemmFwdRest:0.670213,396804096,miopenConvolutionFwdAlgoGEMM;ConvDirectNaiveConvFwd:72.581,0,miopenConvolutionFwdAlgoDirect
192-825-625-3x3-192-412-312-1-0x0-2x2-1x1-0-NCHW-FP32-F=ConvBinWinogradRxSf2x3g1:2.79174,0,miopenConvolutionFwdAlgoWinograd;ConvBinWinogradRxSf3x2:1.36026,0,miopenConvolutionFwdAlgoWinograd;ConvHipImplicitGemmGroupFwdXdlops:1.02117,496048896,miopenConvolutionFwdAlgoImplicitGEMM;ConvAsmImplicitGemmGTCDynamicFwdXdlopsNHWC:1.0086,496048896,miopenConvolutionFwdAlgoImplicitGEMM;GemmFwdRest:1.41218,888496128,miopenConvolutionFwdAlgoGEMM;ConvDirectNaiveConvFwd:188.226,0,miopenConvolutionFwdAlgoDirect
3-3-1106-834-3x3x3-96-1-1104-832-1-0x0x0-1x1x1-1x1x1-0-NCDHW-FP32-F=ConvHipImplicitGemm3DGroupFwdXdlops:0.636084,385952768,miopenConvolutionFwdAlgoImplicitGEMM;GemmFwdRest:0.706385,297603072,miopenConvolutionFwdAlgoGEMM;ConvDirectNaiveConvFwd:54.4063,0,miopenConvolutionFwdAlgoDirect
3-3-1650-1250-3x3x3-96-1-1648-1248-1-0x0x0-1x1x1-1x1x1-0-NCDHW-FP32-F=ConvHipImplicitGemm3DGroupFwdXdlops:1.32416,864055808,miopenConvolutionFwdAlgoImplicitGEMM;GemmFwdRest:1.53281,666372096,miopenConvolutionFwdAlgoGEMM;ConvDirectNaiveConvFwd:129.847,0,miopenConvolutionFwdAlgoDirect
3-6-1106-834-3x3x3-96-4-1104-832-1-0x0x0-1x1x1-1x1x1-0-NCDHW-FP32-F=ConvHipImplicitGemm3DGroupFwdXdlops:2.30512,1477303552,miopenConvolutionFwdAlgoImplicitGEMM;GemmFwdRest:2.64199,1190412288,miopenConvolutionFwdAlgoGEMM;ConvDirectNaiveConvFwd:227.108,0,miopenConvolutionFwdAlgoDirect
3-6-818-626-3x3x3-96-4-816-624-1-0x0x0-1x1x1-1x1x1-0-NCDHW-FP32-F=ConvHipImplicitGemm3DGroupFwdXdlops:1.29532,819006976,miopenConvolutionFwdAlgoImplicitGEMM;GemmFwdRest:1.5103,659902464,miopenConvolutionFwdAlgoGEMM;ConvDirectNaiveConvFwd:120.482,0,miopenConvolutionFwdAlgoDirect
32-21-102-78-1x1x1-32-21-102-78-1-0x0x0-1x1x1-1x1x1-0-NCDHW-FP32-F=ConvHipImplicitGemm3DGroupFwdXdlops:0.0580882,42775552,miopenConvolutionFwdAlgoImplicitGEMM;GemmFwd1x1_0_1:0.0433738,0,miopenConvolutionFwdAlgoGEMM;ConvDirectNaiveConvFwd:10.0869,0,miopenConvolutionFwdAlgoDirect
32-21-138-104-1x1x1-32-21-138-104-1-0x0x0-1x1x1-1x1x1-0-NCDHW-FP32-F=ConvHipImplicitGemm3DGroupFwdXdlops:0.077361,77160448,miopenConvolutionFwdAlgoImplicitGEMM;GemmFwd1x1_0_1:0.0696968,0,miopenConvolutionFwdAlgoGEMM;ConvDirectNaiveConvFwd:18.1275,0,miopenConvolutionFwdAlgoDirect
32-21-206-156-1x1x1-32-21-206-156-1-0x0x0-1x1x1-1x1x1-0-NCDHW-FP32-F=ConvHipImplicitGemm3DGroupFwdXdlops:0.175316,172767232,miopenConvolutionFwdAlgoImplicitGEMM;GemmFwd1x1_0_1:0.145368,0,miopenConvolutionFwdAlgoGEMM;ConvDirectNaiveConvFwd:41.0084,0,miopenConvolutionFwdAlgoDirect
36-21-206-156-1x2x2-5120-21-103-78-1-0x0x0-1x2x2-1x1x1-0-NCDHW-FP32-F=ConvHipImplicitGemm3DGroupFwdXdlops:6.13173,3555391232,miopenConvolutionFwdAlgoImplicitGEMM;GemmFwdRest:2.79422,97179264,miopenConvolutionFwdAlgoGEMM;ConvDirectNaiveConvFwd:118.641,0,miopenConvolutionFwdAlgoDirect
384-3-140-106-3x3x3-384-1-138-104-1-0x0x0-1x1x1-1x1x1-0-NCDHW-FP32-F=ConvHipImplicitGemm3DGroupFwdXdlops:1.2518,106352640,miopenConvolutionFwdAlgoImplicitGEMM;GemmFwdRest:1.74992,595206144,miopenConvolutionFwdAlgoGEMM;ConvDirectNaiveConvFwd:117.932,0,miopenConvolutionFwdAlgoDirect
384-3-206-158-3x3x3-384-1-204-156-1-0x0x0-1x1x1-1x1x1-0-NCDHW-FP32-F=ConvHipImplicitGemm3DGroupFwdXdlops:2.25696,214788096,miopenConvolutionFwdAlgoImplicitGEMM;GemmFwdRest:3.47426,1319804928,miopenConvolutionFwdAlgoGEMM;ConvDirectNaiveConvFwd:264.249,0,miopenConvolutionFwdAlgoDirect
384-3-208-158-3x3x3-384-1-206-156-1-0x0x0-1x1x1-1x1x1-0-NCDHW-FP32-F=ConvHipImplicitGemm3DGroupFwdXdlops:2.21288,216723456,miopenConvolutionFwdAlgoImplicitGEMM;GemmFwdRest:3.56287,1332744192,miopenConvolutionFwdAlgoGEMM;ConvDirectNaiveConvFwd:268.512,0,miopenConvolutionFwdAlgoDirect
384-4-206-158-3x3x3-384-2-204-156-1-0x0x0-1x1x1-1x1x1-0-NCDHW-FP32-F=ConvHipImplicitGemm3DGroupFwdXdlops:4.28306,313663488,miopenConvolutionFwdAlgoImplicitGEMM;GemmFwdRest:6.80603,2639609856,miopenConvolutionFwdAlgoGEMM;ConvDirectNaiveConvFwd:561.622,0,miopenConvolutionFwdAlgoDirect
384-4-414-314-3x3x3-384-2-412-312-1-0x0x0-1x1x1-1x1x1-0-NCDHW-FP32-F=ConvHipImplicitGemm3DGroupFwdXdlops:16.7698,1209507840,miopenConvolutionFwdAlgoImplicitGEMM;GemmFwdRest:27.3863,10661953536,miopenConvolutionFwdAlgoGEMM;ConvDirectNaiveConvFwd:2268.27,0,miopenConvolutionFwdAlgoDirect
384-552-416-3x3-192-552-416-1-1x1-1x1-1x1-0-NCHW-FP32-F=ConvBinWinogradRxSf2x3g1:2.91878,0,miopenConvolutionFwdAlgoWinograd;ConvBinWinogradRxSf3x2:4.56496,0,miopenConvolutionFwdAlgoWinograd;ConvHipImplicitGemmGroupFwdXdlops:2.99746,531726336,miopenConvolutionFwdAlgoImplicitGEMM;ConvAsmImplicitGemmGTCDynamicFwdXdlopsNHWC:2.66456,531726336,miopenConvolutionFwdAlgoImplicitGEMM;GemmFwdRest:4.11707,3174432768,miopenConvolutionFwdAlgoGEMM;ConvDirectNaiveConvFwd:662.572,0,miopenConvolutionFwdAlgoDirect
96-3-1650-1250-3x3x3-3-1-1648-1248-1-0x0x0-1x1x1-1x1x1-0-NCDHW-FP32-F=ConvHipImplicitGemm3DGroupFwdXdlops:11.4258,2400711680,miopenConvolutionFwdAlgoImplicitGEMM;ConvDirectNaiveConvFwd:4706.42,0,miopenConvolutionFwdAlgoDirect
96-4-824-624-1x1x1-192-4-824-624-1-0x0x0-1x1x1-1x1x1-0-NCDHW-FP32-F=ConvHipImplicitGemm3DGroupFwdXdlops:2.38226,2369396736,miopenConvolutionFwdAlgoImplicitGEMM;GemmFwd1x1_0_1:1.42312,0,miopenConvolutionFwdAlgoGEMM;ConvDirectNaiveConvFwd:465.53,0,miopenConvolutionFwdAlgoDirect
96-6-1650-1250-3x3x3-96-4-1648-1248-1-0x0x0-1x1x1-1x1x1-0-NCDHW-FP32-F=ConvHipImplicitGemm3DGroupFwdXdlops:47.2098,7912092672,miopenConvolutionFwdAlgoImplicitGEMM;ConvDirectNaiveConvFwd:17240.5,0,miopenConvolutionFwdAlgoDirect
384-412-312-3x3-192-412-312-2-1x1-1x1-1x1-0-NCHW-FP32-F=ConvBinWinogradRxSf2x3g1:3.08079,0,miopenConvolutionFwdAlgoWinograd;ConvBinWinogradRxSf3x2:5.23015,0,miopenConvolutionFwdAlgoWinograd;ConvHipImplicitGemmGroupFwdXdlops:3.02538,594984960,miopenConvolutionFwdAlgoImplicitGEMM;ConvAsmImplicitGemmGTCDynamicFwdXdlopsNHWC:2.9728,594984960,miopenConvolutionFwdAlgoImplicitGEMM;GemmFwdRest:4.54847,1776992256,miopenConvolutionFwdAlgoGEMM;ConvDirectNaiveConvFwd:366.016,0,miopenConvolutionFwdAlgoDirect
192-816-624-3x3-96-816-624-4-1x1-1x1-1x1-0-NCHW-FP32-F=ConvBinWinogradRxSf2x3g1:6.03094,0,miopenConvolutionFwdAlgoWinograd;ConvBinWinogradRxSf3x2:10.0063,0,miopenConvolutionFwdAlgoWinograd;ConvHipImplicitGemmGroupFwdXdlops:8.30053,2346983424,miopenConvolutionFwdAlgoImplicitGEMM;ConvAsmImplicitGemmGTCDynamicFwdXdlopsNHWC:7.81702,2346983424,miopenConvolutionFwdAlgoImplicitGEMM;GemmFwdRest:11.845,3519479808,miopenConvolutionFwdAlgoGEMM;ConvDirectNaiveConvFwd:803.619,0,miopenConvolutionFwdAlgoDirect
384-552-416-3x3-192-552-416-4-1x1-1x1-1x1-0-NCHW-FP32-F=ConvBinWinogradRxSf2x3g1:10.996,0,miopenConvolutionFwdAlgoWinograd;ConvBinWinogradRxSf3x2:17.8061,0,miopenConvolutionFwdAlgoWinograd;ConvHipImplicitGemmGroupFwdXdlops:10.9724,2118942720,miopenConvolutionFwdAlgoImplicitGEMM;ConvAsmImplicitGemmGTCDynamicFwdXdlopsNHWC:10.5706,2118942720,miopenConvolutionFwdAlgoImplicitGEMM;GemmFwdRest:15.9815,3174432768,miopenConvolutionFwdAlgoGEMM;ConvDirectNaiveConvFwd:883.007,0,miopenConvolutionFwdAlgoDirect
16-21-102-78-1x1x1-16-21-102-78-1-0x0x0-1x1x1-1x1x1-0-NCDHW-BF16-F=ConvHipImplicitGemm3DGroupFwdXdlops:0.029526,10693632,miopenConvolutionFwdAlgoImplicitGEMM;GemmFwd1x1_0_1:0.0146603,0,miopenConvolutionFwdAlgoGEMM;ConvDirectNaiveConvFwd:5.16289,0,miopenConvolutionFwdAlgoDirect
16-21-206-156-1x1x1-16-21-206-156-1-0x0x0-1x1x1-1x1x1-0-NCDHW-BF16-F=ConvHipImplicitGemm3DGroupFwdXdlops:0.0528691,43191296,miopenConvolutionFwdAlgoImplicitGEMM;GemmFwd1x1_0_1:0.0214067,0,miopenConvolutionFwdAlgoGEMM;ConvDirectNaiveConvFwd:20.9485,0,miopenConvolutionFwdAlgoDirect
16-3-140-106-3x3x3-384-1-138-104-1-0x0x0-1x1x1-1x1x1-0-NCDHW-BF16-F=ConvHipImplicitGemm3DGroupFwdXdlops:0.0453275,12778752,miopenConvolutionFwdAlgoImplicitGEMM;GemmFwdRest:0.0579005,12400128,miopenConvolutionFwdAlgoGEMM;ConvDirectNaiveConvFwd:4.15734,0,miopenConvolutionFwdAlgoDirect
16-33-136-240-1x2x2-3072-33-68-120-1-0x0x0-1x2x2-1x1x1-0-NCDHW-BF16-F=ConvHipImplicitGemm3DGroupFwdXdlops:1.77215,1689317376,miopenConvolutionFwdAlgoImplicitGEMM;GemmFwdRest:0.599943,34467840,miopenConvolutionFwdAlgoGEMM;ConvDirectNaiveConvFwd:54.539,0,miopenConvolutionFwdAlgoDirect
192-2-276-208-1x1x1-384-2-276-208-1-0x0x0-1x1x1-1x1x1-0-NCDHW-BF16-F=ConvHipImplicitGemm3DGroupFwdXdlops:0.11463,132415488,miopenConvolutionFwdAlgoImplicitGEMM;GemmFwd1x1_0_1:0.0468642,0,miopenConvolutionFwdAlgoGEMM;ConvDirectNaiveConvFwd:40.795,0,miopenConvolutionFwdAlgoDirect
192-3-206-158-3x3x3-384-1-204-156-1-0x0x0-1x1x1-1x1x1-0-NCDHW-BF16-F=ConvHipImplicitGemm3DGroupFwdXdlops:0.228066,65917440,miopenConvolutionFwdAlgoImplicitGEMM;GemmFwdRest:0.756508,329951232,miopenConvolutionFwdAlgoGEMM;ConvDirectNaiveConvFwd:117.355,0,miopenConvolutionFwdAlgoDirect
192-3-278-210-3x3x3-384-1-276-208-1-0x0x0-1x1x1-1x1x1-0-NCDHW-BF16-F=ConvHipImplicitGemm3DGroupFwdXdlops:0.385644,115324416,miopenConvolutionFwdAlgoImplicitGEMM;GemmFwdRest:1.32958,595206144,miopenConvolutionFwdAlgoGEMM;ConvDirectNaiveConvFwd:211.524,0,miopenConvolutionFwdAlgoDirect
192-3-414-314-3x3x3-384-1-412-312-1-0x0x0-1x1x1-1x1x1-0-NCDHW-BF16-F=ConvHipImplicitGemm3DGroupFwdXdlops:0.936559,252458496,miopenConvolutionFwdAlgoImplicitGEMM;GemmFwdRest:3.00126,1332744192,miopenConvolutionFwdAlgoGEMM;ConvDirectNaiveConvFwd:544.573,0,miopenConvolutionFwdAlgoDirect
192-3-826-626-3x3x3-192-1-824-624-1-0x0x0-1x1x1-1x1x1-0-NCDHW-BF16-F=ConvHipImplicitGemm3DGroupFwdXdlops:2.26477,795105792,miopenConvolutionFwdAlgoImplicitGEMM;GemmFwdRest:11.3767,5330976768,miopenConvolutionFwdAlgoGEMM;ConvDirectNaiveConvFwd:1908.97,0,miopenConvolutionFwdAlgoDirect
192-5-276-208-3x1x1-192-2-276-208-1-0x0x0-2x1x1-1x1x1-0-NCDHW-BF16-F=ConvHipImplicitGemm3DGroupFwdXdlops:0.126834,154533888,miopenConvolutionFwdAlgoImplicitGEMM;GemmFwdRest:0.30841,132268032,miopenConvolutionFwdAlgoGEMM;ConvDirectNaiveConvFwd:110.785,0,miopenConvolutionFwdAlgoDirect
192-6-554-418-3x3x3-192-4-552-416-1-0x0x0-1x1x1-1x1x1-0-NCDHW-BF16-F=ConvHipImplicitGemm3DGroupFwdXdlops:3.25308,888247296,miopenConvolutionFwdAlgoImplicitGEMM;ConvDirectNaiveConvFwd:3378.95,0,miopenConvolutionFwdAlgoDirect
192-1648-1248-3x3-96-1648-1248-1-1x1-1x1-1x1-0-NCHW-BF16-F=ConvHipImplicitGemmGroupFwdXdlops:1.82526,1184993280,miopenConvolutionFwdAlgoImplicitGEMM;ConvAsmImplicitGemmGTCDynamicFwdXdlopsNHWC:2.0511,1974767616,miopenConvolutionFwdAlgoImplicitGEMM;GemmFwdRest:5.62693,7107969024,miopenConvolutionFwdAlgoGEMM;ConvDirectNaiveConvFwd:2598.79,0,miopenConvolutionFwdAlgoDirect
32-21-102-78-1x1x1-32-21-102-78-1-0x0x0-1x1x1-1x1x1-0-NCDHW-BF16-F=ConvHipImplicitGemm3DGroupFwdXdlops:0.0406338,21387776,miopenConvolutionFwdAlgoImplicitGEMM;GemmFwd1x1_0_1:0.0154722,0,miopenConvolutionFwdAlgoGEMM;ConvDirectNaiveConvFwd:9.95928,0,miopenConvolutionFwdAlgoDirect
32-21-138-104-1x1x1-32-21-138-104-1-0x0x0-1x1x1-1x1x1-0-NCDHW-BF16-F=ConvHipImplicitGemm3DGroupFwdXdlops:0.054794,38580224,miopenConvolutionFwdAlgoImplicitGEMM;GemmFwd1x1_0_1:0.0175524,0,miopenConvolutionFwdAlgoGEMM;ConvDirectNaiveConvFwd:18.0644,0,miopenConvolutionFwdAlgoDirect
36-21-102-78-1x2x2-5120-21-51-39-1-0x0x0-1x2x2-1x1x1-0-NCDHW-BF16-F=ConvHipImplicitGemm3DGroupFwdXdlops:0.899078,441218816,miopenConvolutionFwdAlgoImplicitGEMM;GemmFwdRest:0.233419,12029472,miopenConvolutionFwdAlgoGEMM;ConvDirectNaiveConvFwd:28.5892,0,miopenConvolutionFwdAlgoDirect
384-3-102-78-3x1x1-768-1-102-78-1-0x0x0-1x1x1-1x1x1-0-NCDHW-BF16-F=ConvHipImplicitGemm3DGroupFwdXdlops:0.0611684,32320512,miopenConvolutionFwdAlgoImplicitGEMM;GemmFwdRest:0.0754342,18330624,miopenConvolutionFwdAlgoGEMM;ConvDirectNaiveConvFwd:15.9602,0,miopenConvolutionFwdAlgoDirect
384-3-104-80-3x3x3-384-1-102-78-1-0x0x0-1x1x1-1x1x1-0-NCDHW-BF16-F=ConvHipImplicitGemm3DGroupFwdXdlops:0.149967,33242112,miopenConvolutionFwdAlgoImplicitGEMM;GemmFwdRest:0.492013,164975616,miopenConvolutionFwdAlgoGEMM;ConvDirectNaiveConvFwd:61.7701,0,miopenConvolutionFwdAlgoDirect
384-3-140-106-3x3x3-384-1-138-104-1-0x0x0-1x1x1-1x1x1-0-NCDHW-BF16-F=ConvHipImplicitGemm3DGroupFwdXdlops:0.235009,53176320,miopenConvolutionFwdAlgoImplicitGEMM;GemmFwdRest:0.750707,297603072,miopenConvolutionFwdAlgoGEMM;ConvDirectNaiveConvFwd:109.899,0,miopenConvolutionFwdAlgoDirect
384-3-206-158-3x3x3-384-1-204-156-1-0x0x0-1x1x1-1x1x1-0-NCDHW-BF16-F=ConvHipImplicitGemm3DGroupFwdXdlops:0.406359,107394048,miopenConvolutionFwdAlgoImplicitGEMM;GemmFwdRest:1.46444,659902464,miopenConvolutionFwdAlgoGEMM;ConvDirectNaiveConvFwd:260.817,0,miopenConvolutionFwdAlgoDirect
384-4-204-156-3x1x1-768-2-204-156-1-0x0x0-1x1x1-1x1x1-0-NCDHW-BF16-F=ConvHipImplicitGemm3DGroupFwdXdlops:0.262509,197296128,miopenConvolutionFwdAlgoImplicitGEMM;GemmFwdRest:0.431938,146644992,miopenConvolutionFwdAlgoGEMM;ConvDirectNaiveConvFwd:128.938,0,miopenConvolutionFwdAlgoDirect
384-4-276-208-3x1x1-768-2-276-208-1-0x0x0-1x1x1-1x1x1-0-NCDHW-BF16-F=ConvHipImplicitGemm3DGroupFwdXdlops:0.474538,354484224,miopenConvolutionFwdAlgoImplicitGEMM;GemmFwdRest:0.755678,264536064,miopenConvolutionFwdAlgoGEMM;ConvDirectNaiveConvFwd:245.35,0,miopenConvolutionFwdAlgoDirect
384-4-412-312-3x1x1-768-2-412-312-1-0x0x0-1x1x1-1x1x1-0-NCDHW-BF16-F=ConvHipImplicitGemm3DGroupFwdXdlops:0.99065,791543808,miopenConvolutionFwdAlgoImplicitGEMM;GemmFwdRest:1.61398,592330752,miopenConvolutionFwdAlgoGEMM;ConvDirectNaiveConvFwd:640.426,0,miopenConvolutionFwdAlgoDirect
384-205-157-3x3-384-102-78-1-0x0-2x2-1x1-0-NCHW-BF16-F=ConvHipImplicitGemmGroupFwdXdlops:0.0759768,33482496,miopenConvolutionFwdAlgoImplicitGEMM;ConvAsmImplicitGemmGTCDynamicFwdXdlopsNHWC:0.101252,45702912,miopenConvolutionFwdAlgoImplicitGEMM;GemmFwdRest:0.0837675,54991872,miopenConvolutionFwdAlgoGEMM;ConvDirectNaiveConvFwd:22.2358,0,miopenConvolutionFwdAlgoDirect
384-206-156-1x1-384-206-156-1-0x0-1x1-1x1-0-NCHW-BF16-F=ConvHipImplicitGemmGroupFwdXdlops:0.0816612,49655808,miopenConvolutionFwdAlgoImplicitGEMM;ConvAsmImplicitGemmGTCDynamicFwdXdlopsNHWC:0.0708892,98721792,miopenConvolutionFwdAlgoImplicitGEMM;GemmFwd1x1_0_1:0.0298482,0,miopenConvolutionFwdAlgoGEMM;ConvDirectNaiveConvFwd:19.7466,0,miopenConvolutionFwdAlgoDirect
384-277-209-3x3-384-138-104-1-0x0-2x2-1x1-0-NCHW-BF16-F=ConvHipImplicitGemmGroupFwdXdlops:0.127969,58138368,miopenConvolutionFwdAlgoImplicitGEMM;ConvAsmImplicitGemmGTCDynamicFwdXdlopsNHWC:0.165625,80183040,miopenConvolutionFwdAlgoImplicitGEMM;GemmFwdRest:0.134675,99201024,miopenConvolutionFwdAlgoGEMM;ConvDirectNaiveConvFwd:39.2809,0,miopenConvolutionFwdAlgoDirect
384-552-416-3x3-192-552-416-1-1x1-1x1-1x1-0-NCHW-BF16-F=ConvHipImplicitGemmGroupFwdXdlops:0.568029,265863168,miopenConvolutionFwdAlgoImplicitGEMM;ConvAsmImplicitGemmGTCDynamicFwdXdlopsNHWC:0.795694,442220544,miopenConvolutionFwdAlgoImplicitGEMM;GemmFwdRest:1.20814,1587216384,miopenConvolutionFwdAlgoGEMM;ConvDirectNaiveConvFwd:543.925,0,miopenConvolutionFwdAlgoDirect
96-3-1106-834-3x3x3-96-1-1104-832-1-0x0x0-1x1x1-1x1x1-0-NCDHW-BF16-F=ConvHipImplicitGemm3DGroupFwdXdlops:1.5616,708159744,miopenConvolutionFwdAlgoImplicitGEMM;GemmFwdRest:9.71917,4761649152,miopenConvolutionFwdAlgoGEMM;ConvDirectNaiveConvFwd:1708.32,0,miopenConvolutionFwdAlgoDirect
96-3-554-418-3x3x3-192-1-552-416-1-0x0x0-1x1x1-1x1x1-0-NCDHW-BF16-F=ConvHipImplicitGemm3DGroupFwdXdlops:0.51508,222559488,miopenConvolutionFwdAlgoImplicitGEMM;GemmFwdRest:2.49568,1190412288,miopenConvolutionFwdAlgoGEMM;ConvDirectNaiveConvFwd:394.895,0,miopenConvolutionFwdAlgoDirect
96-3-818-626-3x3x3-96-1-816-624-1-0x0x0-1x1x1-1x1x1-0-NCDHW-BF16-F=ConvHipImplicitGemm3DGroupFwdXdlops:0.772597,393212160,miopenConvolutionFwdAlgoImplicitGEMM;GemmFwdRest:5.3732,2639609856,miopenConvolutionFwdAlgoGEMM;ConvDirectNaiveConvFwd:954.806,0,miopenConvolutionFwdAlgoDirect
96-4-408-312-1x1x1-192-4-408-312-1-0x0x0-1x1x1-1x1x1-0-NCDHW-BF16-F=ConvHipImplicitGemm3DGroupFwdXdlops:0.279356,293326848,miopenConvolutionFwdAlgoImplicitGEMM;GemmFwd1x1_0_1:0.086821,0,miopenConvolutionFwdAlgoGEMM;ConvDirectNaiveConvFwd:89.2668,0,miopenConvolutionFwdAlgoDirect
96-4-552-416-1x1x1-192-4-552-416-1-0x0x0-1x1x1-1x1x1-0-NCDHW-BF16-F=ConvHipImplicitGemm3DGroupFwdXdlops:0.552419,529108992,miopenConvolutionFwdAlgoImplicitGEMM;GemmFwd1x1_0_1:0.147602,0,miopenConvolutionFwdAlgoGEMM;ConvDirectNaiveConvFwd:206.831,0,miopenConvolutionFwdAlgoDirect
96-6-1650-1250-3x3x3-3-4-1648-1248-1-0x0x0-1x1x1-1x1x1-0-NCDHW-BF16-F=ConvHipImplicitGemm3DGroupFwdXdlops:48.8829,2425376512,miopenConvolutionFwdAlgoImplicitGEMM;ConvDirectNaiveConvFwd:18234.5,0,miopenConvolutionFwdAlgoDirect
192-1648-1248-3x3-96-1648-1248-4-1x1-1x1-1x1-0-NCHW-BF16-F=ConvHipImplicitGemmGroupFwdXdlops:7.40665,4738977792,miopenConvolutionFwdAlgoImplicitGEMM;ConvAsmImplicitGemmGTCDynamicFwdXdlopsNHWC:8.16854,7898075136,miopenConvolutionFwdAlgoImplicitGEMM;GemmFwdRest:23.0121,7107969024,miopenConvolutionFwdAlgoGEMM;ConvDirectNaiveConvFwd:3351.66,0,miopenConvolutionFwdAlgoDirect
128-11-146-130-3x3x3-3-9-144-128-1-0x0x0-1x1x1-1x1x1-0-NCDHW-FP16-F=ConvHipImplicitGemm3DGroupFwdXdlops:0.207256,54463744,miopenConvolutionFwdAlgoImplicitGEMM;GemmFwdRest:2.252,1146617856,miopenConvolutionFwdAlgoGEMM;ConvDirectNaiveConvFwd:461.755,0,miopenConvolutionFwdAlgoDirect
128-11-162-258-3x3x3-3-9-160-256-1-0x0x0-1x1x1-1x1x1-0-NCDHW-FP16-F=ConvHipImplicitGemm3DGroupFwdXdlops:0.551623,119930112,miopenConvolutionFwdAlgoImplicitGEMM;GemmFwdRest:4.97135,2548039680,miopenConvolutionFwdAlgoGEMM;ConvDirectNaiveConvFwd:993.37,0,miopenConvolutionFwdAlgoDirect
128-19-130-258-3x3x3-3-17-128-256-1-0x0x0-1x1x1-1x1x1-0-NCDHW-FP16-F=ConvHipImplicitGemm3DGroupFwdXdlops:0.886014,166501632,miopenConvolutionFwdAlgoImplicitGEMM;GemmFwdRest:7.53084,3850371072,miopenConvolutionFwdAlgoGEMM;ConvDirectNaiveConvFwd:1505.03,0,miopenConvolutionFwdAlgoDirect
128-19-162-258-3x3x3-3-17-160-256-1-0x0x0-1x1x1-1x1x1-0-NCDHW-FP16-F=ConvHipImplicitGemm3DGroupFwdXdlops:0.97427,207494400,miopenConvolutionFwdAlgoImplicitGEMM;GemmFwdRest:9.3454,4812963840,miopenConvolutionFwdAlgoGEMM;ConvDirectNaiveConvFwd:1871.88,0,miopenConvolutionFwdAlgoDirect
16-3-20-32-1x1x1-16-3-20-32-1-0x0x0-1x1x1-1x1x1-0-NCDHW-FP16-F=ConvHipImplicitGemm3DGroupFwdXdlops:0.0239535,123392,miopenConvolutionFwdAlgoImplicitGEMM;GemmFwd1x1_0_1:0.0087202,0,miopenConvolutionFwdAlgoGEMM;ConvDirectNaiveConvFwd:0.0498861,0,miopenConvolutionFwdAlgoDirect
16-5-16-24-1x1x1-16-5-16-24-1-0x0x0-1x1x1-1x1x1-0-NCDHW-FP16-F=ConvHipImplicitGemm3DGroupFwdXdlops:0.0221205,123392,miopenConvolutionFwdAlgoImplicitGEMM;GemmFwd1x1_0_1:0.00972,0,miopenConvolutionFwdAlgoGEMM;ConvDirectNaiveConvFwd:0.050047,0,miopenConvolutionFwdAlgoDirect
16-5-18-32-1x1x1-16-5-18-32-1-0x0x0-1x1x1-1x1x1-0-NCDHW-FP16-F=ConvHipImplicitGemm3DGroupFwdXdlops:0.0218003,184832,miopenConvolutionFwdAlgoImplicitGEMM;GemmFwd1x1_0_1:0.0112467,0,miopenConvolutionFwdAlgoGEMM;ConvDirectNaiveConvFwd:0.0736672,0,miopenConvolutionFwdAlgoDirect
16-5-20-32-1x1x1-16-5-20-32-1-0x0x0-1x1x1-1x1x1-0-NCDHW-FP16-F=ConvHipImplicitGemm3DGroupFwdXdlops:0.0217522,205312,miopenConvolutionFwdAlgoImplicitGEMM;GemmFwd1x1_0_1:0.0103522,0,miopenConvolutionFwdAlgoGEMM;ConvDirectNaiveConvFwd:0.0797206,0,miopenConvolutionFwdAlgoDirect
16-5-32-16-1x1x1-16-5-32-16-1-0x0x0-1x1x1-1x1x1-0-NCDHW-FP16-F=ConvHipImplicitGemm3DGroupFwdXdlops:0.0219068,164352,miopenConvolutionFwdAlgoImplicitGEMM;GemmFwd1x1_0_1:0.00986017,0,miopenConvolutionFwdAlgoGEMM;ConvDirectNaiveConvFwd:0.0619338,0,miopenConvolutionFwdAlgoDirect
16-5-34-26-3x3x3-512-3-32-24-1-0x0x0-1x1x1-1x1x1-0-NCDHW-FP16-F=ConvHipImplicitGemm3DGroupFwdXdlops:0.0278162,2943232,miopenConvolutionFwdAlgoImplicitGEMM;GemmFwdRest:0.02838,1990656,miopenConvolutionFwdAlgoGEMM;ConvDirectNaiveConvFwd:0.674438,0,miopenConvolutionFwdAlgoDirect
16-7-20-18-3x3x3-512-5-18-16-1-0x0x0-1x1x1-1x1x1-0-NCDHW-FP16-F=ConvHipImplicitGemm3DGroupFwdXdlops:0.027792,1997568,miopenConvolutionFwdAlgoImplicitGEMM;GemmFwdRest:0.0278072,1244160,miopenConvolutionFwdAlgoGEMM;ConvDirectNaiveConvFwd:0.448494,0,miopenConvolutionFwdAlgoDirect
16-7-34-34-3x3x3-512-5-32-32-1-0x0x0-1x1x1-1x1x1-0-NCDHW-FP16-F=ConvHipImplicitGemm3DGroupFwdXdlops:0.0324577,5944320,miopenConvolutionFwdAlgoImplicitGEMM;GemmFwdRest:0.0317537,4423680,miopenConvolutionFwdAlgoGEMM;ConvDirectNaiveConvFwd:1.48336,0,miopenConvolutionFwdAlgoDirect
256-11-130-66-3x3x3-256-9-128-64-1-0x0x0-1x1x1-1x1x1-0-NCDHW-FP16-F=ConvHipImplicitGemm3DGroupFwdXdlops:0.445811,89610240,miopenConvolutionFwdAlgoImplicitGEMM;GemmFwdRest:2.10305,1019215872,miopenConvolutionFwdAlgoGEMM;ConvDirectNaiveConvFwd:393.571,0,miopenConvolutionFwdAlgoDirect
256-11-146-130-3x3x3-256-9-144-128-1-0x0x0-1x1x1-1x1x1-0-NCDHW-FP16-F=ConvHipImplicitGemm3DGroupFwdXdlops:1.00562,195368960,miopenConvolutionFwdAlgoImplicitGEMM;GemmFwdRest:4.9134,2293235712,miopenConvolutionFwdAlgoGEMM;ConvDirectNaiveConvFwd:842.858,0,miopenConvolutionFwdAlgoDirect
256-11-258-130-3x3x3-128-9-256-128-1-0x0x0-1x1x1-1x1x1-0-NCDHW-FP16-F=ConvHipImplicitGemm3DGroupFwdXdlops:0.994701,266164224,miopenConvolutionFwdAlgoImplicitGEMM;GemmFwdRest:8.18795,4076863488,miopenConvolutionFwdAlgoGEMM;ConvDirectNaiveConvFwd:1502.63,0,miopenConvolutionFwdAlgoDirect
256-11-66-130-3x3x3-256-9-64-128-1-0x0x0-1x1x1-1x1x1-0-NCDHW-FP16-F=ConvHipImplicitGemm3DGroupFwdXdlops:0.445965,89610240,miopenConvolutionFwdAlgoImplicitGEMM;GemmFwdRest:2.13043,1019215872,miopenConvolutionFwdAlgoGEMM;ConvDirectNaiveConvFwd:374.198,0,miopenConvolutionFwdAlgoDirect
256-11-82-98-3x3x3-256-9-80-96-1-0x0x0-1x1x1-1x1x1-0-NCDHW-FP16-F=ConvHipImplicitGemm3DGroupFwdXdlops:0.443257,84187136,miopenConvolutionFwdAlgoImplicitGEMM;GemmFwdRest:2.07373,955514880,miopenConvolutionFwdAlgoGEMM;ConvDirectNaiveConvFwd:348.374,0,miopenConvolutionFwdAlgoDirect
256-17-144-128-1x1x1-128-17-144-128-1-0x0x0-1x1x1-1x1x1-0-NCDHW-FP16-F=ConvHipImplicitGemm3DGroupFwdXdlops:0.181722,240713728,miopenConvolutionFwdAlgoImplicitGEMM;GemmFwd1x1_0_1:0.0585207,0,miopenConvolutionFwdAlgoGEMM;ConvDirectNaiveConvFwd:148.46,0,miopenConvolutionFwdAlgoDirect
256-17-256-128-1x1x1-128-17-256-128-1-0x0x0-1x1x1-1x1x1-0-NCDHW-FP16-F=ConvHipImplicitGemm3DGroupFwdXdlops:0.324343,427884544,miopenConvolutionFwdAlgoImplicitGEMM;GemmFwd1x1_0_1:0.101481,0,miopenConvolutionFwdAlgoGEMM;ConvDirectNaiveConvFwd:334.817,0,miopenConvolutionFwdAlgoDirect
256-19-130-258-3x3x3-256-17-128-256-1-0x0x0-1x1x1-1x1x1-0-NCDHW-FP16-F=ConvHipImplicitGemm3DGroupFwdXdlops:3.08116,615028736,miopenConvolutionFwdAlgoImplicitGEMM;ConvDirectNaiveConvFwd:2809.52,0,miopenConvolutionFwdAlgoDirect
256-19-258-130-3x3x3-256-17-256-128-1-0x0x0-1x1x1-1x1x1-0-NCDHW-FP16-F=ConvHipImplicitGemm3DGroupFwdXdlops:3.06628,615028736,miopenConvolutionFwdAlgoImplicitGEMM;ConvDirectNaiveConvFwd:2915.48,0,miopenConvolutionFwdAlgoDirect
256-7-130-98-3x3x3-256-5-128-96-1-0x0x0-1x1x1-1x1x1-0-NCDHW-FP16-F=ConvHipImplicitGemm3DGroupFwdXdlops:0.360497,80656384,miopenConvolutionFwdAlgoImplicitGEMM;GemmFwdRest:1.75054,849346560,miopenConvolutionFwdAlgoGEMM;ConvDirectNaiveConvFwd:310.507,0,miopenConvolutionFwdAlgoDirect
256-7-82-130-3x3x3-256-5-80-128-1-0x0x0-1x1x1-1x1x1-0-NCDHW-FP16-F=ConvHipImplicitGemm3DGroupFwdXdlops:0.31527,67958784,miopenConvolutionFwdAlgoImplicitGEMM;GemmFwdRest:1.46257,707788800,miopenConvolutionFwdAlgoGEMM;ConvDirectNaiveConvFwd:260.509,0,miopenConvolutionFwdAlgoDirect
256-9-144-256-1x1x1-128-9-144-256-1-0x0x0-1x1x1-1x1x1-0-NCDHW-FP16-F=ConvHipImplicitGemm3DGroupFwdXdlops:0.194049,254869504,miopenConvolutionFwdAlgoImplicitGEMM;GemmFwd1x1_0_1:0.0581007,0,miopenConvolutionFwdAlgoGEMM;ConvDirectNaiveConvFwd:157.205,0,miopenConvolutionFwdAlgoDirect
256-9-256-192-1x1x1-128-9-256-192-1-0x0x0-1x1x1-1x1x1-0-NCDHW-FP16-F=ConvHipImplicitGemm3DGroupFwdXdlops:0.263825,339804160,miopenConvolutionFwdAlgoImplicitGEMM;GemmFwd1x1_0_1:0.0840937,0,miopenConvolutionFwdAlgoGEMM;ConvDirectNaiveConvFwd:263.787,0,miopenConvolutionFwdAlgoDirect
512-11-130-66-3x3x3-512-9-128-64-1-0x0x0-1x1x1-1x1x1-0-NCDHW-FP16-F=ConvHipImplicitGemm3DGroupFwdXdlops:1.49547,186298368,miopenConvolutionFwdAlgoImplicitGEMM;GemmFwdRest:4.84558,2038431744,miopenConvolutionFwdAlgoGEMM;ConvDirectNaiveConvFwd:951.53,0,miopenConvolutionFwdAlgoDirect
512-11-66-130-3x3x3-512-9-64-128-1-0x0x0-1x1x1-1x1x1-0-NCDHW-FP16-F=ConvHipImplicitGemm3DGroupFwdXdlops:1.48617,186298368,miopenConvolutionFwdAlgoImplicitGEMM;GemmFwdRest:4.91396,2038431744,miopenConvolutionFwdAlgoGEMM;ConvDirectNaiveConvFwd:949.155,0,miopenConvolutionFwdAlgoDirect
512-11-82-130-3x3x3-512-9-80-128-1-0x0x0-1x1x1-1x1x1-0-NCDHW-FP16-F=ConvHipImplicitGemm3DGroupFwdXdlops:1.92062,228601856,miopenConvolutionFwdAlgoImplicitGEMM;GemmFwdRest:6.04934,2548039680,miopenConvolutionFwdAlgoGEMM;ConvDirectNaiveConvFwd:1192.05,0,miopenConvolutionFwdAlgoDirect
512-5-64-128-1x1x1-256-5-64-128-1-0x0x0-1x1x1-1x1x1-0-NCDHW-FP16-F=ConvHipImplicitGemm3DGroupFwdXdlops:0.0584004,63176704,miopenConvolutionFwdAlgoImplicitGEMM;GemmFwd1x1_0_1:0.0284482,0,miopenConvolutionFwdAlgoGEMM;ConvDirectNaiveConvFwd:38.5824,0,miopenConvolutionFwdAlgoDirect
512-5-80-128-1x1x1-256-5-80-128-1-0x0x0-1x1x1-1x1x1-0-NCDHW-FP16-F=ConvHipImplicitGemm3DGroupFwdXdlops:0.068434,78905344,miopenConvolutionFwdAlgoImplicitGEMM;GemmFwd1x1_0_1:0.0301868,0,miopenConvolutionFwdAlgoGEMM;ConvDirectNaiveConvFwd:49.048,0,miopenConvolutionFwdAlgoDirect
512-7-18-26-3x3x3-512-5-16-24-1-0x0x0-1x1x1-1x1x1-0-NCDHW-FP16-F=ConvHipImplicitGemm3DGroupFwdXdlops:0.156361,19476480,miopenConvolutionFwdAlgoImplicitGEMM;GemmFwdRest:0.264223,53084160,miopenConvolutionFwdAlgoGEMM;ConvDirectNaiveConvFwd:19.7982,0,miopenConvolutionFwdAlgoDirect
512-7-20-18-3x3x3-512-5-18-16-1-0x0x0-1x1x1-1x1x1-0-NCDHW-FP16-F=ConvHipImplicitGemm3DGroupFwdXdlops:0.144419,18210816,miopenConvolutionFwdAlgoImplicitGEMM;GemmFwdRest:0.212702,39813120,miopenConvolutionFwdAlgoGEMM;ConvDirectNaiveConvFwd:14.4534,0,miopenConvolutionFwdAlgoDirect
512-7-22-34-3x3x3-512-5-20-32-1-0x0x0-1x1x1-1x1x1-0-NCDHW-FP16-F=ConvHipImplicitGemm3DGroupFwdXdlops:0.17883,22794240,miopenConvolutionFwdAlgoImplicitGEMM;GemmFwdRest:0.33867,88473600,miopenConvolutionFwdAlgoGEMM;ConvDirectNaiveConvFwd:33.2078,0,miopenConvolutionFwdAlgoDirect
512-7-38-34-3x3x3-512-5-36-32-1-0x0x0-1x1x1-1x1x1-0-NCDHW-FP16-F=ConvHipImplicitGemm3DGroupFwdXdlops:0.185892,29315072,miopenConvolutionFwdAlgoImplicitGEMM;GemmFwdRest:0.523725,159252480,miopenConvolutionFwdAlgoGEMM;ConvDirectNaiveConvFwd:60.2495,0,miopenConvolutionFwdAlgoDirect
512-7-66-50-3x3x3-512-5-64-48-1-0x0x0-1x1x1-1x1x1-0-NCDHW-FP16-F=ConvHipImplicitGemm3DGroupFwdXdlops:0.337705,53538816,miopenConvolutionFwdAlgoImplicitGEMM;GemmFwdRest:1.07118,424673280,miopenConvolutionFwdAlgoGEMM;ConvDirectNaiveConvFwd:168.611,0,miopenConvolutionFwdAlgoDirect
512-7-74-66-3x3x3-256-5-72-64-1-0x0x0-1x1x1-1x1x1-0-NCDHW-FP16-F=ConvHipImplicitGemm3DGroupFwdXdlops:0.31098,53882880,miopenConvolutionFwdAlgoImplicitGEMM;GemmFwdRest:1.45129,637009920,miopenConvolutionFwdAlgoGEMM;ConvDirectNaiveConvFwd:250.578,0,miopenConvolutionFwdAlgoDirect
512-9-128-128-1x1x1-256-9-128-128-1-0x0x0-1x1x1-1x1x1-0-NCDHW-FP16-F=ConvHipImplicitGemm3DGroupFwdXdlops:0.188491,226754560,miopenConvolutionFwdAlgoImplicitGEMM;GemmFwd1x1_0_1:0.0788886,0,miopenConvolutionFwdAlgoGEMM;ConvDirectNaiveConvFwd:139.15,0,miopenConvolutionFwdAlgoDirect
512-9-80-128-1x1x1-256-9-80-128-1-0x0x0-1x1x1-1x1x1-0-NCDHW-FP16-F=ConvHipImplicitGemm3DGroupFwdXdlops:0.118408,141819904,miopenConvolutionFwdAlgoImplicitGEMM;GemmFwd1x1_0_1:0.0450086,0,miopenConvolutionFwdAlgoGEMM;ConvDirectNaiveConvFwd:86.9987,0,miopenConvolutionFwdAlgoDirect
16-21-102-78-1x1x1-16-21-102-78-1-0x0x0-1x1x1-1x1x1-0-NCDHW-FP32-F=ConvHipImplicitGemm3DGroupFwdXdlops:0.0381442,21386752,miopenConvolutionFwdAlgoImplicitGEMM;GemmFwd1x1_0_1:0.0355138,0,miopenConvolutionFwdAlgoGEMM;ConvDirectNaiveConvFwd:5.19076,0,miopenConvolutionFwdAlgoDirect
16-3-208-158-3x3x3-384-1-206-156-1-0x0x0-1x1x1-1x1x1-0-NCDHW-FP32-F=ConvHipImplicitGemm3DGroupFwdXdlops:0.166433,56334336,miopenConvolutionFwdAlgoImplicitGEMM;GemmFwdRest:0.155201,55531008,miopenConvolutionFwdAlgoGEMM;ConvDirectNaiveConvFwd:9.89396,0,miopenConvolutionFwdAlgoDirect
192-2-204-156-1x1x1-384-2-204-156-1-0x0x0-1x1x1-1x1x1-0-NCDHW-FP32-F=ConvHipImplicitGemm3DGroupFwdXdlops:0.188956,146939904,miopenConvolutionFwdAlgoImplicitGEMM;GemmFwd1x1_0_1:0.0971142,0,miopenConvolutionFwdAlgoGEMM;ConvDirectNaiveConvFwd:22.814,0,miopenConvolutionFwdAlgoDirect
192-3-206-158-3x3x3-384-1-204-156-1-0x0x0-1x1x1-1x1x1-0-NCDHW-FP32-F=ConvHipImplicitGemm3DGroupFwdXdlops:1.20181,131834880,miopenConvolutionFwdAlgoImplicitGEMM;GemmFwdRest:1.79092,659902464,miopenConvolutionFwdAlgoGEMM;ConvDirectNaiveConvFwd:119.569,0,miopenConvolutionFwdAlgoDirect
192-3-414-314-3x3x3-384-1-412-312-1-0x0x0-1x1x1-1x1x1-0-NCDHW-FP32-F=ConvHipImplicitGemm3DGroupFwdXdlops:4.37822,504916992,miopenConvolutionFwdAlgoImplicitGEMM;GemmFwdRest:6.8341,2665488384,miopenConvolutionFwdAlgoGEMM;ConvDirectNaiveConvFwd:591.878,0,miopenConvolutionFwdAlgoDirect
192-4-278-210-3x3x3-384-2-276-208-1-0x0x0-1x1x1-1x1x1-0-NCDHW-FP32-F=ConvHipImplicitGemm3DGroupFwdXdlops:4.08237,363663360,miopenConvolutionFwdAlgoImplicitGEMM;GemmFwdRest:6.25185,2380824576,miopenConvolutionFwdAlgoGEMM;ConvDirectNaiveConvFwd:492.46,0,miopenConvolutionFwdAlgoDirect
192-5-412-312-3x1x1-192-2-412-312-1-0x0x0-2x1x1-1x1x1-0-NCDHW-FP32-F=ConvHipImplicitGemm3DGroupFwdXdlops:0.892022,691494912,miopenConvolutionFwdAlgoImplicitGEMM;GemmFwdRest:1.27839,592330752,miopenConvolutionFwdAlgoGEMM;ConvDirectNaiveConvFwd:327.276,0,miopenConvolutionFwdAlgoDirect
192-6-554-418-3x3x3-192-4-552-416-1-0x0x0-1x1x1-1x1x1-0-NCDHW-FP32-F=ConvHipImplicitGemm3DGroupFwdXdlops:15.7179,1776494592,miopenConvolutionFwdAlgoImplicitGEMM;ConvDirectNaiveConvFwd:3623.29,0,miopenConvolutionFwdAlgoDirect
192-409-313-3x3-192-204-156-1-0x0-2x2-1x1-0-NCHW-FP32-F=ConvBinWinogradRxSf2x3g1:0.730287,0,miopenConvolutionFwdAlgoWinograd;ConvBinWinogradRxSf3x2:0.390332,0,miopenConvolutionFwdAlgoWinograd;ConvHipImplicitGemmGroupFwdXdlops:0.284035,124084992,miopenConvolutionFwdAlgoImplicitGEMM;ConvAsmImplicitGemmGTCDynamicFwdXdlopsNHWC:0.26838,124084992,miopenConvolutionFwdAlgoImplicitGEMM;GemmFwdRest:0.34675,219967488,miopenConvolutionFwdAlgoGEMM;ConvDirectNaiveConvFwd:41.0493,0,miopenConvolutionFwdAlgoDirect
192-816-624-3x3-96-816-624-1-1x1-1x1-1x1-0-NCHW-FP32-F=ConvBinWinogradRxSf2x3g1:1.41709,0,miopenConvolutionFwdAlgoWinograd;ConvBinWinogradRxSf3x2:2.5545,0,miopenConvolutionFwdAlgoWinograd;ConvHipImplicitGemmGroupFwdXdlops:2.05842,587243520,miopenConvolutionFwdAlgoImplicitGEMM;ConvAsmImplicitGemmGTCDynamicFwdXdlopsNHWC:2.00967,587243520,miopenConvolutionFwdAlgoImplicitGEMM;GemmFwdRest:3.0824,3519479808,miopenConvolutionFwdAlgoGEMM;ConvDirectNaiveConvFwd:605.243,0,miopenConvolutionFwdAlgoDirect
3-6-1650-1250-3x3x3-96-4-1648-1248-1-0x0x0-1x1x1-1x1x1-0-NCDHW-FP32-F=ConvHipImplicitGemm3DGroupFwdXdlops:6.27082,3307628800,miopenConvolutionFwdAlgoImplicitGEMM;GemmFwdRest:5.87708,2665488384,miopenConvolutionFwdAlgoGEMM;ConvDirectNaiveConvFwd:519.035,0,miopenConvolutionFwdAlgoDirect
36-21-102-78-1x2x2-5120-21-51-39-1-0x0x0-1x2x2-1x1x1-0-NCDHW-FP32-F=ConvHipImplicitGemm3DGroupFwdXdlops:1.47752,882437376,miopenConvolutionFwdAlgoImplicitGEMM;GemmFwdRest:0.737933,24058944,miopenConvolutionFwdAlgoGEMM;ConvDirectNaiveConvFwd:25.4708,0,miopenConvolutionFwdAlgoDirect
384-3-102-78-3x1x1-768-1-102-78-1-0x0x0-1x1x1-1x1x1-0-NCDHW-FP32-F=ConvHipImplicitGemm3DGroupFwdXdlops:0.198596,64641024,miopenConvolutionFwdAlgoImplicitGEMM;GemmFwdRest:0.176688,36661248,miopenConvolutionFwdAlgoGEMM;ConvDirectNaiveConvFwd:16.4841,0,miopenConvolutionFwdAlgoDirect
384-3-104-80-3x3x3-32-1-102-78-1-0x0x0-1x1x1-1x1x1-0-NCDHW-FP32-F=ConvHipImplicitGemm3DGroupFwdXdlops:0.20537,40684032,miopenConvolutionFwdAlgoImplicitGEMM;GemmFwdRest:0.895129,329951232,miopenConvolutionFwdAlgoGEMM;ConvDirectNaiveConvFwd:64.1379,0,miopenConvolutionFwdAlgoDirect
384-3-104-80-3x3x3-384-1-102-78-1-0x0x0-1x1x1-1x1x1-0-NCDHW-FP32-F=ConvHipImplicitGemm3DGroupFwdXdlops:0.788807,66484224,miopenConvolutionFwdAlgoImplicitGEMM;GemmFwdRest:0.983963,329951232,miopenConvolutionFwdAlgoGEMM;ConvDirectNaiveConvFwd:65.4721,0,miopenConvolutionFwdAlgoDirect
384-3-138-104-3x1x1-768-1-138-104-1-0x0x0-1x1x1-1x1x1-0-NCDHW-FP32-F=ConvHipImplicitGemm3DGroupFwdXdlops:0.329707,113762304,miopenConvolutionFwdAlgoImplicitGEMM;GemmFwdRest:0.306323,66134016,miopenConvolutionFwdAlgoGEMM;ConvDirectNaiveConvFwd:29.1003,0,miopenConvolutionFwdAlgoDirect
384-3-140-106-3x3x3-32-1-138-104-1-0x0x0-1x1x1-1x1x1-0-NCDHW-FP32-F=ConvHipImplicitGemm3DGroupFwdXdlops:0.256928,71546880,miopenConvolutionFwdAlgoImplicitGEMM;GemmFwdRest:0.778648,595206144,miopenConvolutionFwdAlgoGEMM;ConvDirectNaiveConvFwd:114.305,0,miopenConvolutionFwdAlgoDirect
384-3-206-156-3x1x1-384-1-206-156-1-0x0x0-2x1x1-1x1x1-0-NCDHW-FP32-F=ConvHipImplicitGemm3DGroupFwdXdlops:0.40459,199213056,miopenConvolutionFwdAlgoImplicitGEMM;GemmFwdRest:0.416912,148082688,miopenConvolutionFwdAlgoGEMM;ConvDirectNaiveConvFwd:64.5061,0,miopenConvolutionFwdAlgoDirect
384-3-206-158-3x3x3-384-1-204-156-1-0x0x0-1x1x1-1x1x1-0-NCDHW-FP32-F=ConvHipImplicitGemm3DGroupFwdXdlops:2.23588,214788096,miopenConvolutionFwdAlgoImplicitGEMM;GemmFwdRest:3.43924,1319804928,miopenConvolutionFwdAlgoGEMM;ConvDirectNaiveConvFwd:272.203,0,miopenConvolutionFwdAlgoDirect
384-3-414-314-3x3x3-384-1-412-312-1-0x0x0-1x1x1-1x1x1-0-NCDHW-FP32-F=ConvHipImplicitGemm3DGroupFwdXdlops:8.55375,812390400,miopenConvolutionFwdAlgoImplicitGEMM;GemmFwdRest:13.8542,5330976768,miopenConvolutionFwdAlgoGEMM;ConvDirectNaiveConvFwd:1129.44,0,miopenConvolutionFwdAlgoDirect
384-102-78-1x1-1152-102-78-1-0x0-1x1-1x1-0-NCHW-FP32-F=ConvBinWinogradRxSf2x3g1:0.60608,0,miopenConvolutionFwdAlgoWinograd;ConvBinWinogradRxSf3x2:0.278069,0,miopenConvolutionFwdAlgoWinograd;ConvHipImplicitGemmGroupFwdXdlops:0.121261,50651136,miopenConvolutionFwdAlgoImplicitGEMM;ConvAsmImplicitGemmGTCDynamicFwdXdlopsNHWC:0.106535,48881664,miopenConvolutionFwdAlgoImplicitGEMM;GemmFwd1x1_0_1:0.0778607,0,miopenConvolutionFwdAlgoGEMM;ConvDirectNaiveConvFwd:5.21787,0,miopenConvolutionFwdAlgoDirect
384-102-78-1x1-384-102-78-1-0x0-1x1-1x1-0-NCHW-FP32-F=ConvBinWinogradRxSf2x3g1:0.207722,0,miopenConvolutionFwdAlgoWinograd;ConvBinWinogradRxSf3x2:0.143024,0,miopenConvolutionFwdAlgoWinograd;ConvHipImplicitGemmGroupFwdXdlops:0.0571128,25030656,miopenConvolutionFwdAlgoImplicitGEMM;ConvAsmImplicitGemmGTCDynamicFwdXdlopsNHWC:0.0533319,24440832,miopenConvolutionFwdAlgoImplicitGEMM;GemmFwd1x1_0_1:0.0315603,0,miopenConvolutionFwdAlgoGEMM;ConvDirectNaiveConvFwd:4.88382,0,miopenConvolutionFwdAlgoDirect
384-204-156-3x3-192-204-156-1-1x1-1x1-1x1-0-NCHW-FP32-F=ConvBinWinogradRxSf2x3g1:0.401944,0,miopenConvolutionFwdAlgoWinograd;ConvBinWinogradRxSf3x2:0.760327,0,miopenConvolutionFwdAlgoWinograd;ConvHipImplicitGemmGroupFwdXdlops:0.463444,75976704,miopenConvolutionFwdAlgoImplicitGEMM;ConvAsmImplicitGemmGTCDynamicFwdXdlopsNHWC:0.428913,75976704,miopenConvolutionFwdAlgoImplicitGEMM;GemmFwdRest:0.649932,439934976,miopenConvolutionFwdAlgoGEMM;ConvDirectNaiveConvFwd:68.9682,0,miopenConvolutionFwdAlgoDirect
384-206-156-1x1-384-206-156-1-0x0-1x1-1x1-0-NCHW-FP32-F=ConvBinWinogradRxSf2x3g1:0.785642,0,miopenConvolutionFwdAlgoWinograd;ConvBinWinogradRxSf3x2:0.415358,0,miopenConvolutionFwdAlgoWinograd;ConvHipImplicitGemmGroupFwdXdlops:0.171582,99311616,miopenConvolutionFwdAlgoImplicitGEMM;ConvAsmImplicitGemmGTCDynamicFwdXdlopsNHWC:0.15151,98721792,miopenConvolutionFwdAlgoImplicitGEMM;GemmFwd1x1_0_1:0.088701,0,miopenConvolutionFwdAlgoGEMM;ConvDirectNaiveConvFwd:19.2516,0,miopenConvolutionFwdAlgoDirect
384-277-209-3x3-384-138-104-1-0x0-2x2-1x1-0-NCHW-FP32-F=ConvBinWinogradRxSf2x3g1:1.42865,0,miopenConvolutionFwdAlgoWinograd;ConvBinWinogradRxSf3x2:0.731721,0,miopenConvolutionFwdAlgoWinograd;ConvHipImplicitGemmGroupFwdXdlops:0.481982,116276736,miopenConvolutionFwdAlgoImplicitGEMM;ConvAsmImplicitGemmGTCDynamicFwdXdlopsNHWC:0.406916,116276736,miopenConvolutionFwdAlgoImplicitGEMM;GemmFwdRest:0.584239,198402048,miopenConvolutionFwdAlgoGEMM;ConvDirectNaiveConvFwd:38.2361,0,miopenConvolutionFwdAlgoDirect
384-412-312-3x3-192-412-312-1-1x1-1x1-1x1-0-NCHW-FP32-F=ConvBinWinogradRxSf2x3g1:1.62385,0,miopenConvolutionFwdAlgoWinograd;ConvBinWinogradRxSf3x2:2.65664,0,miopenConvolutionFwdAlgoWinograd;ConvHipImplicitGemmGroupFwdXdlops:1.50565,298819584,miopenConvolutionFwdAlgoImplicitGEMM;ConvAsmImplicitGemmGTCDynamicFwdXdlopsNHWC:1.48508,298819584,miopenConvolutionFwdAlgoImplicitGEMM;GemmFwdRest:2.44534,1776992256,miopenConvolutionFwdAlgoGEMM;ConvDirectNaiveConvFwd:288.61,0,miopenConvolutionFwdAlgoDirect
96-3-1106-834-3x3x3-3-1-1104-832-1-0x0x0-1x1x1-1x1x1-0-NCDHW-FP32-F=ConvHipImplicitGemm3DGroupFwdXdlops:2.39628,1073662976,miopenConvolutionFwdAlgoImplicitGEMM;GemmFwdRest:13.2685,9523298304,miopenConvolutionFwdAlgoGEMM;ConvDirectNaiveConvFwd:2076.52,0,miopenConvolutionFwdAlgoDirect
96-3-1650-1250-3x3x3-96-1-1648-1248-1-0x0x0-1x1x1-1x1x1-0-NCDHW-FP32-F=ConvHipImplicitGemm3DGroupFwdXdlops:13.0088,3166769664,miopenConvolutionFwdAlgoImplicitGEMM;ConvDirectNaiveConvFwd:4306.56,0,miopenConvolutionFwdAlgoDirect
96-6-1650-1250-3x3x3-3-4-1648-1248-1-0x0x0-1x1x1-1x1x1-0-NCDHW-FP32-F=ConvHipImplicitGemm3DGroupFwdXdlops:41.9725,4850753024,miopenConvolutionFwdAlgoImplicitGEMM;ConvDirectNaiveConvFwd:18522,0,miopenConvolutionFwdAlgoDirect
384-413-313-3x3-384-206-156-2-0x0-2x2-1x1-0-NCHW-FP32-F=ConvBinWinogradRxSf2x3g1:5.4907,0,miopenConvolutionFwdAlgoWinograd;ConvBinWinogradRxSf3x2:2.69349,0,miopenConvolutionFwdAlgoWinograd;ConvHipImplicitGemmGroupFwdXdlops:1.66846,501144576,miopenConvolutionFwdAlgoImplicitGEMM;ConvAsmImplicitGemmGTCDynamicFwdXdlopsNHWC:1.68659,501144576,miopenConvolutionFwdAlgoImplicitGEMM;GemmFwdRest:1.97535,444248064,miopenConvolutionFwdAlgoGEMM;ConvDirectNaiveConvFwd:107,0,miopenConvolutionFwdAlgoDirect
192-409-313-3x3-192-204-156-4-0x0-2x2-1x1-0-NCHW-FP32-F=ConvBinWinogradRxSf2x3g1:2.78779,0,miopenConvolutionFwdAlgoWinograd;ConvBinWinogradRxSf3x2:1.30642,0,miopenConvolutionFwdAlgoWinograd;ConvHipImplicitGemmGroupFwdXdlops:0.983164,492358656,miopenConvolutionFwdAlgoImplicitGEMM;ConvAsmImplicitGemmGTCDynamicFwdXdlopsNHWC:0.956123,492358656,miopenConvolutionFwdAlgoImplicitGEMM;GemmFwdRest:1.35082,219967488,miopenConvolutionFwdAlgoGEMM;ConvDirectNaiveConvFwd:52.3325,0,miopenConvolutionFwdAlgoDirect
192-553-417-3x3-192-276-208-4-0x0-2x2-1x1-0-NCHW-FP32-F=ConvBinWinogradRxSf2x3g1:4.93858,0,miopenConvolutionFwdAlgoWinograd;ConvBinWinogradRxSf3x2:2.33749,0,miopenConvolutionFwdAlgoWinograd;ConvHipImplicitGemmGroupFwdXdlops:1.82536,886090752,miopenConvolutionFwdAlgoImplicitGEMM;ConvAsmImplicitGemmGTCDynamicFwdXdlopsNHWC:1.72779,886090752,miopenConvolutionFwdAlgoImplicitGEMM;GemmFwdRest:2.44332,396804096,miopenConvolutionFwdAlgoGEMM;ConvDirectNaiveConvFwd:93.1406,0,miopenConvolutionFwdAlgoDirect
192-825-625-3x3-192-412-312-4-0x0-2x2-1x1-0-NCHW-FP32-F=ConvBinWinogradRxSf2x3g1:10.9122,0,miopenConvolutionFwdAlgoWinograd;ConvBinWinogradRxSf3x2:5.21264,0,miopenConvolutionFwdAlgoWinograd;ConvHipImplicitGemmGroupFwdXdlops:3.89329,1980214272,miopenConvolutionFwdAlgoImplicitGEMM;ConvAsmImplicitGemmGTCDynamicFwdXdlopsNHWC:3.82584,1980214272,miopenConvolutionFwdAlgoImplicitGEMM;GemmFwdRest:4.90544,888496128,miopenConvolutionFwdAlgoGEMM;ConvDirectNaiveConvFwd:210.399,0,miopenConvolutionFwdAlgoDirect
384-408-312-3x3-192-408-312-4-1x1-1x1-1x1-0-NCHW-FP32-F=ConvBinWinogradRxSf2x3g1:6.08694,0,miopenConvolutionFwdAlgoWinograd;ConvBinWinogradRxSf3x2:9.97206,0,miopenConvolutionFwdAlgoWinograd;ConvHipImplicitGemmGroupFwdXdlops:5.92254,1175814144,miopenConvolutionFwdAlgoImplicitGEMM;ConvAsmImplicitGemmGTCDynamicFwdXdlopsNHWC:5.78089,1175814144,miopenConvolutionFwdAlgoImplicitGEMM;GemmFwdRest:8.81848,1759739904,miopenConvolutionFwdAlgoGEMM;ConvDirectNaiveConvFwd:411.409,0,miopenConvolutionFwdAlgoDirect
96-1105-833-3x3-96-552-416-4-0x0-2x2-1x1-0-NCHW-FP32-F=ConvBinWinogradRxSf2x3g1:4.94369,0,miopenConvolutionFwdAlgoWinograd;ConvBinWinogradRxSf3x2:2.41883,0,miopenConvolutionFwdAlgoWinograd;ConvHipImplicitGemmGroupFwdXdlops:2.70792,1766880768,miopenConvolutionFwdAlgoImplicitGEMM;ConvAsmImplicitGemmGTCDynamicFwdXdlopsNHWC:2.65066,1766880768,miopenConvolutionFwdAlgoImplicitGEMM;GemmFwdRest:3.11189,793608192,miopenConvolutionFwdAlgoGEMM;ConvDirectNaiveConvFwd:181.316,0,miopenConvolutionFwdAlgoDirect
96-1649-1249-3x3-96-824-624-4-0x0-2x2-1x1-0-NCHW-FP32-F=ConvBinWinogradRxSf2x3g1:10.9979,0,miopenConvolutionFwdAlgoWinograd;ConvBinWinogradRxSf3x2:5.31231,0,miopenConvolutionFwdAlgoWinograd;ConvHipImplicitGemmGroupFwdXdlops:5.89156,3953653248,miopenConvolutionFwdAlgoImplicitGEMM;ConvAsmImplicitGemmGTCDynamicFwdXdlopsNHWC:5.6067,3953653248,miopenConvolutionFwdAlgoImplicitGEMM;GemmFwdRest:6.52934,1776992256,miopenConvolutionFwdAlgoGEMM;ConvDirectNaiveConvFwd:417.303,0,miopenConvolutionFwdAlgoDirect
96-817-625-3x3-96-408-312-4-0x0-2x2-1x1-0-NCHW-FP32-F=ConvBinWinogradRxSf2x3g1:2.75927,0,miopenConvolutionFwdAlgoWinograd;ConvBinWinogradRxSf3x2:1.40194,0,miopenConvolutionFwdAlgoWinograd;ConvHipImplicitGemmGroupFwdXdlops:1.45846,980178432,miopenConvolutionFwdAlgoImplicitGEMM;ConvAsmImplicitGemmGTCDynamicFwdXdlopsNHWC:1.44827,980178432,miopenConvolutionFwdAlgoImplicitGEMM;GemmFwdRest:1.75112,439934976,miopenConvolutionFwdAlgoGEMM;ConvDirectNaiveConvFwd:100.09,0,miopenConvolutionFwdAlgoDirect
16-21-138-104-1x1x1-16-21-138-104-1-0x0x0-1x1x1-1x1x1-0-NCDHW-BF16-F=ConvHipImplicitGemm3DGroupFwdXdlops:0.0352724,19289600,miopenConvolutionFwdAlgoImplicitGEMM;GemmFwd1x1_0_1:0.0161204,0,miopenConvolutionFwdAlgoGEMM;ConvDirectNaiveConvFwd:9.42914,0,miopenConvolutionFwdAlgoDirect
16-3-104-80-3x3x3-384-1-102-78-1-0x0x0-1x1x1-1x1x1-0-NCDHW-BF16-F=ConvHipImplicitGemm3DGroupFwdXdlops:0.036607,7240704,miopenConvolutionFwdAlgoImplicitGEMM;GemmFwdRest:0.0416404,6873984,miopenConvolutionFwdAlgoGEMM;ConvDirectNaiveConvFwd:2.29822,0,miopenConvolutionFwdAlgoDirect
16-3-140-106-3x3x3-384-1-138-104-1-0x0x0-1x1x1-1x1x1-0-NCDHW-BF16-F=ConvHipImplicitGemm3DGroupFwdXdlops:0.044847,12778752,miopenConvolutionFwdAlgoImplicitGEMM;GemmFwdRest:0.0584338,12400128,miopenConvolutionFwdAlgoGEMM;ConvDirectNaiveConvFwd:4.13619,0,miopenConvolutionFwdAlgoDirect
16-33-68-120-1x2x2-3072-33-34-60-1-0x0x0-1x2x2-1x1x1-0-NCDHW-BF16-F=ConvHipImplicitGemm3DGroupFwdXdlops:0.506228,422624256,miopenConvolutionFwdAlgoImplicitGEMM;GemmFwdRest:0.151458,8616960,miopenConvolutionFwdAlgoGEMM;ConvDirectNaiveConvFwd:12.0201,0,miopenConvolutionFwdAlgoDirect
192-1-276-208-1x1x1-384-1-276-208-1-0x0x0-1x1x1-1x1x1-0-NCDHW-BF16-F=ConvHipImplicitGemm3DGroupFwdXdlops:0.0667675,66281472,miopenConvolutionFwdAlgoImplicitGEMM;GemmFwd1x1_0_1:0.0324322,0,miopenConvolutionFwdAlgoGEMM;ConvDirectNaiveConvFwd:20.6173,0,miopenConvolutionFwdAlgoDirect
192-1-412-312-1x1x1-384-1-412-312-1-0x0x0-1x1x1-1x1x1-0-NCDHW-BF16-F=ConvHipImplicitGemm3DGroupFwdXdlops:0.266232,148230144,miopenConvolutionFwdAlgoImplicitGEMM;GemmFwd1x1_0_1:0.0519272,0,miopenConvolutionFwdAlgoGEMM;ConvDirectNaiveConvFwd:44.8615,0,miopenConvolutionFwdAlgoDirect
192-2-276-208-1x1x1-384-2-276-208-1-0x0x0-1x1x1-1x1x1-0-NCDHW-BF16-F=ConvHipImplicitGemm3DGroupFwdXdlops:0.113257,132415488,miopenConvolutionFwdAlgoImplicitGEMM;GemmFwd1x1_0_1:0.049594,0,miopenConvolutionFwdAlgoGEMM;ConvDirectNaiveConvFwd:41.0565,0,miopenConvolutionFwdAlgoDirect
192-3-206-158-3x3x3-384-1-204-156-1-0x0x0-1x1x1-1x1x1-0-NCDHW-BF16-F=ConvHipImplicitGemm3DGroupFwdXdlops:0.226431,65917440,miopenConvolutionFwdAlgoImplicitGEMM;GemmFwdRest:0.74488,329951232,miopenConvolutionFwdAlgoGEMM;ConvDirectNaiveConvFwd:117.476,0,miopenConvolutionFwdAlgoDirect
192-3-410-314-3x3x3-192-1-408-312-1-0x0x0-1x1x1-1x1x1-0-NCDHW-BF16-F=ConvHipImplicitGemm3DGroupFwdXdlops:0.472616,199180800,miopenConvolutionFwdAlgoImplicitGEMM;GemmFwdRest:2.68248,1319804928,miopenConvolutionFwdAlgoGEMM;ConvDirectNaiveConvFwd:435.517,0,miopenConvolutionFwdAlgoDirect
192-3-554-418-3x3x3-192-1-552-416-1-0x0x0-1x1x1-1x1x1-0-NCDHW-BF16-F=ConvHipImplicitGemm3DGroupFwdXdlops:1.03818,356940288,miopenConvolutionFwdAlgoImplicitGEMM;GemmFwdRest:4.93468,2380824576,miopenConvolutionFwdAlgoGEMM;ConvDirectNaiveConvFwd:851.626,0,miopenConvolutionFwdAlgoDirect
192-4-206-158-3x3x3-384-2-204-156-1-0x0x0-1x1x1-1x1x1-0-NCDHW-BF16-F=ConvHipImplicitGemm3DGroupFwdXdlops:0.431131,102856704,miopenConvolutionFwdAlgoImplicitGEMM;GemmFwdRest:1.46165,659902464,miopenConvolutionFwdAlgoGEMM;ConvDirectNaiveConvFwd:236.567,0,miopenConvolutionFwdAlgoDirect
192-4-278-210-3x3x3-384-2-276-208-1-0x0x0-1x1x1-1x1x1-0-NCDHW-BF16-F=ConvHipImplicitGemm3DGroupFwdXdlops:0.71271,181831680,miopenConvolutionFwdAlgoImplicitGEMM;GemmFwdRest:2.63463,1190412288,miopenConvolutionFwdAlgoGEMM;ConvDirectNaiveConvFwd:460.045,0,miopenConvolutionFwdAlgoDirect
192-5-204-156-3x1x1-192-2-204-156-1-0x0x0-2x1x1-1x1x1-0-NCDHW-BF16-F=ConvHipImplicitGemm3DGroupFwdXdlops:0.122373,85764096,miopenConvolutionFwdAlgoImplicitGEMM;GemmFwdRest:0.182329,73322496,miopenConvolutionFwdAlgoGEMM;ConvDirectNaiveConvFwd:61.3218,0,miopenConvolutionFwdAlgoDirect
192-5-412-312-3x1x1-192-2-412-312-1-0x0x0-2x1x1-1x1x1-0-NCDHW-BF16-F=ConvHipImplicitGemm3DGroupFwdXdlops:0.43941,345747456,miopenConvolutionFwdAlgoImplicitGEMM;GemmFwdRest:0.685854,296165376,miopenConvolutionFwdAlgoGEMM;ConvDirectNaiveConvFwd:290.537,0,miopenConvolutionFwdAlgoDirect
192-6-826-626-3x3x3-192-4-824-624-1-0x0x0-1x1x1-1x1x1-0-NCDHW-BF16-F=ConvHipImplicitGemm3DGroupFwdXdlops:8.20319,1983108096,miopenConvolutionFwdAlgoImplicitGEMM;ConvDirectNaiveConvFwd:7686.7,0,miopenConvolutionFwdAlgoDirect
384-3-102-78-3x1x1-384-1-102-78-1-0x0x0-2x1x1-1x1x1-0-NCDHW-BF16-F=ConvHipImplicitGemm3DGroupFwdXdlops:0.0468803,25325568,miopenConvolutionFwdAlgoImplicitGEMM;GemmFwdRest:0.0663738,18330624,miopenConvolutionFwdAlgoGEMM;ConvDirectNaiveConvFwd:15.673,0,miopenConvolutionFwdAlgoDirect
384-3-138-104-3x1x1-384-1-138-104-1-0x0x0-2x1x1-1x1x1-0-NCDHW-BF16-F=ConvHipImplicitGemm3DGroupFwdXdlops:0.0737877,44974080,miopenConvolutionFwdAlgoImplicitGEMM;GemmFwdRest:0.100515,33067008,miopenConvolutionFwdAlgoGEMM;ConvDirectNaiveConvFwd:27.805,0,miopenConvolutionFwdAlgoDirect
384-3-140-106-3x3x3-32-1-138-104-1-0x0x0-1x1x1-1x1x1-0-NCDHW-BF16-F=ConvHipImplicitGemm3DGroupFwdXdlops:0.108993,35773440,miopenConvolutionFwdAlgoImplicitGEMM;GemmFwdRest:0.628314,297603072,miopenConvolutionFwdAlgoGEMM;ConvDirectNaiveConvFwd:109.111,0,miopenConvolutionFwdAlgoDirect
384-3-206-156-3x1x1-768-1-206-156-1-0x0x0-1x1x1-1x1x1-0-NCDHW-BF16-F=ConvHipImplicitGemm3DGroupFwdXdlops:0.203419,125171712,miopenConvolutionFwdAlgoImplicitGEMM;GemmFwdRest:0.220822,74041344,miopenConvolutionFwdAlgoGEMM;ConvDirectNaiveConvFwd:65.3551,0,miopenConvolutionFwdAlgoDirect
384-3-278-210-3x3x3-384-1-276-208-1-0x0x0-1x1x1-1x1x1-0-NCDHW-BF16-F=ConvHipImplicitGemm3DGroupFwdXdlops:0.715373,186559488,miopenConvolutionFwdAlgoImplicitGEMM;GemmFwdRest:2.6247,1190412288,miopenConvolutionFwdAlgoGEMM;ConvDirectNaiveConvFwd:497.203,0,miopenConvolutionFwdAlgoDirect
384-4-278-210-3x3x3-384-2-276-208-1-0x0x0-1x1x1-1x1x1-0-NCDHW-BF16-F=ConvHipImplicitGemm3DGroupFwdXdlops:1.42387,275484672,miopenConvolutionFwdAlgoImplicitGEMM;GemmFwdRest:5.27283,2380824576,miopenConvolutionFwdAlgoGEMM;ConvDirectNaiveConvFwd:1054.23,0,miopenConvolutionFwdAlgoDirect
384-138-104-1x1-1152-138-104-1-0x0-1x1-1x1-0-NCHW-BF16-F=ConvHipImplicitGemmGroupFwdXdlops:0.0814408,44974080,miopenConvolutionFwdAlgoImplicitGEMM;ConvAsmImplicitGemmGTCDynamicFwdXdlopsNHWC:0.0694342,110223360,miopenConvolutionFwdAlgoImplicitGEMM;GemmFwd1x1_0_1:0.0338724,0,miopenConvolutionFwdAlgoGEMM;ConvDirectNaiveConvFwd:9.92118,0,miopenConvolutionFwdAlgoDirect
384-204-156-3x3-192-204-156-1-1x1-1x1-1x1-0-NCHW-BF16-F=ConvHipImplicitGemmGroupFwdXdlops:0.11599,37988352,miopenConvolutionFwdAlgoImplicitGEMM;ConvAsmImplicitGemmGTCDynamicFwdXdlopsNHWC:0.157828,62429184,miopenConvolutionFwdAlgoImplicitGEMM;GemmFwdRest:0.151348,219967488,miopenConvolutionFwdAlgoGEMM;ConvDirectNaiveConvFwd:74.1864,0,miopenConvolutionFwdAlgoDirect
384-276-208-3x3-192-276-208-1-1x1-1x1-1x1-0-NCHW-BF16-F=ConvHipImplicitGemmGroupFwdXdlops:0.140748,67461120,miopenConvolutionFwdAlgoImplicitGEMM;ConvAsmImplicitGemmGTCDynamicFwdXdlopsNHWC:0.238523,111550464,miopenConvolutionFwdAlgoImplicitGEMM;GemmFwdRest:0.318523,396804096,miopenConvolutionFwdAlgoGEMM;ConvDirectNaiveConvFwd:133.961,0,miopenConvolutionFwdAlgoDirect
384-408-312-3x3-192-408-312-1-1x1-1x1-1x1-0-NCHW-BF16-F=ConvHipImplicitGemmGroupFwdXdlops:0.29394,147972096,miopenConvolutionFwdAlgoImplicitGEMM;ConvAsmImplicitGemmGTCDynamicFwdXdlopsNHWC:0.419268,245735424,miopenConvolutionFwdAlgoImplicitGEMM;GemmFwdRest:0.681682,879869952,miopenConvolutionFwdAlgoGEMM;ConvDirectNaiveConvFwd:300.663,0,miopenConvolutionFwdAlgoDirect
384-824-624-3x3-192-824-624-1-1x1-1x1-1x1-0-NCHW-BF16-F=ConvHipImplicitGemmGroupFwdXdlops:1.28398,593657856,miopenConvolutionFwdAlgoImplicitGEMM;ConvAsmImplicitGemmGTCDynamicFwdXdlopsNHWC:1.6161,988545024,miopenConvolutionFwdAlgoImplicitGEMM;GemmFwdRest:2.6095,3553984512,miopenConvolutionFwdAlgoGEMM;ConvDirectNaiveConvFwd:1296.97,0,miopenConvolutionFwdAlgoDirect
96-3-1650-1250-3x3x3-96-1-1648-1248-1-0x0x0-1x1x1-1x1x1-0-NCDHW-BF16-F=ConvHipImplicitGemm3DGroupFwdXdlops:3.95628,1583384832,miopenConvolutionFwdAlgoImplicitGEMM;ConvDirectNaiveConvFwd:3869.69,0,miopenConvolutionFwdAlgoDirect
96-6-1106-834-3x3x3-96-4-1104-832-1-0x0x0-1x1x1-1x1x1-0-NCDHW-BF16-F=ConvHipImplicitGemm3DGroupFwdXdlops:5.33685,1768536576,miopenConvolutionFwdAlgoImplicitGEMM;ConvDirectNaiveConvFwd:6841.29,0,miopenConvolutionFwdAlgoDirect
96-6-410-314-3x3x3-192-4-408-312-1-0x0x0-1x1x1-1x1x1-0-NCDHW-BF16-F=ConvHipImplicitGemm3DGroupFwdXdlops:1.06461,344830464,miopenConvolutionFwdAlgoImplicitGEMM;GemmFwdRest:5.45263,2639609856,miopenConvolutionFwdAlgoGEMM;ConvDirectNaiveConvFwd:876.602,0,miopenConvolutionFwdAlgoDirect
96-6-818-626-3x3x3-3-4-816-624-1-0x0x0-1x1x1-1x1x1-0-NCDHW-BF16-F=ConvHipImplicitGemm3DGroupFwdXdlops:2.69528,602138368,miopenConvolutionFwdAlgoImplicitGEMM;ConvDirectNaiveConvFwd:4401.76,0,miopenConvolutionFwdAlgoDirect
96-6-826-626-3x3x3-192-4-824-624-1-0x0x0-1x1x1-1x1x1-0-NCDHW-BF16-F=ConvHipImplicitGemm3DGroupFwdXdlops:4.09252,1386441216,miopenConvolutionFwdAlgoImplicitGEMM;ConvDirectNaiveConvFwd:3826.78,0,miopenConvolutionFwdAlgoDirect
384-413-313-3x3-384-206-156-2-0x0-2x2-1x1-0-NCHW-BF16-F=ConvHipImplicitGemmGroupFwdXdlops:0.485925,250572288,miopenConvolutionFwdAlgoImplicitGEMM;ConvAsmImplicitGemmGTCDynamicFwdXdlopsNHWC:0.557937,349294080,miopenConvolutionFwdAlgoImplicitGEMM;GemmFwdRest:0.534063,222124032,miopenConvolutionFwdAlgoGEMM;ConvDirectNaiveConvFwd:95.2178,0,miopenConvolutionFwdAlgoDirect
192-409-313-3x3-192-204-156-4-0x0-2x2-1x1-0-NCHW-BF16-F=ConvHipImplicitGemmGroupFwdXdlops:0.39533,246179328,miopenConvolutionFwdAlgoImplicitGEMM;ConvAsmImplicitGemmGTCDynamicFwdXdlopsNHWC:0.423498,343942656,miopenConvolutionFwdAlgoImplicitGEMM;GemmFwdRest:0.538817,109983744,miopenConvolutionFwdAlgoGEMM;ConvDirectNaiveConvFwd:46.8249,0,miopenConvolutionFwdAlgoDirect
192-816-624-3x3-96-816-624-4-1x1-1x1-1x1-0-NCHW-BF16-F=ConvHipImplicitGemmGroupFwdXdlops:1.78015,1173491712,miopenConvolutionFwdAlgoImplicitGEMM;ConvAsmImplicitGemmGTCDynamicFwdXdlopsNHWC:1.97668,1955598336,miopenConvolutionFwdAlgoImplicitGEMM;GemmFwdRest:4.88404,1759739904,miopenConvolutionFwdAlgoGEMM;ConvDirectNaiveConvFwd:898.503,0,miopenConvolutionFwdAlgoDirect
384-552-416-3x3-192-552-416-4-1x1-1x1-1x1-0-NCHW-BF16-F=ConvHipImplicitGemmGroupFwdXdlops:2.31007,1059471360,miopenConvolutionFwdAlgoImplicitGEMM;ConvAsmImplicitGemmGTCDynamicFwdXdlopsNHWC:2.93134,1764900864,miopenConvolutionFwdAlgoImplicitGEMM;GemmFwdRest:4.67138,1587216384,miopenConvolutionFwdAlgoGEMM;ConvDirectNaiveConvFwd:844.485,0,miopenConvolutionFwdAlgoDirect
96-817-625-3x3-96-408-312-4-0x0-2x2-1x1-0-NCHW-BF16-F=ConvHipImplicitGemmGroupFwdXdlops:0.617944,490089216,miopenConvolutionFwdAlgoImplicitGEMM;ConvAsmImplicitGemmGTCDynamicFwdXdlopsNHWC:0.631686,685615872,miopenConvolutionFwdAlgoImplicitGEMM;GemmFwdRest:0.858632,219967488,miopenConvolutionFwdAlgoGEMM;ConvDirectNaiveConvFwd:100.754,0,miopenConvolutionFwdAlgoDirect
128-11-130-194-3x3x3-128-9-128-192-1-0x0x0-1x1x1-1x1x1-0-NCDHW-FP16-F=ConvHipImplicitGemm3DGroupFwdXdlops:0.372924,128527360,miopenConvolutionFwdAlgoImplicitGEMM;GemmFwdRest:3.06767,1528823808,miopenConvolutionFwdAlgoGEMM;ConvDirectNaiveConvFwd:559.993,0,miopenConvolutionFwdAlgoDirect
128-11-146-258-3x3x3-128-9-144-256-1-0x0x0-1x1x1-1x1x1-0-NCDHW-FP16-F=ConvHipImplicitGemm3DGroupFwdXdlops:0.600263,191892480,miopenConvolutionFwdAlgoImplicitGEMM;GemmFwdRest:4.48115,2293235712,miopenConvolutionFwdAlgoGEMM;ConvDirectNaiveConvFwd:836.497,0,miopenConvolutionFwdAlgoDirect
128-11-258-194-3x3x3-128-9-256-192-1-0x0x0-1x1x1-1x1x1-0-NCDHW-FP16-F=ConvHipImplicitGemm3DGroupFwdXdlops:0.751111,255077376,miopenConvolutionFwdAlgoImplicitGEMM;GemmFwdRest:6.06256,3057647616,miopenConvolutionFwdAlgoGEMM;ConvDirectNaiveConvFwd:1123.74,0,miopenConvolutionFwdAlgoDirect
128-19-146-130-3x3x3-3-17-144-128-1-0x0x0-1x1x1-1x1x1-0-NCDHW-FP16-F=ConvHipImplicitGemm3DGroupFwdXdlops:0.499805,94219520,miopenConvolutionFwdAlgoImplicitGEMM;GemmFwdRest:4.18015,2165833728,miopenConvolutionFwdAlgoGEMM;ConvDirectNaiveConvFwd:870.277,0,miopenConvolutionFwdAlgoDirect
128-19-258-130-3x3x3-3-17-256-128-1-0x0x0-1x1x1-1x1x1-0-NCDHW-FP16-F=ConvHipImplicitGemm3DGroupFwdXdlops:0.926592,166501632,miopenConvolutionFwdAlgoImplicitGEMM;GemmFwdRest:7.47985,3850371072,miopenConvolutionFwdAlgoGEMM;ConvDirectNaiveConvFwd:1543.52,0,miopenConvolutionFwdAlgoDirect
16-3-16-32-1x1x1-16-3-16-32-1-0x0x0-1x1x1-1x1x1-0-NCDHW-FP16-F=ConvHipImplicitGemm3DGroupFwdXdlops:0.0220962,98816,miopenConvolutionFwdAlgoImplicitGEMM;GemmFwd1x1_0_1:0.010184,0,miopenConvolutionFwdAlgoGEMM;ConvDirectNaiveConvFwd:0.038521,0,miopenConvolutionFwdAlgoDirect
16-3-20-24-1x1x1-16-3-20-24-1-0x0x0-1x1x1-1x1x1-0-NCDHW-FP16-F=ConvHipImplicitGemm3DGroupFwdXdlops:0.0217316,92672,miopenConvolutionFwdAlgoImplicitGEMM;GemmFwd1x1_0_1:0.0098962,0,miopenConvolutionFwdAlgoGEMM;ConvDirectNaiveConvFwd:0.038521,0,miopenConvolutionFwdAlgoDirect
16-3-32-32-1x1x1-16-3-32-32-1-0x0x0-1x1x1-1x1x1-0-NCDHW-FP16-F=ConvHipImplicitGemm3DGroupFwdXdlops:0.0218133,197120,miopenConvolutionFwdAlgoImplicitGEMM;GemmFwd1x1_0_1:0.0101122,0,miopenConvolutionFwdAlgoGEMM;ConvDirectNaiveConvFwd:0.0742694,0,miopenConvolutionFwdAlgoDirect
16-5-18-26-3x3x3-512-3-16-24-1-0x0x0-1x1x1-1x1x1-0-NCDHW-FP16-F=ConvHipImplicitGemm3DGroupFwdXdlops:0.0261764,1697024,miopenConvolutionFwdAlgoImplicitGEMM;GemmFwdRest:0.0232886,995328,miopenConvolutionFwdAlgoGEMM;ConvDirectNaiveConvFwd:0.380571,0,miopenConvolutionFwdAlgoDirect
16-5-20-18-3x3x3-512-3-18-16-1-0x0x0-1x1x1-1x1x1-0-NCDHW-FP16-F=ConvHipImplicitGemm3DGroupFwdXdlops:0.0251944,1384704,miopenConvolutionFwdAlgoImplicitGEMM;GemmFwdRest:0.0188603,746496,miopenConvolutionFwdAlgoGEMM;ConvDirectNaiveConvFwd:0.30205,0,miopenConvolutionFwdAlgoDirect
16-5-22-26-3x3x3-512-3-20-24-1-0x0x0-1x1x1-1x1x1-0-NCDHW-FP16-F=ConvHipImplicitGemm3DGroupFwdXdlops:0.0266803,2008576,miopenConvolutionFwdAlgoImplicitGEMM;GemmFwdRest:0.0242004,1244160,miopenConvolutionFwdAlgoGEMM;ConvDirectNaiveConvFwd:0.457249,0,miopenConvolutionFwdAlgoDirect
16-5-32-32-1x1x1-16-5-32-32-1-0x0x0-1x1x1-1x1x1-0-NCDHW-FP16-F=ConvHipImplicitGemm3DGroupFwdXdlops:0.021944,328192,miopenConvolutionFwdAlgoImplicitGEMM;GemmFwd1x1_0_1:0.0111762,0,miopenConvolutionFwdAlgoGEMM;ConvDirectNaiveConvFwd:0.122258,0,miopenConvolutionFwdAlgoDirect
16-7-18-26-3x3x3-512-5-16-24-1-0x0x0-1x1x1-1x1x1-0-NCDHW-FP16-F=ConvHipImplicitGemm3DGroupFwdXdlops:0.0277267,2513408,miopenConvolutionFwdAlgoImplicitGEMM;GemmFwdRest:0.025208,1658880,miopenConvolutionFwdAlgoGEMM;ConvDirectNaiveConvFwd:0.607835,0,miopenConvolutionFwdAlgoDirect
16-7-34-18-3x3x3-512-5-32-16-1-0x0x0-1x1x1-1x1x1-0-NCDHW-FP16-F=ConvHipImplicitGemm3DGroupFwdXdlops:0.0281608,3201024,miopenConvolutionFwdAlgoImplicitGEMM;GemmFwdRest:0.0255442,2211840,miopenConvolutionFwdAlgoGEMM;ConvDirectNaiveConvFwd:0.753049,0,miopenConvolutionFwdAlgoDirect
256-11-130-258-3x3x3-128-9-128-256-1-0x0x0-1x1x1-1x1x1-0-NCDHW-FP16-F=ConvHipImplicitGemm3DGroupFwdXdlops:0.976096,266164224,miopenConvolutionFwdAlgoImplicitGEMM;GemmFwdRest:8.18203,4076863488,miopenConvolutionFwdAlgoGEMM;ConvDirectNaiveConvFwd:1486.74,0,miopenConvolutionFwdAlgoDirect
256-11-162-258-3x3x3-256-9-160-256-1-0x0x0-1x1x1-1x1x1-0-NCDHW-FP16-F=ConvHipImplicitGemm3DGroupFwdXdlops:2.07855,427677696,miopenConvolutionFwdAlgoImplicitGEMM;GemmFwdRest:10.892,5096079360,miopenConvolutionFwdAlgoGEMM;ConvDirectNaiveConvFwd:1865.66,0,miopenConvolutionFwdAlgoDirect
256-11-74-66-3x3x3-256-9-72-64-1-0x0x0-1x1x1-1x1x1-0-NCDHW-FP16-F=ConvHipImplicitGemm3DGroupFwdXdlops:0.270989,52279296,miopenConvolutionFwdAlgoImplicitGEMM;GemmFwdRest:1.22124,573308928,miopenConvolutionFwdAlgoGEMM;ConvDirectNaiveConvFwd:225.087,0,miopenConvolutionFwdAlgoDirect
256-17-128-256-1x1x1-128-17-128-256-1-0x0x0-1x1x1-1x1x1-0-NCDHW-FP16-F=ConvHipImplicitGemm3DGroupFwdXdlops:0.325755,427884544,miopenConvolutionFwdAlgoImplicitGEMM;GemmFwd1x1_0_1:0.102574,0,miopenConvolutionFwdAlgoGEMM;ConvDirectNaiveConvFwd:333.544,0,miopenConvolutionFwdAlgoDirect
256-17-160-256-1x1x1-128-17-160-256-1-0x0x0-1x1x1-1x1x1-0-NCDHW-FP16-F=ConvHipImplicitGemm3DGroupFwdXdlops:0.408816,534839296,miopenConvolutionFwdAlgoImplicitGEMM;GemmFwd1x1_0_1:0.132721,0,miopenConvolutionFwdAlgoGEMM;ConvDirectNaiveConvFwd:410.746,0,miopenConvolutionFwdAlgoDirect
256-19-130-258-3x3x3-128-17-128-256-1-0x0x0-1x1x1-1x1x1-0-NCDHW-FP16-F=ConvHipImplicitGemm3DGroupFwdXdlops:1.74598,470652928,miopenConvolutionFwdAlgoImplicitGEMM;ConvDirectNaiveConvFwd:2828.22,0,miopenConvolutionFwdAlgoDirect
256-19-258-130-3x3x3-128-17-256-128-1-0x0x0-1x1x1-1x1x1-0-NCDHW-FP16-F=ConvHipImplicitGemm3DGroupFwdXdlops:1.74298,470652928,miopenConvolutionFwdAlgoImplicitGEMM;ConvDirectNaiveConvFwd:2922.46,0,miopenConvolutionFwdAlgoDirect
256-7-130-130-3x3x3-256-5-128-128-1-0x0x0-1x1x1-1x1x1-0-NCDHW-FP16-F=ConvHipImplicitGemm3DGroupFwdXdlops:0.465598,106051584,miopenConvolutionFwdAlgoImplicitGEMM;GemmFwdRest:2.37487,1132462080,miopenConvolutionFwdAlgoGEMM;ConvDirectNaiveConvFwd:418.234,0,miopenConvolutionFwdAlgoDirect
256-7-74-130-3x3x3-256-5-72-128-1-0x0x0-1x1x1-1x1x1-0-NCDHW-FP16-F=ConvHipImplicitGemm3DGroupFwdXdlops:0.290529,61609984,miopenConvolutionFwdAlgoImplicitGEMM;GemmFwdRest:1.34426,637009920,miopenConvolutionFwdAlgoGEMM;ConvDirectNaiveConvFwd:234.84,0,miopenConvolutionFwdAlgoDirect
256-9-128-256-1x1x1-128-9-128-256-1-0x0x0-1x1x1-1x1x1-0-NCDHW-FP16-F=ConvHipImplicitGemm3DGroupFwdXdlops:0.167555,226557952,miopenConvolutionFwdAlgoImplicitGEMM;GemmFwd1x1_0_1:0.058711,0,miopenConvolutionFwdAlgoGEMM;ConvDirectNaiveConvFwd:139.471,0,miopenConvolutionFwdAlgoDirect
256-9-160-256-1x1x1-128-9-160-256-1-0x0x0-1x1x1-1x1x1-0-NCDHW-FP16-F=ConvHipImplicitGemm3DGroupFwdXdlops:0.220763,283181056,miopenConvolutionFwdAlgoImplicitGEMM;GemmFwd1x1_0_1:0.0711448,0,miopenConvolutionFwdAlgoGEMM;ConvDirectNaiveConvFwd:177.063,0,miopenConvolutionFwdAlgoDirect
512-11-130-130-3x3x3-256-9-128-128-1-0x0x0-1x1x1-1x1x1-0-NCDHW-FP16-F=ConvHipImplicitGemm3DGroupFwdXdlops:1.64057,272936960,miopenConvolutionFwdAlgoImplicitGEMM;GemmFwdRest:8.72721,4076863488,miopenConvolutionFwdAlgoGEMM;ConvDirectNaiveConvFwd:1512.22,0,miopenConvolutionFwdAlgoDirect
512-11-66-98-3x3x3-256-9-64-96-1-0x0x0-1x1x1-1x1x1-0-NCDHW-FP16-F=ConvHipImplicitGemm3DGroupFwdXdlops:0.586012,108244992,miopenConvolutionFwdAlgoImplicitGEMM;GemmFwdRest:3.11978,1528823808,miopenConvolutionFwdAlgoGEMM;ConvDirectNaiveConvFwd:560.137,0,miopenConvolutionFwdAlgoDirect
512-11-74-66-3x3x3-512-9-72-64-1-0x0x0-1x1x1-1x1x1-0-NCDHW-FP16-F=ConvHipImplicitGemm3DGroupFwdXdlops:0.911746,111636480,miopenConvolutionFwdAlgoImplicitGEMM;GemmFwdRest:2.72736,1146617856,miopenConvolutionFwdAlgoGEMM;ConvDirectNaiveConvFwd:507.607,0,miopenConvolutionFwdAlgoDirect
512-5-128-64-1x1x1-256-5-128-64-1-0x0x0-1x1x1-1x1x1-0-NCDHW-FP16-F=ConvHipImplicitGemm3DGroupFwdXdlops:0.0597072,63176704,miopenConvolutionFwdAlgoImplicitGEMM;GemmFwd1x1_0_1:0.0285803,0,miopenConvolutionFwdAlgoGEMM;ConvDirectNaiveConvFwd:38.6166,0,miopenConvolutionFwdAlgoDirect
512-5-18-34-3x3x3-512-3-16-32-1-0x0x0-1x1x1-1x1x1-0-NCDHW-FP16-F=ConvHipImplicitGemm3DGroupFwdXdlops:0.153339,18862080,miopenConvolutionFwdAlgoImplicitGEMM;GemmFwdRest:0.210895,42467328,miopenConvolutionFwdAlgoGEMM;ConvDirectNaiveConvFwd:15.0596,0,miopenConvolutionFwdAlgoDirect
512-5-34-34-3x3x3-512-3-32-32-1-0x0x0-1x1x1-1x1x1-0-NCDHW-FP16-F=ConvHipImplicitGemm3DGroupFwdXdlops:0.177762,23220224,miopenConvolutionFwdAlgoImplicitGEMM;GemmFwdRest:0.328277,84934656,miopenConvolutionFwdAlgoGEMM;ConvDirectNaiveConvFwd:31.9787,0,miopenConvolutionFwdAlgoDirect
512-5-64-96-1x1x1-256-5-64-96-1-0x0x0-1x1x1-1x1x1-0-NCDHW-FP16-F=ConvHipImplicitGemm3DGroupFwdXdlops:0.0476073,47448064,miopenConvolutionFwdAlgoImplicitGEMM;GemmFwd1x1_0_1:0.019992,0,miopenConvolutionFwdAlgoGEMM;ConvDirectNaiveConvFwd:29.1399,0,miopenConvolutionFwdAlgoDirect
512-5-80-96-1x1x1-256-5-80-96-1-0x0x0-1x1x1-1x1x1-0-NCDHW-FP16-F=ConvHipImplicitGemm3DGroupFwdXdlops:0.0585204,59244544,miopenConvolutionFwdAlgoImplicitGEMM;GemmFwd1x1_0_1:0.0270004,0,miopenConvolutionFwdAlgoGEMM;ConvDirectNaiveConvFwd:36.2385,0,miopenConvolutionFwdAlgoDirect
512-7-18-34-3x3x3-512-5-16-32-1-0x0x0-1x1x1-1x1x1-0-NCDHW-FP16-F=ConvHipImplicitGemm3DGroupFwdXdlops:0.174533,21164032,miopenConvolutionFwdAlgoImplicitGEMM;GemmFwdRest:0.30695,70778880,miopenConvolutionFwdAlgoGEMM;ConvDirectNaiveConvFwd:25.3466,0,miopenConvolutionFwdAlgoDirect
512-7-20-34-3x3x3-512-5-18-32-1-0x0x0-1x1x1-1x1x1-0-NCDHW-FP16-F=ConvHipImplicitGemm3DGroupFwdXdlops:0.176253,21979136,miopenConvolutionFwdAlgoImplicitGEMM;GemmFwdRest:0.32389,79626240,miopenConvolutionFwdAlgoGEMM;ConvDirectNaiveConvFwd:30.4147,0,miopenConvolutionFwdAlgoDirect
512-7-34-18-3x3x3-512-5-32-16-1-0x0x0-1x1x1-1x1x1-0-NCDHW-FP16-F=ConvHipImplicitGemm3DGroupFwdXdlops:0.17613,21164032,miopenConvolutionFwdAlgoImplicitGEMM;GemmFwdRest:0.309075,70778880,miopenConvolutionFwdAlgoGEMM;ConvDirectNaiveConvFwd:24.972,0,miopenConvolutionFwdAlgoDirect
512-7-38-66-3x3x3-512-5-36-64-1-0x0x0-1x1x1-1x1x1-0-NCDHW-FP16-F=ConvHipImplicitGemm3DGroupFwdXdlops:0.288179,43929600,miopenConvolutionFwdAlgoImplicitGEMM;GemmFwdRest:0.852228,318504960,miopenConvolutionFwdAlgoGEMM;ConvDirectNaiveConvFwd:127.023,0,miopenConvolutionFwdAlgoDirect
512-7-66-98-3x3x3-256-5-64-96-1-0x0x0-1x1x1-1x1x1-0-NCDHW-FP16-F=ConvHipImplicitGemm3DGroupFwdXdlops:0.344306,69169152,miopenConvolutionFwdAlgoImplicitGEMM;GemmFwdRest:1.79583,849346560,miopenConvolutionFwdAlgoGEMM;ConvDirectNaiveConvFwd:311.606,0,miopenConvolutionFwdAlgoDirect
512-7-82-130-3x3x3-512-5-80-128-1-0x0x0-1x1x1-1x1x1-0-NCDHW-FP16-F=ConvHipImplicitGemm3DGroupFwdXdlops:1.10865,142995456,miopenConvolutionFwdAlgoImplicitGEMM;GemmFwdRest:3.31163,1415577600,miopenConvolutionFwdAlgoGEMM;ConvDirectNaiveConvFwd:636.607,0,miopenConvolutionFwdAlgoDirect
16-21-138-104-1x1x1-16-21-138-104-1-0x0x0-1x1x1-1x1x1-0-NCDHW-FP32-F=ConvHipImplicitGemm3DGroupFwdXdlops:0.0476473,38579200,miopenConvolutionFwdAlgoImplicitGEMM;GemmFwd1x1_0_1:0.0587046,0,miopenConvolutionFwdAlgoGEMM;ConvDirectNaiveConvFwd:9.29523,0,miopenConvolutionFwdAlgoDirect
192-1-204-156-1x1x1-384-1-204-156-1-0x0x0-1x1x1-1x1x1-0-NCDHW-FP32-F=ConvHipImplicitGemm3DGroupFwdXdlops:0.110504,73617408,miopenConvolutionFwdAlgoImplicitGEMM;GemmFwd1x1_0_1:0.0494305,0,miopenConvolutionFwdAlgoGEMM;ConvDirectNaiveConvFwd:11.4226,0,miopenConvolutionFwdAlgoDirect
192-2-276-208-1x1x1-384-2-276-208-1-0x0x0-1x1x1-1x1x1-0-NCDHW-FP32-F=ConvHipImplicitGemm3DGroupFwdXdlops:0.354037,264830976,miopenConvolutionFwdAlgoImplicitGEMM;GemmFwd1x1_0_1:0.165712,0,miopenConvolutionFwdAlgoGEMM;ConvDirectNaiveConvFwd:43.5155,0,miopenConvolutionFwdAlgoDirect
192-3-410-314-3x3x3-192-1-408-312-1-0x0x0-1x1x1-1x1x1-0-NCDHW-FP32-F=ConvHipImplicitGemm3DGroupFwdXdlops:2.2656,398361600,miopenConvolutionFwdAlgoImplicitGEMM;GemmFwdRest:5.13412,2639609856,miopenConvolutionFwdAlgoGEMM;ConvDirectNaiveConvFwd:496.814,0,miopenConvolutionFwdAlgoDirect
192-4-206-158-3x3x3-384-2-204-156-1-0x0x0-1x1x1-1x1x1-0-NCDHW-FP32-F=ConvHipImplicitGemm3DGroupFwdXdlops:2.22879,205713408,miopenConvolutionFwdAlgoImplicitGEMM;GemmFwdRest:3.35649,1319804928,miopenConvolutionFwdAlgoGEMM;ConvDirectNaiveConvFwd:269.05,0,miopenConvolutionFwdAlgoDirect
192-4-414-314-3x3x3-384-2-412-312-1-0x0x0-1x1x1-1x1x1-0-NCDHW-FP32-F=ConvHipImplicitGemm3DGroupFwdXdlops:8.476,802197504,miopenConvolutionFwdAlgoImplicitGEMM;GemmFwdRest:13.7482,5330976768,miopenConvolutionFwdAlgoGEMM;ConvDirectNaiveConvFwd:1180.74,0,miopenConvolutionFwdAlgoDirect
192-6-826-626-3x3x3-192-4-824-624-1-0x0x0-1x1x1-1x1x1-0-NCDHW-FP32-F=ConvHipImplicitGemm3DGroupFwdXdlops:43.9517,3966216192,miopenConvolutionFwdAlgoImplicitGEMM;ConvDirectNaiveConvFwd:8807.1,0,miopenConvolutionFwdAlgoDirect
384-3-414-314-3x3x3-384-1-412-312-1-0x0x0-1x1x1-1x1x1-0-NCDHW-FP32-F=ConvHipImplicitGemm3DGroupFwdXdlops:8.48472,812390400,miopenConvolutionFwdAlgoImplicitGEMM;GemmFwdRest:13.8614,5330976768,miopenConvolutionFwdAlgoGEMM;ConvDirectNaiveConvFwd:1129.11,0,miopenConvolutionFwdAlgoDirect
384-102-78-1x1-1152-102-78-1-0x0-1x1-1x1-0-NCHW-FP32-F=ConvBinWinogradRxSf2x3g1:0.59584,0,miopenConvolutionFwdAlgoWinograd;ConvBinWinogradRxSf3x2:0.275863,0,miopenConvolutionFwdAlgoWinograd;ConvHipImplicitGemmGroupFwdXdlops:0.119715,50651136,miopenConvolutionFwdAlgoImplicitGEMM;ConvAsmImplicitGemmGTCDynamicFwdXdlopsNHWC:0.106481,48881664,miopenConvolutionFwdAlgoImplicitGEMM;GemmFwd1x1_0_1:0.0758088,0,miopenConvolutionFwdAlgoGEMM;ConvDirectNaiveConvFwd:5.22933,0,miopenConvolutionFwdAlgoDirect
384-102-78-1x1-384-102-78-1-0x0-1x1-1x1-0-NCHW-FP32-F=ConvBinWinogradRxSf2x3g1:0.202386,0,miopenConvolutionFwdAlgoWinograd;ConvBinWinogradRxSf3x2:0.139282,0,miopenConvolutionFwdAlgoWinograd;ConvHipImplicitGemmGroupFwdXdlops:0.0565777,25030656,miopenConvolutionFwdAlgoImplicitGEMM;ConvAsmImplicitGemmGTCDynamicFwdXdlopsNHWC:0.0529208,24440832,miopenConvolutionFwdAlgoImplicitGEMM;GemmFwd1x1_0_1:0.026707,0,miopenConvolutionFwdAlgoGEMM;ConvDirectNaiveConvFwd:4.87966,0,miopenConvolutionFwdAlgoDirect
384-204-156-3x3-192-204-156-1-1x1-1x1-1x1-0-NCHW-FP32-F=ConvBinWinogradRxSf2x3g1:0.402091,0,miopenConvolutionFwdAlgoWinograd;ConvBinWinogradRxSf3x2:0.750927,0,miopenConvolutionFwdAlgoWinograd;ConvHipImplicitGemmGroupFwdXdlops:0.466338,75976704,miopenConvolutionFwdAlgoImplicitGEMM;ConvAsmImplicitGemmGTCDynamicFwdXdlopsNHWC:0.443884,75976704,miopenConvolutionFwdAlgoImplicitGEMM;GemmFwdRest:0.639338,439934976,miopenConvolutionFwdAlgoGEMM;ConvDirectNaiveConvFwd:68.4769,0,miopenConvolutionFwdAlgoDirect
384-206-156-1x1-384-206-156-1-0x0-1x1-1x1-0-NCHW-FP32-F=ConvBinWinogradRxSf2x3g1:0.78111,0,miopenConvolutionFwdAlgoWinograd;ConvBinWinogradRxSf3x2:0.404824,0,miopenConvolutionFwdAlgoWinograd;ConvHipImplicitGemmGroupFwdXdlops:0.164779,99311616,miopenConvolutionFwdAlgoImplicitGEMM;ConvAsmImplicitGemmGTCDynamicFwdXdlopsNHWC:0.149127,98721792,miopenConvolutionFwdAlgoImplicitGEMM;GemmFwd1x1_0_1:0.086841,0,miopenConvolutionFwdAlgoGEMM;ConvDirectNaiveConvFwd:19.1944,0,miopenConvolutionFwdAlgoDirect
384-277-209-3x3-384-138-104-1-0x0-2x2-1x1-0-NCHW-FP32-F=ConvBinWinogradRxSf2x3g1:1.41113,0,miopenConvolutionFwdAlgoWinograd;ConvBinWinogradRxSf3x2:0.714904,0,miopenConvolutionFwdAlgoWinograd;ConvHipImplicitGemmGroupFwdXdlops:0.46965,116276736,miopenConvolutionFwdAlgoImplicitGEMM;ConvAsmImplicitGemmGTCDynamicFwdXdlopsNHWC:0.404644,116276736,miopenConvolutionFwdAlgoImplicitGEMM;GemmFwdRest:0.586783,198402048,miopenConvolutionFwdAlgoGEMM;ConvDirectNaiveConvFwd:38.2363,0,miopenConvolutionFwdAlgoDirect
384-413-313-3x3-384-206-156-1-0x0-2x2-1x1-0-NCHW-FP32-F=ConvBinWinogradRxSf2x3g1:2.75279,0,miopenConvolutionFwdAlgoWinograd;ConvBinWinogradRxSf3x2:1.41276,0,miopenConvolutionFwdAlgoWinograd;ConvHipImplicitGemmGroupFwdXdlops:0.904233,253226496,miopenConvolutionFwdAlgoImplicitGEMM;ConvAsmImplicitGemmGTCDynamicFwdXdlopsNHWC:0.859342,253226496,miopenConvolutionFwdAlgoImplicitGEMM;GemmFwdRest:1.05489,444248064,miopenConvolutionFwdAlgoGEMM;ConvDirectNaiveConvFwd:90.8739,0,miopenConvolutionFwdAlgoDirect
384-824-624-3x3-192-824-624-1-1x1-1x1-1x1-0-NCHW-FP32-F=ConvBinWinogradRxSf2x3g1:5.59754,0,miopenConvolutionFwdAlgoWinograd;ConvBinWinogradRxSf3x2:9.94691,0,miopenConvolutionFwdAlgoWinograd;ConvHipImplicitGemmGroupFwdXdlops:6.00049,1187315712,miopenConvolutionFwdAlgoImplicitGEMM;ConvAsmImplicitGemmGTCDynamicFwdXdlopsNHWC:5.86548,1187315712,miopenConvolutionFwdAlgoImplicitGEMM;GemmFwdRest:9.19239,7107969024,miopenConvolutionFwdAlgoGEMM;ConvDirectNaiveConvFwd:1226.13,0,miopenConvolutionFwdAlgoDirect
96-3-826-626-3x3x3-192-1-824-624-1-0x0x0-1x1x1-1x1x1-0-NCDHW-FP32-F=ConvHipImplicitGemm3DGroupFwdXdlops:4.67987,992549376,miopenConvolutionFwdAlgoImplicitGEMM;GemmFwdRest:10.3314,5330976768,miopenConvolutionFwdAlgoGEMM;ConvDirectNaiveConvFwd:1002.58,0,miopenConvolutionFwdAlgoDirect
96-4-552-416-1x1x1-192-4-552-416-1-0x0x0-1x1x1-1x1x1-0-NCDHW-FP32-F=ConvHipImplicitGemm3DGroupFwdXdlops:1.10468,1058217984,miopenConvolutionFwdAlgoImplicitGEMM;GemmFwd1x1_0_1:0.683914,0,miopenConvolutionFwdAlgoGEMM;ConvDirectNaiveConvFwd:208.819,0,miopenConvolutionFwdAlgoDirect
96-6-1106-834-3x3x3-96-4-1104-832-1-0x0x0-1x1x1-1x1x1-0-NCDHW-FP32-F=ConvHipImplicitGemm3DGroupFwdXdlops:21.0729,3537073152,miopenConvolutionFwdAlgoImplicitGEMM;ConvDirectNaiveConvFwd:7270.95,0,miopenConvolutionFwdAlgoDirect
96-6-410-314-3x3x3-192-4-408-312-1-0x0x0-1x1x1-1x1x1-0-NCDHW-FP32-F=ConvHipImplicitGemm3DGroupFwdXdlops:4.50493,689660928,miopenConvolutionFwdAlgoImplicitGEMM;GemmFwdRest:10.0688,5279219712,miopenConvolutionFwdAlgoGEMM;ConvDirectNaiveConvFwd:943.474,0,miopenConvolutionFwdAlgoDirect
96-6-818-626-3x3x3-3-4-816-624-1-0x0x0-1x1x1-1x1x1-0-NCDHW-FP32-F=ConvHipImplicitGemm3DGroupFwdXdlops:4.48711,1204276736,miopenConvolutionFwdAlgoImplicitGEMM;ConvDirectNaiveConvFwd:4622.32,0,miopenConvolutionFwdAlgoDirect
96-6-826-626-3x3x3-192-4-824-624-1-0x0x0-1x1x1-1x1x1-0-NCDHW-FP32-F=ConvHipImplicitGemm3DGroupFwdXdlops:17.7223,2772882432,miopenConvolutionFwdAlgoImplicitGEMM;ConvDirectNaiveConvFwd:4011.7,0,miopenConvolutionFwdAlgoDirect
384-277-209-3x3-384-138-104-2-0x0-2x2-1x1-0-NCHW-FP32-F=ConvBinWinogradRxSf2x3g1:2.53612,0,miopenConvolutionFwdAlgoWinograd;ConvBinWinogradRxSf3x2:1.21325,0,miopenConvolutionFwdAlgoWinograd;ConvHipImplicitGemmGroupFwdXdlops:0.844151,227245056,miopenConvolutionFwdAlgoImplicitGEMM;ConvAsmImplicitGemmGTCDynamicFwdXdlopsNHWC:0.764333,227245056,miopenConvolutionFwdAlgoImplicitGEMM;GemmFwdRest:1.11026,198402048,miopenConvolutionFwdAlgoGEMM;ConvDirectNaiveConvFwd:44.2917,0,miopenConvolutionFwdAlgoDirect
192-1104-832-3x3-96-1104-832-4-1x1-1x1-1x1-0-NCHW-FP32-F=ConvBinWinogradRxSf2x3g1:10.6302,0,miopenConvolutionFwdAlgoWinograd;ConvBinWinogradRxSf3x2:17.7711,0,miopenConvolutionFwdAlgoWinograd;ConvHipImplicitGemmGroupFwdXdlops:14.8624,4233240576,miopenConvolutionFwdAlgoImplicitGEMM;ConvAsmImplicitGemmGTCDynamicFwdXdlopsNHWC:14.0939,4233240576,miopenConvolutionFwdAlgoImplicitGEMM;GemmFwdRest:19.7427,6348865536,miopenConvolutionFwdAlgoGEMM;ConvDirectNaiveConvFwd:1732.77,0,miopenConvolutionFwdAlgoDirect
384-824-624-3x3-192-824-624-4-1x1-1x1-1x1-0-NCHW-FP32-F=ConvBinWinogradRxSf2x3g1:23.2258,0,miopenConvolutionFwdAlgoWinograd;ConvBinWinogradRxSf3x2:39.8071,0,miopenConvolutionFwdAlgoWinograd;ConvHipImplicitGemmGroupFwdXdlops:23.465,4741300224,miopenConvolutionFwdAlgoImplicitGEMM;ConvAsmImplicitGemmGTCDynamicFwdXdlopsNHWC:23.3232,4741300224,miopenConvolutionFwdAlgoImplicitGEMM;GemmFwdRest:36.9774,7107969024,miopenConvolutionFwdAlgoGEMM;ConvDirectNaiveConvFwd:2121.26,0,miopenConvolutionFwdAlgoDirect
192-409-313-3x3-192-204-156-1-0x0-2x2-1x1-0-NCHW-BF16-F=ConvHipImplicitGemmGroupFwdXdlops:0.107153,62042624,miopenConvolutionFwdAlgoImplicitGEMM;ConvAsmImplicitGemmGTCDynamicFwdXdlopsNHWC:0.11735,86483456,miopenConvolutionFwdAlgoImplicitGEMM;GemmFwdRest:0.107082,109983744,miopenConvolutionFwdAlgoGEMM;ConvDirectNaiveConvFwd:42.6488,0,miopenConvolutionFwdAlgoDirect
192-816-624-3x3-96-816-624-1-1x1-1x1-1x1-0-NCHW-BF16-F=ConvHipImplicitGemmGroupFwdXdlops:0.440185,293621760,miopenConvolutionFwdAlgoImplicitGEMM;ConvAsmImplicitGemmGTCDynamicFwdXdlopsNHWC:0.519397,489148416,miopenConvolutionFwdAlgoImplicitGEMM;GemmFwdRest:1.3131,1759739904,miopenConvolutionFwdAlgoGEMM;ConvDirectNaiveConvFwd:614.408,0,miopenConvolutionFwdAlgoDirect
3-3-1650-1250-3x3x3-96-1-1648-1248-1-0x0x0-1x1x1-1x1x1-0-NCDHW-BF16-F=ConvHipImplicitGemm3DGroupFwdXdlops:0.849055,432027904,miopenConvolutionFwdAlgoImplicitGEMM;GemmFwdRest:0.844345,333186048,miopenConvolutionFwdAlgoGEMM;ConvDirectNaiveConvFwd:124.932,0,miopenConvolutionFwdAlgoDirect
3-6-1650-1250-3x3x3-96-4-1648-1248-1-0x0x0-1x1x1-1x1x1-0-NCDHW-BF16-F=ConvHipImplicitGemm3DGroupFwdXdlops:3.28451,1653814528,miopenConvolutionFwdAlgoImplicitGEMM;GemmFwdRest:3.22763,1332744192,miopenConvolutionFwdAlgoGEMM;ConvDirectNaiveConvFwd:492.977,0,miopenConvolutionFwdAlgoDirect
36-21-138-104-1x2x2-5120-21-69-52-1-0x0x0-1x2x2-1x1x1-0-NCDHW-BF16-F=ConvHipImplicitGemm3DGroupFwdXdlops:1.31377,794738432,miopenConvolutionFwdAlgoImplicitGEMM;GemmFwdRest:0.387684,21700224,miopenConvolutionFwdAlgoGEMM;ConvDirectNaiveConvFwd:52.6721,0,miopenConvolutionFwdAlgoDirect
384-3-104-80-3x3x3-384-1-102-78-1-0x0x0-1x1x1-1x1x1-0-NCDHW-BF16-F=ConvHipImplicitGemm3DGroupFwdXdlops:0.147493,33242112,miopenConvolutionFwdAlgoImplicitGEMM;GemmFwdRest:0.488831,164975616,miopenConvolutionFwdAlgoGEMM;ConvDirectNaiveConvFwd:61.7325,0,miopenConvolutionFwdAlgoDirect
384-3-138-104-3x1x1-768-1-138-104-1-0x0x0-1x1x1-1x1x1-0-NCDHW-BF16-F=ConvHipImplicitGemm3DGroupFwdXdlops:0.100567,56881152,miopenConvolutionFwdAlgoImplicitGEMM;GemmFwdRest:0.110073,33067008,miopenConvolutionFwdAlgoGEMM;ConvDirectNaiveConvFwd:27.9893,0,miopenConvolutionFwdAlgoDirect
384-3-206-156-3x1x1-384-1-206-156-1-0x0x0-2x1x1-1x1x1-0-NCDHW-BF16-F=ConvHipImplicitGemm3DGroupFwdXdlops:0.142007,99606528,miopenConvolutionFwdAlgoImplicitGEMM;GemmFwdRest:0.192818,74041344,miopenConvolutionFwdAlgoGEMM;ConvDirectNaiveConvFwd:63.5143,0,miopenConvolutionFwdAlgoDirect
384-3-208-158-3x3x3-384-1-206-156-1-0x0x0-1x1x1-1x1x1-0-NCDHW-BF16-F=ConvHipImplicitGemm3DGroupFwdXdlops:0.406425,108361728,miopenConvolutionFwdAlgoImplicitGEMM;GemmFwdRest:1.47712,666372096,miopenConvolutionFwdAlgoGEMM;ConvDirectNaiveConvFwd:251.689,0,miopenConvolutionFwdAlgoDirect
384-4-206-158-3x3x3-384-2-204-156-1-0x0x0-1x1x1-1x1x1-0-NCDHW-BF16-F=ConvHipImplicitGemm3DGroupFwdXdlops:0.79686,156831744,miopenConvolutionFwdAlgoImplicitGEMM;GemmFwdRest:2.87945,1319804928,miopenConvolutionFwdAlgoGEMM;ConvDirectNaiveConvFwd:557.443,0,miopenConvolutionFwdAlgoDirect
384-4-414-314-3x3x3-384-2-412-312-1-0x0x0-1x1x1-1x1x1-0-NCDHW-BF16-F=ConvHipImplicitGemm3DGroupFwdXdlops:3.06546,604753920,miopenConvolutionFwdAlgoImplicitGEMM;GemmFwdRest:12.4298,5330976768,miopenConvolutionFwdAlgoGEMM;ConvDirectNaiveConvFwd:2182.82,0,miopenConvolutionFwdAlgoDirect
384-413-313-3x3-384-206-156-1-0x0-2x2-1x1-0-NCHW-BF16-F=ConvHipImplicitGemmGroupFwdXdlops:0.223971,126613248,miopenConvolutionFwdAlgoImplicitGEMM;ConvAsmImplicitGemmGTCDynamicFwdXdlopsNHWC:0.280536,175974144,miopenConvolutionFwdAlgoImplicitGEMM;GemmFwdRest:0.26111,222124032,miopenConvolutionFwdAlgoGEMM;ConvDirectNaiveConvFwd:86.3652,0,miopenConvolutionFwdAlgoDirect
96-1-552-416-1x1x1-192-1-552-416-1-0x0x0-1x1x1-1x1x1-0-NCDHW-BF16-F=ConvHipImplicitGemm3DGroupFwdXdlops:0.108247,132304896,miopenConvolutionFwdAlgoImplicitGEMM;GemmFwd1x1_0_1:0.039767,0,miopenConvolutionFwdAlgoGEMM;ConvDirectNaiveConvFwd:40.458,0,miopenConvolutionFwdAlgoDirect
96-3-1106-834-3x3x3-3-1-1104-832-1-0x0x0-1x1x1-1x1x1-0-NCDHW-BF16-F=ConvHipImplicitGemm3DGroupFwdXdlops:1.4496,536831488,miopenConvolutionFwdAlgoImplicitGEMM;GemmFwdRest:9.50511,4761649152,miopenConvolutionFwdAlgoGEMM;ConvDirectNaiveConvFwd:2023.46,0,miopenConvolutionFwdAlgoDirect
96-3-410-314-3x3x3-192-1-408-312-1-0x0x0-1x1x1-1x1x1-0-NCDHW-BF16-F=ConvHipImplicitGemm3DGroupFwdXdlops:0.257809,124031232,miopenConvolutionFwdAlgoImplicitGEMM;GemmFwdRest:1.38913,659902464,miopenConvolutionFwdAlgoGEMM;ConvDirectNaiveConvFwd:216.706,0,miopenConvolutionFwdAlgoDirect
96-3-818-626-3x3x3-3-1-816-624-1-0x0x0-1x1x1-1x1x1-0-NCDHW-BF16-F=ConvHipImplicitGemm3DGroupFwdXdlops:0.736143,298021888,miopenConvolutionFwdAlgoImplicitGEMM;GemmFwdRest:5.3144,2639609856,miopenConvolutionFwdAlgoGEMM;ConvDirectNaiveConvFwd:1125.14,0,miopenConvolutionFwdAlgoDirect
96-3-826-626-3x3x3-192-1-824-624-1-0x0x0-1x1x1-1x1x1-0-NCDHW-BF16-F=ConvHipImplicitGemm3DGroupFwdXdlops:1.22052,496274688,miopenConvolutionFwdAlgoImplicitGEMM;GemmFwdRest:5.62559,2665488384,miopenConvolutionFwdAlgoGEMM;ConvDirectNaiveConvFwd:955.18,0,miopenConvolutionFwdAlgoDirect
96-6-1106-834-3x3x3-96-4-1104-832-1-0x0x0-1x1x1-1x1x1-0-NCDHW-BF16-F=ConvHipImplicitGemm3DGroupFwdXdlops:5.3238,1768536576,miopenConvolutionFwdAlgoImplicitGEMM;ConvDirectNaiveConvFwd:6850.81,0,miopenConvolutionFwdAlgoDirect
96-6-410-314-3x3x3-192-4-408-312-1-0x0x0-1x1x1-1x1x1-0-NCDHW-BF16-F=ConvHipImplicitGemm3DGroupFwdXdlops:1.07062,344830464,miopenConvolutionFwdAlgoImplicitGEMM;GemmFwdRest:5.44352,2639609856,miopenConvolutionFwdAlgoGEMM;ConvDirectNaiveConvFwd:874.726,0,miopenConvolutionFwdAlgoDirect
96-6-818-626-3x3x3-3-4-816-624-1-0x0x0-1x1x1-1x1x1-0-NCDHW-BF16-F=ConvHipImplicitGemm3DGroupFwdXdlops:2.69951,602138368,miopenConvolutionFwdAlgoImplicitGEMM;ConvDirectNaiveConvFwd:4417.42,0,miopenConvolutionFwdAlgoDirect
96-6-826-626-3x3x3-192-4-824-624-1-0x0x0-1x1x1-1x1x1-0-NCDHW-BF16-F=ConvHipImplicitGemm3DGroupFwdXdlops:4.08474,1386441216,miopenConvolutionFwdAlgoImplicitGEMM;ConvDirectNaiveConvFwd:3831.03,0,miopenConvolutionFwdAlgoDirect
384-412-312-3x3-192-412-312-2-1x1-1x1-1x1-0-NCHW-BF16-F=ConvHipImplicitGemmGroupFwdXdlops:0.800168,297492480,miopenConvolutionFwdAlgoImplicitGEMM;ConvAsmImplicitGemmGTCDynamicFwdXdlopsNHWC:0.972336,494936064,miopenConvolutionFwdAlgoImplicitGEMM;GemmFwdRest:1.39571,888496128,miopenConvolutionFwdAlgoGEMM;ConvDirectNaiveConvFwd:326.365,0,miopenConvolutionFwdAlgoDirect
192-553-417-3x3-192-276-208-4-0x0-2x2-1x1-0-NCHW-BF16-F=ConvHipImplicitGemmGroupFwdXdlops:0.635549,443045376,miopenConvolutionFwdAlgoImplicitGEMM;ConvAsmImplicitGemmGTCDynamicFwdXdlopsNHWC:0.723791,619402752,miopenConvolutionFwdAlgoImplicitGEMM;GemmFwdRest:0.865229,198402048,miopenConvolutionFwdAlgoGEMM;ConvDirectNaiveConvFwd:92.3946,0,miopenConvolutionFwdAlgoDirect
192-825-625-3x3-192-412-312-4-0x0-2x2-1x1-0-NCHW-BF16-F=ConvHipImplicitGemmGroupFwdXdlops:1.53592,990107136,miopenConvolutionFwdAlgoImplicitGEMM;ConvAsmImplicitGemmGTCDynamicFwdXdlopsNHWC:1.61402,1384994304,miopenConvolutionFwdAlgoImplicitGEMM;GemmFwdRest:1.74339,444248064,miopenConvolutionFwdAlgoGEMM;ConvDirectNaiveConvFwd:211.258,0,miopenConvolutionFwdAlgoDirect
384-408-312-3x3-192-408-312-4-1x1-1x1-1x1-0-NCHW-BF16-F=ConvHipImplicitGemmGroupFwdXdlops:1.28438,587907072,miopenConvolutionFwdAlgoImplicitGEMM;ConvAsmImplicitGemmGTCDynamicFwdXdlopsNHWC:1.61774,978960384,miopenConvolutionFwdAlgoImplicitGEMM;GemmFwdRest:2.67569,879869952,miopenConvolutionFwdAlgoGEMM;ConvDirectNaiveConvFwd:425.752,0,miopenConvolutionFwdAlgoDirect
96-1105-833-3x3-96-552-416-4-0x0-2x2-1x1-0-NCHW-BF16-F=ConvHipImplicitGemmGroupFwdXdlops:1.26247,883440384,miopenConvolutionFwdAlgoImplicitGEMM;ConvAsmImplicitGemmGTCDynamicFwdXdlopsNHWC:1.2577,1236155136,miopenConvolutionFwdAlgoImplicitGEMM;GemmFwdRest:1.54594,396804096,miopenConvolutionFwdAlgoGEMM;ConvDirectNaiveConvFwd:181.49,0,miopenConvolutionFwdAlgoDirect
96-1649-1249-3x3-96-824-624-4-0x0-2x2-1x1-0-NCHW-BF16-F=ConvHipImplicitGemmGroupFwdXdlops:2.68821,1976826624,miopenConvolutionFwdAlgoImplicitGEMM;ConvAsmImplicitGemmGTCDynamicFwdXdlopsNHWC:2.75044,2766600960,miopenConvolutionFwdAlgoImplicitGEMM;GemmFwdRest:3.28874,888496128,miopenConvolutionFwdAlgoGEMM;ConvDirectNaiveConvFwd:420.017,0,miopenConvolutionFwdAlgoDirect
128-11-130-258-3x3x3-128-9-128-256-1-0x0x0-1x1x1-1x1x1-0-NCDHW-FP16-F=ConvHipImplicitGemm3DGroupFwdXdlops:0.483239,170830848,miopenConvolutionFwdAlgoImplicitGEMM;GemmFwdRest:4.10126,2038431744,miopenConvolutionFwdAlgoGEMM;ConvDirectNaiveConvFwd:738.323,0,miopenConvolutionFwdAlgoDirect
128-11-258-130-3x3x3-128-9-256-128-1-0x0x0-1x1x1-1x1x1-0-NCDHW-FP16-F=ConvHipImplicitGemm3DGroupFwdXdlops:0.483645,170830848,miopenConvolutionFwdAlgoImplicitGEMM;GemmFwdRest:4.02074,2038431744,miopenConvolutionFwdAlgoGEMM;ConvDirectNaiveConvFwd:754.143,0,miopenConvolutionFwdAlgoDirect
128-19-130-194-3x3x3-128-17-128-192-1-0x0x0-1x1x1-1x1x1-0-NCDHW-FP16-F=ConvHipImplicitGemm3DGroupFwdXdlops:0.726487,230509568,miopenConvolutionFwdAlgoImplicitGEMM;GemmFwdRest:5.78121,2887778304,miopenConvolutionFwdAlgoGEMM;ConvDirectNaiveConvFwd:1052.86,0,miopenConvolutionFwdAlgoDirect
128-19-162-194-3x3x3-128-17-160-192-1-0x0x0-1x1x1-1x1x1-0-NCDHW-FP16-F=ConvHipImplicitGemm3DGroupFwdXdlops:0.868872,287443968,miopenConvolutionFwdAlgoImplicitGEMM;GemmFwdRest:7.11862,3609722880,miopenConvolutionFwdAlgoGEMM;ConvDirectNaiveConvFwd:1318.46,0,miopenConvolutionFwdAlgoDirect
128-19-258-194-3x3x3-128-17-256-192-1-0x0x0-1x1x1-1x1x1-0-NCDHW-FP16-F=ConvHipImplicitGemm3DGroupFwdXdlops:1.37525,458247168,miopenConvolutionFwdAlgoImplicitGEMM;GemmFwdRest:12.1447,5775556608,miopenConvolutionFwdAlgoGEMM;ConvDirectNaiveConvFwd:2177.66,0,miopenConvolutionFwdAlgoDirect
16-7-22-26-3x3x3-512-5-20-24-1-0x0x0-1x1x1-1x1x1-0-NCDHW-FP16-F=ConvHipImplicitGemm3DGroupFwdXdlops:0.0278516,3028224,miopenConvolutionFwdAlgoImplicitGEMM;GemmFwdRest:0.0258402,2073600,miopenConvolutionFwdAlgoGEMM;ConvDirectNaiveConvFwd:0.745128,0,miopenConvolutionFwdAlgoDirect
256-11-130-194-3x3x3-128-9-128-192-1-0x0x0-1x1x1-1x1x1-0-NCDHW-FP16-F=ConvHipImplicitGemm3DGroupFwdXdlops:0.725687,200431616,miopenConvolutionFwdAlgoImplicitGEMM;GemmFwdRest:6.16902,3057647616,miopenConvolutionFwdAlgoGEMM;ConvDirectNaiveConvFwd:1119.69,0,miopenConvolutionFwdAlgoDirect
256-11-162-194-3x3x3-128-9-160-192-1-0x0x0-1x1x1-1x1x1-0-NCDHW-FP16-F=ConvHipImplicitGemm3DGroupFwdXdlops:0.942433,249550848,miopenConvolutionFwdAlgoImplicitGEMM;GemmFwdRest:7.86909,3822059520,miopenConvolutionFwdAlgoGEMM;ConvDirectNaiveConvFwd:1396.76,0,miopenConvolutionFwdAlgoDirect
256-11-258-194-3x3x3-256-9-256-192-1-0x0x0-1x1x1-1x1x1-0-NCDHW-FP16-F=ConvHipImplicitGemm3DGroupFwdXdlops:2.46719,511924224,miopenConvolutionFwdAlgoImplicitGEMM;GemmFwdRest:13.0391,6115295232,miopenConvolutionFwdAlgoGEMM;ConvDirectNaiveConvFwd:2284.64,0,miopenConvolutionFwdAlgoDirect
256-17-256-256-1x1x1-128-17-256-256-1-0x0x0-1x1x1-1x1x1-0-NCDHW-FP16-F=ConvHipImplicitGemm3DGroupFwdXdlops:0.644093,855703552,miopenConvolutionFwdAlgoImplicitGEMM;GemmFwd1x1_0_1:0.183275,0,miopenConvolutionFwdAlgoGEMM;ConvDirectNaiveConvFwd:673.485,0,miopenConvolutionFwdAlgoDirect
256-19-146-258-3x3x3-256-17-144-256-1-0x0x0-1x1x1-1x1x1-0-NCDHW-FP16-F=ConvHipImplicitGemm3DGroupFwdXdlops:3.4903,690837504,miopenConvolutionFwdAlgoImplicitGEMM;ConvDirectNaiveConvFwd:3195.28,0,miopenConvolutionFwdAlgoDirect
256-19-258-194-3x3x3-256-17-256-192-1-0x0x0-1x1x1-1x1x1-0-NCDHW-FP16-F=ConvHipImplicitGemm3DGroupFwdXdlops:4.52907,918263808,miopenConvolutionFwdAlgoImplicitGEMM;ConvDirectNaiveConvFwd:4332,0,miopenConvolutionFwdAlgoDirect
512-11-130-98-3x3x3-512-9-128-96-1-0x0x0-1x1x1-1x1x1-0-NCDHW-FP16-F=ConvHipImplicitGemm3DGroupFwdXdlops:2.24092,270905344,miopenConvolutionFwdAlgoImplicitGEMM;GemmFwdRest:7.28667,3057647616,miopenConvolutionFwdAlgoGEMM;ConvDirectNaiveConvFwd:1469.33,0,miopenConvolutionFwdAlgoDirect
512-11-74-66-3x3x3-256-9-72-64-1-0x0x0-1x1x1-1x1x1-0-NCDHW-FP16-F=ConvHipImplicitGemm3DGroupFwdXdlops:0.503225,83324928,miopenConvolutionFwdAlgoImplicitGEMM;GemmFwdRest:2.40215,1146617856,miopenConvolutionFwdAlgoGEMM;ConvDirectNaiveConvFwd:451.97,0,miopenConvolutionFwdAlgoDirect
512-5-128-128-1x1x1-256-5-128-128-1-0x0x0-1x1x1-1x1x1-0-NCDHW-FP16-F=ConvHipImplicitGemm3DGroupFwdXdlops:0.0978572,126091264,miopenConvolutionFwdAlgoImplicitGEMM;GemmFwd1x1_0_1:0.0406004,0,miopenConvolutionFwdAlgoGEMM;ConvDirectNaiveConvFwd:77.0322,0,miopenConvolutionFwdAlgoDirect
512-5-18-26-3x3x3-512-3-16-24-1-0x0x0-1x1x1-1x1x1-0-NCDHW-FP16-F=ConvHipImplicitGemm3DGroupFwdXdlops:0.131955,17731584,miopenConvolutionFwdAlgoImplicitGEMM;GemmFwdRest:0.180268,31850496,miopenConvolutionFwdAlgoGEMM;ConvDirectNaiveConvFwd:12.0122,0,miopenConvolutionFwdAlgoDirect
512-5-22-26-3x3x3-512-3-20-24-1-0x0x0-1x1x1-1x1x1-0-NCDHW-FP16-F=ConvHipImplicitGemm3DGroupFwdXdlops:0.148108,18558976,miopenConvolutionFwdAlgoImplicitGEMM;GemmFwdRest:0.212849,39813120,miopenConvolutionFwdAlgoGEMM;ConvDirectNaiveConvFwd:14.7587,0,miopenConvolutionFwdAlgoDirect
512-5-34-66-3x3x3-512-3-32-64-1-0x0x0-1x1x1-1x1x1-0-NCDHW-FP16-F=ConvHipImplicitGemm3DGroupFwdXdlops:0.187995,31936512,miopenConvolutionFwdAlgoImplicitGEMM;GemmFwdRest:0.484612,169869312,miopenConvolutionFwdAlgoGEMM;ConvDirectNaiveConvFwd:67.6695,0,miopenConvolutionFwdAlgoDirect
512-5-66-50-3x3x3-512-3-64-48-1-0x0x0-1x1x1-1x1x1-0-NCDHW-FP16-F=ConvHipImplicitGemm3DGroupFwdXdlops:0.262649,40488960,miopenConvolutionFwdAlgoImplicitGEMM;GemmFwdRest:0.738274,254803968,miopenConvolutionFwdAlgoGEMM;ConvDirectNaiveConvFwd:97.8897,0,miopenConvolutionFwdAlgoDirect
512-7-130-66-3x3x3-256-5-128-64-1-0x0x0-1x1x1-1x1x1-0-NCDHW-FP16-F=ConvHipImplicitGemm3DGroupFwdXdlops:0.501451,89550848,miopenConvolutionFwdAlgoImplicitGEMM;GemmFwdRest:2.32436,1132462080,miopenConvolutionFwdAlgoGEMM;ConvDirectNaiveConvFwd:438.994,0,miopenConvolutionFwdAlgoDirect
512-7-22-26-3x3x3-512-5-20-24-1-0x0x0-1x1x1-1x1x1-0-NCDHW-FP16-F=ConvHipImplicitGemm3DGroupFwdXdlops:0.164578,20713472,miopenConvolutionFwdAlgoImplicitGEMM;GemmFwdRest:0.29935,66355200,miopenConvolutionFwdAlgoGEMM;ConvDirectNaiveConvFwd:24.7899,0,miopenConvolutionFwdAlgoDirect
512-7-34-50-3x3x3-512-5-32-48-1-0x0x0-1x1x1-1x1x1-0-NCDHW-FP16-F=ConvHipImplicitGemm3DGroupFwdXdlops:0.192402,34205696,miopenConvolutionFwdAlgoImplicitGEMM;GemmFwdRest:0.62172,212336640,miopenConvolutionFwdAlgoGEMM;ConvDirectNaiveConvFwd:81.0825,0,miopenConvolutionFwdAlgoDirect
512-7-66-34-3x3x3-512-5-64-32-1-0x0x0-1x1x1-1x1x1-0-NCDHW-FP16-F=ConvHipImplicitGemm3DGroupFwdXdlops:0.276569,40726528,miopenConvolutionFwdAlgoImplicitGEMM;GemmFwdRest:0.804904,283115520,miopenConvolutionFwdAlgoGEMM;ConvDirectNaiveConvFwd:106.194,0,miopenConvolutionFwdAlgoDirect
512-7-74-130-3x3x3-512-5-72-128-1-0x0x0-1x1x1-1x1x1-0-NCDHW-FP16-F=ConvHipImplicitGemm3DGroupFwdXdlops:0.985003,130297856,miopenConvolutionFwdAlgoImplicitGEMM;GemmFwdRest:2.98005,1274019840,miopenConvolutionFwdAlgoGEMM;ConvDirectNaiveConvFwd:574.589,0,miopenConvolutionFwdAlgoDirect
512-9-64-128-1x1x1-256-9-64-128-1-0x0x0-1x1x1-1x1x1-0-NCDHW-FP16-F=ConvHipImplicitGemm3DGroupFwdXdlops:0.0917345,113508352,miopenConvolutionFwdAlgoImplicitGEMM;GemmFwd1x1_0_1:0.0428324,0,miopenConvolutionFwdAlgoGEMM;ConvDirectNaiveConvFwd:70.3186,0,miopenConvolutionFwdAlgoDirect
16-21-138-104-1x1x1-16-21-138-104-1-0x0x0-1x1x1-1x1x1-0-NCDHW-FP32-F=ConvHipImplicitGemm3DGroupFwdXdlops:0.0481606,38579200,miopenConvolutionFwdAlgoImplicitGEMM;GemmFwd1x1_0_1:0.0593206,0,miopenConvolutionFwdAlgoGEMM;ConvDirectNaiveConvFwd:9.32812,0,miopenConvolutionFwdAlgoDirect
192-1-204-156-1x1x1-384-1-204-156-1-0x0x0-1x1x1-1x1x1-0-NCDHW-FP32-F=ConvHipImplicitGemm3DGroupFwdXdlops:0.109968,73617408,miopenConvolutionFwdAlgoImplicitGEMM;GemmFwd1x1_0_1:0.0510484,0,miopenConvolutionFwdAlgoGEMM;ConvDirectNaiveConvFwd:11.4437,0,miopenConvolutionFwdAlgoDirect
192-2-276-208-1x1x1-384-2-276-208-1-0x0x0-1x1x1-1x1x1-0-NCDHW-FP32-F=ConvHipImplicitGemm3DGroupFwdXdlops:0.350363,264830976,miopenConvolutionFwdAlgoImplicitGEMM;GemmFwd1x1_0_1:0.165625,0,miopenConvolutionFwdAlgoGEMM;ConvDirectNaiveConvFwd:44.0818,0,miopenConvolutionFwdAlgoDirect
192-3-410-314-3x3x3-192-1-408-312-1-0x0x0-1x1x1-1x1x1-0-NCDHW-FP32-F=ConvHipImplicitGemm3DGroupFwdXdlops:2.30151,398361600,miopenConvolutionFwdAlgoImplicitGEMM;GemmFwdRest:5.02058,2639609856,miopenConvolutionFwdAlgoGEMM;ConvDirectNaiveConvFwd:495.957,0,miopenConvolutionFwdAlgoDirect
192-4-206-158-3x3x3-384-2-204-156-1-0x0x0-1x1x1-1x1x1-0-NCDHW-FP32-F=ConvHipImplicitGemm3DGroupFwdXdlops:2.19978,205713408,miopenConvolutionFwdAlgoImplicitGEMM;GemmFwdRest:3.42111,1319804928,miopenConvolutionFwdAlgoGEMM;ConvDirectNaiveConvFwd:259.308,0,miopenConvolutionFwdAlgoDirect
192-4-414-314-3x3x3-384-2-412-312-1-0x0x0-1x1x1-1x1x1-0-NCDHW-FP32-F=ConvHipImplicitGemm3DGroupFwdXdlops:8.64114,802197504,miopenConvolutionFwdAlgoImplicitGEMM;GemmFwdRest:13.8048,5330976768,miopenConvolutionFwdAlgoGEMM;ConvDirectNaiveConvFwd:1198.4,0,miopenConvolutionFwdAlgoDirect
192-6-826-626-3x3x3-192-4-824-624-1-0x0x0-1x1x1-1x1x1-0-NCDHW-FP32-F=ConvHipImplicitGemm3DGroupFwdXdlops:43.9991,3966216192,miopenConvolutionFwdAlgoImplicitGEMM;ConvDirectNaiveConvFwd:8798.33,0,miopenConvolutionFwdAlgoDirect
384-4-204-156-3x1x1-768-2-204-156-1-0x0x0-1x1x1-1x1x1-0-NCDHW-FP32-F=ConvHipImplicitGemm3DGroupFwdXdlops:1.22002,394592256,miopenConvolutionFwdAlgoImplicitGEMM;GemmFwdRest:1.33539,293289984,miopenConvolutionFwdAlgoGEMM;ConvDirectNaiveConvFwd:143.985,0,miopenConvolutionFwdAlgoDirect
384-4-276-208-3x1x1-768-2-276-208-1-0x0x0-1x1x1-1x1x1-0-NCDHW-FP32-F=ConvHipImplicitGemm3DGroupFwdXdlops:2.17234,708968448,miopenConvolutionFwdAlgoImplicitGEMM;GemmFwdRest:2.32411,529072128,miopenConvolutionFwdAlgoGEMM;ConvDirectNaiveConvFwd:292.545,0,miopenConvolutionFwdAlgoDirect
384-4-412-312-3x1x1-768-2-412-312-1-0x0x0-1x1x1-1x1x1-0-NCDHW-FP32-F=ConvHipImplicitGemm3DGroupFwdXdlops:4.70038,1583087616,miopenConvolutionFwdAlgoImplicitGEMM;GemmFwdRest:5.0868,1184661504,miopenConvolutionFwdAlgoGEMM;ConvDirectNaiveConvFwd:660.133,0,miopenConvolutionFwdAlgoDirect
384-138-104-1x1-384-138-104-1-0x0-1x1-1x1-0-NCHW-FP32-F=ConvBinWinogradRxSf2x3g1:0.409164,0,miopenConvolutionFwdAlgoWinograd;ConvBinWinogradRxSf3x2:0.205716,0,miopenConvolutionFwdAlgoWinograd;ConvHipImplicitGemmGroupFwdXdlops:0.0911475,44679168,miopenConvolutionFwdAlgoImplicitGEMM;ConvAsmImplicitGemmGTCDynamicFwdXdlopsNHWC:0.0778183,44089344,miopenConvolutionFwdAlgoImplicitGEMM;GemmFwd1x1_0_1:0.0653207,0,miopenConvolutionFwdAlgoGEMM;ConvDirectNaiveConvFwd:8.56,0,miopenConvolutionFwdAlgoDirect
384-205-157-3x3-384-102-78-1-0x0-2x2-1x1-0-NCHW-FP32-F=ConvBinWinogradRxSf2x3g1:0.762602,0,miopenConvolutionFwdAlgoWinograd;ConvBinWinogradRxSf3x2:0.509439,0,miopenConvolutionFwdAlgoWinograd;ConvHipImplicitGemmGroupFwdXdlops:0.302933,66964992,miopenConvolutionFwdAlgoImplicitGEMM;ConvAsmImplicitGemmGTCDynamicFwdXdlopsNHWC:0.257734,66964992,miopenConvolutionFwdAlgoImplicitGEMM;GemmFwdRest:0.228042,109983744,miopenConvolutionFwdAlgoGEMM;ConvDirectNaiveConvFwd:21.529,0,miopenConvolutionFwdAlgoDirect
384-276-208-3x3-192-276-208-1-1x1-1x1-1x1-0-NCHW-FP32-F=ConvBinWinogradRxSf2x3g1:0.745047,0,miopenConvolutionFwdAlgoWinograd;ConvBinWinogradRxSf3x2:1.26602,0,miopenConvolutionFwdAlgoWinograd;ConvHipImplicitGemmGroupFwdXdlops:0.779128,134922240,miopenConvolutionFwdAlgoImplicitGEMM;ConvAsmImplicitGemmGTCDynamicFwdXdlopsNHWC:0.71038,134922240,miopenConvolutionFwdAlgoImplicitGEMM;GemmFwdRest:1.15673,793608192,miopenConvolutionFwdAlgoGEMM;ConvDirectNaiveConvFwd:128.745,0,miopenConvolutionFwdAlgoDirect
384-552-416-3x3-192-552-416-1-1x1-1x1-1x1-0-NCHW-FP32-F=ConvBinWinogradRxSf2x3g1:2.80877,0,miopenConvolutionFwdAlgoWinograd;ConvBinWinogradRxSf3x2:4.57697,0,miopenConvolutionFwdAlgoWinograd;ConvHipImplicitGemmGroupFwdXdlops:2.94837,531726336,miopenConvolutionFwdAlgoImplicitGEMM;ConvAsmImplicitGemmGTCDynamicFwdXdlopsNHWC:2.68305,531726336,miopenConvolutionFwdAlgoImplicitGEMM;GemmFwdRest:4.10451,3174432768,miopenConvolutionFwdAlgoGEMM;ConvDirectNaiveConvFwd:661.929,0,miopenConvolutionFwdAlgoDirect
96-3-1650-1250-3x3x3-3-1-1648-1248-1-0x0x0-1x1x1-1x1x1-0-NCDHW-FP32-F=ConvHipImplicitGemm3DGroupFwdXdlops:11.4324,2400711680,miopenConvolutionFwdAlgoImplicitGEMM;ConvDirectNaiveConvFwd:4692.5,0,miopenConvolutionFwdAlgoDirect
96-4-824-624-1x1x1-192-4-824-624-1-0x0x0-1x1x1-1x1x1-0-NCDHW-FP32-F=ConvHipImplicitGemm3DGroupFwdXdlops:2.40063,2369396736,miopenConvolutionFwdAlgoImplicitGEMM;GemmFwd1x1_0_1:1.42429,0,miopenConvolutionFwdAlgoGEMM;ConvDirectNaiveConvFwd:466.186,0,miopenConvolutionFwdAlgoDirect
96-6-1650-1250-3x3x3-96-4-1648-1248-1-0x0x0-1x1x1-1x1x1-0-NCDHW-FP32-F=ConvHipImplicitGemm3DGroupFwdXdlops:47.3104,7912092672,miopenConvolutionFwdAlgoImplicitGEMM;ConvDirectNaiveConvFwd:17211.8,0,miopenConvolutionFwdAlgoDirect
384-412-312-3x3-192-412-312-2-1x1-1x1-1x1-0-NCHW-FP32-F=ConvBinWinogradRxSf2x3g1:3.1208,0,miopenConvolutionFwdAlgoWinograd;ConvBinWinogradRxSf3x2:5.22796,0,miopenConvolutionFwdAlgoWinograd;ConvHipImplicitGemmGroupFwdXdlops:3.04082,594984960,miopenConvolutionFwdAlgoImplicitGEMM;ConvAsmImplicitGemmGTCDynamicFwdXdlopsNHWC:2.96737,594984960,miopenConvolutionFwdAlgoImplicitGEMM;GemmFwdRest:4.62165,1776992256,miopenConvolutionFwdAlgoGEMM;ConvDirectNaiveConvFwd:400.627,0,miopenConvolutionFwdAlgoDirect
192-816-624-3x3-96-816-624-4-1x1-1x1-1x1-0-NCHW-FP32-F=ConvBinWinogradRxSf2x3g1:6.16867,0,miopenConvolutionFwdAlgoWinograd;ConvBinWinogradRxSf3x2:10.0911,0,miopenConvolutionFwdAlgoWinograd;ConvHipImplicitGemmGroupFwdXdlops:8.24092,2346983424,miopenConvolutionFwdAlgoImplicitGEMM;ConvAsmImplicitGemmGTCDynamicFwdXdlopsNHWC:7.75014,2346983424,miopenConvolutionFwdAlgoImplicitGEMM;GemmFwdRest:11.7513,3519479808,miopenConvolutionFwdAlgoGEMM;ConvDirectNaiveConvFwd:802.95,0,miopenConvolutionFwdAlgoDirect
384-552-416-3x3-192-552-416-4-1x1-1x1-1x1-0-NCHW-FP32-F=ConvBinWinogradRxSf2x3g1:11.1018,0,miopenConvolutionFwdAlgoWinograd;ConvBinWinogradRxSf3x2:18.0044,0,miopenConvolutionFwdAlgoWinograd;ConvHipImplicitGemmGroupFwdXdlops:11.0069,2118942720,miopenConvolutionFwdAlgoImplicitGEMM;ConvAsmImplicitGemmGTCDynamicFwdXdlopsNHWC:10.6344,2118942720,miopenConvolutionFwdAlgoImplicitGEMM;GemmFwdRest:15.9899,3174432768,miopenConvolutionFwdAlgoGEMM;ConvDirectNaiveConvFwd:880.177,0,miopenConvolutionFwdAlgoDirect
16-21-102-78-1x1x1-16-21-102-78-1-0x0x0-1x1x1-1x1x1-0-NCDHW-BF16-F=ConvHipImplicitGemm3DGroupFwdXdlops:0.0278324,10693632,miopenConvolutionFwdAlgoImplicitGEMM;GemmFwd1x1_0_1:0.0139284,0,miopenConvolutionFwdAlgoGEMM;ConvDirectNaiveConvFwd:5.19633,0,miopenConvolutionFwdAlgoDirect
16-21-206-156-1x1x1-16-21-206-156-1-0x0x0-1x1x1-1x1x1-0-NCDHW-BF16-F=ConvHipImplicitGemm3DGroupFwdXdlops:0.0522205,43191296,miopenConvolutionFwdAlgoImplicitGEMM;GemmFwd1x1_0_1:0.021584,0,miopenConvolutionFwdAlgoGEMM;ConvDirectNaiveConvFwd:20.9481,0,miopenConvolutionFwdAlgoDirect
16-3-208-158-3x3x3-384-1-206-156-1-0x0x0-1x1x1-1x1x1-0-NCDHW-BF16-F=ConvHipImplicitGemm3DGroupFwdXdlops:0.0704411,28167168,miopenConvolutionFwdAlgoImplicitGEMM;GemmFwdRest:0.0954007,27765504,miopenConvolutionFwdAlgoGEMM;ConvDirectNaiveConvFwd:9.76345,0,miopenConvolutionFwdAlgoDirect
16-33-90-160-1x2x2-3072-33-45-80-1-0x0x0-1x2x2-1x1x1-0-NCDHW-BF16-F=ConvHipImplicitGemm3DGroupFwdXdlops:1.06529,745506816,miopenConvolutionFwdAlgoImplicitGEMM;GemmFwdRest:0.257643,15206400,miopenConvolutionFwdAlgoGEMM;ConvDirectNaiveConvFwd:21.4258,0,miopenConvolutionFwdAlgoDirect
192-1-412-312-1x1x1-384-1-412-312-1-0x0x0-1x1x1-1x1x1-0-NCDHW-BF16-F=ConvHipImplicitGemm3DGroupFwdXdlops:0.268574,148230144,miopenConvolutionFwdAlgoImplicitGEMM;GemmFwd1x1_0_1:0.0533273,0,miopenConvolutionFwdAlgoGEMM;ConvDirectNaiveConvFwd:44.8066,0,miopenConvolutionFwdAlgoDirect
192-2-204-156-1x1x1-384-2-204-156-1-0x0x0-1x1x1-1x1x1-0-NCDHW-BF16-F=ConvHipImplicitGemm3DGroupFwdXdlops:0.116208,73469952,miopenConvolutionFwdAlgoImplicitGEMM;GemmFwd1x1_0_1:0.0394338,0,miopenConvolutionFwdAlgoGEMM;ConvDirectNaiveConvFwd:22.1441,0,miopenConvolutionFwdAlgoDirect
192-2-412-312-1x1x1-384-2-412-312-1-0x0x0-1x1x1-1x1x1-0-NCDHW-BF16-F=ConvHipImplicitGemm3DGroupFwdXdlops:0.277375,296312832,miopenConvolutionFwdAlgoImplicitGEMM;GemmFwd1x1_0_1:0.0960478,0,miopenConvolutionFwdAlgoGEMM;ConvDirectNaiveConvFwd:90.6715,0,miopenConvolutionFwdAlgoDirect
192-3-410-314-3x3x3-192-1-408-312-1-0x0x0-1x1x1-1x1x1-0-NCDHW-BF16-F=ConvHipImplicitGemm3DGroupFwdXdlops:0.472581,199180800,miopenConvolutionFwdAlgoImplicitGEMM;GemmFwdRest:2.69801,1319804928,miopenConvolutionFwdAlgoGEMM;ConvDirectNaiveConvFwd:435.475,0,miopenConvolutionFwdAlgoDirect
192-3-554-418-3x3x3-192-1-552-416-1-0x0x0-1x1x1-1x1x1-0-NCDHW-BF16-F=ConvHipImplicitGemm3DGroupFwdXdlops:1.02733,356940288,miopenConvolutionFwdAlgoImplicitGEMM;GemmFwdRest:5.01409,2380824576,miopenConvolutionFwdAlgoGEMM;ConvDirectNaiveConvFwd:852.145,0,miopenConvolutionFwdAlgoDirect
192-4-206-158-3x3x3-384-2-204-156-1-0x0x0-1x1x1-1x1x1-0-NCDHW-BF16-F=ConvHipImplicitGemm3DGroupFwdXdlops:0.436393,102856704,miopenConvolutionFwdAlgoImplicitGEMM;GemmFwdRest:1.46238,659902464,miopenConvolutionFwdAlgoGEMM;ConvDirectNaiveConvFwd:235.713,0,miopenConvolutionFwdAlgoDirect
192-4-278-210-3x3x3-384-2-276-208-1-0x0x0-1x1x1-1x1x1-0-NCDHW-BF16-F=ConvHipImplicitGemm3DGroupFwdXdlops:0.721488,181831680,miopenConvolutionFwdAlgoImplicitGEMM;GemmFwdRest:2.64136,1190412288,miopenConvolutionFwdAlgoGEMM;ConvDirectNaiveConvFwd:482.773,0,miopenConvolutionFwdAlgoDirect
192-5-204-156-3x1x1-192-2-204-156-1-0x0x0-2x1x1-1x1x1-0-NCDHW-BF16-F=ConvHipImplicitGemm3DGroupFwdXdlops:0.122875,85764096,miopenConvolutionFwdAlgoImplicitGEMM;GemmFwdRest:0.184482,73322496,miopenConvolutionFwdAlgoGEMM;ConvDirectNaiveConvFwd:61.2103,0,miopenConvolutionFwdAlgoDirect
192-5-276-208-3x1x1-192-2-276-208-1-0x0x0-2x1x1-1x1x1-0-NCDHW-BF16-F=ConvHipImplicitGemm3DGroupFwdXdlops:0.125122,154533888,miopenConvolutionFwdAlgoImplicitGEMM;GemmFwdRest:0.304771,132268032,miopenConvolutionFwdAlgoGEMM;ConvDirectNaiveConvFwd:110.955,0,miopenConvolutionFwdAlgoDirect
192-6-410-314-3x3x3-192-4-408-312-1-0x0x0-1x1x1-1x1x1-0-NCDHW-BF16-F=ConvHipImplicitGemm3DGroupFwdXdlops:1.96753,494134272,miopenConvolutionFwdAlgoImplicitGEMM;GemmFwdRest:10.7171,5279219712,miopenConvolutionFwdAlgoGEMM;ConvDirectNaiveConvFwd:1797.92,0,miopenConvolutionFwdAlgoDirect
192-1104-832-3x3-96-1104-832-1-1x1-1x1-1x1-0-NCHW-BF16-F=ConvHipImplicitGemmGroupFwdXdlops:0.87833,529403904,miopenConvolutionFwdAlgoImplicitGEMM;ConvAsmImplicitGemmGTCDynamicFwdXdlopsNHWC:0.950031,882118656,miopenConvolutionFwdAlgoImplicitGEMM;GemmFwdRest:2.46167,3174432768,miopenConvolutionFwdAlgoGEMM;ConvDirectNaiveConvFwd:1294.86,0,miopenConvolutionFwdAlgoDirect
192-409-313-3x3-192-204-156-1-0x0-2x2-1x1-0-NCHW-BF16-F=ConvHipImplicitGemmGroupFwdXdlops:0.105268,62042624,miopenConvolutionFwdAlgoImplicitGEMM;ConvAsmImplicitGemmGTCDynamicFwdXdlopsNHWC:0.117344,86483456,miopenConvolutionFwdAlgoImplicitGEMM;GemmFwdRest:0.107521,109983744,miopenConvolutionFwdAlgoGEMM;ConvDirectNaiveConvFwd:42.7152,0,miopenConvolutionFwdAlgoDirect
192-816-624-3x3-96-816-624-1-1x1-1x1-1x1-0-NCHW-BF16-F=ConvHipImplicitGemmGroupFwdXdlops:0.441918,293621760,miopenConvolutionFwdAlgoImplicitGEMM;ConvAsmImplicitGemmGTCDynamicFwdXdlopsNHWC:0.520846,489148416,miopenConvolutionFwdAlgoImplicitGEMM;GemmFwdRest:1.33048,1759739904,miopenConvolutionFwdAlgoGEMM;ConvDirectNaiveConvFwd:617.636,0,miopenConvolutionFwdAlgoDirect
3-3-1650-1250-3x3x3-96-1-1648-1248-1-0x0x0-1x1x1-1x1x1-0-NCDHW-BF16-F=ConvHipImplicitGemm3DGroupFwdXdlops:0.856524,432027904,miopenConvolutionFwdAlgoImplicitGEMM;GemmFwdRest:0.848936,333186048,miopenConvolutionFwdAlgoGEMM;ConvDirectNaiveConvFwd:124.989,0,miopenConvolutionFwdAlgoDirect
3-6-1650-1250-3x3x3-96-4-1648-1248-1-0x0x0-1x1x1-1x1x1-0-NCDHW-BF16-F=ConvHipImplicitGemm3DGroupFwdXdlops:3.2875,1653814528,miopenConvolutionFwdAlgoImplicitGEMM;GemmFwdRest:3.20744,1332744192,miopenConvolutionFwdAlgoGEMM;ConvDirectNaiveConvFwd:492.378,0,miopenConvolutionFwdAlgoDirect
36-21-206-156-1x2x2-5120-21-103-78-1-0x0x0-1x2x2-1x1x1-0-NCDHW-BF16-F=ConvHipImplicitGemm3DGroupFwdXdlops:3.55997,1777695744,miopenConvolutionFwdAlgoImplicitGEMM;GemmFwdRest:0.987391,48589632,miopenConvolutionFwdAlgoGEMM;ConvDirectNaiveConvFwd:133.315,0,miopenConvolutionFwdAlgoDirect
384-3-206-156-3x1x1-768-1-206-156-1-0x0x0-1x1x1-1x1x1-0-NCDHW-BF16-F=ConvHipImplicitGemm3DGroupFwdXdlops:0.204865,125171712,miopenConvolutionFwdAlgoImplicitGEMM;GemmFwdRest:0.221922,74041344,miopenConvolutionFwdAlgoGEMM;ConvDirectNaiveConvFwd:65.1511,0,miopenConvolutionFwdAlgoDirect
384-3-278-210-3x3x3-384-1-276-208-1-0x0x0-1x1x1-1x1x1-0-NCDHW-BF16-F=ConvHipImplicitGemm3DGroupFwdXdlops:0.723028,186559488,miopenConvolutionFwdAlgoImplicitGEMM;GemmFwdRest:2.6239,1190412288,miopenConvolutionFwdAlgoGEMM;ConvDirectNaiveConvFwd:505.43,0,miopenConvolutionFwdAlgoDirect
384-4-278-210-3x3x3-384-2-276-208-1-0x0x0-1x1x1-1x1x1-0-NCDHW-BF16-F=ConvHipImplicitGemm3DGroupFwdXdlops:1.43977,275484672,miopenConvolutionFwdAlgoImplicitGEMM;GemmFwdRest:5.3377,2380824576,miopenConvolutionFwdAlgoGEMM;ConvDirectNaiveConvFwd:1063.82,0,miopenConvolutionFwdAlgoDirect
384-138-104-1x1-1152-138-104-1-0x0-1x1-1x1-0-NCHW-BF16-F=ConvHipImplicitGemmGroupFwdXdlops:0.083289,44974080,miopenConvolutionFwdAlgoImplicitGEMM;ConvAsmImplicitGemmGTCDynamicFwdXdlopsNHWC:0.0706007,110223360,miopenConvolutionFwdAlgoImplicitGEMM;GemmFwd1x1_0_1:0.0349844,0,miopenConvolutionFwdAlgoGEMM;ConvDirectNaiveConvFwd:9.85932,0,miopenConvolutionFwdAlgoDirect
384-204-156-3x3-192-204-156-1-1x1-1x1-1x1-0-NCHW-BF16-F=ConvHipImplicitGemmGroupFwdXdlops:0.116298,37988352,miopenConvolutionFwdAlgoImplicitGEMM;ConvAsmImplicitGemmGTCDynamicFwdXdlopsNHWC:0.169048,62429184,miopenConvolutionFwdAlgoImplicitGEMM;GemmFwdRest:0.152681,219967488,miopenConvolutionFwdAlgoGEMM;ConvDirectNaiveConvFwd:73.962,0,miopenConvolutionFwdAlgoDirect
384-276-208-3x3-192-276-208-1-1x1-1x1-1x1-0-NCHW-BF16-F=ConvHipImplicitGemmGroupFwdXdlops:0.143722,67461120,miopenConvolutionFwdAlgoImplicitGEMM;ConvAsmImplicitGemmGTCDynamicFwdXdlopsNHWC:0.226105,111550464,miopenConvolutionFwdAlgoImplicitGEMM;GemmFwdRest:0.31837,396804096,miopenConvolutionFwdAlgoGEMM;ConvDirectNaiveConvFwd:133.698,0,miopenConvolutionFwdAlgoDirect
384-412-312-3x3-192-412-312-1-1x1-1x1-1x1-0-NCHW-BF16-F=ConvHipImplicitGemmGroupFwdXdlops:0.410897,149409792,miopenConvolutionFwdAlgoImplicitGEMM;ConvAsmImplicitGemmGTCDynamicFwdXdlopsNHWC:0.511477,248131584,miopenConvolutionFwdAlgoImplicitGEMM;GemmFwdRest:0.717271,888496128,miopenConvolutionFwdAlgoGEMM;ConvDirectNaiveConvFwd:304.423,0,miopenConvolutionFwdAlgoDirect
96-1-408-312-1x1x1-192-1-408-312-1-0x0x0-1x1x1-1x1x1-0-NCDHW-BF16-F=ConvHipImplicitGemm3DGroupFwdXdlops:0.0664979,73359360,miopenConvolutionFwdAlgoImplicitGEMM;GemmFwd1x1_0_1:0.0321672,0,miopenConvolutionFwdAlgoGEMM;ConvDirectNaiveConvFwd:22.0542,0,miopenConvolutionFwdAlgoDirect
96-1-824-624-1x1x1-192-1-824-624-1-0x0x0-1x1x1-1x1x1-0-NCDHW-BF16-F=ConvHipImplicitGemm3DGroupFwdXdlops:0.286163,296202240,miopenConvolutionFwdAlgoImplicitGEMM;GemmFwd1x1_0_1:0.0931277,0,miopenConvolutionFwdAlgoGEMM;ConvDirectNaiveConvFwd:89.6887,0,miopenConvolutionFwdAlgoDirect
96-3-1650-1250-3x3x3-3-1-1648-1248-1-0x0x0-1x1x1-1x1x1-0-NCDHW-BF16-F=ConvHipImplicitGemm3DGroupFwdXdlops:3.8995,1200355840,miopenConvolutionFwdAlgoImplicitGEMM;ConvDirectNaiveConvFwd:4543.86,0,miopenConvolutionFwdAlgoDirect
96-4-824-624-1x1x1-192-4-824-624-1-0x0x0-1x1x1-1x1x1-0-NCDHW-BF16-F=ConvHipImplicitGemm3DGroupFwdXdlops:1.15687,1184698368,miopenConvolutionFwdAlgoImplicitGEMM;GemmFwd1x1_0_1:0.343477,0,miopenConvolutionFwdAlgoGEMM;ConvDirectNaiveConvFwd:448.965,0,miopenConvolutionFwdAlgoDirect
96-6-1650-1250-3x3x3-96-4-1648-1248-1-0x0x0-1x1x1-1x1x1-0-NCDHW-BF16-F=ConvHipImplicitGemm3DGroupFwdXdlops:12.1802,3956046336,miopenConvolutionFwdAlgoImplicitGEMM;ConvDirectNaiveConvFwd:15397.2,0,miopenConvolutionFwdAlgoDirect
384-276-208-3x3-192-276-208-2-1x1-1x1-1x1-0-NCHW-BF16-F=ConvHipImplicitGemmGroupFwdXdlops:0.274811,133595136,miopenConvolutionFwdAlgoImplicitGEMM;ConvAsmImplicitGemmGTCDynamicFwdXdlopsNHWC:0.412652,221773824,miopenConvolutionFwdAlgoImplicitGEMM;GemmFwdRest:0.666344,396804096,miopenConvolutionFwdAlgoGEMM;ConvDirectNaiveConvFwd:142.03,0,miopenConvolutionFwdAlgoDirect
384-413-313-3x3-384-206-156-2-0x0-2x2-1x1-0-NCHW-BF16-F=ConvHipImplicitGemmGroupFwdXdlops:0.489261,250572288,miopenConvolutionFwdAlgoImplicitGEMM;ConvAsmImplicitGemmGTCDynamicFwdXdlopsNHWC:0.557669,349294080,miopenConvolutionFwdAlgoImplicitGEMM;GemmFwdRest:0.541686,222124032,miopenConvolutionFwdAlgoGEMM;ConvDirectNaiveConvFwd:95.6475,0,miopenConvolutionFwdAlgoDirect
192-409-313-3x3-192-204-156-4-0x0-2x2-1x1-0-NCHW-BF16-F=ConvHipImplicitGemmGroupFwdXdlops:0.396901,246179328,miopenConvolutionFwdAlgoImplicitGEMM;ConvAsmImplicitGemmGTCDynamicFwdXdlopsNHWC:0.437256,343942656,miopenConvolutionFwdAlgoImplicitGEMM;GemmFwdRest:0.531539,109983744,miopenConvolutionFwdAlgoGEMM;ConvDirectNaiveConvFwd:46.8099,0,miopenConvolutionFwdAlgoDirect
192-816-624-3x3-96-816-624-4-1x1-1x1-1x1-0-NCHW-BF16-F=ConvHipImplicitGemmGroupFwdXdlops:1.79003,1173491712,miopenConvolutionFwdAlgoImplicitGEMM;ConvAsmImplicitGemmGTCDynamicFwdXdlopsNHWC:2.00238,1955598336,miopenConvolutionFwdAlgoImplicitGEMM;GemmFwdRest:4.89585,1759739904,miopenConvolutionFwdAlgoGEMM;ConvDirectNaiveConvFwd:897.17,0,miopenConvolutionFwdAlgoDirect
384-552-416-3x3-192-552-416-4-1x1-1x1-1x1-0-NCHW-BF16-F=ConvHipImplicitGemmGroupFwdXdlops:2.34578,1059471360,miopenConvolutionFwdAlgoImplicitGEMM;ConvAsmImplicitGemmGTCDynamicFwdXdlopsNHWC:2.93388,1764900864,miopenConvolutionFwdAlgoImplicitGEMM;GemmFwdRest:4.6668,1587216384,miopenConvolutionFwdAlgoGEMM;ConvDirectNaiveConvFwd:826.794,0,miopenConvolutionFwdAlgoDirect
96-817-625-3x3-96-408-312-4-0x0-2x2-1x1-0-NCHW-BF16-F=ConvHipImplicitGemmGroupFwdXdlops:0.617269,490089216,miopenConvolutionFwdAlgoImplicitGEMM;ConvAsmImplicitGemmGTCDynamicFwdXdlopsNHWC:0.637426,685615872,miopenConvolutionFwdAlgoImplicitGEMM;GemmFwdRest:0.853297,219967488,miopenConvolutionFwdAlgoGEMM;ConvDirectNaiveConvFwd:100.841,0,miopenConvolutionFwdAlgoDirect
128-11-130-194-3x3x3-3-9-128-192-1-0x0x0-1x1x1-1x1x1-0-NCDHW-FP16-F=ConvHipImplicitGemm3DGroupFwdXdlops:0.311157,72367360,miopenConvolutionFwdAlgoImplicitGEMM;GemmFwdRest:3.02796,1528823808,miopenConvolutionFwdAlgoGEMM;ConvDirectNaiveConvFwd:598.737,0,miopenConvolutionFwdAlgoDirect
128-11-146-258-3x3x3-3-9-144-256-1-0x0x0-1x1x1-1x1x1-0-NCDHW-FP16-F=ConvHipImplicitGemm3DGroupFwdXdlops:0.523262,108084480,miopenConvolutionFwdAlgoImplicitGEMM;GemmFwdRest:4.44467,2293235712,miopenConvolutionFwdAlgoGEMM;ConvDirectNaiveConvFwd:898.09,0,miopenConvolutionFwdAlgoDirect
128-11-258-194-3x3x3-3-9-256-192-1-0x0x0-1x1x1-1x1x1-0-NCDHW-FP16-F=ConvHipImplicitGemm3DGroupFwdXdlops:0.648213,143621376,miopenConvolutionFwdAlgoImplicitGEMM;GemmFwdRest:5.96395,3057647616,miopenConvolutionFwdAlgoGEMM;ConvDirectNaiveConvFwd:1192.93,0,miopenConvolutionFwdAlgoDirect
128-19-146-130-3x3x3-128-17-144-128-1-0x0x0-1x1x1-1x1x1-0-NCDHW-FP16-F=ConvHipImplicitGemm3DGroupFwdXdlops:0.519325,173419520,miopenConvolutionFwdAlgoImplicitGEMM;GemmFwdRest:4.24959,2165833728,miopenConvolutionFwdAlgoGEMM;ConvDirectNaiveConvFwd:805.923,0,miopenConvolutionFwdAlgoDirect
128-19-258-130-3x3x3-128-17-256-128-1-0x0x0-1x1x1-1x1x1-0-NCDHW-FP16-F=ConvHipImplicitGemm3DGroupFwdXdlops:0.943478,306629632,miopenConvolutionFwdAlgoImplicitGEMM;GemmFwdRest:7.84705,3850371072,miopenConvolutionFwdAlgoGEMM;ConvDirectNaiveConvFwd:1421.51,0,miopenConvolutionFwdAlgoDirect
16-3-16-24-1x1x1-16-3-16-24-1-0x0x0-1x1x1-1x1x1-0-NCDHW-FP16-F=ConvHipImplicitGemm3DGroupFwdXdlops:0.0217358,74240,miopenConvolutionFwdAlgoImplicitGEMM;GemmFwd1x1_0_1:0.01,0,miopenConvolutionFwdAlgoGEMM;ConvDirectNaiveConvFwd:0.032353,0,miopenConvolutionFwdAlgoDirect
16-3-18-32-1x1x1-16-3-18-32-1-0x0x0-1x1x1-1x1x1-0-NCDHW-FP16-F=ConvHipImplicitGemm3DGroupFwdXdlops:0.0215524,111104,miopenConvolutionFwdAlgoImplicitGEMM;GemmFwd1x1_0_1:0.0104868,0,miopenConvolutionFwdAlgoGEMM;ConvDirectNaiveConvFwd:0.044351,0,miopenConvolutionFwdAlgoDirect
16-3-32-16-1x1x1-16-3-32-16-1-0x0x0-1x1x1-1x1x1-0-NCDHW-FP16-F=ConvHipImplicitGemm3DGroupFwdXdlops:0.0218322,98816,miopenConvolutionFwdAlgoImplicitGEMM;GemmFwd1x1_0_1:0.01028,0,miopenConvolutionFwdAlgoGEMM;ConvDirectNaiveConvFwd:0.0381724,0,miopenConvolutionFwdAlgoDirect
16-5-16-32-1x1x1-16-5-16-32-1-0x0x0-1x1x1-1x1x1-0-NCDHW-FP16-F=ConvHipImplicitGemm3DGroupFwdXdlops:0.0219774,164352,miopenConvolutionFwdAlgoImplicitGEMM;GemmFwd1x1_0_1:0.0105667,0,miopenConvolutionFwdAlgoGEMM;ConvDirectNaiveConvFwd:0.062983,0,miopenConvolutionFwdAlgoDirect
16-5-18-34-3x3x3-512-3-16-32-1-0x0x0-1x1x1-1x1x1-0-NCDHW-FP16-F=ConvHipImplicitGemm3DGroupFwdXdlops:0.0267202,2113280,miopenConvolutionFwdAlgoImplicitGEMM;GemmFwdRest:0.0230726,1327104,miopenConvolutionFwdAlgoGEMM;ConvDirectNaiveConvFwd:0.461078,0,miopenConvolutionFwdAlgoDirect
16-5-20-34-3x3x3-512-3-18-32-1-0x0x0-1x1x1-1x1x1-0-NCDHW-FP16-F=ConvHipImplicitGemm3DGroupFwdXdlops:0.0270564,2320640,miopenConvolutionFwdAlgoImplicitGEMM;GemmFwdRest:0.0244802,1492992,miopenConvolutionFwdAlgoGEMM;ConvDirectNaiveConvFwd:0.533929,0,miopenConvolutionFwdAlgoDirect
16-5-32-24-1x1x1-16-5-32-24-1-0x0x0-1x1x1-1x1x1-0-NCDHW-FP16-F=ConvHipImplicitGemm3DGroupFwdXdlops:0.0220644,246272,miopenConvolutionFwdAlgoImplicitGEMM;GemmFwd1x1_0_1:0.0116068,0,miopenConvolutionFwdAlgoGEMM;ConvDirectNaiveConvFwd:0.0926943,0,miopenConvolutionFwdAlgoDirect
16-5-34-34-3x3x3-512-3-32-32-1-0x0x0-1x1x1-1x1x1-0-NCDHW-FP16-F=ConvHipImplicitGemm3DGroupFwdXdlops:0.0284347,3773184,miopenConvolutionFwdAlgoImplicitGEMM;GemmFwdRest:0.0264882,2654208,miopenConvolutionFwdAlgoGEMM;ConvDirectNaiveConvFwd:0.920335,0,miopenConvolutionFwdAlgoDirect
16-7-22-34-3x3x3-512-5-20-32-1-0x0x0-1x1x1-1x1x1-0-NCDHW-FP16-F=ConvHipImplicitGemm3DGroupFwdXdlops:0.0289007,3886848,miopenConvolutionFwdAlgoImplicitGEMM;GemmFwdRest:0.0283603,2764800,miopenConvolutionFwdAlgoGEMM;ConvDirectNaiveConvFwd:0.97853,0,miopenConvolutionFwdAlgoDirect
256-11-130-194-3x3x3-256-9-128-192-1-0x0x0-1x1x1-1x1x1-0-NCDHW-FP16-F=ConvHipImplicitGemm3DGroupFwdXdlops:1.23927,258824192,miopenConvolutionFwdAlgoImplicitGEMM;GemmFwdRest:6.57951,3057647616,miopenConvolutionFwdAlgoGEMM;ConvDirectNaiveConvFwd:1113.98,0,miopenConvolutionFwdAlgoDirect
256-11-162-194-3x3x3-256-9-160-192-1-0x0x0-1x1x1-1x1x1-0-NCDHW-FP16-F=ConvHipImplicitGemm3DGroupFwdXdlops:1.56827,322099200,miopenConvolutionFwdAlgoImplicitGEMM;GemmFwdRest:8.40472,3822059520,miopenConvolutionFwdAlgoGEMM;ConvDirectNaiveConvFwd:1392.4,0,miopenConvolutionFwdAlgoDirect
256-11-258-258-3x3x3-128-9-256-256-1-0x0x0-1x1x1-1x1x1-0-NCDHW-FP16-F=ConvHipImplicitGemm3DGroupFwdXdlops:1.86552,527652864,miopenConvolutionFwdAlgoImplicitGEMM;ConvDirectNaiveConvFwd:3017.07,0,miopenConvolutionFwdAlgoDirect
256-19-146-130-3x3x3-128-17-144-128-1-0x0x0-1x1x1-1x1x1-0-NCDHW-FP16-F=ConvHipImplicitGemm3DGroupFwdXdlops:1.0118,266622976,miopenConvolutionFwdAlgoImplicitGEMM;GemmFwdRest:8.63843,4331667456,miopenConvolutionFwdAlgoGEMM;ConvDirectNaiveConvFwd:1595.67,0,miopenConvolutionFwdAlgoDirect
256-19-162-194-3x3x3-128-17-160-192-1-0x0x0-1x1x1-1x1x1-0-NCDHW-FP16-F=ConvHipImplicitGemm3DGroupFwdXdlops:1.62261,441194496,miopenConvolutionFwdAlgoImplicitGEMM;GemmFwdRest:15.0471,7219445760,miopenConvolutionFwdAlgoGEMM;ConvDirectNaiveConvFwd:2717.16,0,miopenConvolutionFwdAlgoDirect
256-19-258-258-3x3x3-128-17-256-256-1-0x0x0-1x1x1-1x1x1-0-NCDHW-FP16-F=ConvHipImplicitGemm3DGroupFwdXdlops:3.44722,934516736,miopenConvolutionFwdAlgoImplicitGEMM;ConvDirectNaiveConvFwd:5666.25,0,miopenConvolutionFwdAlgoDirect
512-11-82-130-3x3x3-256-9-80-128-1-0x0x0-1x1x1-1x1x1-0-NCDHW-FP16-F=ConvHipImplicitGemm3DGroupFwdXdlops:1.05654,174338048,miopenConvolutionFwdAlgoImplicitGEMM;GemmFwdRest:5.38913,2548039680,miopenConvolutionFwdAlgoGEMM;ConvDirectNaiveConvFwd:942.845,0,miopenConvolutionFwdAlgoDirect
512-5-22-34-3x3x3-512-3-20-32-1-0x0x0-1x1x1-1x1x1-0-NCDHW-FP16-F=ConvHipImplicitGemm3DGroupFwdXdlops:0.155848,19951616,miopenConvolutionFwdAlgoImplicitGEMM;GemmFwdRest:0.264456,53084160,miopenConvolutionFwdAlgoGEMM;ConvDirectNaiveConvFwd:20.2859,0,miopenConvolutionFwdAlgoDirect
512-5-38-34-3x3x3-512-3-36-32-1-0x0x0-1x1x1-1x1x1-0-NCDHW-FP16-F=ConvHipImplicitGemm3DGroupFwdXdlops:0.183287,24309760,miopenConvolutionFwdAlgoImplicitGEMM;GemmFwdRest:0.352084,95551488,miopenConvolutionFwdAlgoGEMM;ConvDirectNaiveConvFwd:36.7037,0,miopenConvolutionFwdAlgoDirect
512-5-66-66-3x3x3-512-3-64-64-1-0x0x0-1x1x1-1x1x1-0-NCDHW-FP16-F=ConvHipImplicitGemm3DGroupFwdXdlops:0.30121,49041408,miopenConvolutionFwdAlgoImplicitGEMM;GemmFwdRest:0.890449,339738624,miopenConvolutionFwdAlgoGEMM;ConvDirectNaiveConvFwd:135.541,0,miopenConvolutionFwdAlgoDirect
512-7-130-66-3x3x3-512-5-128-64-1-0x0x0-1x1x1-1x1x1-0-NCDHW-FP16-F=ConvHipImplicitGemm3DGroupFwdXdlops:0.842465,117600256,miopenConvolutionFwdAlgoImplicitGEMM;GemmFwdRest:2.66556,1132462080,miopenConvolutionFwdAlgoGEMM;ConvDirectNaiveConvFwd:503.818,0,miopenConvolutionFwdAlgoDirect
512-7-34-26-3x3x3-512-5-32-24-1-0x0x0-1x1x1-1x1x1-0-NCDHW-FP16-F=ConvHipImplicitGemm3DGroupFwdXdlops:0.182202,24424448,miopenConvolutionFwdAlgoImplicitGEMM;GemmFwdRest:0.369564,106168320,miopenConvolutionFwdAlgoGEMM;ConvDirectNaiveConvFwd:39.4034,0,miopenConvolutionFwdAlgoDirect
512-7-42-50-3x3x3-512-5-40-48-1-0x0x0-1x1x1-1x1x1-0-NCDHW-FP16-F=ConvHipImplicitGemm3DGroupFwdXdlops:0.273454,39038976,miopenConvolutionFwdAlgoImplicitGEMM;GemmFwdRest:0.782268,265420800,miopenConvolutionFwdAlgoGEMM;ConvDirectNaiveConvFwd:103.144,0,miopenConvolutionFwdAlgoDirect
512-7-66-98-3x3x3-512-5-64-96-1-0x0x0-1x1x1-1x1x1-0-NCDHW-FP16-F=ConvHipImplicitGemm3DGroupFwdXdlops:0.634212,91975680,miopenConvolutionFwdAlgoImplicitGEMM;GemmFwdRest:1.94461,849346560,miopenConvolutionFwdAlgoGEMM;ConvDirectNaiveConvFwd:380.315,0,miopenConvolutionFwdAlgoDirect
512-7-82-98-3x3x3-512-5-80-96-1-0x0x0-1x1x1-1x1x1-0-NCDHW-FP16-F=ConvHipImplicitGemm3DGroupFwdXdlops:0.818241,111079424,miopenConvolutionFwdAlgoImplicitGEMM;GemmFwdRest:2.59629,1061683200,miopenConvolutionFwdAlgoGEMM;ConvDirectNaiveConvFwd:485.803,0,miopenConvolutionFwdAlgoDirect
16-21-206-156-1x1x1-16-21-206-156-1-0x0x0-1x1x1-1x1x1-0-NCDHW-FP32-F=ConvHipImplicitGemm3DGroupFwdXdlops:0.0826926,86382592,miopenConvolutionFwdAlgoImplicitGEMM;GemmFwd1x1_0_1:0.116781,0,miopenConvolutionFwdAlgoGEMM;ConvDirectNaiveConvFwd:22.6165,0,miopenConvolutionFwdAlgoDirect
192-1-276-208-1x1x1-384-1-276-208-1-0x0x0-1x1x1-1x1x1-0-NCDHW-FP32-F=ConvHipImplicitGemm3DGroupFwdXdlops:0.171002,132562944,miopenConvolutionFwdAlgoImplicitGEMM;GemmFwd1x1_0_1:0.087641,0,miopenConvolutionFwdAlgoGEMM;ConvDirectNaiveConvFwd:21.8721,0,miopenConvolutionFwdAlgoDirect
192-2-412-312-1x1x1-384-2-412-312-1-0x0x0-1x1x1-1x1x1-0-NCDHW-FP32-F=ConvHipImplicitGemm3DGroupFwdXdlops:0.748401,592625664,miopenConvolutionFwdAlgoImplicitGEMM;GemmFwd1x1_0_1:0.430999,0,miopenConvolutionFwdAlgoGEMM;ConvDirectNaiveConvFwd:115.308,0,miopenConvolutionFwdAlgoDirect
192-3-554-418-3x3x3-192-1-552-416-1-0x0x0-1x1x1-1x1x1-0-NCDHW-FP32-F=ConvHipImplicitGemm3DGroupFwdXdlops:4.4653,713880576,miopenConvolutionFwdAlgoImplicitGEMM;GemmFwdRest:9.30456,4761649152,miopenConvolutionFwdAlgoGEMM;ConvDirectNaiveConvFwd:914.978,0,miopenConvolutionFwdAlgoDirect
192-5-204-156-3x1x1-192-2-204-156-1-0x0x0-2x1x1-1x1x1-0-NCDHW-FP32-F=ConvHipImplicitGemm3DGroupFwdXdlops:0.237739,171528192,miopenConvolutionFwdAlgoImplicitGEMM;GemmFwdRest:0.324703,146644992,miopenConvolutionFwdAlgoGEMM;ConvDirectNaiveConvFwd:63.3058,0,miopenConvolutionFwdAlgoDirect
192-5-276-208-3x1x1-192-2-276-208-1-0x0x0-2x1x1-1x1x1-0-NCDHW-FP32-F=ConvHipImplicitGemm3DGroupFwdXdlops:0.393044,309067776,miopenConvolutionFwdAlgoImplicitGEMM;GemmFwdRest:0.604252,264536064,miopenConvolutionFwdAlgoGEMM;ConvDirectNaiveConvFwd:133.311,0,miopenConvolutionFwdAlgoDirect
192-6-410-314-3x3x3-192-4-408-312-1-0x0x0-1x1x1-1x1x1-0-NCDHW-FP32-F=ConvHipImplicitGemm3DGroupFwdXdlops:8.82094,988268544,miopenConvolutionFwdAlgoImplicitGEMM;GemmFwdRest:19.9832,10558439424,miopenConvolutionFwdAlgoGEMM;ConvDirectNaiveConvFwd:1982.25,0,miopenConvolutionFwdAlgoDirect
192-1648-1248-3x3-96-1648-1248-1-1x1-1x1-1x1-0-NCHW-FP32-F=ConvBinWinogradRxSf2x3g1:5.88316,0,miopenConvolutionFwdAlgoWinograd;ConvBinWinogradRxSf3x2:10.1879,0,miopenConvolutionFwdAlgoWinograd;ConvHipImplicitGemmGroupFwdXdlops:8.26817,2369986560,miopenConvolutionFwdAlgoImplicitGEMM;ConvAsmImplicitGemmGTCDynamicFwdXdlopsNHWC:7.79399,2369986560,miopenConvolutionFwdAlgoImplicitGEMM;GemmFwdRest:11.5418,14215938048,miopenConvolutionFwdAlgoGEMM;ConvDirectNaiveConvFwd:3078.5,0,miopenConvolutionFwdAlgoDirect
384-4-204-156-3x1x1-768-2-204-156-1-0x0x0-1x1x1-1x1x1-0-NCDHW-FP32-F=ConvHipImplicitGemm3DGroupFwdXdlops:1.219,394592256,miopenConvolutionFwdAlgoImplicitGEMM;GemmFwdRest:1.33856,293289984,miopenConvolutionFwdAlgoGEMM;ConvDirectNaiveConvFwd:144.444,0,miopenConvolutionFwdAlgoDirect
384-4-276-208-3x1x1-768-2-276-208-1-0x0x0-1x1x1-1x1x1-0-NCDHW-FP32-F=ConvHipImplicitGemm3DGroupFwdXdlops:2.15195,708968448,miopenConvolutionFwdAlgoImplicitGEMM;GemmFwdRest:2.19878,529072128,miopenConvolutionFwdAlgoGEMM;ConvDirectNaiveConvFwd:292.674,0,miopenConvolutionFwdAlgoDirect
384-4-414-314-3x3x3-384-2-412-312-1-0x0x0-1x1x1-1x1x1-0-NCDHW-FP32-F=ConvHipImplicitGemm3DGroupFwdXdlops:16.9922,1209507840,miopenConvolutionFwdAlgoImplicitGEMM;GemmFwdRest:27.4199,10661953536,miopenConvolutionFwdAlgoGEMM;ConvDirectNaiveConvFwd:2267.22,0,miopenConvolutionFwdAlgoDirect
384-413-313-3x3-384-206-156-1-0x0-2x2-1x1-0-NCHW-FP32-F=ConvBinWinogradRxSf2x3g1:2.79497,0,miopenConvolutionFwdAlgoWinograd;ConvBinWinogradRxSf3x2:1.38594,0,miopenConvolutionFwdAlgoWinograd;ConvHipImplicitGemmGroupFwdXdlops:0.870757,253226496,miopenConvolutionFwdAlgoImplicitGEMM;ConvAsmImplicitGemmGTCDynamicFwdXdlopsNHWC:0.839584,253226496,miopenConvolutionFwdAlgoImplicitGEMM;GemmFwdRest:1.03304,444248064,miopenConvolutionFwdAlgoGEMM;ConvDirectNaiveConvFwd:89.9412,0,miopenConvolutionFwdAlgoDirect
384-824-624-3x3-192-824-624-1-1x1-1x1-1x1-0-NCHW-FP32-F=ConvBinWinogradRxSf2x3g1:5.91501,0,miopenConvolutionFwdAlgoWinograd;ConvBinWinogradRxSf3x2:10.1566,0,miopenConvolutionFwdAlgoWinograd;ConvHipImplicitGemmGroupFwdXdlops:6.06639,1187315712,miopenConvolutionFwdAlgoImplicitGEMM;ConvAsmImplicitGemmGTCDynamicFwdXdlopsNHWC:5.93485,1187315712,miopenConvolutionFwdAlgoImplicitGEMM;GemmFwdRest:9.19846,7107969024,miopenConvolutionFwdAlgoGEMM;ConvDirectNaiveConvFwd:1234.14,0,miopenConvolutionFwdAlgoDirect
96-3-826-626-3x3x3-192-1-824-624-1-0x0x0-1x1x1-1x1x1-0-NCDHW-FP32-F=ConvHipImplicitGemm3DGroupFwdXdlops:4.76978,992549376,miopenConvolutionFwdAlgoImplicitGEMM;GemmFwdRest:10.3768,5330976768,miopenConvolutionFwdAlgoGEMM;ConvDirectNaiveConvFwd:1002.17,0,miopenConvolutionFwdAlgoDirect
96-6-1106-834-3x3x3-3-4-1104-832-1-0x0x0-1x1x1-1x1x1-0-NCDHW-FP32-F=ConvHipImplicitGemm3DGroupFwdXdlops:8.11992,2169339392,miopenConvolutionFwdAlgoImplicitGEMM;ConvDirectNaiveConvFwd:8353.85,0,miopenConvolutionFwdAlgoDirect
96-6-554-418-3x3x3-192-4-552-416-1-0x0x0-1x1x1-1x1x1-0-NCDHW-FP32-F=ConvHipImplicitGemm3DGroupFwdXdlops:8.3785,1240962048,miopenConvolutionFwdAlgoImplicitGEMM;GemmFwdRest:18.0524,9523298304,miopenConvolutionFwdAlgoGEMM;ConvDirectNaiveConvFwd:1785.46,0,miopenConvolutionFwdAlgoDirect
96-6-818-626-3x3x3-96-4-816-624-1-0x0x0-1x1x1-1x1x1-0-NCDHW-FP32-F=ConvHipImplicitGemm3DGroupFwdXdlops:11.8091,1962906624,miopenConvolutionFwdAlgoImplicitGEMM;ConvDirectNaiveConvFwd:3993.34,0,miopenConvolutionFwdAlgoDirect
96-1105-833-3x3-96-552-416-1-0x0-2x2-1x1-0-NCHW-FP32-F=ConvBinWinogradRxSf2x3g1:1.30368,0,miopenConvolutionFwdAlgoWinograd;ConvBinWinogradRxSf3x2:0.642493,0,miopenConvolutionFwdAlgoWinograd;ConvHipImplicitGemmGroupFwdXdlops:0.700839,441969152,miopenConvolutionFwdAlgoImplicitGEMM;ConvAsmImplicitGemmGTCDynamicFwdXdlopsNHWC:0.709824,441969152,miopenConvolutionFwdAlgoImplicitGEMM;GemmFwdRest:0.864963,793608192,miopenConvolutionFwdAlgoGEMM;ConvDirectNaiveConvFwd:170.947,0,miopenConvolutionFwdAlgoDirect
96-1649-1249-3x3-96-824-624-1-0x0-2x2-1x1-0-NCHW-FP32-F=ConvBinWinogradRxSf2x3g1:2.83428,0,miopenConvolutionFwdAlgoWinograd;ConvBinWinogradRxSf3x2:1.409,0,miopenConvolutionFwdAlgoWinograd;ConvHipImplicitGemmGroupFwdXdlops:1.46924,988662272,miopenConvolutionFwdAlgoImplicitGEMM;ConvAsmImplicitGemmGTCDynamicFwdXdlopsNHWC:1.4647,988662272,miopenConvolutionFwdAlgoImplicitGEMM;GemmFwdRest:1.80997,1776992256,miopenConvolutionFwdAlgoGEMM;ConvDirectNaiveConvFwd:383.912,0,miopenConvolutionFwdAlgoDirect
96-817-625-3x3-96-408-312-1-0x0-2x2-1x1-0-NCHW-FP32-F=ConvBinWinogradRxSf2x3g1:0.744413,0,miopenConvolutionFwdAlgoWinograd;ConvBinWinogradRxSf3x2:0.396964,0,miopenConvolutionFwdAlgoWinograd;ConvHipImplicitGemmGroupFwdXdlops:0.394147,245293568,miopenConvolutionFwdAlgoImplicitGEMM;ConvAsmImplicitGemmGTCDynamicFwdXdlopsNHWC:0.395117,245293568,miopenConvolutionFwdAlgoImplicitGEMM;GemmFwdRest:0.465811,439934976,miopenConvolutionFwdAlgoGEMM;ConvDirectNaiveConvFwd:81.2694,0,miopenConvolutionFwdAlgoDirect
384-204-156-3x3-192-204-156-2-1x1-1x1-1x1-0-NCHW-FP32-F=ConvBinWinogradRxSf2x3g1:0.809795,0,miopenConvolutionFwdAlgoWinograd;ConvBinWinogradRxSf3x2:1.40351,0,miopenConvolutionFwdAlgoWinograd;ConvHipImplicitGemmGroupFwdXdlops:0.832681,149299200,miopenConvolutionFwdAlgoImplicitGEMM;ConvAsmImplicitGemmGTCDynamicFwdXdlopsNHWC:0.800961,149299200,miopenConvolutionFwdAlgoImplicitGEMM;GemmFwdRest:1.26062,439934976,miopenConvolutionFwdAlgoGEMM;ConvDirectNaiveConvFwd:73.1285,0,miopenConvolutionFwdAlgoDirect
384-205-157-3x3-384-102-78-2-0x0-2x2-1x1-0-NCHW-FP32-F=ConvBinWinogradRxSf2x3g1:1.42389,0,miopenConvolutionFwdAlgoWinograd;ConvBinWinogradRxSf3x2:0.733116,0,miopenConvolutionFwdAlgoWinograd;ConvHipImplicitGemmGroupFwdXdlops:0.476278,128621568,miopenConvolutionFwdAlgoImplicitGEMM;ConvAsmImplicitGemmGTCDynamicFwdXdlopsNHWC:0.425564,128621568,miopenConvolutionFwdAlgoImplicitGEMM;GemmFwdRest:0.488828,109983744,miopenConvolutionFwdAlgoGEMM;ConvDirectNaiveConvFwd:22.7628,0,miopenConvolutionFwdAlgoDirect
384-276-208-3x3-192-276-208-2-1x1-1x1-1x1-0-NCHW-FP32-F=ConvBinWinogradRxSf2x3g1:1.46013,0,miopenConvolutionFwdAlgoWinograd;ConvBinWinogradRxSf3x2:2.37104,0,miopenConvolutionFwdAlgoWinograd;ConvHipImplicitGemmGroupFwdXdlops:1.51059,267190272,miopenConvolutionFwdAlgoImplicitGEMM;ConvAsmImplicitGemmGTCDynamicFwdXdlopsNHWC:1.37138,267190272,miopenConvolutionFwdAlgoImplicitGEMM;GemmFwdRest:2.25754,793608192,miopenConvolutionFwdAlgoGEMM;ConvDirectNaiveConvFwd:153.05,0,miopenConvolutionFwdAlgoDirect
192-1648-1248-3x3-96-1648-1248-4-1x1-1x1-1x1-0-NCHW-FP32-F=ConvBinWinogradRxSf2x3g1:23.8211,0,miopenConvolutionFwdAlgoWinograd;ConvBinWinogradRxSf3x2:40.5674,0,miopenConvolutionFwdAlgoWinograd;ConvHipImplicitGemmGroupFwdXdlops:33.1192,9477955584,miopenConvolutionFwdAlgoImplicitGEMM;ConvAsmImplicitGemmGTCDynamicFwdXdlopsNHWC:32.8846,9477955584,miopenConvolutionFwdAlgoImplicitGEMM;GemmFwdRest:46.3391,14215938048,miopenConvolutionFwdAlgoGEMM;ConvDirectNaiveConvFwd:3946.02,0,miopenConvolutionFwdAlgoDirect
192-4-414-314-3x3x3-384-2-412-312-1-0x0x0-1x1x1-1x1x1-0-NCDHW-BF16-F=ConvHipImplicitGemm3DGroupFwdXdlops:1.64664,401098752,miopenConvolutionFwdAlgoImplicitGEMM;GemmFwdRest:6.09687,2665488384,miopenConvolutionFwdAlgoGEMM;ConvDirectNaiveConvFwd:1125.84,0,miopenConvolutionFwdAlgoDirect
192-6-554-418-3x3x3-192-4-552-416-1-0x0x0-1x1x1-1x1x1-0-NCDHW-BF16-F=ConvHipImplicitGemm3DGroupFwdXdlops:3.11926,888247296,miopenConvolutionFwdAlgoImplicitGEMM;ConvDirectNaiveConvFwd:3381.19,0,miopenConvolutionFwdAlgoDirect
192-553-417-3x3-192-276-208-1-0x0-2x2-1x1-0-NCHW-BF16-F=ConvHipImplicitGemmGroupFwdXdlops:0.159402,111259136,miopenConvolutionFwdAlgoImplicitGEMM;ConvAsmImplicitGemmGTCDynamicFwdXdlopsNHWC:0.196448,155348480,miopenConvolutionFwdAlgoImplicitGEMM;GemmFwdRest:0.215538,198402048,miopenConvolutionFwdAlgoGEMM;ConvDirectNaiveConvFwd:75.8493,0,miopenConvolutionFwdAlgoDirect
192-825-625-3x3-192-412-312-1-0x0-2x2-1x1-0-NCHW-BF16-F=ConvHipImplicitGemmGroupFwdXdlops:0.395661,248024576,miopenConvolutionFwdAlgoImplicitGEMM;ConvAsmImplicitGemmGTCDynamicFwdXdlopsNHWC:0.439672,346746368,miopenConvolutionFwdAlgoImplicitGEMM;GemmFwdRest:0.445658,444248064,miopenConvolutionFwdAlgoGEMM;ConvDirectNaiveConvFwd:168.333,0,miopenConvolutionFwdAlgoDirect
3-3-1106-834-3x3x3-96-1-1104-832-1-0x0x0-1x1x1-1x1x1-0-NCDHW-BF16-F=ConvHipImplicitGemm3DGroupFwdXdlops:0.382617,192976384,miopenConvolutionFwdAlgoImplicitGEMM;GemmFwdRest:0.365051,148801536,miopenConvolutionFwdAlgoGEMM;ConvDirectNaiveConvFwd:51.3543,0,miopenConvolutionFwdAlgoDirect
3-3-818-626-3x3x3-96-1-816-624-1-0x0x0-1x1x1-1x1x1-0-NCDHW-BF16-F=ConvHipImplicitGemm3DGroupFwdXdlops:0.202122,106996224,miopenConvolutionFwdAlgoImplicitGEMM;GemmFwdRest:0.206056,82487808,miopenConvolutionFwdAlgoGEMM;ConvDirectNaiveConvFwd:27.9557,0,miopenConvolutionFwdAlgoDirect
3-6-1106-834-3x3x3-96-4-1104-832-1-0x0x0-1x1x1-1x1x1-0-NCDHW-BF16-F=ConvHipImplicitGemm3DGroupFwdXdlops:1.47124,738651904,miopenConvolutionFwdAlgoImplicitGEMM;GemmFwdRest:1.47847,595206144,miopenConvolutionFwdAlgoGEMM;ConvDirectNaiveConvFwd:207.819,0,miopenConvolutionFwdAlgoDirect
3-6-818-626-3x3x3-96-4-816-624-1-0x0x0-1x1x1-1x1x1-0-NCDHW-BF16-F=ConvHipImplicitGemm3DGroupFwdXdlops:0.812563,409503488,miopenConvolutionFwdAlgoImplicitGEMM;GemmFwdRest:0.783929,329951232,miopenConvolutionFwdAlgoGEMM;ConvDirectNaiveConvFwd:112.393,0,miopenConvolutionFwdAlgoDirect
32-21-138-104-1x1x1-32-21-138-104-1-0x0x0-1x1x1-1x1x1-0-NCDHW-BF16-F=ConvHipImplicitGemm3DGroupFwdXdlops:0.0530693,38580224,miopenConvolutionFwdAlgoImplicitGEMM;GemmFwd1x1_0_1:0.0161902,0,miopenConvolutionFwdAlgoGEMM;ConvDirectNaiveConvFwd:18.0151,0,miopenConvolutionFwdAlgoDirect
36-21-102-78-1x2x2-5120-21-51-39-1-0x0x0-1x2x2-1x1x1-0-NCDHW-BF16-F=ConvHipImplicitGemm3DGroupFwdXdlops:0.888909,441218816,miopenConvolutionFwdAlgoImplicitGEMM;GemmFwdRest:0.231009,12029472,miopenConvolutionFwdAlgoGEMM;ConvDirectNaiveConvFwd:28.5549,0,miopenConvolutionFwdAlgoDirect
384-3-102-78-3x1x1-768-1-102-78-1-0x0x0-1x1x1-1x1x1-0-NCDHW-BF16-F=ConvHipImplicitGemm3DGroupFwdXdlops:0.0615208,32320512,miopenConvolutionFwdAlgoImplicitGEMM;GemmFwdRest:0.0755942,18330624,miopenConvolutionFwdAlgoGEMM;ConvDirectNaiveConvFwd:16.068,0,miopenConvolutionFwdAlgoDirect
384-3-138-104-3x1x1-384-1-138-104-1-0x0x0-2x1x1-1x1x1-0-NCDHW-BF16-F=ConvHipImplicitGemm3DGroupFwdXdlops:0.0745738,44974080,miopenConvolutionFwdAlgoImplicitGEMM;GemmFwdRest:0.100953,33067008,miopenConvolutionFwdAlgoGEMM;ConvDirectNaiveConvFwd:27.6955,0,miopenConvolutionFwdAlgoDirect
384-3-140-106-3x3x3-384-1-138-104-1-0x0x0-1x1x1-1x1x1-0-NCDHW-BF16-F=ConvHipImplicitGemm3DGroupFwdXdlops:0.236702,53176320,miopenConvolutionFwdAlgoImplicitGEMM;GemmFwdRest:0.747228,297603072,miopenConvolutionFwdAlgoGEMM;ConvDirectNaiveConvFwd:109.281,0,miopenConvolutionFwdAlgoDirect
384-3-208-158-3x3x3-32-1-206-156-1-0x0x0-1x1x1-1x1x1-0-NCDHW-BF16-F=ConvHipImplicitGemm3DGroupFwdXdlops:0.153053,78438912,miopenConvolutionFwdAlgoImplicitGEMM;GemmFwdRest:1.37808,666372096,miopenConvolutionFwdAlgoGEMM;ConvDirectNaiveConvFwd:236.706,0,miopenConvolutionFwdAlgoDirect
384-3-414-314-3x3x3-384-1-412-312-1-0x0x0-1x1x1-1x1x1-0-NCDHW-BF16-F=ConvHipImplicitGemm3DGroupFwdXdlops:1.74875,406195200,miopenConvolutionFwdAlgoImplicitGEMM;GemmFwdRest:6.08457,2665488384,miopenConvolutionFwdAlgoGEMM;ConvDirectNaiveConvFwd:1084.59,0,miopenConvolutionFwdAlgoDirect
384-102-78-1x1-1152-102-78-1-0x0-1x1-1x1-0-NCHW-BF16-F=ConvHipImplicitGemmGroupFwdXdlops:0.0535672,25325568,miopenConvolutionFwdAlgoImplicitGEMM;ConvAsmImplicitGemmGTCDynamicFwdXdlopsNHWC:0.0493803,61102080,miopenConvolutionFwdAlgoImplicitGEMM;GemmFwd1x1_0_1:0.0271284,0,miopenConvolutionFwdAlgoGEMM;ConvDirectNaiveConvFwd:5.33754,0,miopenConvolutionFwdAlgoDirect
384-102-78-1x1-384-102-78-1-0x0-1x1-1x1-0-NCHW-BF16-F=ConvHipImplicitGemmGroupFwdXdlops:0.0340735,12515328,miopenConvolutionFwdAlgoImplicitGEMM;ConvAsmImplicitGemmGTCDynamicFwdXdlopsNHWC:0.0288974,24440832,miopenConvolutionFwdAlgoImplicitGEMM;GemmFwd1x1_0_1:0.0162802,0,miopenConvolutionFwdAlgoGEMM;ConvDirectNaiveConvFwd:4.9499,0,miopenConvolutionFwdAlgoDirect
384-138-104-1x1-384-138-104-1-0x0-1x1-1x1-0-NCHW-BF16-F=ConvHipImplicitGemmGroupFwdXdlops:0.0449126,22339584,miopenConvolutionFwdAlgoImplicitGEMM;ConvAsmImplicitGemmGTCDynamicFwdXdlopsNHWC:0.0398696,44089344,miopenConvolutionFwdAlgoImplicitGEMM;GemmFwd1x1_0_1:0.0209042,0,miopenConvolutionFwdAlgoGEMM;ConvDirectNaiveConvFwd:8.69642,0,miopenConvolutionFwdAlgoDirect
384-206-156-1x1-1152-206-156-1-0x0-1x1-1x1-0-NCHW-BF16-F=ConvHipImplicitGemmGroupFwdXdlops:0.180155,99606528,miopenConvolutionFwdAlgoImplicitGEMM;ConvAsmImplicitGemmGTCDynamicFwdXdlopsNHWC:0.152062,246804480,miopenConvolutionFwdAlgoImplicitGEMM;GemmFwd1x1_0_1:0.0582072,0,miopenConvolutionFwdAlgoGEMM;ConvDirectNaiveConvFwd:21.7313,0,miopenConvolutionFwdAlgoDirect
384-277-209-3x3-384-138-104-1-0x0-2x2-1x1-0-NCHW-BF16-F=ConvHipImplicitGemmGroupFwdXdlops:0.128486,58138368,miopenConvolutionFwdAlgoImplicitGEMM;ConvAsmImplicitGemmGTCDynamicFwdXdlopsNHWC:0.163099,80183040,miopenConvolutionFwdAlgoImplicitGEMM;GemmFwdRest:0.134408,99201024,miopenConvolutionFwdAlgoGEMM;ConvDirectNaiveConvFwd:39.3902,0,miopenConvolutionFwdAlgoDirect
384-552-416-3x3-192-552-416-1-1x1-1x1-1x1-0-NCHW-BF16-F=ConvHipImplicitGemmGroupFwdXdlops:0.567819,265863168,miopenConvolutionFwdAlgoImplicitGEMM;ConvAsmImplicitGemmGTCDynamicFwdXdlopsNHWC:0.79183,442220544,miopenConvolutionFwdAlgoImplicitGEMM;GemmFwdRest:1.22813,1587216384,miopenConvolutionFwdAlgoGEMM;ConvDirectNaiveConvFwd:542.192,0,miopenConvolutionFwdAlgoDirect
96-3-1106-834-3x3x3-96-1-1104-832-1-0x0x0-1x1x1-1x1x1-0-NCDHW-BF16-F=ConvHipImplicitGemm3DGroupFwdXdlops:1.55394,708159744,miopenConvolutionFwdAlgoImplicitGEMM;GemmFwdRest:9.70683,4761649152,miopenConvolutionFwdAlgoGEMM;ConvDirectNaiveConvFwd:1709.95,0,miopenConvolutionFwdAlgoDirect
96-3-410-314-3x3x3-192-1-408-312-1-0x0x0-1x1x1-1x1x1-0-NCDHW-BF16-F=ConvHipImplicitGemm3DGroupFwdXdlops:0.266494,124031232,miopenConvolutionFwdAlgoImplicitGEMM;GemmFwdRest:1.40457,659902464,miopenConvolutionFwdAlgoGEMM;ConvDirectNaiveConvFwd:217.234,0,miopenConvolutionFwdAlgoDirect
96-3-818-626-3x3x3-3-1-816-624-1-0x0x0-1x1x1-1x1x1-0-NCDHW-BF16-F=ConvHipImplicitGemm3DGroupFwdXdlops:0.753876,298021888,miopenConvolutionFwdAlgoImplicitGEMM;GemmFwdRest:5.29098,2639609856,miopenConvolutionFwdAlgoGEMM;ConvDirectNaiveConvFwd:1131.93,0,miopenConvolutionFwdAlgoDirect
96-3-826-626-3x3x3-192-1-824-624-1-0x0x0-1x1x1-1x1x1-0-NCDHW-BF16-F=ConvHipImplicitGemm3DGroupFwdXdlops:1.23525,496274688,miopenConvolutionFwdAlgoImplicitGEMM;GemmFwdRest:5.61914,2665488384,miopenConvolutionFwdAlgoGEMM;ConvDirectNaiveConvFwd:953.295,0,miopenConvolutionFwdAlgoDirect
96-6-1106-834-3x3x3-3-4-1104-832-1-0x0x0-1x1x1-1x1x1-0-NCDHW-BF16-F=ConvHipImplicitGemm3DGroupFwdXdlops:5.1903,1084669696,miopenConvolutionFwdAlgoImplicitGEMM;ConvDirectNaiveConvFwd:8106.62,0,miopenConvolutionFwdAlgoDirect
96-6-554-418-3x3x3-192-4-552-416-1-0x0x0-1x1x1-1x1x1-0-NCDHW-BF16-F=ConvHipImplicitGemm3DGroupFwdXdlops:1.96883,620481024,miopenConvolutionFwdAlgoImplicitGEMM;GemmFwdRest:10.0087,4761649152,miopenConvolutionFwdAlgoGEMM;ConvDirectNaiveConvFwd:1624.53,0,miopenConvolutionFwdAlgoDirect
96-6-818-626-3x3x3-96-4-816-624-1-0x0x0-1x1x1-1x1x1-0-NCDHW-BF16-F=ConvHipImplicitGemm3DGroupFwdXdlops:2.76395,981453312,miopenConvolutionFwdAlgoImplicitGEMM;ConvDirectNaiveConvFwd:3811.44,0,miopenConvolutionFwdAlgoDirect
96-1105-833-3x3-96-552-416-1-0x0-2x2-1x1-0-NCHW-BF16-F=ConvHipImplicitGemmGroupFwdXdlops:0.316797,220984576,miopenConvolutionFwdAlgoImplicitGEMM;ConvAsmImplicitGemmGTCDynamicFwdXdlopsNHWC:0.332697,309163264,miopenConvolutionFwdAlgoImplicitGEMM;GemmFwdRest:0.390364,396804096,miopenConvolutionFwdAlgoGEMM;ConvDirectNaiveConvFwd:152.774,0,miopenConvolutionFwdAlgoDirect
96-1649-1249-3x3-96-824-624-1-0x0-2x2-1x1-0-NCHW-BF16-F=ConvHipImplicitGemmGroupFwdXdlops:0.6538,494331136,miopenConvolutionFwdAlgoImplicitGEMM;ConvAsmImplicitGemmGTCDynamicFwdXdlopsNHWC:0.695344,691774720,miopenConvolutionFwdAlgoImplicitGEMM;GemmFwdRest:0.869435,888496128,miopenConvolutionFwdAlgoGEMM;ConvDirectNaiveConvFwd:390.109,0,miopenConvolutionFwdAlgoDirect
96-817-625-3x3-96-408-312-1-0x0-2x2-1x1-0-NCHW-BF16-F=ConvHipImplicitGemmGroupFwdXdlops:0.157462,122646784,miopenConvolutionFwdAlgoImplicitGEMM;ConvAsmImplicitGemmGTCDynamicFwdXdlopsNHWC:0.176009,171528448,miopenConvolutionFwdAlgoImplicitGEMM;GemmFwdRest:0.211676,219967488,miopenConvolutionFwdAlgoGEMM;ConvDirectNaiveConvFwd:84.1035,0,miopenConvolutionFwdAlgoDirect
384-204-156-3x3-192-204-156-2-1x1-1x1-1x1-0-NCHW-BF16-F=ConvHipImplicitGemmGroupFwdXdlops:0.193899,74649600,miopenConvolutionFwdAlgoImplicitGEMM;ConvAsmImplicitGemmGTCDynamicFwdXdlopsNHWC:0.250152,123531264,miopenConvolutionFwdAlgoImplicitGEMM;GemmFwdRest:0.337223,219967488,miopenConvolutionFwdAlgoGEMM;ConvDirectNaiveConvFwd:77.9835,0,miopenConvolutionFwdAlgoDirect
384-205-157-3x3-384-102-78-2-0x0-2x2-1x1-0-NCHW-BF16-F=ConvHipImplicitGemmGroupFwdXdlops:0.118594,64310784,miopenConvolutionFwdAlgoImplicitGEMM;ConvAsmImplicitGemmGTCDynamicFwdXdlopsNHWC:0.153304,88751616,miopenConvolutionFwdAlgoImplicitGEMM;GemmFwdRest:0.161321,54991872,miopenConvolutionFwdAlgoGEMM;ConvDirectNaiveConvFwd:23.5278,0,miopenConvolutionFwdAlgoDirect
384-277-209-3x3-384-138-104-2-0x0-2x2-1x1-0-NCHW-BF16-F=ConvHipImplicitGemmGroupFwdXdlops:0.219539,113622528,miopenConvolutionFwdAlgoImplicitGEMM;ConvAsmImplicitGemmGTCDynamicFwdXdlopsNHWC:0.25591,157711872,miopenConvolutionFwdAlgoImplicitGEMM;GemmFwdRest:0.275863,99201024,miopenConvolutionFwdAlgoGEMM;ConvDirectNaiveConvFwd:43.4234,0,miopenConvolutionFwdAlgoDirect
192-1104-832-3x3-96-1104-832-4-1x1-1x1-1x1-0-NCHW-BF16-F=ConvHipImplicitGemmGroupFwdXdlops:3.294,2116620288,miopenConvolutionFwdAlgoImplicitGEMM;ConvAsmImplicitGemmGTCDynamicFwdXdlopsNHWC:3.64877,3527479296,miopenConvolutionFwdAlgoImplicitGEMM;GemmFwdRest:9.6132,3174432768,miopenConvolutionFwdAlgoGEMM;ConvDirectNaiveConvFwd:1559.61,0,miopenConvolutionFwdAlgoDirect
384-824-624-3x3-192-824-624-4-1x1-1x1-1x1-0-NCHW-BF16-F=ConvHipImplicitGemmGroupFwdXdlops:5.16182,2370650112,miopenConvolutionFwdAlgoImplicitGEMM;ConvAsmImplicitGemmGTCDynamicFwdXdlopsNHWC:6.44643,3950198784,miopenConvolutionFwdAlgoImplicitGEMM;GemmFwdRest:9.47429,3553984512,miopenConvolutionFwdAlgoGEMM;ConvDirectNaiveConvFwd:2031.25,0,miopenConvolutionFwdAlgoDirect
128-11-162-194-3x3x3-128-9-160-192-1-0x0x0-1x1x1-1x1x1-0-NCDHW-FP16-F=ConvHipImplicitGemm3DGroupFwdXdlops:0.477571,160164864,miopenConvolutionFwdAlgoImplicitGEMM;GemmFwdRest:3.86834,1911029760,miopenConvolutionFwdAlgoGEMM;ConvDirectNaiveConvFwd:700.123,0,miopenConvolutionFwdAlgoDirect
128-11-258-258-3x3x3-3-9-256-256-1-0x0x0-1x1x1-1x1x1-0-NCDHW-FP16-F=ConvHipImplicitGemm3DGroupFwdXdlops:0.856032,191003904,miopenConvolutionFwdAlgoImplicitGEMM;GemmFwdRest:7.89906,4076863488,miopenConvolutionFwdAlgoGEMM;ConvDirectNaiveConvFwd:1587.77,0,miopenConvolutionFwdAlgoDirect
128-19-162-194-3x3x3-3-17-160-192-1-0x0x0-1x1x1-1x1x1-0-NCDHW-FP16-F=ConvHipImplicitGemm3DGroupFwdXdlops:0.825677,156019968,miopenConvolutionFwdAlgoImplicitGEMM;GemmFwdRest:6.96224,3609722880,miopenConvolutionFwdAlgoGEMM;ConvDirectNaiveConvFwd:1396.2,0,miopenConvolutionFwdAlgoDirect
128-19-258-194-3x3x3-3-17-256-192-1-0x0x0-1x1x1-1x1x1-0-NCDHW-FP16-F=ConvHipImplicitGemm3DGroupFwdXdlops:1.27319,248487168,miopenConvolutionFwdAlgoImplicitGEMM;GemmFwdRest:11.1983,5775556608,miopenConvolutionFwdAlgoGEMM;ConvDirectNaiveConvFwd:2238.28,0,miopenConvolutionFwdAlgoDirect
16-7-20-34-3x3x3-512-5-18-32-1-0x0x0-1x1x1-1x1x1-0-NCDHW-FP16-F=ConvHipImplicitGemm3DGroupFwdXdlops:0.0288203,3543808,miopenConvolutionFwdAlgoImplicitGEMM;GemmFwdRest:0.0257042,2488320,miopenConvolutionFwdAlgoGEMM;ConvDirectNaiveConvFwd:0.892117,0,miopenConvolutionFwdAlgoDirect
256-11-130-130-3x3x3-256-9-128-128-1-0x0x0-1x1x1-1x1x1-0-NCDHW-FP16-F=ConvHipImplicitGemm3DGroupFwdXdlops:0.822088,174217216,miopenConvolutionFwdAlgoImplicitGEMM;GemmFwdRest:4.3081,2038431744,miopenConvolutionFwdAlgoGEMM;ConvDirectNaiveConvFwd:749.311,0,miopenConvolutionFwdAlgoDirect
256-11-146-258-3x3x3-128-9-144-256-1-0x0x0-1x1x1-1x1x1-0-NCDHW-FP16-F=ConvHipImplicitGemm3DGroupFwdXdlops:1.13999,298850304,miopenConvolutionFwdAlgoImplicitGEMM;GemmFwdRest:9.09691,4586471424,miopenConvolutionFwdAlgoGEMM;ConvDirectNaiveConvFwd:1668.52,0,miopenConvolutionFwdAlgoDirect
256-11-258-194-3x3x3-128-9-256-192-1-0x0x0-1x1x1-1x1x1-0-NCDHW-FP16-F=ConvHipImplicitGemm3DGroupFwdXdlops:1.42887,396908544,miopenConvolutionFwdAlgoImplicitGEMM;GemmFwdRest:12.9516,6115295232,miopenConvolutionFwdAlgoGEMM;ConvDirectNaiveConvFwd:2288.17,0,miopenConvolutionFwdAlgoDirect
256-17-256-192-1x1x1-128-17-256-192-1-0x0x0-1x1x1-1x1x1-0-NCDHW-FP16-F=ConvHipImplicitGemm3DGroupFwdXdlops:0.491131,641794048,miopenConvolutionFwdAlgoImplicitGEMM;GemmFwd1x1_0_1:0.143388,0,miopenConvolutionFwdAlgoGEMM;ConvDirectNaiveConvFwd:501.253,0,miopenConvolutionFwdAlgoDirect
256-19-146-130-3x3x3-256-17-144-128-1-0x0x0-1x1x1-1x1x1-0-NCDHW-FP16-F=ConvHipImplicitGemm3DGroupFwdXdlops:1.7729,348608512,miopenConvolutionFwdAlgoImplicitGEMM;GemmFwdRest:9.30005,4331667456,miopenConvolutionFwdAlgoGEMM;ConvDirectNaiveConvFwd:1625.97,0,miopenConvolutionFwdAlgoDirect
256-19-162-258-3x3x3-256-17-160-256-1-0x0x0-1x1x1-1x1x1-0-NCDHW-FP16-F=ConvHipImplicitGemm3DGroupFwdXdlops:3.95946,766646272,miopenConvolutionFwdAlgoImplicitGEMM;ConvDirectNaiveConvFwd:3532.9,0,miopenConvolutionFwdAlgoDirect
256-7-66-130-3x3x3-256-5-64-128-1-0x0x0-1x1x1-1x1x1-0-NCDHW-FP16-F=ConvHipImplicitGemm3DGroupFwdXdlops:0.2775,55261184,miopenConvolutionFwdAlgoImplicitGEMM;GemmFwdRest:1.1893,566231040,miopenConvolutionFwdAlgoGEMM;ConvDirectNaiveConvFwd:208.298,0,miopenConvolutionFwdAlgoDirect
256-7-74-66-3x3x3-256-5-72-64-1-0x0x0-1x1x1-1x1x1-0-NCDHW-FP16-F=ConvHipImplicitGemm3DGroupFwdXdlops:0.17171,32839680,miopenConvolutionFwdAlgoImplicitGEMM;GemmFwdRest:0.746514,318504960,miopenConvolutionFwdAlgoGEMM;ConvDirectNaiveConvFwd:123.865,0,miopenConvolutionFwdAlgoDirect
256-9-128-192-1x1x1-128-9-128-192-1-0x0x0-1x1x1-1x1x1-0-NCDHW-FP16-F=ConvHipImplicitGemm3DGroupFwdXdlops:0.121314,169934848,miopenConvolutionFwdAlgoImplicitGEMM;GemmFwd1x1_0_1:0.0439405,0,miopenConvolutionFwdAlgoGEMM;ConvDirectNaiveConvFwd:104.763,0,miopenConvolutionFwdAlgoDirect
256-9-160-192-1x1x1-128-9-160-192-1-0x0x0-1x1x1-1x1x1-0-NCDHW-FP16-F=ConvHipImplicitGemm3DGroupFwdXdlops:0.16187,212402176,miopenConvolutionFwdAlgoImplicitGEMM;GemmFwd1x1_0_1:0.0558203,0,miopenConvolutionFwdAlgoGEMM;ConvDirectNaiveConvFwd:131.313,0,miopenConvolutionFwdAlgoDirect
256-9-256-256-1x1x1-128-9-256-256-1-0x0x0-1x1x1-1x1x1-0-NCDHW-FP16-F=ConvHipImplicitGemm3DGroupFwdXdlops:0.351991,453050368,miopenConvolutionFwdAlgoImplicitGEMM;GemmFwd1x1_0_1:0.108888,0,miopenConvolutionFwdAlgoGEMM;ConvDirectNaiveConvFwd:350.714,0,miopenConvolutionFwdAlgoDirect
512-11-130-98-3x3x3-256-9-128-96-1-0x0x0-1x1x1-1x1x1-0-NCDHW-FP16-F=ConvHipImplicitGemm3DGroupFwdXdlops:1.24718,207204352,miopenConvolutionFwdAlgoImplicitGEMM;GemmFwdRest:6.50245,3057647616,miopenConvolutionFwdAlgoGEMM;ConvDirectNaiveConvFwd:1117.61,0,miopenConvolutionFwdAlgoDirect
512-11-66-98-3x3x3-512-9-64-96-1-0x0x0-1x1x1-1x1x1-0-NCDHW-FP16-F=ConvHipImplicitGemm3DGroupFwdXdlops:1.16201,143634432,miopenConvolutionFwdAlgoImplicitGEMM;GemmFwdRest:3.50881,1528823808,miopenConvolutionFwdAlgoGEMM;ConvDirectNaiveConvFwd:689.719,0,miopenConvolutionFwdAlgoDirect
512-11-82-98-3x3x3-256-9-80-96-1-0x0x0-1x1x1-1x1x1-0-NCDHW-FP16-F=ConvHipImplicitGemm3DGroupFwdXdlops:0.856842,132984832,miopenConvolutionFwdAlgoImplicitGEMM;GemmFwdRest:4.12322,1911029760,miopenConvolutionFwdAlgoGEMM;ConvDirectNaiveConvFwd:700.617,0,miopenConvolutionFwdAlgoDirect
512-5-34-18-3x3x3-512-3-32-16-1-0x0x0-1x1x1-1x1x1-0-NCDHW-FP16-F=ConvHipImplicitGemm3DGroupFwdXdlops:0.153969,18862080,miopenConvolutionFwdAlgoImplicitGEMM;GemmFwdRest:0.208882,42467328,miopenConvolutionFwdAlgoGEMM;ConvDirectNaiveConvFwd:15.4475,0,miopenConvolutionFwdAlgoDirect
512-5-42-50-3x3x3-512-3-40-48-1-0x0x0-1x1x1-1x1x1-0-NCDHW-FP16-F=ConvHipImplicitGemm3DGroupFwdXdlops:0.189422,30806016,miopenConvolutionFwdAlgoImplicitGEMM;GemmFwdRest:0.524685,159252480,miopenConvolutionFwdAlgoGEMM;ConvDirectNaiveConvFwd:63.6992,0,miopenConvolutionFwdAlgoDirect
512-5-72-128-1x1x1-256-5-72-128-1-0x0x0-1x1x1-1x1x1-0-NCDHW-FP16-F=ConvHipImplicitGemm3DGroupFwdXdlops:0.0634324,71041024,miopenConvolutionFwdAlgoImplicitGEMM;GemmFwd1x1_0_1:0.0288803,0,miopenConvolutionFwdAlgoGEMM;ConvDirectNaiveConvFwd:44.1112,0,miopenConvolutionFwdAlgoDirect
512-7-130-98-3x3x3-512-5-128-96-1-0x0x0-1x1x1-1x1x1-0-NCDHW-FP16-F=ConvHipImplicitGemm3DGroupFwdXdlops:1.30353,168390656,miopenConvolutionFwdAlgoImplicitGEMM;GemmFwdRest:3.89782,1698693120,miopenConvolutionFwdAlgoGEMM;ConvDirectNaiveConvFwd:804.183,0,miopenConvolutionFwdAlgoDirect
512-7-42-66-3x3x3-512-5-40-64-1-0x0x0-1x1x1-1x1x1-0-NCDHW-FP16-F=ConvHipImplicitGemm3DGroupFwdXdlops:0.315943,47132672,miopenConvolutionFwdAlgoImplicitGEMM;GemmFwdRest:0.949698,353894400,miopenConvolutionFwdAlgoGEMM;ConvDirectNaiveConvFwd:143.214,0,miopenConvolutionFwdAlgoDirect
512-7-74-130-3x3x3-256-5-72-128-1-0x0x0-1x1x1-1x1x1-0-NCDHW-FP16-F=ConvHipImplicitGemm3DGroupFwdXdlops:0.557973,99627008,miopenConvolutionFwdAlgoImplicitGEMM;GemmFwdRest:2.66979,1274019840,miopenConvolutionFwdAlgoGEMM;ConvDirectNaiveConvFwd:475.503,0,miopenConvolutionFwdAlgoDirect
512-9-128-64-1x1x1-256-9-128-64-1-0x0x0-1x1x1-1x1x1-0-NCDHW-FP16-F=ConvHipImplicitGemm3DGroupFwdXdlops:0.0900654,113508352,miopenConvolutionFwdAlgoImplicitGEMM;GemmFwd1x1_0_1:0.0416564,0,miopenConvolutionFwdAlgoGEMM;ConvDirectNaiveConvFwd:69.5102,0,miopenConvolutionFwdAlgoDirect
512-9-64-96-1x1x1-256-9-64-96-1-0x0x0-1x1x1-1x1x1-0-NCDHW-FP16-F=ConvHipImplicitGemm3DGroupFwdXdlops:0.0722342,85196800,miopenConvolutionFwdAlgoImplicitGEMM;GemmFwd1x1_0_1:0.030007,0,miopenConvolutionFwdAlgoGEMM;ConvDirectNaiveConvFwd:52.4028,0,miopenConvolutionFwdAlgoDirect
16-21-206-156-1x1x1-16-21-206-156-1-0x0x0-1x1x1-1x1x1-0-NCDHW-FP32-F=ConvHipImplicitGemm3DGroupFwdXdlops:0.0835808,86382592,miopenConvolutionFwdAlgoImplicitGEMM;GemmFwd1x1_0_1:0.116954,0,miopenConvolutionFwdAlgoGEMM;ConvDirectNaiveConvFwd:22.1283,0,miopenConvolutionFwdAlgoDirect
192-1-276-208-1x1x1-384-1-276-208-1-0x0x0-1x1x1-1x1x1-0-NCDHW-FP32-F=ConvHipImplicitGemm3DGroupFwdXdlops:0.16787,132562944,miopenConvolutionFwdAlgoImplicitGEMM;GemmFwd1x1_0_1:0.086801,0,miopenConvolutionFwdAlgoGEMM;ConvDirectNaiveConvFwd:21.2292,0,miopenConvolutionFwdAlgoDirect
192-2-412-312-1x1x1-384-2-412-312-1-0x0x0-1x1x1-1x1x1-0-NCDHW-FP32-F=ConvHipImplicitGemm3DGroupFwdXdlops:0.775316,592625664,miopenConvolutionFwdAlgoImplicitGEMM;GemmFwd1x1_0_1:0.41205,0,miopenConvolutionFwdAlgoGEMM;ConvDirectNaiveConvFwd:115.374,0,miopenConvolutionFwdAlgoDirect
192-3-414-314-3x3x3-384-1-412-312-1-0x0x0-1x1x1-1x1x1-0-NCDHW-FP32-F=ConvHipImplicitGemm3DGroupFwdXdlops:4.45173,504916992,miopenConvolutionFwdAlgoImplicitGEMM;GemmFwdRest:6.96084,2665488384,miopenConvolutionFwdAlgoGEMM;ConvDirectNaiveConvFwd:608.001,0,miopenConvolutionFwdAlgoDirect
192-4-278-210-3x3x3-384-2-276-208-1-0x0x0-1x1x1-1x1x1-0-NCDHW-FP32-F=ConvHipImplicitGemm3DGroupFwdXdlops:4.22352,363663360,miopenConvolutionFwdAlgoImplicitGEMM;GemmFwdRest:6.17478,2380824576,miopenConvolutionFwdAlgoGEMM;ConvDirectNaiveConvFwd:490.899,0,miopenConvolutionFwdAlgoDirect
192-5-412-312-3x1x1-192-2-412-312-1-0x0x0-2x1x1-1x1x1-0-NCDHW-FP32-F=ConvHipImplicitGemm3DGroupFwdXdlops:0.834929,691494912,miopenConvolutionFwdAlgoImplicitGEMM;GemmFwdRest:1.32717,592330752,miopenConvolutionFwdAlgoGEMM;ConvDirectNaiveConvFwd:327.674,0,miopenConvolutionFwdAlgoDirect
192-6-554-418-3x3x3-192-4-552-416-1-0x0x0-1x1x1-1x1x1-0-NCDHW-FP32-F=ConvHipImplicitGemm3DGroupFwdXdlops:16.066,1776494592,miopenConvolutionFwdAlgoImplicitGEMM;ConvDirectNaiveConvFwd:3643.11,0,miopenConvolutionFwdAlgoDirect
192-553-417-3x3-192-276-208-1-0x0-2x2-1x1-0-NCHW-FP32-F=ConvBinWinogradRxSf2x3g1:1.325,0,miopenConvolutionFwdAlgoWinograd;ConvBinWinogradRxSf3x2:0.648509,0,miopenConvolutionFwdAlgoWinograd;ConvHipImplicitGemmGroupFwdXdlops:0.518571,222518016,miopenConvolutionFwdAlgoImplicitGEMM;ConvAsmImplicitGemmGTCDynamicFwdXdlopsNHWC:0.479862,222518016,miopenConvolutionFwdAlgoImplicitGEMM;GemmFwdRest:0.659813,396804096,miopenConvolutionFwdAlgoGEMM;ConvDirectNaiveConvFwd:72.5513,0,miopenConvolutionFwdAlgoDirect
192-825-625-3x3-192-412-312-1-0x0-2x2-1x1-0-NCHW-FP32-F=ConvBinWinogradRxSf2x3g1:2.86798,0,miopenConvolutionFwdAlgoWinograd;ConvBinWinogradRxSf3x2:1.40657,0,miopenConvolutionFwdAlgoWinograd;ConvHipImplicitGemmGroupFwdXdlops:1.01367,496048896,miopenConvolutionFwdAlgoImplicitGEMM;ConvAsmImplicitGemmGTCDynamicFwdXdlopsNHWC:0.994038,496048896,miopenConvolutionFwdAlgoImplicitGEMM;GemmFwdRest:1.38691,888496128,miopenConvolutionFwdAlgoGEMM;ConvDirectNaiveConvFwd:187.973,0,miopenConvolutionFwdAlgoDirect
3-3-1650-1250-3x3x3-96-1-1648-1248-1-0x0x0-1x1x1-1x1x1-0-NCDHW-FP32-F=ConvHipImplicitGemm3DGroupFwdXdlops:1.31464,864055808,miopenConvolutionFwdAlgoImplicitGEMM;GemmFwdRest:1.51893,666372096,miopenConvolutionFwdAlgoGEMM;ConvDirectNaiveConvFwd:129.958,0,miopenConvolutionFwdAlgoDirect
3-3-818-626-3x3x3-96-1-816-624-1-0x0x0-1x1x1-1x1x1-0-NCDHW-FP32-F=ConvHipImplicitGemm3DGroupFwdXdlops:0.348757,213992448,miopenConvolutionFwdAlgoImplicitGEMM;GemmFwdRest:0.396683,164975616,miopenConvolutionFwdAlgoGEMM;ConvDirectNaiveConvFwd:29.0823,0,miopenConvolutionFwdAlgoDirect
3-6-1650-1250-3x3x3-96-4-1648-1248-1-0x0x0-1x1x1-1x1x1-0-NCDHW-FP32-F=ConvHipImplicitGemm3DGroupFwdXdlops:6.31663,3307628800,miopenConvolutionFwdAlgoImplicitGEMM;GemmFwdRest:5.90519,2665488384,miopenConvolutionFwdAlgoGEMM;ConvDirectNaiveConvFwd:518.265,0,miopenConvolutionFwdAlgoDirect
36-21-138-104-1x2x2-5120-21-69-52-1-0x0x0-1x2x2-1x1x1-0-NCDHW-FP32-F=ConvHipImplicitGemm3DGroupFwdXdlops:2.50781,1589476608,miopenConvolutionFwdAlgoImplicitGEMM;GemmFwdRest:1.27296,43400448,miopenConvolutionFwdAlgoGEMM;ConvDirectNaiveConvFwd:53.0175,0,miopenConvolutionFwdAlgoDirect
384-3-138-104-3x1x1-384-1-138-104-1-0x0x0-2x1x1-1x1x1-0-NCDHW-FP32-F=ConvHipImplicitGemm3DGroupFwdXdlops:0.201602,89948160,miopenConvolutionFwdAlgoImplicitGEMM;GemmFwdRest:0.223218,66134016,miopenConvolutionFwdAlgoGEMM;ConvDirectNaiveConvFwd:28.9013,0,miopenConvolutionFwdAlgoDirect
384-3-140-106-3x3x3-32-1-138-104-1-0x0x0-1x1x1-1x1x1-0-NCDHW-FP32-F=ConvHipImplicitGemm3DGroupFwdXdlops:0.259139,71546880,miopenConvolutionFwdAlgoImplicitGEMM;GemmFwdRest:0.771641,595206144,miopenConvolutionFwdAlgoGEMM;ConvDirectNaiveConvFwd:113.488,0,miopenConvolutionFwdAlgoDirect
384-3-206-156-3x1x1-384-1-206-156-1-0x0x0-2x1x1-1x1x1-0-NCDHW-FP32-F=ConvHipImplicitGemm3DGroupFwdXdlops:0.387973,199213056,miopenConvolutionFwdAlgoImplicitGEMM;GemmFwdRest:0.399751,148082688,miopenConvolutionFwdAlgoGEMM;ConvDirectNaiveConvFwd:64.3905,0,miopenConvolutionFwdAlgoDirect
384-3-206-156-3x1x1-768-1-206-156-1-0x0x0-1x1x1-1x1x1-0-NCDHW-FP32-F=ConvHipImplicitGemm3DGroupFwdXdlops:0.682754,250343424,miopenConvolutionFwdAlgoImplicitGEMM;GemmFwdRest:0.69611,148082688,miopenConvolutionFwdAlgoGEMM;ConvDirectNaiveConvFwd:67.2818,0,miopenConvolutionFwdAlgoDirect
384-3-208-158-3x3x3-32-1-206-156-1-0x0x0-1x1x1-1x1x1-0-NCDHW-FP32-F=ConvHipImplicitGemm3DGroupFwdXdlops:0.405627,156877824,miopenConvolutionFwdAlgoImplicitGEMM;GemmFwdRest:1.89257,1332744192,miopenConvolutionFwdAlgoGEMM;ConvDirectNaiveConvFwd:244.317,0,miopenConvolutionFwdAlgoDirect
384-3-278-210-3x3x3-384-1-276-208-1-0x0x0-1x1x1-1x1x1-0-NCDHW-FP32-F=ConvHipImplicitGemm3DGroupFwdXdlops:4.38796,373118976,miopenConvolutionFwdAlgoImplicitGEMM;GemmFwdRest:6.35392,2380824576,miopenConvolutionFwdAlgoGEMM;ConvDirectNaiveConvFwd:518.599,0,miopenConvolutionFwdAlgoDirect
384-4-278-210-3x3x3-384-2-276-208-1-0x0x0-1x1x1-1x1x1-0-NCDHW-FP32-F=ConvHipImplicitGemm3DGroupFwdXdlops:8.15535,550969344,miopenConvolutionFwdAlgoImplicitGEMM;GemmFwdRest:12.6412,4761649152,miopenConvolutionFwdAlgoGEMM;ConvDirectNaiveConvFwd:1056.62,0,miopenConvolutionFwdAlgoDirect
384-138-104-1x1-1152-138-104-1-0x0-1x1-1x1-0-NCHW-FP32-F=ConvBinWinogradRxSf2x3g1:1.04002,0,miopenConvolutionFwdAlgoWinograd;ConvBinWinogradRxSf3x2:0.541072,0,miopenConvolutionFwdAlgoWinograd;ConvHipImplicitGemmGroupFwdXdlops:0.186586,89948160,miopenConvolutionFwdAlgoImplicitGEMM;ConvAsmImplicitGemmGTCDynamicFwdXdlopsNHWC:0.170465,88178688,miopenConvolutionFwdAlgoImplicitGEMM;GemmFwd1x1_0_1:0.145515,0,miopenConvolutionFwdAlgoGEMM;ConvDirectNaiveConvFwd:10.2435,0,miopenConvolutionFwdAlgoDirect
384-206-156-1x1-1152-206-156-1-0x0-1x1-1x1-0-NCHW-FP32-F=ConvBinWinogradRxSf2x3g1:2.30617,0,miopenConvolutionFwdAlgoWinograd;ConvBinWinogradRxSf3x2:1.06252,0,miopenConvolutionFwdAlgoWinograd;ConvHipImplicitGemmGroupFwdXdlops:0.430525,199213056,miopenConvolutionFwdAlgoImplicitGEMM;ConvAsmImplicitGemmGTCDynamicFwdXdlopsNHWC:0.401317,197443584,miopenConvolutionFwdAlgoImplicitGEMM;GemmFwd1x1_0_1:0.246242,0,miopenConvolutionFwdAlgoGEMM;ConvDirectNaiveConvFwd:22.1936,0,miopenConvolutionFwdAlgoDirect
384-408-312-3x3-192-408-312-1-1x1-1x1-1x1-0-NCHW-FP32-F=ConvBinWinogradRxSf2x3g1:1.56391,0,miopenConvolutionFwdAlgoWinograd;ConvBinWinogradRxSf3x2:2.70439,0,miopenConvolutionFwdAlgoWinograd;ConvHipImplicitGemmGroupFwdXdlops:1.53472,295944192,miopenConvolutionFwdAlgoImplicitGEMM;ConvAsmImplicitGemmGTCDynamicFwdXdlopsNHWC:1.52782,295944192,miopenConvolutionFwdAlgoImplicitGEMM;GemmFwdRest:2.44287,1759739904,miopenConvolutionFwdAlgoGEMM;ConvDirectNaiveConvFwd:290.63,0,miopenConvolutionFwdAlgoDirect
96-1-408-312-1x1x1-192-1-408-312-1-0x0x0-1x1x1-1x1x1-0-NCDHW-FP32-F=ConvHipImplicitGemm3DGroupFwdXdlops:0.145539,146718720,miopenConvolutionFwdAlgoImplicitGEMM;GemmFwd1x1_0_1:0.0911867,0,miopenConvolutionFwdAlgoGEMM;ConvDirectNaiveConvFwd:22.914,0,miopenConvolutionFwdAlgoDirect
96-1-552-416-1x1x1-192-1-552-416-1-0x0x0-1x1x1-1x1x1-0-NCDHW-FP32-F=ConvHipImplicitGemm3DGroupFwdXdlops:0.285467,264609792,miopenConvolutionFwdAlgoImplicitGEMM;GemmFwd1x1_0_1:0.162541,0,miopenConvolutionFwdAlgoGEMM;ConvDirectNaiveConvFwd:41.3197,0,miopenConvolutionFwdAlgoDirect
96-1-824-624-1x1x1-192-1-824-624-1-0x0x0-1x1x1-1x1x1-0-NCDHW-FP32-F=ConvHipImplicitGemm3DGroupFwdXdlops:0.609628,592404480,miopenConvolutionFwdAlgoImplicitGEMM;GemmFwd1x1_0_1:0.370341,0,miopenConvolutionFwdAlgoGEMM;ConvDirectNaiveConvFwd:112.68,0,miopenConvolutionFwdAlgoDirect
96-3-1106-834-3x3x3-96-1-1104-832-1-0x0x0-1x1x1-1x1x1-0-NCDHW-FP32-F=ConvHipImplicitGemm3DGroupFwdXdlops:5.82416,1416319488,miopenConvolutionFwdAlgoImplicitGEMM;GemmFwdRest:13.929,9523298304,miopenConvolutionFwdAlgoGEMM;ConvDirectNaiveConvFwd:1815.22,0,miopenConvolutionFwdAlgoDirect
96-3-410-314-3x3x3-192-1-408-312-1-0x0x0-1x1x1-1x1x1-0-NCDHW-FP32-F=ConvHipImplicitGemm3DGroupFwdXdlops:1.20889,248062464,miopenConvolutionFwdAlgoImplicitGEMM;GemmFwdRest:2.57747,1319804928,miopenConvolutionFwdAlgoGEMM;ConvDirectNaiveConvFwd:227.755,0,miopenConvolutionFwdAlgoDirect
96-3-554-418-3x3x3-192-1-552-416-1-0x0x0-1x1x1-1x1x1-0-NCDHW-FP32-F=ConvHipImplicitGemm3DGroupFwdXdlops:2.32654,445118976,miopenConvolutionFwdAlgoImplicitGEMM;GemmFwdRest:4.69843,2380824576,miopenConvolutionFwdAlgoGEMM;ConvDirectNaiveConvFwd:447.595,0,miopenConvolutionFwdAlgoDirect
96-3-818-626-3x3x3-3-1-816-624-1-0x0x0-1x1x1-1x1x1-0-NCDHW-FP32-F=ConvHipImplicitGemm3DGroupFwdXdlops:1.30025,596043776,miopenConvolutionFwdAlgoImplicitGEMM;GemmFwdRest:7.44264,5279219712,miopenConvolutionFwdAlgoGEMM;ConvDirectNaiveConvFwd:1154.43,0,miopenConvolutionFwdAlgoDirect
96-3-818-626-3x3x3-96-1-816-624-1-0x0x0-1x1x1-1x1x1-0-NCDHW-FP32-F=ConvHipImplicitGemm3DGroupFwdXdlops:3.19365,786424320,miopenConvolutionFwdAlgoImplicitGEMM;GemmFwdRest:7.71326,5279219712,miopenConvolutionFwdAlgoGEMM;ConvDirectNaiveConvFwd:1000.17,0,miopenConvolutionFwdAlgoDirect
96-4-408-312-1x1x1-192-4-408-312-1-0x0x0-1x1x1-1x1x1-0-NCDHW-FP32-F=ConvHipImplicitGemm3DGroupFwdXdlops:0.62008,586653696,miopenConvolutionFwdAlgoImplicitGEMM;GemmFwd1x1_0_1:0.35879,0,miopenConvolutionFwdAlgoGEMM;ConvDirectNaiveConvFwd:118.619,0,miopenConvolutionFwdAlgoDirect
96-6-1106-834-3x3x3-3-4-1104-832-1-0x0x0-1x1x1-1x1x1-0-NCDHW-FP32-F=ConvHipImplicitGemm3DGroupFwdXdlops:8.03078,2169339392,miopenConvolutionFwdAlgoImplicitGEMM;ConvDirectNaiveConvFwd:8343.95,0,miopenConvolutionFwdAlgoDirect
96-6-410-314-3x3x3-192-4-408-312-1-0x0x0-1x1x1-1x1x1-0-NCDHW-FP32-F=ConvHipImplicitGemm3DGroupFwdXdlops:4.61681,689660928,miopenConvolutionFwdAlgoImplicitGEMM;GemmFwdRest:10.0024,5279219712,miopenConvolutionFwdAlgoGEMM;ConvDirectNaiveConvFwd:945.337,0,miopenConvolutionFwdAlgoDirect
96-6-818-626-3x3x3-3-4-816-624-1-0x0x0-1x1x1-1x1x1-0-NCDHW-FP32-F=ConvHipImplicitGemm3DGroupFwdXdlops:4.48563,1204276736,miopenConvolutionFwdAlgoImplicitGEMM;ConvDirectNaiveConvFwd:4620.69,0,miopenConvolutionFwdAlgoDirect
96-6-826-626-3x3x3-192-4-824-624-1-0x0x0-1x1x1-1x1x1-0-NCDHW-FP32-F=ConvHipImplicitGemm3DGroupFwdXdlops:18.1225,2772882432,miopenConvolutionFwdAlgoImplicitGEMM;ConvDirectNaiveConvFwd:4015.17,0,miopenConvolutionFwdAlgoDirect
384-277-209-3x3-384-138-104-2-0x0-2x2-1x1-0-NCHW-FP32-F=ConvBinWinogradRxSf2x3g1:2.58438,0,miopenConvolutionFwdAlgoWinograd;ConvBinWinogradRxSf3x2:1.22985,0,miopenConvolutionFwdAlgoWinograd;ConvHipImplicitGemmGroupFwdXdlops:0.866889,227245056,miopenConvolutionFwdAlgoImplicitGEMM;ConvAsmImplicitGemmGTCDynamicFwdXdlopsNHWC:0.788355,227245056,miopenConvolutionFwdAlgoImplicitGEMM;GemmFwdRest:1.10441,198402048,miopenConvolutionFwdAlgoGEMM;ConvDirectNaiveConvFwd:42.6595,0,miopenConvolutionFwdAlgoDirect
192-1104-832-3x3-96-1104-832-4-1x1-1x1-1x1-0-NCHW-FP32-F=ConvBinWinogradRxSf2x3g1:11.0403,0,miopenConvolutionFwdAlgoWinograd;ConvBinWinogradRxSf3x2:18.1528,0,miopenConvolutionFwdAlgoWinograd;ConvHipImplicitGemmGroupFwdXdlops:14.9137,4233240576,miopenConvolutionFwdAlgoImplicitGEMM;ConvAsmImplicitGemmGTCDynamicFwdXdlopsNHWC:14.0909,4233240576,miopenConvolutionFwdAlgoImplicitGEMM;GemmFwdRest:19.8351,6348865536,miopenConvolutionFwdAlgoGEMM;ConvDirectNaiveConvFwd:1735.62,0,miopenConvolutionFwdAlgoDirect
384-824-624-3x3-192-824-624-4-1x1-1x1-1x1-0-NCHW-FP32-F=ConvBinWinogradRxSf2x3g1:23.7578,0,miopenConvolutionFwdAlgoWinograd;ConvBinWinogradRxSf3x2:40.2124,0,miopenConvolutionFwdAlgoWinograd;ConvHipImplicitGemmGroupFwdXdlops:24.0521,4741300224,miopenConvolutionFwdAlgoImplicitGEMM;ConvAsmImplicitGemmGTCDynamicFwdXdlopsNHWC:23.6258,4741300224,miopenConvolutionFwdAlgoImplicitGEMM;GemmFwdRest:37.246,7107969024,miopenConvolutionFwdAlgoGEMM;ConvDirectNaiveConvFwd:2083.71,0,miopenConvolutionFwdAlgoDirect
192-553-417-3x3-192-276-208-1-0x0-2x2-1x1-0-NCHW-BF16-F=ConvHipImplicitGemmGroupFwdXdlops:0.162973,111259136,miopenConvolutionFwdAlgoImplicitGEMM;ConvAsmImplicitGemmGTCDynamicFwdXdlopsNHWC:0.198059,155348480,miopenConvolutionFwdAlgoImplicitGEMM;GemmFwdRest:0.214389,198402048,miopenConvolutionFwdAlgoGEMM;ConvDirectNaiveConvFwd:76.9876,0,miopenConvolutionFwdAlgoDirect
192-825-625-3x3-192-412-312-1-0x0-2x2-1x1-0-NCHW-BF16-F=ConvHipImplicitGemmGroupFwdXdlops:0.395331,248024576,miopenConvolutionFwdAlgoImplicitGEMM;ConvAsmImplicitGemmGTCDynamicFwdXdlopsNHWC:0.439638,346746368,miopenConvolutionFwdAlgoImplicitGEMM;GemmFwdRest:0.460377,444248064,miopenConvolutionFwdAlgoGEMM;ConvDirectNaiveConvFwd:167.972,0,miopenConvolutionFwdAlgoDirect
3-3-1106-834-3x3x3-96-1-1104-832-1-0x0x0-1x1x1-1x1x1-0-NCDHW-BF16-F=ConvHipImplicitGemm3DGroupFwdXdlops:0.382393,192976384,miopenConvolutionFwdAlgoImplicitGEMM;GemmFwdRest:0.365791,148801536,miopenConvolutionFwdAlgoGEMM;ConvDirectNaiveConvFwd:51.2855,0,miopenConvolutionFwdAlgoDirect
3-3-818-626-3x3x3-96-1-816-624-1-0x0x0-1x1x1-1x1x1-0-NCDHW-BF16-F=ConvHipImplicitGemm3DGroupFwdXdlops:0.201693,106996224,miopenConvolutionFwdAlgoImplicitGEMM;GemmFwdRest:0.204842,82487808,miopenConvolutionFwdAlgoGEMM;ConvDirectNaiveConvFwd:27.9943,0,miopenConvolutionFwdAlgoDirect
3-6-1106-834-3x3x3-96-4-1104-832-1-0x0x0-1x1x1-1x1x1-0-NCDHW-BF16-F=ConvHipImplicitGemm3DGroupFwdXdlops:1.47271,738651904,miopenConvolutionFwdAlgoImplicitGEMM;GemmFwdRest:1.47202,595206144,miopenConvolutionFwdAlgoGEMM;ConvDirectNaiveConvFwd:208.098,0,miopenConvolutionFwdAlgoDirect
3-6-818-626-3x3x3-96-4-816-624-1-0x0x0-1x1x1-1x1x1-0-NCDHW-BF16-F=ConvHipImplicitGemm3DGroupFwdXdlops:0.836063,409503488,miopenConvolutionFwdAlgoImplicitGEMM;GemmFwdRest:0.798115,329951232,miopenConvolutionFwdAlgoGEMM;ConvDirectNaiveConvFwd:112.259,0,miopenConvolutionFwdAlgoDirect
32-21-206-156-1x1x1-32-21-206-156-1-0x0x0-1x1x1-1x1x1-0-NCDHW-BF16-F=ConvHipImplicitGemm3DGroupFwdXdlops:0.0958947,86383616,miopenConvolutionFwdAlgoImplicitGEMM;GemmFwd1x1_0_1:0.0296244,0,miopenConvolutionFwdAlgoGEMM;ConvDirectNaiveConvFwd:40.9787,0,miopenConvolutionFwdAlgoDirect
36-21-206-156-1x2x2-5120-21-103-78-1-0x0x0-1x2x2-1x1x1-0-NCDHW-BF16-F=ConvHipImplicitGemm3DGroupFwdXdlops:3.56551,1777695744,miopenConvolutionFwdAlgoImplicitGEMM;GemmFwdRest:0.99359,48589632,miopenConvolutionFwdAlgoGEMM;ConvDirectNaiveConvFwd:135.399,0,miopenConvolutionFwdAlgoDirect
384-3-208-158-3x3x3-32-1-206-156-1-0x0x0-1x1x1-1x1x1-0-NCDHW-BF16-F=ConvHipImplicitGemm3DGroupFwdXdlops:0.154575,78438912,miopenConvolutionFwdAlgoImplicitGEMM;GemmFwdRest:1.37945,666372096,miopenConvolutionFwdAlgoGEMM;ConvDirectNaiveConvFwd:238.249,0,miopenConvolutionFwdAlgoDirect
384-4-204-156-3x1x1-768-2-204-156-1-0x0x0-1x1x1-1x1x1-0-NCDHW-BF16-F=ConvHipImplicitGemm3DGroupFwdXdlops:0.268106,197296128,miopenConvolutionFwdAlgoImplicitGEMM;GemmFwdRest:0.431132,146644992,miopenConvolutionFwdAlgoGEMM;ConvDirectNaiveConvFwd:129.217,0,miopenConvolutionFwdAlgoDirect
384-4-276-208-3x1x1-768-2-276-208-1-0x0x0-1x1x1-1x1x1-0-NCDHW-BF16-F=ConvHipImplicitGemm3DGroupFwdXdlops:0.471997,354484224,miopenConvolutionFwdAlgoImplicitGEMM;GemmFwdRest:0.763704,264536064,miopenConvolutionFwdAlgoGEMM;ConvDirectNaiveConvFwd:245.036,0,miopenConvolutionFwdAlgoDirect
384-4-414-314-3x3x3-384-2-412-312-1-0x0x0-1x1x1-1x1x1-0-NCDHW-BF16-F=ConvHipImplicitGemm3DGroupFwdXdlops:3.16713,604753920,miopenConvolutionFwdAlgoImplicitGEMM;GemmFwdRest:12.4507,5330976768,miopenConvolutionFwdAlgoGEMM;ConvDirectNaiveConvFwd:2178.44,0,miopenConvolutionFwdAlgoDirect
384-413-313-3x3-384-206-156-1-0x0-2x2-1x1-0-NCHW-BF16-F=ConvHipImplicitGemmGroupFwdXdlops:0.228783,126613248,miopenConvolutionFwdAlgoImplicitGEMM;ConvAsmImplicitGemmGTCDynamicFwdXdlopsNHWC:0.271345,175974144,miopenConvolutionFwdAlgoImplicitGEMM;GemmFwdRest:0.261551,222124032,miopenConvolutionFwdAlgoGEMM;ConvDirectNaiveConvFwd:86.5341,0,miopenConvolutionFwdAlgoDirect
96-1-552-416-1x1x1-192-1-552-416-1-0x0x0-1x1x1-1x1x1-0-NCDHW-BF16-F=ConvHipImplicitGemm3DGroupFwdXdlops:0.116653,132304896,miopenConvolutionFwdAlgoImplicitGEMM;GemmFwd1x1_0_1:0.0378072,0,miopenConvolutionFwdAlgoGEMM;ConvDirectNaiveConvFwd:40.4268,0,miopenConvolutionFwdAlgoDirect
96-3-1106-834-3x3x3-3-1-1104-832-1-0x0x0-1x1x1-1x1x1-0-NCDHW-BF16-F=ConvHipImplicitGemm3DGroupFwdXdlops:1.44941,536831488,miopenConvolutionFwdAlgoImplicitGEMM;GemmFwdRest:9.52474,4761649152,miopenConvolutionFwdAlgoGEMM;ConvDirectNaiveConvFwd:2029.43,0,miopenConvolutionFwdAlgoDirect
96-3-554-418-3x3x3-192-1-552-416-1-0x0x0-1x1x1-1x1x1-0-NCDHW-BF16-F=ConvHipImplicitGemm3DGroupFwdXdlops:0.517152,222559488,miopenConvolutionFwdAlgoImplicitGEMM;GemmFwdRest:2.49029,1190412288,miopenConvolutionFwdAlgoGEMM;ConvDirectNaiveConvFwd:394.774,0,miopenConvolutionFwdAlgoDirect
96-3-818-626-3x3x3-96-1-816-624-1-0x0x0-1x1x1-1x1x1-0-NCDHW-BF16-F=ConvHipImplicitGemm3DGroupFwdXdlops:0.780175,393212160,miopenConvolutionFwdAlgoImplicitGEMM;GemmFwdRest:5.36733,2639609856,miopenConvolutionFwdAlgoGEMM;ConvDirectNaiveConvFwd:954.446,0,miopenConvolutionFwdAlgoDirect
96-4-408-312-1x1x1-192-4-408-312-1-0x0x0-1x1x1-1x1x1-0-NCDHW-BF16-F=ConvHipImplicitGemm3DGroupFwdXdlops:0.28086,293326848,miopenConvolutionFwdAlgoImplicitGEMM;GemmFwd1x1_0_1:0.0871477,0,miopenConvolutionFwdAlgoGEMM;ConvDirectNaiveConvFwd:89.3613,0,miopenConvolutionFwdAlgoDirect
96-4-824-624-1x1x1-192-4-824-624-1-0x0x0-1x1x1-1x1x1-0-NCDHW-BF16-F=ConvHipImplicitGemm3DGroupFwdXdlops:1.15883,1184698368,miopenConvolutionFwdAlgoImplicitGEMM;GemmFwd1x1_0_1:0.341203,0,miopenConvolutionFwdAlgoGEMM;ConvDirectNaiveConvFwd:445.273,0,miopenConvolutionFwdAlgoDirect
96-6-1650-1250-3x3x3-96-4-1648-1248-1-0x0x0-1x1x1-1x1x1-0-NCDHW-BF16-F=ConvHipImplicitGemm3DGroupFwdXdlops:12.2326,3956046336,miopenConvolutionFwdAlgoImplicitGEMM;ConvDirectNaiveConvFwd:15405.6,0,miopenConvolutionFwdAlgoDirect
384-276-208-3x3-192-276-208-2-1x1-1x1-1x1-0-NCHW-BF16-F=ConvHipImplicitGemmGroupFwdXdlops:0.276683,133595136,miopenConvolutionFwdAlgoImplicitGEMM;ConvAsmImplicitGemmGTCDynamicFwdXdlopsNHWC:0.412711,221773824,miopenConvolutionFwdAlgoImplicitGEMM;GemmFwdRest:0.648909,396804096,miopenConvolutionFwdAlgoGEMM;ConvDirectNaiveConvFwd:142.563,0,miopenConvolutionFwdAlgoDirect
384-412-312-3x3-192-412-312-2-1x1-1x1-1x1-0-NCHW-BF16-F=ConvHipImplicitGemmGroupFwdXdlops:0.815568,297492480,miopenConvolutionFwdAlgoImplicitGEMM;ConvAsmImplicitGemmGTCDynamicFwdXdlopsNHWC:0.985513,494936064,miopenConvolutionFwdAlgoImplicitGEMM;GemmFwdRest:1.40481,888496128,miopenConvolutionFwdAlgoGEMM;ConvDirectNaiveConvFwd:325.52,0,miopenConvolutionFwdAlgoDirect
192-553-417-3x3-192-276-208-4-0x0-2x2-1x1-0-NCHW-BF16-F=ConvHipImplicitGemmGroupFwdXdlops:0.637212,443045376,miopenConvolutionFwdAlgoImplicitGEMM;ConvAsmImplicitGemmGTCDynamicFwdXdlopsNHWC:0.731632,619402752,miopenConvolutionFwdAlgoImplicitGEMM;GemmFwdRest:0.867775,198402048,miopenConvolutionFwdAlgoGEMM;ConvDirectNaiveConvFwd:92.4069,0,miopenConvolutionFwdAlgoDirect
192-825-625-3x3-192-412-312-4-0x0-2x2-1x1-0-NCHW-BF16-F=ConvHipImplicitGemmGroupFwdXdlops:1.54648,990107136,miopenConvolutionFwdAlgoImplicitGEMM;ConvAsmImplicitGemmGTCDynamicFwdXdlopsNHWC:1.64085,1384994304,miopenConvolutionFwdAlgoImplicitGEMM;GemmFwdRest:1.77359,444248064,miopenConvolutionFwdAlgoGEMM;ConvDirectNaiveConvFwd:211.935,0,miopenConvolutionFwdAlgoDirect
384-408-312-3x3-192-408-312-4-1x1-1x1-1x1-0-NCHW-BF16-F=ConvHipImplicitGemmGroupFwdXdlops:1.29752,587907072,miopenConvolutionFwdAlgoImplicitGEMM;ConvAsmImplicitGemmGTCDynamicFwdXdlopsNHWC:1.63964,978960384,miopenConvolutionFwdAlgoImplicitGEMM;GemmFwdRest:2.62229,879869952,miopenConvolutionFwdAlgoGEMM;ConvDirectNaiveConvFwd:389.044,0,miopenConvolutionFwdAlgoDirect
96-1105-833-3x3-96-552-416-4-0x0-2x2-1x1-0-NCHW-BF16-F=ConvHipImplicitGemmGroupFwdXdlops:1.2666,883440384,miopenConvolutionFwdAlgoImplicitGEMM;ConvAsmImplicitGemmGTCDynamicFwdXdlopsNHWC:1.26714,1236155136,miopenConvolutionFwdAlgoImplicitGEMM;GemmFwdRest:1.54306,396804096,miopenConvolutionFwdAlgoGEMM;ConvDirectNaiveConvFwd:181.369,0,miopenConvolutionFwdAlgoDirect
96-1649-1249-3x3-96-824-624-4-0x0-2x2-1x1-0-NCHW-BF16-F=ConvHipImplicitGemmGroupFwdXdlops:2.70361,1976826624,miopenConvolutionFwdAlgoImplicitGEMM;ConvAsmImplicitGemmGTCDynamicFwdXdlopsNHWC:2.78349,2766600960,miopenConvolutionFwdAlgoImplicitGEMM;GemmFwdRest:3.33188,888496128,miopenConvolutionFwdAlgoGEMM;ConvDirectNaiveConvFwd:420.365,0,miopenConvolutionFwdAlgoDirect
128-11-130-258-3x3x3-3-9-128-256-1-0x0x0-1x1x1-1x1x1-0-NCDHW-FP16-F=ConvHipImplicitGemm3DGroupFwdXdlops:0.500926,96238848,miopenConvolutionFwdAlgoImplicitGEMM;GemmFwdRest:3.95983,2038431744,miopenConvolutionFwdAlgoGEMM;ConvDirectNaiveConvFwd:796.021,0,miopenConvolutionFwdAlgoDirect
128-11-258-130-3x3x3-3-9-256-128-1-0x0x0-1x1x1-1x1x1-0-NCDHW-FP16-F=ConvHipImplicitGemm3DGroupFwdXdlops:0.519893,96238848,miopenConvolutionFwdAlgoImplicitGEMM;GemmFwdRest:3.97234,2038431744,miopenConvolutionFwdAlgoGEMM;ConvDirectNaiveConvFwd:813.917,0,miopenConvolutionFwdAlgoDirect
128-19-130-258-3x3x3-128-17-128-256-1-0x0x0-1x1x1-1x1x1-0-NCDHW-FP16-F=ConvHipImplicitGemm3DGroupFwdXdlops:0.957381,306629632,miopenConvolutionFwdAlgoImplicitGEMM;GemmFwdRest:7.84182,3850371072,miopenConvolutionFwdAlgoGEMM;ConvDirectNaiveConvFwd:1393.35,0,miopenConvolutionFwdAlgoDirect
128-19-162-258-3x3x3-128-17-160-256-1-0x0x0-1x1x1-1x1x1-0-NCDHW-FP16-F=ConvHipImplicitGemm3DGroupFwdXdlops:1.18829,382438400,miopenConvolutionFwdAlgoImplicitGEMM;GemmFwdRest:9.83419,4812963840,miopenConvolutionFwdAlgoGEMM;ConvDirectNaiveConvFwd:1760.94,0,miopenConvolutionFwdAlgoDirect
16-3-18-16-1x1x1-16-3-18-16-1-0x0x0-1x1x1-1x1x1-0-NCDHW-FP16-F=ConvHipImplicitGemm3DGroupFwdXdlops:0.0226602,55808,miopenConvolutionFwdAlgoImplicitGEMM;GemmFwd1x1_0_1:0.00858667,0,miopenConvolutionFwdAlgoGEMM;ConvDirectNaiveConvFwd:0.0262804,0,miopenConvolutionFwdAlgoDirect
16-3-32-24-1x1x1-16-3-32-24-1-0x0x0-1x1x1-1x1x1-0-NCDHW-FP16-F=ConvHipImplicitGemm3DGroupFwdXdlops:0.0237003,147968,miopenConvolutionFwdAlgoImplicitGEMM;GemmFwd1x1_0_1:0.008344,0,miopenConvolutionFwdAlgoGEMM;ConvDirectNaiveConvFwd:0.0562357,0,miopenConvolutionFwdAlgoDirect
16-5-18-16-1x1x1-16-5-18-16-1-0x0x0-1x1x1-1x1x1-0-NCDHW-FP16-F=ConvHipImplicitGemm3DGroupFwdXdlops:0.0229537,92672,miopenConvolutionFwdAlgoImplicitGEMM;GemmFwd1x1_0_1:0.00846667,0,miopenConvolutionFwdAlgoGEMM;ConvDirectNaiveConvFwd:0.0381272,0,miopenConvolutionFwdAlgoDirect
16-5-20-24-1x1x1-16-5-20-24-1-0x0x0-1x1x1-1x1x1-0-NCDHW-FP16-F=ConvHipImplicitGemm3DGroupFwdXdlops:0.0234804,154112,miopenConvolutionFwdAlgoImplicitGEMM;GemmFwd1x1_0_1:0.0085,0,miopenConvolutionFwdAlgoGEMM;ConvDirectNaiveConvFwd:0.0623538,0,miopenConvolutionFwdAlgoDirect
16-5-22-34-3x3x3-512-3-20-32-1-0x0x0-1x1x1-1x1x1-0-NCDHW-FP16-F=ConvHipImplicitGemm3DGroupFwdXdlops:0.02778,2528256,miopenConvolutionFwdAlgoImplicitGEMM;GemmFwdRest:0.0303735,1658880,miopenConvolutionFwdAlgoGEMM;ConvDirectNaiveConvFwd:0.594302,0,miopenConvolutionFwdAlgoDirect
16-5-34-18-3x3x3-512-3-32-16-1-0x0x0-1x1x1-1x1x1-0-NCDHW-FP16-F=ConvHipImplicitGemm3DGroupFwdXdlops:0.0277603,2113280,miopenConvolutionFwdAlgoImplicitGEMM;GemmFwdRest:0.0231844,1327104,miopenConvolutionFwdAlgoGEMM;ConvDirectNaiveConvFwd:0.453991,0,miopenConvolutionFwdAlgoDirect
16-7-18-34-3x3x3-512-5-16-32-1-0x0x0-1x1x1-1x1x1-0-NCDHW-FP16-F=ConvHipImplicitGemm3DGroupFwdXdlops:0.0286805,3201024,miopenConvolutionFwdAlgoImplicitGEMM;GemmFwdRest:0.0266242,2211840,miopenConvolutionFwdAlgoGEMM;ConvDirectNaiveConvFwd:0.743818,0,miopenConvolutionFwdAlgoDirect
16-7-34-26-3x3x3-512-5-32-24-1-0x0x0-1x1x1-1x1x1-0-NCDHW-FP16-F=ConvHipImplicitGemm3DGroupFwdXdlops:0.0300322,4572672,miopenConvolutionFwdAlgoImplicitGEMM;GemmFwdRest:0.0272724,3317760,miopenConvolutionFwdAlgoGEMM;ConvDirectNaiveConvFwd:1.10934,0,miopenConvolutionFwdAlgoDirect
256-11-130-258-3x3x3-256-9-128-256-1-0x0x0-1x1x1-1x1x1-0-NCDHW-FP16-F=ConvHipImplicitGemm3DGroupFwdXdlops:1.66303,343431168,miopenConvolutionFwdAlgoImplicitGEMM;GemmFwdRest:8.91349,4076863488,miopenConvolutionFwdAlgoGEMM;ConvDirectNaiveConvFwd:1469.65,0,miopenConvolutionFwdAlgoDirect
256-11-258-130-3x3x3-256-9-256-128-1-0x0x0-1x1x1-1x1x1-0-NCDHW-FP16-F=ConvHipImplicitGemm3DGroupFwdXdlops:1.64158,343431168,miopenConvolutionFwdAlgoImplicitGEMM;GemmFwdRest:8.90606,4076863488,miopenConvolutionFwdAlgoGEMM;ConvDirectNaiveConvFwd:1519.38,0,miopenConvolutionFwdAlgoDirect
256-11-66-98-3x3x3-256-9-64-96-1-0x0x0-1x1x1-1x1x1-0-NCDHW-FP16-F=ConvHipImplicitGemm3DGroupFwdXdlops:0.323676,68278272,miopenConvolutionFwdAlgoImplicitGEMM;GemmFwdRest:1.56368,764411904,miopenConvolutionFwdAlgoGEMM;ConvDirectNaiveConvFwd:279.222,0,miopenConvolutionFwdAlgoDirect
256-11-82-130-3x3x3-256-9-80-128-1-0x0x0-1x1x1-1x1x1-0-NCDHW-FP16-F=ConvHipImplicitGemm3DGroupFwdXdlops:0.548994,110761984,miopenConvolutionFwdAlgoImplicitGEMM;GemmFwdRest:2.65607,1274019840,miopenConvolutionFwdAlgoGEMM;ConvDirectNaiveConvFwd:468.979,0,miopenConvolutionFwdAlgoDirect
256-17-144-256-1x1x1-128-17-144-256-1-0x0x0-1x1x1-1x1x1-0-NCDHW-FP16-F=ConvHipImplicitGemm3DGroupFwdXdlops:0.368824,481361920,miopenConvolutionFwdAlgoImplicitGEMM;GemmFwd1x1_0_1:0.087771,0,miopenConvolutionFwdAlgoGEMM;ConvDirectNaiveConvFwd:378.578,0,miopenConvolutionFwdAlgoDirect
256-19-130-194-3x3x3-256-17-128-192-1-0x0x0-1x1x1-1x1x1-0-NCDHW-FP16-F=ConvHipImplicitGemm3DGroupFwdXdlops:2.35117,462788608,miopenConvolutionFwdAlgoImplicitGEMM;GemmFwdRest:12.5783,5775556608,miopenConvolutionFwdAlgoGEMM;ConvDirectNaiveConvFwd:2146.38,0,miopenConvolutionFwdAlgoDirect
256-19-162-258-3x3x3-128-17-160-256-1-0x0x0-1x1x1-1x1x1-0-NCDHW-FP16-F=ConvHipImplicitGemm3DGroupFwdXdlops:2.20943,586618880,miopenConvolutionFwdAlgoImplicitGEMM;ConvDirectNaiveConvFwd:3558.5,0,miopenConvolutionFwdAlgoDirect
256-7-130-66-3x3x3-256-5-128-64-1-0x0x0-1x1x1-1x1x1-0-NCDHW-FP16-F=ConvHipImplicitGemm3DGroupFwdXdlops:0.277551,55261184,miopenConvolutionFwdAlgoImplicitGEMM;GemmFwdRest:1.18279,566231040,miopenConvolutionFwdAlgoGEMM;ConvDirectNaiveConvFwd:218.705,0,miopenConvolutionFwdAlgoDirect
256-7-66-98-3x3x3-256-5-64-96-1-0x0x0-1x1x1-1x1x1-0-NCDHW-FP16-F=ConvHipImplicitGemm3DGroupFwdXdlops:0.195768,42448896,miopenConvolutionFwdAlgoImplicitGEMM;GemmFwdRest:0.911289,424673280,miopenConvolutionFwdAlgoGEMM;ConvDirectNaiveConvFwd:155.581,0,miopenConvolutionFwdAlgoDirect
256-7-82-98-3x3x3-256-5-80-96-1-0x0x0-1x1x1-1x1x1-0-NCDHW-FP16-F=ConvHipImplicitGemm3DGroupFwdXdlops:0.270456,52000768,miopenConvolutionFwdAlgoImplicitGEMM;GemmFwdRest:1.1428,530841600,miopenConvolutionFwdAlgoGEMM;ConvDirectNaiveConvFwd:194.747,0,miopenConvolutionFwdAlgoDirect
256-9-144-128-1x1x1-128-9-144-128-1-0x0x0-1x1x1-1x1x1-0-NCDHW-FP16-F=ConvHipImplicitGemm3DGroupFwdXdlops:0.0928343,127467520,miopenConvolutionFwdAlgoImplicitGEMM;GemmFwd1x1_0_1:0.0389205,0,miopenConvolutionFwdAlgoGEMM;ConvDirectNaiveConvFwd:78.7734,0,miopenConvolutionFwdAlgoDirect
256-9-256-128-1x1x1-128-9-256-128-1-0x0x0-1x1x1-1x1x1-0-NCDHW-FP16-F=ConvHipImplicitGemm3DGroupFwdXdlops:0.169275,226557952,miopenConvolutionFwdAlgoImplicitGEMM;GemmFwd1x1_0_1:0.0581673,0,miopenConvolutionFwdAlgoGEMM;ConvDirectNaiveConvFwd:139.188,0,miopenConvolutionFwdAlgoDirect
3-224-224-14x14-1280-16-16-1-0x0-14x14-1x1-0-NCHW-FP16-F=ConvHipImplicitGemmGroupFwdXdlops:0.0778726,2461696,miopenConvolutionFwdAlgoImplicitGEMM;ConvAsmImplicitGemmGTCDynamicFwdXdlopsNHWC:0.0396631,3772416,miopenConvolutionFwdAlgoImplicitGEMM;GemmFwdRest:0.039527,301056,miopenConvolutionFwdAlgoGEMM;ConvDirectNaiveConvFwd:0.158555,0,miopenConvolutionFwdAlgoDirect
512-11-130-66-3x3x3-256-9-128-64-1-0x0x0-1x1x1-1x1x1-0-NCDHW-FP16-F=ConvHipImplicitGemm3DGroupFwdXdlops:0.866334,141471744,miopenConvolutionFwdAlgoImplicitGEMM;GemmFwdRest:4.36056,2038431744,miopenConvolutionFwdAlgoGEMM;ConvDirectNaiveConvFwd:786.14,0,miopenConvolutionFwdAlgoDirect
512-11-66-130-3x3x3-256-9-64-128-1-0x0x0-1x1x1-1x1x1-0-NCDHW-FP16-F=ConvHipImplicitGemm3DGroupFwdXdlops:0.87526,141471744,miopenConvolutionFwdAlgoImplicitGEMM;GemmFwdRest:4.34617,2038431744,miopenConvolutionFwdAlgoGEMM;ConvDirectNaiveConvFwd:760.165,0,miopenConvolutionFwdAlgoDirect
512-11-74-130-3x3x3-256-9-72-128-1-0x0x0-1x1x1-1x1x1-0-NCDHW-FP16-F=ConvHipImplicitGemm3DGroupFwdXdlops:1.03214,157904896,miopenConvolutionFwdAlgoImplicitGEMM;GemmFwdRest:4.97084,2293235712,miopenConvolutionFwdAlgoGEMM;ConvDirectNaiveConvFwd:855.438,0,miopenConvolutionFwdAlgoDirect
512-5-128-96-1x1x1-256-5-128-96-1-0x0x0-1x1x1-1x1x1-0-NCDHW-FP16-F=ConvHipImplicitGemm3DGroupFwdXdlops:0.0774293,94633984,miopenConvolutionFwdAlgoImplicitGEMM;GemmFwd1x1_0_1:0.0281522,0,miopenConvolutionFwdAlgoGEMM;ConvDirectNaiveConvFwd:58.0788,0,miopenConvolutionFwdAlgoDirect
512-5-20-34-3x3x3-512-3-18-32-1-0x0x0-1x1x1-1x1x1-0-NCDHW-FP16-F=ConvHipImplicitGemm3DGroupFwdXdlops:0.153582,19406848,miopenConvolutionFwdAlgoImplicitGEMM;GemmFwdRest:0.21715,47775744,miopenConvolutionFwdAlgoGEMM;ConvDirectNaiveConvFwd:17.63,0,miopenConvolutionFwdAlgoDirect
512-5-34-50-3x3x3-512-3-32-48-1-0x0x0-1x1x1-1x1x1-0-NCDHW-FP16-F=ConvHipImplicitGemm3DGroupFwdXdlops:0.181642,27578368,miopenConvolutionFwdAlgoImplicitGEMM;GemmFwdRest:0.405097,127401984,miopenConvolutionFwdAlgoGEMM;ConvDirectNaiveConvFwd:48.9107,0,miopenConvolutionFwdAlgoDirect
512-5-66-34-3x3x3-512-3-64-32-1-0x0x0-1x1x1-1x1x1-0-NCDHW-FP16-F=ConvHipImplicitGemm3DGroupFwdXdlops:0.187482,31936512,miopenConvolutionFwdAlgoImplicitGEMM;GemmFwdRest:0.477584,169869312,miopenConvolutionFwdAlgoGEMM;ConvDirectNaiveConvFwd:63.2118,0,miopenConvolutionFwdAlgoDirect
512-7-130-130-3x3x3-512-5-128-128-1-0x0x0-1x1x1-1x1x1-0-NCDHW-FP16-F=ConvHipImplicitGemm3DGroupFwdXdlops:1.71335,219181056,miopenConvolutionFwdAlgoImplicitGEMM;GemmFwdRest:5.41822,2264924160,miopenConvolutionFwdAlgoGEMM;ConvDirectNaiveConvFwd:1037.41,0,miopenConvolutionFwdAlgoDirect
512-7-66-130-3x3x3-256-5-64-128-1-0x0x0-1x1x1-1x1x1-0-NCDHW-FP16-F=ConvHipImplicitGemm3DGroupFwdXdlops:0.518097,89550848,miopenConvolutionFwdAlgoImplicitGEMM;GemmFwdRest:2.35718,1132462080,miopenConvolutionFwdAlgoGEMM;ConvDirectNaiveConvFwd:422.595,0,miopenConvolutionFwdAlgoDirect
512-7-82-130-3x3x3-256-5-80-128-1-0x0x0-1x1x1-1x1x1-0-NCDHW-FP16-F=ConvHipImplicitGemm3DGroupFwdXdlops:0.600519,109703168,miopenConvolutionFwdAlgoImplicitGEMM;GemmFwdRest:2.92679,1415577600,miopenConvolutionFwdAlgoGEMM;ConvDirectNaiveConvFwd:529.055,0,miopenConvolutionFwdAlgoDirect
512-9-72-64-1x1x1-256-9-72-64-1-0x0x0-1x1x1-1x1x1-0-NCDHW-FP16-F=ConvHipImplicitGemm3DGroupFwdXdlops:0.0598875,63963136,miopenConvolutionFwdAlgoImplicitGEMM;GemmFwd1x1_0_1:0.0270535,0,miopenConvolutionFwdAlgoGEMM;ConvDirectNaiveConvFwd:39.1389,0,miopenConvolutionFwdAlgoDirect
16-3-104-80-3x3x3-384-1-102-78-1-0x0x0-1x1x1-1x1x1-0-NCDHW-FP32-F=ConvHipImplicitGemm3DGroupFwdXdlops:0.0657768,14481408,miopenConvolutionFwdAlgoImplicitGEMM;GemmFwdRest:0.0529305,13747968,miopenConvolutionFwdAlgoGEMM;ConvDirectNaiveConvFwd:2.2745,0,miopenConvolutionFwdAlgoDirect
16-3-208-158-3x3x3-384-1-206-156-1-0x0x0-1x1x1-1x1x1-0-NCDHW-FP32-F=ConvHipImplicitGemm3DGroupFwdXdlops:0.169755,56334336,miopenConvolutionFwdAlgoImplicitGEMM;GemmFwdRest:0.151633,55531008,miopenConvolutionFwdAlgoGEMM;ConvDirectNaiveConvFwd:9.90407,0,miopenConvolutionFwdAlgoDirect
192-2-204-156-1x1x1-384-2-204-156-1-0x0x0-1x1x1-1x1x1-0-NCDHW-FP32-F=ConvHipImplicitGemm3DGroupFwdXdlops:0.183282,146939904,miopenConvolutionFwdAlgoImplicitGEMM;GemmFwd1x1_0_1:0.0950143,0,miopenConvolutionFwdAlgoGEMM;ConvDirectNaiveConvFwd:23.1724,0,miopenConvolutionFwdAlgoDirect
192-3-206-158-3x3x3-384-1-204-156-1-0x0x0-1x1x1-1x1x1-0-NCDHW-FP32-F=ConvHipImplicitGemm3DGroupFwdXdlops:1.20049,131834880,miopenConvolutionFwdAlgoImplicitGEMM;GemmFwdRest:1.78246,659902464,miopenConvolutionFwdAlgoGEMM;ConvDirectNaiveConvFwd:119.756,0,miopenConvolutionFwdAlgoDirect
192-3-554-418-3x3x3-192-1-552-416-1-0x0x0-1x1x1-1x1x1-0-NCDHW-FP32-F=ConvHipImplicitGemm3DGroupFwdXdlops:4.47822,713880576,miopenConvolutionFwdAlgoImplicitGEMM;GemmFwdRest:9.32971,4761649152,miopenConvolutionFwdAlgoGEMM;ConvDirectNaiveConvFwd:921.233,0,miopenConvolutionFwdAlgoDirect
192-5-204-156-3x1x1-192-2-204-156-1-0x0x0-2x1x1-1x1x1-0-NCDHW-FP32-F=ConvHipImplicitGemm3DGroupFwdXdlops:0.235425,171528192,miopenConvolutionFwdAlgoImplicitGEMM;GemmFwdRest:0.319063,146644992,miopenConvolutionFwdAlgoGEMM;ConvDirectNaiveConvFwd:63.2334,0,miopenConvolutionFwdAlgoDirect
192-5-276-208-3x1x1-192-2-276-208-1-0x0x0-2x1x1-1x1x1-0-NCDHW-FP32-F=ConvHipImplicitGemm3DGroupFwdXdlops:0.394941,309067776,miopenConvolutionFwdAlgoImplicitGEMM;GemmFwdRest:0.601666,264536064,miopenConvolutionFwdAlgoGEMM;ConvDirectNaiveConvFwd:130.974,0,miopenConvolutionFwdAlgoDirect
192-6-410-314-3x3x3-192-4-408-312-1-0x0x0-1x1x1-1x1x1-0-NCDHW-FP32-F=ConvHipImplicitGemm3DGroupFwdXdlops:8.60983,988268544,miopenConvolutionFwdAlgoImplicitGEMM;GemmFwdRest:20.1647,10558439424,miopenConvolutionFwdAlgoGEMM;ConvDirectNaiveConvFwd:1978.37,0,miopenConvolutionFwdAlgoDirect
192-1648-1248-3x3-96-1648-1248-1-1x1-1x1-1x1-0-NCHW-FP32-F=ConvBinWinogradRxSf2x3g1:5.73158,0,miopenConvolutionFwdAlgoWinograd;ConvBinWinogradRxSf3x2:10.0581,0,miopenConvolutionFwdAlgoWinograd;ConvHipImplicitGemmGroupFwdXdlops:8.25429,2369986560,miopenConvolutionFwdAlgoImplicitGEMM;ConvAsmImplicitGemmGTCDynamicFwdXdlopsNHWC:7.84984,2369986560,miopenConvolutionFwdAlgoImplicitGEMM;GemmFwdRest:11.5572,14215938048,miopenConvolutionFwdAlgoGEMM;ConvDirectNaiveConvFwd:3062.46,0,miopenConvolutionFwdAlgoDirect
384-3-208-158-3x3x3-384-1-206-156-1-0x0x0-1x1x1-1x1x1-0-NCDHW-FP32-F=ConvHipImplicitGemm3DGroupFwdXdlops:2.16656,216723456,miopenConvolutionFwdAlgoImplicitGEMM;GemmFwdRest:3.45501,1332744192,miopenConvolutionFwdAlgoGEMM;ConvDirectNaiveConvFwd:271.816,0,miopenConvolutionFwdAlgoDirect
384-4-206-158-3x3x3-384-2-204-156-1-0x0x0-1x1x1-1x1x1-0-NCDHW-FP32-F=ConvHipImplicitGemm3DGroupFwdXdlops:4.24381,313663488,miopenConvolutionFwdAlgoImplicitGEMM;GemmFwdRest:6.74819,2639609856,miopenConvolutionFwdAlgoGEMM;ConvDirectNaiveConvFwd:536.334,0,miopenConvolutionFwdAlgoDirect
384-4-412-312-3x1x1-768-2-412-312-1-0x0x0-1x1x1-1x1x1-0-NCDHW-FP32-F=ConvHipImplicitGemm3DGroupFwdXdlops:4.58849,1583087616,miopenConvolutionFwdAlgoImplicitGEMM;GemmFwdRest:4.9869,1184661504,miopenConvolutionFwdAlgoGEMM;ConvDirectNaiveConvFwd:661.73,0,miopenConvolutionFwdAlgoDirect
384-138-104-1x1-384-138-104-1-0x0-1x1-1x1-0-NCHW-FP32-F=ConvBinWinogradRxSf2x3g1:0.405817,0,miopenConvolutionFwdAlgoWinograd;ConvBinWinogradRxSf3x2:0.204659,0,miopenConvolutionFwdAlgoWinograd;ConvHipImplicitGemmGroupFwdXdlops:0.0900248,44679168,miopenConvolutionFwdAlgoImplicitGEMM;ConvAsmImplicitGemmGTCDynamicFwdXdlopsNHWC:0.0786505,44089344,miopenConvolutionFwdAlgoImplicitGEMM;GemmFwd1x1_0_1:0.0617444,0,miopenConvolutionFwdAlgoGEMM;ConvDirectNaiveConvFwd:8.54966,0,miopenConvolutionFwdAlgoDirect
384-206-156-1x1-1152-206-156-1-0x0-1x1-1x1-0-NCHW-FP32-F=ConvBinWinogradRxSf2x3g1:2.26465,0,miopenConvolutionFwdAlgoWinograd;ConvBinWinogradRxSf3x2:1.02225,0,miopenConvolutionFwdAlgoWinograd;ConvHipImplicitGemmGroupFwdXdlops:0.419284,199213056,miopenConvolutionFwdAlgoImplicitGEMM;ConvAsmImplicitGemmGTCDynamicFwdXdlopsNHWC:0.387544,197443584,miopenConvolutionFwdAlgoImplicitGEMM;GemmFwd1x1_0_1:0.261871,0,miopenConvolutionFwdAlgoGEMM;ConvDirectNaiveConvFwd:23.0582,0,miopenConvolutionFwdAlgoDirect
384-408-312-3x3-192-408-312-1-1x1-1x1-1x1-0-NCHW-FP32-F=ConvBinWinogradRxSf2x3g1:1.61466,0,miopenConvolutionFwdAlgoWinograd;ConvBinWinogradRxSf3x2:2.58991,0,miopenConvolutionFwdAlgoWinograd;ConvHipImplicitGemmGroupFwdXdlops:1.51443,295944192,miopenConvolutionFwdAlgoImplicitGEMM;ConvAsmImplicitGemmGTCDynamicFwdXdlopsNHWC:1.48818,295944192,miopenConvolutionFwdAlgoImplicitGEMM;GemmFwdRest:2.37138,1759739904,miopenConvolutionFwdAlgoGEMM;ConvDirectNaiveConvFwd:285.303,0,miopenConvolutionFwdAlgoDirect
96-1-408-312-1x1x1-192-1-408-312-1-0x0x0-1x1x1-1x1x1-0-NCDHW-FP32-F=ConvHipImplicitGemm3DGroupFwdXdlops:0.146487,146718720,miopenConvolutionFwdAlgoImplicitGEMM;GemmFwd1x1_0_1:0.089233,0,miopenConvolutionFwdAlgoGEMM;ConvDirectNaiveConvFwd:22.876,0,miopenConvolutionFwdAlgoDirect
96-1-552-416-1x1x1-192-1-552-416-1-0x0x0-1x1x1-1x1x1-0-NCDHW-FP32-F=ConvHipImplicitGemm3DGroupFwdXdlops:0.28537,264609792,miopenConvolutionFwdAlgoImplicitGEMM;GemmFwd1x1_0_1:0.163048,0,miopenConvolutionFwdAlgoGEMM;ConvDirectNaiveConvFwd:41.9441,0,miopenConvolutionFwdAlgoDirect
96-1-824-624-1x1x1-192-1-824-624-1-0x0x0-1x1x1-1x1x1-0-NCDHW-FP32-F=ConvHipImplicitGemm3DGroupFwdXdlops:0.613818,592404480,miopenConvolutionFwdAlgoImplicitGEMM;GemmFwd1x1_0_1:0.360243,0,miopenConvolutionFwdAlgoGEMM;ConvDirectNaiveConvFwd:112.433,0,miopenConvolutionFwdAlgoDirect
96-3-1106-834-3x3x3-96-1-1104-832-1-0x0x0-1x1x1-1x1x1-0-NCDHW-FP32-F=ConvHipImplicitGemm3DGroupFwdXdlops:5.69621,1416319488,miopenConvolutionFwdAlgoImplicitGEMM;GemmFwdRest:13.7031,9523298304,miopenConvolutionFwdAlgoGEMM;ConvDirectNaiveConvFwd:1818.28,0,miopenConvolutionFwdAlgoDirect
96-3-410-314-3x3x3-192-1-408-312-1-0x0x0-1x1x1-1x1x1-0-NCDHW-FP32-F=ConvHipImplicitGemm3DGroupFwdXdlops:1.17813,248062464,miopenConvolutionFwdAlgoImplicitGEMM;GemmFwdRest:2.52669,1319804928,miopenConvolutionFwdAlgoGEMM;ConvDirectNaiveConvFwd:226.99,0,miopenConvolutionFwdAlgoDirect
96-3-554-418-3x3x3-192-1-552-416-1-0x0x0-1x1x1-1x1x1-0-NCDHW-FP32-F=ConvHipImplicitGemm3DGroupFwdXdlops:2.2828,445118976,miopenConvolutionFwdAlgoImplicitGEMM;GemmFwdRest:4.65745,2380824576,miopenConvolutionFwdAlgoGEMM;ConvDirectNaiveConvFwd:447.178,0,miopenConvolutionFwdAlgoDirect
96-3-818-626-3x3x3-3-1-816-624-1-0x0x0-1x1x1-1x1x1-0-NCDHW-FP32-F=ConvHipImplicitGemm3DGroupFwdXdlops:1.31085,596043776,miopenConvolutionFwdAlgoImplicitGEMM;GemmFwdRest:7.40401,5279219712,miopenConvolutionFwdAlgoGEMM;ConvDirectNaiveConvFwd:1154.58,0,miopenConvolutionFwdAlgoDirect
96-3-818-626-3x3x3-96-1-816-624-1-0x0x0-1x1x1-1x1x1-0-NCDHW-FP32-F=ConvHipImplicitGemm3DGroupFwdXdlops:3.13896,786424320,miopenConvolutionFwdAlgoImplicitGEMM;GemmFwdRest:7.63779,5279219712,miopenConvolutionFwdAlgoGEMM;ConvDirectNaiveConvFwd:999.88,0,miopenConvolutionFwdAlgoDirect
96-4-408-312-1x1x1-192-4-408-312-1-0x0x0-1x1x1-1x1x1-0-NCDHW-FP32-F=ConvHipImplicitGemm3DGroupFwdXdlops:0.624355,586653696,miopenConvolutionFwdAlgoImplicitGEMM;GemmFwd1x1_0_1:0.35871,0,miopenConvolutionFwdAlgoGEMM;ConvDirectNaiveConvFwd:115.46,0,miopenConvolutionFwdAlgoDirect
96-4-552-416-1x1x1-192-4-552-416-1-0x0x0-1x1x1-1x1x1-0-NCDHW-FP32-F=ConvHipImplicitGemm3DGroupFwdXdlops:1.10161,1058217984,miopenConvolutionFwdAlgoImplicitGEMM;GemmFwd1x1_0_1:0.665561,0,miopenConvolutionFwdAlgoGEMM;ConvDirectNaiveConvFwd:209.082,0,miopenConvolutionFwdAlgoDirect
96-6-1106-834-3x3x3-96-4-1104-832-1-0x0x0-1x1x1-1x1x1-0-NCDHW-FP32-F=ConvHipImplicitGemm3DGroupFwdXdlops:21.0599,3537073152,miopenConvolutionFwdAlgoImplicitGEMM;ConvDirectNaiveConvFwd:7272.18,0,miopenConvolutionFwdAlgoDirect
96-6-554-418-3x3x3-192-4-552-416-1-0x0x0-1x1x1-1x1x1-0-NCDHW-FP32-F=ConvHipImplicitGemm3DGroupFwdXdlops:8.15631,1240962048,miopenConvolutionFwdAlgoImplicitGEMM;GemmFwdRest:17.968,9523298304,miopenConvolutionFwdAlgoGEMM;ConvDirectNaiveConvFwd:1783.43,0,miopenConvolutionFwdAlgoDirect
96-6-818-626-3x3x3-96-4-816-624-1-0x0x0-1x1x1-1x1x1-0-NCDHW-FP32-F=ConvHipImplicitGemm3DGroupFwdXdlops:11.7724,1962906624,miopenConvolutionFwdAlgoImplicitGEMM;ConvDirectNaiveConvFwd:3995.33,0,miopenConvolutionFwdAlgoDirect
96-1105-833-3x3-96-552-416-1-0x0-2x2-1x1-0-NCHW-FP32-F=ConvBinWinogradRxSf2x3g1:1.28881,0,miopenConvolutionFwdAlgoWinograd;ConvBinWinogradRxSf3x2:0.642869,0,miopenConvolutionFwdAlgoWinograd;ConvHipImplicitGemmGroupFwdXdlops:0.699345,441969152,miopenConvolutionFwdAlgoImplicitGEMM;ConvAsmImplicitGemmGTCDynamicFwdXdlopsNHWC:0.69747,441969152,miopenConvolutionFwdAlgoImplicitGEMM;GemmFwdRest:0.856774,793608192,miopenConvolutionFwdAlgoGEMM;ConvDirectNaiveConvFwd:170.64,0,miopenConvolutionFwdAlgoDirect
96-1649-1249-3x3-96-824-624-1-0x0-2x2-1x1-0-NCHW-FP32-F=ConvBinWinogradRxSf2x3g1:2.76917,0,miopenConvolutionFwdAlgoWinograd;ConvBinWinogradRxSf3x2:1.40423,0,miopenConvolutionFwdAlgoWinograd;ConvHipImplicitGemmGroupFwdXdlops:1.45887,988662272,miopenConvolutionFwdAlgoImplicitGEMM;ConvAsmImplicitGemmGTCDynamicFwdXdlopsNHWC:1.43334,988662272,miopenConvolutionFwdAlgoImplicitGEMM;GemmFwdRest:1.78508,1776992256,miopenConvolutionFwdAlgoGEMM;ConvDirectNaiveConvFwd:383.944,0,miopenConvolutionFwdAlgoDirect
96-817-625-3x3-96-408-312-1-0x0-2x2-1x1-0-NCHW-FP32-F=ConvBinWinogradRxSf2x3g1:0.735687,0,miopenConvolutionFwdAlgoWinograd;ConvBinWinogradRxSf3x2:0.387924,0,miopenConvolutionFwdAlgoWinograd;ConvHipImplicitGemmGroupFwdXdlops:0.391151,245293568,miopenConvolutionFwdAlgoImplicitGEMM;ConvAsmImplicitGemmGTCDynamicFwdXdlopsNHWC:0.389514,245293568,miopenConvolutionFwdAlgoImplicitGEMM;GemmFwdRest:0.469119,439934976,miopenConvolutionFwdAlgoGEMM;ConvDirectNaiveConvFwd:81.3487,0,miopenConvolutionFwdAlgoDirect
384-204-156-3x3-192-204-156-2-1x1-1x1-1x1-0-NCHW-FP32-F=ConvBinWinogradRxSf2x3g1:0.797535,0,miopenConvolutionFwdAlgoWinograd;ConvBinWinogradRxSf3x2:1.49192,0,miopenConvolutionFwdAlgoWinograd;ConvHipImplicitGemmGroupFwdXdlops:0.840089,149299200,miopenConvolutionFwdAlgoImplicitGEMM;ConvAsmImplicitGemmGTCDynamicFwdXdlopsNHWC:0.795789,149299200,miopenConvolutionFwdAlgoImplicitGEMM;GemmFwdRest:1.2609,439934976,miopenConvolutionFwdAlgoGEMM;ConvDirectNaiveConvFwd:73.1758,0,miopenConvolutionFwdAlgoDirect
384-205-157-3x3-384-102-78-2-0x0-2x2-1x1-0-NCHW-FP32-F=ConvBinWinogradRxSf2x3g1:1.38677,0,miopenConvolutionFwdAlgoWinograd;ConvBinWinogradRxSf3x2:0.738574,0,miopenConvolutionFwdAlgoWinograd;ConvHipImplicitGemmGroupFwdXdlops:0.476678,128621568,miopenConvolutionFwdAlgoImplicitGEMM;ConvAsmImplicitGemmGTCDynamicFwdXdlopsNHWC:0.433196,128621568,miopenConvolutionFwdAlgoImplicitGEMM;GemmFwdRest:0.481519,109983744,miopenConvolutionFwdAlgoGEMM;ConvDirectNaiveConvFwd:22.7966,0,miopenConvolutionFwdAlgoDirect
384-276-208-3x3-192-276-208-2-1x1-1x1-1x1-0-NCHW-FP32-F=ConvBinWinogradRxSf2x3g1:1.45123,0,miopenConvolutionFwdAlgoWinograd;ConvBinWinogradRxSf3x2:2.34435,0,miopenConvolutionFwdAlgoWinograd;ConvHipImplicitGemmGroupFwdXdlops:1.48556,267190272,miopenConvolutionFwdAlgoImplicitGEMM;ConvAsmImplicitGemmGTCDynamicFwdXdlopsNHWC:1.34182,267190272,miopenConvolutionFwdAlgoImplicitGEMM;GemmFwdRest:2.24019,793608192,miopenConvolutionFwdAlgoGEMM;ConvDirectNaiveConvFwd:151.873,0,miopenConvolutionFwdAlgoDirect
192-1648-1248-3x3-96-1648-1248-4-1x1-1x1-1x1-0-NCHW-FP32-F=ConvBinWinogradRxSf2x3g1:23.8171,0,miopenConvolutionFwdAlgoWinograd;ConvBinWinogradRxSf3x2:39.5524,0,miopenConvolutionFwdAlgoWinograd;ConvHipImplicitGemmGroupFwdXdlops:32.971,9477955584,miopenConvolutionFwdAlgoImplicitGEMM;ConvAsmImplicitGemmGTCDynamicFwdXdlopsNHWC:31.4321,9477955584,miopenConvolutionFwdAlgoImplicitGEMM;GemmFwdRest:46.1846,14215938048,miopenConvolutionFwdAlgoGEMM;ConvDirectNaiveConvFwd:3960.77,0,miopenConvolutionFwdAlgoDirect
192-4-414-314-3x3x3-384-2-412-312-1-0x0x0-1x1x1-1x1x1-0-NCDHW-BF16-F=ConvHipImplicitGemm3DGroupFwdXdlops:1.56913,401098752,miopenConvolutionFwdAlgoImplicitGEMM;GemmFwdRest:6.06789,2665488384,miopenConvolutionFwdAlgoGEMM;ConvDirectNaiveConvFwd:1140.01,0,miopenConvolutionFwdAlgoDirect
192-6-410-314-3x3x3-192-4-408-312-1-0x0x0-1x1x1-1x1x1-0-NCDHW-BF16-F=ConvHipImplicitGemm3DGroupFwdXdlops:1.91513,494134272,miopenConvolutionFwdAlgoImplicitGEMM;GemmFwdRest:10.8216,5279219712,miopenConvolutionFwdAlgoGEMM;ConvDirectNaiveConvFwd:1798.72,0,miopenConvolutionFwdAlgoDirect
192-1104-832-3x3-96-1104-832-1-1x1-1x1-1x1-0-NCHW-BF16-F=ConvHipImplicitGemmGroupFwdXdlops:0.872297,529403904,miopenConvolutionFwdAlgoImplicitGEMM;ConvAsmImplicitGemmGTCDynamicFwdXdlopsNHWC:0.924211,882118656,miopenConvolutionFwdAlgoImplicitGEMM;GemmFwdRest:2.45777,3174432768,miopenConvolutionFwdAlgoGEMM;ConvDirectNaiveConvFwd:1298.68,0,miopenConvolutionFwdAlgoDirect
192-1648-1248-3x3-96-1648-1248-1-1x1-1x1-1x1-0-NCHW-BF16-F=ConvHipImplicitGemmGroupFwdXdlops:1.83644,1184993280,miopenConvolutionFwdAlgoImplicitGEMM;ConvAsmImplicitGemmGTCDynamicFwdXdlopsNHWC:2.02099,1974767616,miopenConvolutionFwdAlgoImplicitGEMM;GemmFwdRest:5.76389,7107969024,miopenConvolutionFwdAlgoGEMM;ConvDirectNaiveConvFwd:2589.43,0,miopenConvolutionFwdAlgoDirect
32-21-102-78-1x1x1-32-21-102-78-1-0x0x0-1x1x1-1x1x1-0-NCDHW-BF16-F=ConvHipImplicitGemm3DGroupFwdXdlops:0.0386566,21387776,miopenConvolutionFwdAlgoImplicitGEMM;GemmFwd1x1_0_1:0.0140402,0,miopenConvolutionFwdAlgoGEMM;ConvDirectNaiveConvFwd:9.95927,0,miopenConvolutionFwdAlgoDirect
32-21-206-156-1x1x1-32-21-206-156-1-0x0x0-1x1x1-1x1x1-0-NCDHW-BF16-F=ConvHipImplicitGemm3DGroupFwdXdlops:0.0961073,86383616,miopenConvolutionFwdAlgoImplicitGEMM;GemmFwd1x1_0_1:0.0298137,0,miopenConvolutionFwdAlgoGEMM;ConvDirectNaiveConvFwd:40.3147,0,miopenConvolutionFwdAlgoDirect
36-21-138-104-1x2x2-5120-21-69-52-1-0x0x0-1x2x2-1x1x1-0-NCDHW-BF16-F=ConvHipImplicitGemm3DGroupFwdXdlops:1.3038,794738432,miopenConvolutionFwdAlgoImplicitGEMM;GemmFwdRest:0.372948,21700224,miopenConvolutionFwdAlgoGEMM;ConvDirectNaiveConvFwd:52.6835,0,miopenConvolutionFwdAlgoDirect
384-3-104-80-3x3x3-32-1-102-78-1-0x0x0-1x1x1-1x1x1-0-NCDHW-BF16-F=ConvHipImplicitGemm3DGroupFwdXdlops:0.0853288,20342016,miopenConvolutionFwdAlgoImplicitGEMM;GemmFwdRest:0.404124,164975616,miopenConvolutionFwdAlgoGEMM;ConvDirectNaiveConvFwd:62.5208,0,miopenConvolutionFwdAlgoDirect
384-3-140-106-3x3x3-32-1-138-104-1-0x0x0-1x1x1-1x1x1-0-NCDHW-BF16-F=ConvHipImplicitGemm3DGroupFwdXdlops:0.108555,35773440,miopenConvolutionFwdAlgoImplicitGEMM;GemmFwdRest:0.620433,297603072,miopenConvolutionFwdAlgoGEMM;ConvDirectNaiveConvFwd:108.777,0,miopenConvolutionFwdAlgoDirect
384-3-206-158-3x3x3-384-1-204-156-1-0x0x0-1x1x1-1x1x1-0-NCDHW-BF16-F=ConvHipImplicitGemm3DGroupFwdXdlops:0.394901,107394048,miopenConvolutionFwdAlgoImplicitGEMM;GemmFwdRest:1.45081,659902464,miopenConvolutionFwdAlgoGEMM;ConvDirectNaiveConvFwd:249.893,0,miopenConvolutionFwdAlgoDirect
384-3-414-314-3x3x3-384-1-412-312-1-0x0x0-1x1x1-1x1x1-0-NCDHW-BF16-F=ConvHipImplicitGemm3DGroupFwdXdlops:1.68774,406195200,miopenConvolutionFwdAlgoImplicitGEMM;GemmFwdRest:6.07273,2665488384,miopenConvolutionFwdAlgoGEMM;ConvDirectNaiveConvFwd:1083.61,0,miopenConvolutionFwdAlgoDirect
384-102-78-1x1-1152-102-78-1-0x0-1x1-1x1-0-NCHW-BF16-F=ConvHipImplicitGemmGroupFwdXdlops:0.0515868,25325568,miopenConvolutionFwdAlgoImplicitGEMM;ConvAsmImplicitGemmGTCDynamicFwdXdlopsNHWC:0.0481337,61102080,miopenConvolutionFwdAlgoImplicitGEMM;GemmFwd1x1_0_1:0.0254886,0,miopenConvolutionFwdAlgoGEMM;ConvDirectNaiveConvFwd:5.32085,0,miopenConvolutionFwdAlgoDirect
384-102-78-1x1-384-102-78-1-0x0-1x1-1x1-0-NCHW-BF16-F=ConvHipImplicitGemmGroupFwdXdlops:0.0341738,12515328,miopenConvolutionFwdAlgoImplicitGEMM;ConvAsmImplicitGemmGTCDynamicFwdXdlopsNHWC:0.0284514,24440832,miopenConvolutionFwdAlgoImplicitGEMM;GemmFwd1x1_0_1:0.0158164,0,miopenConvolutionFwdAlgoGEMM;ConvDirectNaiveConvFwd:4.93665,0,miopenConvolutionFwdAlgoDirect
384-138-104-1x1-384-138-104-1-0x0-1x1-1x1-0-NCHW-BF16-F=ConvHipImplicitGemmGroupFwdXdlops:0.0462937,22339584,miopenConvolutionFwdAlgoImplicitGEMM;ConvAsmImplicitGemmGTCDynamicFwdXdlopsNHWC:0.0399604,44089344,miopenConvolutionFwdAlgoImplicitGEMM;GemmFwd1x1_0_1:0.0221924,0,miopenConvolutionFwdAlgoGEMM;ConvDirectNaiveConvFwd:8.69633,0,miopenConvolutionFwdAlgoDirect
384-206-156-1x1-1152-206-156-1-0x0-1x1-1x1-0-NCHW-BF16-F=ConvHipImplicitGemmGroupFwdXdlops:0.175848,99606528,miopenConvolutionFwdAlgoImplicitGEMM;ConvAsmImplicitGemmGTCDynamicFwdXdlopsNHWC:0.149145,246804480,miopenConvolutionFwdAlgoImplicitGEMM;GemmFwd1x1_0_1:0.0590648,0,miopenConvolutionFwdAlgoGEMM;ConvDirectNaiveConvFwd:21.7344,0,miopenConvolutionFwdAlgoDirect
384-408-312-3x3-192-408-312-1-1x1-1x1-1x1-0-NCHW-BF16-F=ConvHipImplicitGemmGroupFwdXdlops:0.291744,147972096,miopenConvolutionFwdAlgoImplicitGEMM;ConvAsmImplicitGemmGTCDynamicFwdXdlopsNHWC:0.413634,245735424,miopenConvolutionFwdAlgoImplicitGEMM;GemmFwdRest:0.692939,879869952,miopenConvolutionFwdAlgoGEMM;ConvDirectNaiveConvFwd:300.626,0,miopenConvolutionFwdAlgoDirect
96-1-408-312-1x1x1-192-1-408-312-1-0x0x0-1x1x1-1x1x1-0-NCDHW-BF16-F=ConvHipImplicitGemm3DGroupFwdXdlops:0.0662207,73359360,miopenConvolutionFwdAlgoImplicitGEMM;GemmFwd1x1_0_1:0.0309202,0,miopenConvolutionFwdAlgoGEMM;ConvDirectNaiveConvFwd:22.052,0,miopenConvolutionFwdAlgoDirect
96-1-824-624-1x1x1-192-1-824-624-1-0x0x0-1x1x1-1x1x1-0-NCDHW-BF16-F=ConvHipImplicitGemm3DGroupFwdXdlops:0.285929,296202240,miopenConvolutionFwdAlgoImplicitGEMM;GemmFwd1x1_0_1:0.091041,0,miopenConvolutionFwdAlgoGEMM;ConvDirectNaiveConvFwd:89.3961,0,miopenConvolutionFwdAlgoDirect
96-3-1650-1250-3x3x3-3-1-1648-1248-1-0x0x0-1x1x1-1x1x1-0-NCDHW-BF16-F=ConvHipImplicitGemm3DGroupFwdXdlops:3.91732,1200355840,miopenConvolutionFwdAlgoImplicitGEMM;ConvDirectNaiveConvFwd:4551.73,0,miopenConvolutionFwdAlgoDirect
96-4-552-416-1x1x1-192-4-552-416-1-0x0x0-1x1x1-1x1x1-0-NCDHW-BF16-F=ConvHipImplicitGemm3DGroupFwdXdlops:0.550669,529108992,miopenConvolutionFwdAlgoImplicitGEMM;GemmFwd1x1_0_1:0.150655,0,miopenConvolutionFwdAlgoGEMM;ConvDirectNaiveConvFwd:206.709,0,miopenConvolutionFwdAlgoDirect
96-6-1650-1250-3x3x3-3-4-1648-1248-1-0x0x0-1x1x1-1x1x1-0-NCDHW-BF16-F=ConvHipImplicitGemm3DGroupFwdXdlops:48.6964,2425376512,miopenConvolutionFwdAlgoImplicitGEMM;ConvDirectNaiveConvFwd:18194.2,0,miopenConvolutionFwdAlgoDirect
192-1648-1248-3x3-96-1648-1248-4-1x1-1x1-1x1-0-NCHW-BF16-F=ConvHipImplicitGemmGroupFwdXdlops:7.37202,4738977792,miopenConvolutionFwdAlgoImplicitGEMM;ConvAsmImplicitGemmGTCDynamicFwdXdlopsNHWC:8.07514,7898075136,miopenConvolutionFwdAlgoImplicitGEMM;GemmFwdRest:23.0099,7107969024,miopenConvolutionFwdAlgoGEMM;ConvDirectNaiveConvFwd:3350.21,0,miopenConvolutionFwdAlgoDirect
128-11-146-130-3x3x3-128-9-144-128-1-0x0x0-1x1x1-1x1x1-0-NCDHW-FP16-F=ConvHipImplicitGemm3DGroupFwdXdlops:0.301386,96799744,miopenConvolutionFwdAlgoImplicitGEMM;GemmFwdRest:2.27083,1146617856,miopenConvolutionFwdAlgoGEMM;ConvDirectNaiveConvFwd:426,0,miopenConvolutionFwdAlgoDirect
128-11-162-258-3x3x3-128-9-160-256-1-0x0x0-1x1x1-1x1x1-0-NCDHW-FP16-F=ConvHipImplicitGemm3DGroupFwdXdlops:0.625225,212954112,miopenConvolutionFwdAlgoImplicitGEMM;GemmFwdRest:5.0249,2548039680,miopenConvolutionFwdAlgoGEMM;ConvDirectNaiveConvFwd:925.021,0,miopenConvolutionFwdAlgoDirect
128-19-130-194-3x3x3-3-17-128-192-1-0x0x0-1x1x1-1x1x1-0-NCDHW-FP16-F=ConvHipImplicitGemm3DGroupFwdXdlops:0.598613,125197568,miopenConvolutionFwdAlgoImplicitGEMM;GemmFwdRest:5.5847,2887778304,miopenConvolutionFwdAlgoGEMM;ConvDirectNaiveConvFwd:1110.41,0,miopenConvolutionFwdAlgoDirect
128-19-146-258-3x3x3-128-17-144-256-1-0x0x0-1x1x1-1x1x1-0-NCDHW-FP16-F=ConvHipImplicitGemm3DGroupFwdXdlops:1.04932,344534016,miopenConvolutionFwdAlgoImplicitGEMM;GemmFwdRest:8.56961,4331667456,miopenConvolutionFwdAlgoGEMM;ConvDirectNaiveConvFwd:1575.97,0,miopenConvolutionFwdAlgoDirect
128-19-258-258-3x3x3-128-17-256-256-1-0x0x0-1x1x1-1x1x1-0-NCDHW-FP16-F=ConvHipImplicitGemm3DGroupFwdXdlops:1.81822,609864704,miopenConvolutionFwdAlgoImplicitGEMM;ConvDirectNaiveConvFwd:2839.95,0,miopenConvolutionFwdAlgoDirect
256-11-130-98-3x3x3-256-9-128-96-1-0x0x0-1x1x1-1x1x1-0-NCDHW-FP16-F=ConvHipImplicitGemm3DGroupFwdXdlops:0.619173,131913728,miopenConvolutionFwdAlgoImplicitGEMM;GemmFwdRest:3.16889,1528823808,miopenConvolutionFwdAlgoGEMM;ConvDirectNaiveConvFwd:559.461,0,miopenConvolutionFwdAlgoDirect
256-11-146-258-3x3x3-256-9-144-256-1-0x0x0-1x1x1-1x1x1-0-NCDHW-FP16-F=ConvHipImplicitGemm3DGroupFwdXdlops:1.88458,385554432,miopenConvolutionFwdAlgoImplicitGEMM;GemmFwdRest:9.86352,4586471424,miopenConvolutionFwdAlgoGEMM;ConvDirectNaiveConvFwd:1670.37,0,miopenConvolutionFwdAlgoDirect
256-11-258-258-3x3x3-256-9-256-256-1-0x0x0-1x1x1-1x1x1-0-NCDHW-FP16-F=ConvHipImplicitGemm3DGroupFwdXdlops:3.23062,680417280,miopenConvolutionFwdAlgoImplicitGEMM;ConvDirectNaiveConvFwd:2984.66,0,miopenConvolutionFwdAlgoDirect
256-19-146-258-3x3x3-128-17-144-256-1-0x0x0-1x1x1-1x1x1-0-NCDHW-FP16-F=ConvHipImplicitGemm3DGroupFwdXdlops:1.93104,528635904,miopenConvolutionFwdAlgoImplicitGEMM;ConvDirectNaiveConvFwd:3223.32,0,miopenConvolutionFwdAlgoDirect
256-19-258-194-3x3x3-128-17-256-192-1-0x0x0-1x1x1-1x1x1-0-NCDHW-FP16-F=ConvHipImplicitGemm3DGroupFwdXdlops:2.55369,702584832,miopenConvolutionFwdAlgoImplicitGEMM;ConvDirectNaiveConvFwd:4358.91,0,miopenConvolutionFwdAlgoDirect
512-11-130-130-3x3x3-512-9-128-128-1-0x0x0-1x1x1-1x1x1-0-NCDHW-FP16-F=ConvHipImplicitGemm3DGroupFwdXdlops:2.90323,355512320,miopenConvolutionFwdAlgoImplicitGEMM;GemmFwdRest:9.64334,4076863488,miopenConvolutionFwdAlgoGEMM;ConvDirectNaiveConvFwd:1928.84,0,miopenConvolutionFwdAlgoDirect
512-11-74-130-3x3x3-512-9-72-128-1-0x0x0-1x1x1-1x1x1-0-NCDHW-FP16-F=ConvHipImplicitGemm3DGroupFwdXdlops:1.79606,207450112,miopenConvolutionFwdAlgoImplicitGEMM;GemmFwdRest:5.39289,2293235712,miopenConvolutionFwdAlgoGEMM;ConvDirectNaiveConvFwd:1071.05,0,miopenConvolutionFwdAlgoDirect
512-5-20-18-3x3x3-512-3-18-16-1-0x0x0-1x1x1-1x1x1-0-NCDHW-FP16-F=ConvHipImplicitGemm3DGroupFwdXdlops:0.112668,16883712,miopenConvolutionFwdAlgoImplicitGEMM;GemmFwdRest:0.168428,23887872,miopenConvolutionFwdAlgoGEMM;ConvDirectNaiveConvFwd:9.58356,0,miopenConvolutionFwdAlgoDirect
512-5-34-26-3x3x3-512-3-32-24-1-0x0x0-1x1x1-1x1x1-0-NCDHW-FP16-F=ConvHipImplicitGemm3DGroupFwdXdlops:0.177535,21041152,miopenConvolutionFwdAlgoImplicitGEMM;GemmFwdRest:0.278076,63700992,miopenConvolutionFwdAlgoGEMM;ConvDirectNaiveConvFwd:23.0017,0,miopenConvolutionFwdAlgoDirect
512-5-42-66-3x3x3-512-3-40-64-1-0x0x0-1x1x1-1x1x1-0-NCDHW-FP16-F=ConvHipImplicitGemm3DGroupFwdXdlops:0.19657,36212736,miopenConvolutionFwdAlgoImplicitGEMM;GemmFwdRest:0.624339,212336640,miopenConvolutionFwdAlgoGEMM;ConvDirectNaiveConvFwd:84.3194,0,miopenConvolutionFwdAlgoDirect
512-7-130-130-3x3x3-256-5-128-128-1-0x0x0-1x1x1-1x1x1-0-NCDHW-FP16-F=ConvHipImplicitGemm3DGroupFwdXdlops:1.02665,170160128,miopenConvolutionFwdAlgoImplicitGEMM;GemmFwdRest:4.83134,2264924160,miopenConvolutionFwdAlgoGEMM;ConvDirectNaiveConvFwd:834.113,0,miopenConvolutionFwdAlgoDirect
512-7-34-34-3x3x3-512-5-32-32-1-0x0x0-1x1x1-1x1x1-0-NCDHW-FP16-F=ConvHipImplicitGemm3DGroupFwdXdlops:0.192968,27684864,miopenConvolutionFwdAlgoImplicitGEMM;GemmFwdRest:0.453131,141557760,miopenConvolutionFwdAlgoGEMM;ConvDirectNaiveConvFwd:52.4688,0,miopenConvolutionFwdAlgoDirect
512-7-66-130-3x3x3-512-5-64-128-1-0x0x0-1x1x1-1x1x1-0-NCDHW-FP16-F=ConvHipImplicitGemm3DGroupFwdXdlops:0.820911,117600256,miopenConvolutionFwdAlgoImplicitGEMM;GemmFwdRest:2.63678,1132462080,miopenConvolutionFwdAlgoGEMM;ConvDirectNaiveConvFwd:506.938,0,miopenConvolutionFwdAlgoDirect
512-7-82-98-3x3x3-256-5-80-96-1-0x0x0-1x1x1-1x1x1-0-NCDHW-FP16-F=ConvHipImplicitGemm3DGroupFwdXdlops:0.481512,84340736,miopenConvolutionFwdAlgoImplicitGEMM;GemmFwdRest:2.20793,1061683200,miopenConvolutionFwdAlgoGEMM;ConvDirectNaiveConvFwd:391.386,0,miopenConvolutionFwdAlgoDirect
512-9-72-128-1x1x1-256-9-72-128-1-0x0x0-1x1x1-1x1x1-0-NCDHW-FP16-F=ConvHipImplicitGemm3DGroupFwdXdlops:0.107553,127664128,miopenConvolutionFwdAlgoImplicitGEMM;GemmFwd1x1_0_1:0.0462538,0,miopenConvolutionFwdAlgoGEMM;ConvDirectNaiveConvFwd:79.4764,0,miopenConvolutionFwdAlgoDirect
16-3-104-80-3x3x3-384-1-102-78-1-0x0x0-1x1x1-1x1x1-0-NCDHW-FP32-F=ConvHipImplicitGemm3DGroupFwdXdlops:0.0674005,14481408,miopenConvolutionFwdAlgoImplicitGEMM;GemmFwdRest:0.0518003,13747968,miopenConvolutionFwdAlgoGEMM;ConvDirectNaiveConvFwd:2.26876,0,miopenConvolutionFwdAlgoDirect
16-3-140-106-3x3x3-384-1-138-104-1-0x0x0-1x1x1-1x1x1-0-NCDHW-FP32-F=ConvHipImplicitGemm3DGroupFwdXdlops:0.0933366,25557504,miopenConvolutionFwdAlgoImplicitGEMM;GemmFwdRest:0.103361,24800256,miopenConvolutionFwdAlgoGEMM;ConvDirectNaiveConvFwd:4.40358,0,miopenConvolutionFwdAlgoDirect
192-1-412-312-1x1x1-384-1-412-312-1-0x0x0-1x1x1-1x1x1-0-NCDHW-FP32-F=ConvHipImplicitGemm3DGroupFwdXdlops:0.388678,296460288,miopenConvolutionFwdAlgoImplicitGEMM;GemmFwd1x1_0_1:0.183732,0,miopenConvolutionFwdAlgoGEMM;ConvDirectNaiveConvFwd:46.3917,0,miopenConvolutionFwdAlgoDirect
192-3-278-210-3x3x3-384-1-276-208-1-0x0x0-1x1x1-1x1x1-0-NCDHW-FP32-F=ConvHipImplicitGemm3DGroupFwdXdlops:2.23274,230648832,miopenConvolutionFwdAlgoImplicitGEMM;GemmFwdRest:3.08443,1190412288,miopenConvolutionFwdAlgoGEMM;ConvDirectNaiveConvFwd:238.811,0,miopenConvolutionFwdAlgoDirect
192-3-826-626-3x3x3-192-1-824-624-1-0x0x0-1x1x1-1x1x1-0-NCDHW-FP32-F=ConvHipImplicitGemm3DGroupFwdXdlops:9.23907,1590211584,miopenConvolutionFwdAlgoImplicitGEMM;GemmFwdRest:20.8323,10661953536,miopenConvolutionFwdAlgoGEMM;ConvDirectNaiveConvFwd:2212.26,0,miopenConvolutionFwdAlgoDirect
192-1104-832-3x3-96-1104-832-1-1x1-1x1-1x1-0-NCHW-FP32-F=ConvBinWinogradRxSf2x3g1:2.81962,0,miopenConvolutionFwdAlgoWinograd;ConvBinWinogradRxSf3x2:4.67269,0,miopenConvolutionFwdAlgoWinograd;ConvHipImplicitGemmGroupFwdXdlops:3.87452,1058807808,miopenConvolutionFwdAlgoImplicitGEMM;ConvAsmImplicitGemmGTCDynamicFwdXdlopsNHWC:3.63941,1058807808,miopenConvolutionFwdAlgoImplicitGEMM;GemmFwdRest:5.07622,6348865536,miopenConvolutionFwdAlgoGEMM;ConvDirectNaiveConvFwd:1347.98,0,miopenConvolutionFwdAlgoDirect
192-409-313-3x3-192-204-156-1-0x0-2x2-1x1-0-NCHW-FP32-F=ConvBinWinogradRxSf2x3g1:0.746061,0,miopenConvolutionFwdAlgoWinograd;ConvBinWinogradRxSf3x2:0.383598,0,miopenConvolutionFwdAlgoWinograd;ConvHipImplicitGemmGroupFwdXdlops:0.285146,124084992,miopenConvolutionFwdAlgoImplicitGEMM;ConvAsmImplicitGemmGTCDynamicFwdXdlopsNHWC:0.273368,124084992,miopenConvolutionFwdAlgoImplicitGEMM;GemmFwdRest:0.337184,219967488,miopenConvolutionFwdAlgoGEMM;ConvDirectNaiveConvFwd:40.8959,0,miopenConvolutionFwdAlgoDirect
192-816-624-3x3-96-816-624-1-1x1-1x1-1x1-0-NCHW-FP32-F=ConvBinWinogradRxSf2x3g1:1.48689,0,miopenConvolutionFwdAlgoWinograd;ConvBinWinogradRxSf3x2:2.59297,0,miopenConvolutionFwdAlgoWinograd;ConvHipImplicitGemmGroupFwdXdlops:2.12407,587243520,miopenConvolutionFwdAlgoImplicitGEMM;ConvAsmImplicitGemmGTCDynamicFwdXdlopsNHWC:2.07016,587243520,miopenConvolutionFwdAlgoImplicitGEMM;GemmFwdRest:3.05865,3519479808,miopenConvolutionFwdAlgoGEMM;ConvDirectNaiveConvFwd:606.596,0,miopenConvolutionFwdAlgoDirect
3-6-1106-834-3x3x3-96-4-1104-832-1-0x0x0-1x1x1-1x1x1-0-NCDHW-FP32-F=ConvHipImplicitGemm3DGroupFwdXdlops:2.31173,1477303552,miopenConvolutionFwdAlgoImplicitGEMM;GemmFwdRest:2.64483,1190412288,miopenConvolutionFwdAlgoGEMM;ConvDirectNaiveConvFwd:226.777,0,miopenConvolutionFwdAlgoDirect
3-6-818-626-3x3x3-96-4-816-624-1-0x0x0-1x1x1-1x1x1-0-NCDHW-FP32-F=ConvHipImplicitGemm3DGroupFwdXdlops:1.30197,819006976,miopenConvolutionFwdAlgoImplicitGEMM;GemmFwdRest:1.51723,659902464,miopenConvolutionFwdAlgoGEMM;ConvDirectNaiveConvFwd:119.916,0,miopenConvolutionFwdAlgoDirect
32-21-102-78-1x1x1-32-21-102-78-1-0x0x0-1x1x1-1x1x1-0-NCDHW-FP32-F=ConvHipImplicitGemm3DGroupFwdXdlops:0.0580803,42775552,miopenConvolutionFwdAlgoImplicitGEMM;GemmFwd1x1_0_1:0.0434405,0,miopenConvolutionFwdAlgoGEMM;ConvDirectNaiveConvFwd:10.063,0,miopenConvolutionFwdAlgoDirect
32-21-138-104-1x1x1-32-21-138-104-1-0x0x0-1x1x1-1x1x1-0-NCDHW-FP32-F=ConvHipImplicitGemm3DGroupFwdXdlops:0.0781472,77160448,miopenConvolutionFwdAlgoImplicitGEMM;GemmFwd1x1_0_1:0.0694968,0,miopenConvolutionFwdAlgoGEMM;ConvDirectNaiveConvFwd:18.1028,0,miopenConvolutionFwdAlgoDirect
32-21-206-156-1x1x1-32-21-206-156-1-0x0x0-1x1x1-1x1x1-0-NCDHW-FP32-F=ConvHipImplicitGemm3DGroupFwdXdlops:0.175715,172767232,miopenConvolutionFwdAlgoImplicitGEMM;GemmFwd1x1_0_1:0.145461,0,miopenConvolutionFwdAlgoGEMM;ConvDirectNaiveConvFwd:40.4819,0,miopenConvolutionFwdAlgoDirect
384-3-102-78-3x1x1-384-1-102-78-1-0x0x0-2x1x1-1x1x1-0-NCDHW-FP32-F=ConvHipImplicitGemm3DGroupFwdXdlops:0.130535,50651136,miopenConvolutionFwdAlgoImplicitGEMM;GemmFwdRest:0.105905,36661248,miopenConvolutionFwdAlgoGEMM;ConvDirectNaiveConvFwd:16.2927,0,miopenConvolutionFwdAlgoDirect
384-3-102-78-3x1x1-768-1-102-78-1-0x0x0-1x1x1-1x1x1-0-NCDHW-FP32-F=ConvHipImplicitGemm3DGroupFwdXdlops:0.211414,64641024,miopenConvolutionFwdAlgoImplicitGEMM;GemmFwdRest:0.170941,36661248,miopenConvolutionFwdAlgoGEMM;ConvDirectNaiveConvFwd:16.4728,0,miopenConvolutionFwdAlgoDirect
384-3-104-80-3x3x3-32-1-102-78-1-0x0x0-1x1x1-1x1x1-0-NCDHW-FP32-F=ConvHipImplicitGemm3DGroupFwdXdlops:0.204434,40684032,miopenConvolutionFwdAlgoImplicitGEMM;GemmFwdRest:0.887032,329951232,miopenConvolutionFwdAlgoGEMM;ConvDirectNaiveConvFwd:64.0743,0,miopenConvolutionFwdAlgoDirect
384-3-104-80-3x3x3-384-1-102-78-1-0x0x0-1x1x1-1x1x1-0-NCDHW-FP32-F=ConvHipImplicitGemm3DGroupFwdXdlops:0.792394,66484224,miopenConvolutionFwdAlgoImplicitGEMM;GemmFwdRest:0.976038,329951232,miopenConvolutionFwdAlgoGEMM;ConvDirectNaiveConvFwd:65.2308,0,miopenConvolutionFwdAlgoDirect
384-3-138-104-3x1x1-768-1-138-104-1-0x0x0-1x1x1-1x1x1-0-NCDHW-FP32-F=ConvHipImplicitGemm3DGroupFwdXdlops:0.328372,113762304,miopenConvolutionFwdAlgoImplicitGEMM;GemmFwdRest:0.299653,66134016,miopenConvolutionFwdAlgoGEMM;ConvDirectNaiveConvFwd:29.0429,0,miopenConvolutionFwdAlgoDirect
384-3-140-106-3x3x3-384-1-138-104-1-0x0x0-1x1x1-1x1x1-0-NCDHW-FP32-F=ConvHipImplicitGemm3DGroupFwdXdlops:1.27996,106352640,miopenConvolutionFwdAlgoImplicitGEMM;GemmFwdRest:1.74572,595206144,miopenConvolutionFwdAlgoGEMM;ConvDirectNaiveConvFwd:116.995,0,miopenConvolutionFwdAlgoDirect
384-3-206-156-3x1x1-768-1-206-156-1-0x0x0-1x1x1-1x1x1-0-NCDHW-FP32-F=ConvHipImplicitGemm3DGroupFwdXdlops:0.677669,250343424,miopenConvolutionFwdAlgoImplicitGEMM;GemmFwdRest:0.708201,148082688,miopenConvolutionFwdAlgoGEMM;ConvDirectNaiveConvFwd:67.5392,0,miopenConvolutionFwdAlgoDirect
384-3-208-158-3x3x3-32-1-206-156-1-0x0x0-1x1x1-1x1x1-0-NCDHW-FP32-F=ConvHipImplicitGemm3DGroupFwdXdlops:0.408524,156877824,miopenConvolutionFwdAlgoImplicitGEMM;GemmFwdRest:1.86839,1332744192,miopenConvolutionFwdAlgoGEMM;ConvDirectNaiveConvFwd:243.683,0,miopenConvolutionFwdAlgoDirect
384-3-278-210-3x3x3-384-1-276-208-1-0x0x0-1x1x1-1x1x1-0-NCDHW-FP32-F=ConvHipImplicitGemm3DGroupFwdXdlops:4.40924,373118976,miopenConvolutionFwdAlgoImplicitGEMM;GemmFwdRest:6.25248,2380824576,miopenConvolutionFwdAlgoGEMM;ConvDirectNaiveConvFwd:522.813,0,miopenConvolutionFwdAlgoDirect
384-4-278-210-3x3x3-384-2-276-208-1-0x0x0-1x1x1-1x1x1-0-NCDHW-FP32-F=ConvHipImplicitGemm3DGroupFwdXdlops:8.19969,550969344,miopenConvolutionFwdAlgoImplicitGEMM;GemmFwdRest:12.5304,4761649152,miopenConvolutionFwdAlgoGEMM;ConvDirectNaiveConvFwd:1052.47,0,miopenConvolutionFwdAlgoDirect
384-138-104-1x1-1152-138-104-1-0x0-1x1-1x1-0-NCHW-FP32-F=ConvBinWinogradRxSf2x3g1:1.04572,0,miopenConvolutionFwdAlgoWinograd;ConvBinWinogradRxSf3x2:0.54064,0,miopenConvolutionFwdAlgoWinograd;ConvHipImplicitGemmGroupFwdXdlops:0.194784,89948160,miopenConvolutionFwdAlgoImplicitGEMM;ConvAsmImplicitGemmGTCDynamicFwdXdlopsNHWC:0.167622,88178688,miopenConvolutionFwdAlgoImplicitGEMM;GemmFwd1x1_0_1:0.151482,0,miopenConvolutionFwdAlgoGEMM;ConvDirectNaiveConvFwd:10.1084,0,miopenConvolutionFwdAlgoDirect
384-205-157-3x3-384-102-78-1-0x0-2x2-1x1-0-NCHW-FP32-F=ConvBinWinogradRxSf2x3g1:0.74839,0,miopenConvolutionFwdAlgoWinograd;ConvBinWinogradRxSf3x2:0.493656,0,miopenConvolutionFwdAlgoWinograd;ConvHipImplicitGemmGroupFwdXdlops:0.292347,66964992,miopenConvolutionFwdAlgoImplicitGEMM;ConvAsmImplicitGemmGTCDynamicFwdXdlopsNHWC:0.244778,66964992,miopenConvolutionFwdAlgoImplicitGEMM;GemmFwdRest:0.234536,109983744,miopenConvolutionFwdAlgoGEMM;ConvDirectNaiveConvFwd:21.6063,0,miopenConvolutionFwdAlgoDirect
384-276-208-3x3-192-276-208-1-1x1-1x1-1x1-0-NCHW-FP32-F=ConvBinWinogradRxSf2x3g1:0.755442,0,miopenConvolutionFwdAlgoWinograd;ConvBinWinogradRxSf3x2:1.27533,0,miopenConvolutionFwdAlgoWinograd;ConvHipImplicitGemmGroupFwdXdlops:0.801573,134922240,miopenConvolutionFwdAlgoImplicitGEMM;ConvAsmImplicitGemmGTCDynamicFwdXdlopsNHWC:0.713356,134922240,miopenConvolutionFwdAlgoImplicitGEMM;GemmFwdRest:1.21929,793608192,miopenConvolutionFwdAlgoGEMM;ConvDirectNaiveConvFwd:126.194,0,miopenConvolutionFwdAlgoDirect
384-412-312-3x3-192-412-312-1-1x1-1x1-1x1-0-NCHW-FP32-F=ConvBinWinogradRxSf2x3g1:1.65742,0,miopenConvolutionFwdAlgoWinograd;ConvBinWinogradRxSf3x2:2.73642,0,miopenConvolutionFwdAlgoWinograd;ConvHipImplicitGemmGroupFwdXdlops:1.55606,298819584,miopenConvolutionFwdAlgoImplicitGEMM;ConvAsmImplicitGemmGTCDynamicFwdXdlopsNHWC:1.53387,298819584,miopenConvolutionFwdAlgoImplicitGEMM;GemmFwdRest:2.45693,1776992256,miopenConvolutionFwdAlgoGEMM;ConvDirectNaiveConvFwd:292.01,0,miopenConvolutionFwdAlgoDirect
96-3-1106-834-3x3x3-3-1-1104-832-1-0x0x0-1x1x1-1x1x1-0-NCDHW-FP32-F=ConvHipImplicitGemm3DGroupFwdXdlops:2.38906,1073662976,miopenConvolutionFwdAlgoImplicitGEMM;GemmFwdRest:13.3213,9523298304,miopenConvolutionFwdAlgoGEMM;ConvDirectNaiveConvFwd:2077.76,0,miopenConvolutionFwdAlgoDirect
96-3-1650-1250-3x3x3-96-1-1648-1248-1-0x0x0-1x1x1-1x1x1-0-NCDHW-FP32-F=ConvHipImplicitGemm3DGroupFwdXdlops:13.6997,3166769664,miopenConvolutionFwdAlgoImplicitGEMM;ConvDirectNaiveConvFwd:4314.84,0,miopenConvolutionFwdAlgoDirect
96-6-1650-1250-3x3x3-3-4-1648-1248-1-0x0x0-1x1x1-1x1x1-0-NCDHW-FP32-F=ConvHipImplicitGemm3DGroupFwdXdlops:42.1506,4850753024,miopenConvolutionFwdAlgoImplicitGEMM;ConvDirectNaiveConvFwd:18478.4,0,miopenConvolutionFwdAlgoDirect
384-413-313-3x3-384-206-156-2-0x0-2x2-1x1-0-NCHW-FP32-F=ConvBinWinogradRxSf2x3g1:5.6781,0,miopenConvolutionFwdAlgoWinograd;ConvBinWinogradRxSf3x2:2.78888,0,miopenConvolutionFwdAlgoWinograd;ConvHipImplicitGemmGroupFwdXdlops:1.73948,501144576,miopenConvolutionFwdAlgoImplicitGEMM;ConvAsmImplicitGemmGTCDynamicFwdXdlopsNHWC:1.70662,501144576,miopenConvolutionFwdAlgoImplicitGEMM;GemmFwdRest:1.98667,444248064,miopenConvolutionFwdAlgoGEMM;ConvDirectNaiveConvFwd:108.5,0,miopenConvolutionFwdAlgoDirect
192-409-313-3x3-192-204-156-4-0x0-2x2-1x1-0-NCHW-FP32-F=ConvBinWinogradRxSf2x3g1:2.86726,0,miopenConvolutionFwdAlgoWinograd;ConvBinWinogradRxSf3x2:1.35192,0,miopenConvolutionFwdAlgoWinograd;ConvHipImplicitGemmGroupFwdXdlops:1.01303,492358656,miopenConvolutionFwdAlgoImplicitGEMM;ConvAsmImplicitGemmGTCDynamicFwdXdlopsNHWC:0.977644,492358656,miopenConvolutionFwdAlgoImplicitGEMM;GemmFwdRest:1.37592,219967488,miopenConvolutionFwdAlgoGEMM;ConvDirectNaiveConvFwd:52.3142,0,miopenConvolutionFwdAlgoDirect
192-553-417-3x3-192-276-208-4-0x0-2x2-1x1-0-NCHW-FP32-F=ConvBinWinogradRxSf2x3g1:5.0613,0,miopenConvolutionFwdAlgoWinograd;ConvBinWinogradRxSf3x2:2.4413,0,miopenConvolutionFwdAlgoWinograd;ConvHipImplicitGemmGroupFwdXdlops:1.90967,886090752,miopenConvolutionFwdAlgoImplicitGEMM;ConvAsmImplicitGemmGTCDynamicFwdXdlopsNHWC:1.81682,886090752,miopenConvolutionFwdAlgoImplicitGEMM;GemmFwdRest:2.46717,396804096,miopenConvolutionFwdAlgoGEMM;ConvDirectNaiveConvFwd:93.3764,0,miopenConvolutionFwdAlgoDirect
192-825-625-3x3-192-412-312-4-0x0-2x2-1x1-0-NCHW-FP32-F=ConvBinWinogradRxSf2x3g1:12.352,0,miopenConvolutionFwdAlgoWinograd;ConvBinWinogradRxSf3x2:5.45181,0,miopenConvolutionFwdAlgoWinograd;ConvHipImplicitGemmGroupFwdXdlops:3.92131,1980214272,miopenConvolutionFwdAlgoImplicitGEMM;ConvAsmImplicitGemmGTCDynamicFwdXdlopsNHWC:3.88019,1980214272,miopenConvolutionFwdAlgoImplicitGEMM;GemmFwdRest:4.94736,888496128,miopenConvolutionFwdAlgoGEMM;ConvDirectNaiveConvFwd:210.698,0,miopenConvolutionFwdAlgoDirect
384-408-312-3x3-192-408-312-4-1x1-1x1-1x1-0-NCHW-FP32-F=ConvBinWinogradRxSf2x3g1:6.25651,0,miopenConvolutionFwdAlgoWinograd;ConvBinWinogradRxSf3x2:10.209,0,miopenConvolutionFwdAlgoWinograd;ConvHipImplicitGemmGroupFwdXdlops:6.13736,1175814144,miopenConvolutionFwdAlgoImplicitGEMM;ConvAsmImplicitGemmGTCDynamicFwdXdlopsNHWC:5.96322,1175814144,miopenConvolutionFwdAlgoImplicitGEMM;GemmFwdRest:8.98815,1759739904,miopenConvolutionFwdAlgoGEMM;ConvDirectNaiveConvFwd:408.744,0,miopenConvolutionFwdAlgoDirect
96-1105-833-3x3-96-552-416-4-0x0-2x2-1x1-0-NCHW-FP32-F=ConvBinWinogradRxSf2x3g1:5.07728,0,miopenConvolutionFwdAlgoWinograd;ConvBinWinogradRxSf3x2:2.48514,0,miopenConvolutionFwdAlgoWinograd;ConvHipImplicitGemmGroupFwdXdlops:2.74044,1766880768,miopenConvolutionFwdAlgoImplicitGEMM;ConvAsmImplicitGemmGTCDynamicFwdXdlopsNHWC:2.7174,1766880768,miopenConvolutionFwdAlgoImplicitGEMM;GemmFwdRest:3.14582,793608192,miopenConvolutionFwdAlgoGEMM;ConvDirectNaiveConvFwd:181.682,0,miopenConvolutionFwdAlgoDirect
96-1649-1249-3x3-96-824-624-4-0x0-2x2-1x1-0-NCHW-FP32-F=ConvBinWinogradRxSf2x3g1:11.2587,0,miopenConvolutionFwdAlgoWinograd;ConvBinWinogradRxSf3x2:5.44954,0,miopenConvolutionFwdAlgoWinograd;ConvHipImplicitGemmGroupFwdXdlops:6.02143,3953653248,miopenConvolutionFwdAlgoImplicitGEMM;ConvAsmImplicitGemmGTCDynamicFwdXdlopsNHWC:5.70239,3953653248,miopenConvolutionFwdAlgoImplicitGEMM;GemmFwdRest:6.61294,1776992256,miopenConvolutionFwdAlgoGEMM;ConvDirectNaiveConvFwd:418.047,0,miopenConvolutionFwdAlgoDirect
96-817-625-3x3-96-408-312-4-0x0-2x2-1x1-0-NCHW-FP32-F=ConvBinWinogradRxSf2x3g1:2.81251,0,miopenConvolutionFwdAlgoWinograd;ConvBinWinogradRxSf3x2:1.3773,0,miopenConvolutionFwdAlgoWinograd;ConvHipImplicitGemmGroupFwdXdlops:1.45782,980178432,miopenConvolutionFwdAlgoImplicitGEMM;ConvAsmImplicitGemmGTCDynamicFwdXdlopsNHWC:1.44331,980178432,miopenConvolutionFwdAlgoImplicitGEMM;GemmFwdRest:1.77213,439934976,miopenConvolutionFwdAlgoGEMM;ConvDirectNaiveConvFwd:99.8388,0,miopenConvolutionFwdAlgoDirect
16-21-138-104-1x1x1-16-21-138-104-1-0x0x0-1x1x1-1x1x1-0-NCDHW-BF16-F=ConvHipImplicitGemm3DGroupFwdXdlops:0.0337376,19289600,miopenConvolutionFwdAlgoImplicitGEMM;GemmFwd1x1_0_1:0.0147937,0,miopenConvolutionFwdAlgoGEMM;ConvDirectNaiveConvFwd:9.38303,0,miopenConvolutionFwdAlgoDirect
16-3-104-80-3x3x3-384-1-102-78-1-0x0x0-1x1x1-1x1x1-0-NCDHW-BF16-F=ConvHipImplicitGemm3DGroupFwdXdlops:0.0370063,7240704,miopenConvolutionFwdAlgoImplicitGEMM;GemmFwdRest:0.0414002,6873984,miopenConvolutionFwdAlgoGEMM;ConvDirectNaiveConvFwd:2.29569,0,miopenConvolutionFwdAlgoDirect
16-3-208-158-3x3x3-384-1-206-156-1-0x0x0-1x1x1-1x1x1-0-NCDHW-BF16-F=ConvHipImplicitGemm3DGroupFwdXdlops:0.071341,28167168,miopenConvolutionFwdAlgoImplicitGEMM;GemmFwdRest:0.0961612,27765504,miopenConvolutionFwdAlgoGEMM;ConvDirectNaiveConvFwd:9.70096,0,miopenConvolutionFwdAlgoDirect
192-1-204-156-1x1x1-384-1-204-156-1-0x0x0-1x1x1-1x1x1-0-NCDHW-BF16-F=ConvHipImplicitGemm3DGroupFwdXdlops:0.0655403,36808704,miopenConvolutionFwdAlgoImplicitGEMM;GemmFwd1x1_0_1:0.0283682,0,miopenConvolutionFwdAlgoGEMM;ConvDirectNaiveConvFwd:11.2694,0,miopenConvolutionFwdAlgoDirect
192-1-276-208-1x1x1-384-1-276-208-1-0x0x0-1x1x1-1x1x1-0-NCDHW-BF16-F=ConvHipImplicitGemm3DGroupFwdXdlops:0.0670568,66281472,miopenConvolutionFwdAlgoImplicitGEMM;GemmFwd1x1_0_1:0.0327803,0,miopenConvolutionFwdAlgoGEMM;ConvDirectNaiveConvFwd:20.6649,0,miopenConvolutionFwdAlgoDirect
192-2-204-156-1x1x1-384-2-204-156-1-0x0x0-1x1x1-1x1x1-0-NCDHW-BF16-F=ConvHipImplicitGemm3DGroupFwdXdlops:0.11527,73469952,miopenConvolutionFwdAlgoImplicitGEMM;GemmFwd1x1_0_1:0.0402564,0,miopenConvolutionFwdAlgoGEMM;ConvDirectNaiveConvFwd:22.1286,0,miopenConvolutionFwdAlgoDirect
192-2-412-312-1x1x1-384-2-412-312-1-0x0x0-1x1x1-1x1x1-0-NCDHW-BF16-F=ConvHipImplicitGemm3DGroupFwdXdlops:0.278997,296312832,miopenConvolutionFwdAlgoImplicitGEMM;GemmFwd1x1_0_1:0.0946743,0,miopenConvolutionFwdAlgoGEMM;ConvDirectNaiveConvFwd:90.287,0,miopenConvolutionFwdAlgoDirect
192-3-278-210-3x3x3-384-1-276-208-1-0x0x0-1x1x1-1x1x1-0-NCDHW-BF16-F=ConvHipImplicitGemm3DGroupFwdXdlops:0.387137,115324416,miopenConvolutionFwdAlgoImplicitGEMM;GemmFwdRest:1.32441,595206144,miopenConvolutionFwdAlgoGEMM;ConvDirectNaiveConvFwd:211.679,0,miopenConvolutionFwdAlgoDirect
192-3-414-314-3x3x3-384-1-412-312-1-0x0x0-1x1x1-1x1x1-0-NCDHW-BF16-F=ConvHipImplicitGemm3DGroupFwdXdlops:0.944947,252458496,miopenConvolutionFwdAlgoImplicitGEMM;GemmFwdRest:3.01761,1332744192,miopenConvolutionFwdAlgoGEMM;ConvDirectNaiveConvFwd:545.177,0,miopenConvolutionFwdAlgoDirect
192-3-826-626-3x3x3-192-1-824-624-1-0x0x0-1x1x1-1x1x1-0-NCDHW-BF16-F=ConvHipImplicitGemm3DGroupFwdXdlops:2.29568,795105792,miopenConvolutionFwdAlgoImplicitGEMM;GemmFwdRest:11.4874,5330976768,miopenConvolutionFwdAlgoGEMM;ConvDirectNaiveConvFwd:1914.26,0,miopenConvolutionFwdAlgoDirect
192-5-412-312-3x1x1-192-2-412-312-1-0x0x0-2x1x1-1x1x1-0-NCDHW-BF16-F=ConvHipImplicitGemm3DGroupFwdXdlops:0.440225,345747456,miopenConvolutionFwdAlgoImplicitGEMM;GemmFwdRest:0.682267,296165376,miopenConvolutionFwdAlgoGEMM;ConvDirectNaiveConvFwd:290.836,0,miopenConvolutionFwdAlgoDirect
192-6-826-626-3x3x3-192-4-824-624-1-0x0x0-1x1x1-1x1x1-0-NCDHW-BF16-F=ConvHipImplicitGemm3DGroupFwdXdlops:8.32946,1983108096,miopenConvolutionFwdAlgoImplicitGEMM;ConvDirectNaiveConvFwd:7690.76,0,miopenConvolutionFwdAlgoDirect
384-3-102-78-3x1x1-384-1-102-78-1-0x0x0-2x1x1-1x1x1-0-NCDHW-BF16-F=ConvHipImplicitGemm3DGroupFwdXdlops:0.0467433,25325568,miopenConvolutionFwdAlgoImplicitGEMM;GemmFwdRest:0.0643368,18330624,miopenConvolutionFwdAlgoGEMM;ConvDirectNaiveConvFwd:15.628,0,miopenConvolutionFwdAlgoDirect
384-3-104-80-3x3x3-32-1-102-78-1-0x0x0-1x1x1-1x1x1-0-NCDHW-BF16-F=ConvHipImplicitGemm3DGroupFwdXdlops:0.084305,20342016,miopenConvolutionFwdAlgoImplicitGEMM;GemmFwdRest:0.409931,164975616,miopenConvolutionFwdAlgoGEMM;ConvDirectNaiveConvFwd:62.4221,0,miopenConvolutionFwdAlgoDirect
384-3-138-104-3x1x1-768-1-138-104-1-0x0x0-1x1x1-1x1x1-0-NCDHW-BF16-F=ConvHipImplicitGemm3DGroupFwdXdlops:0.100024,56881152,miopenConvolutionFwdAlgoImplicitGEMM;GemmFwdRest:0.108888,33067008,miopenConvolutionFwdAlgoGEMM;ConvDirectNaiveConvFwd:27.9607,0,miopenConvolutionFwdAlgoDirect
384-3-206-156-3x1x1-384-1-206-156-1-0x0x0-2x1x1-1x1x1-0-NCDHW-BF16-F=ConvHipImplicitGemm3DGroupFwdXdlops:0.140468,99606528,miopenConvolutionFwdAlgoImplicitGEMM;GemmFwdRest:0.191429,74041344,miopenConvolutionFwdAlgoGEMM;ConvDirectNaiveConvFwd:63.4782,0,miopenConvolutionFwdAlgoDirect
384-3-208-158-3x3x3-384-1-206-156-1-0x0x0-1x1x1-1x1x1-0-NCDHW-BF16-F=ConvHipImplicitGemm3DGroupFwdXdlops:0.41494,108361728,miopenConvolutionFwdAlgoImplicitGEMM;GemmFwdRest:1.48243,666372096,miopenConvolutionFwdAlgoGEMM;ConvDirectNaiveConvFwd:261.597,0,miopenConvolutionFwdAlgoDirect
384-4-206-158-3x3x3-384-2-204-156-1-0x0x0-1x1x1-1x1x1-0-NCDHW-BF16-F=ConvHipImplicitGemm3DGroupFwdXdlops:0.812911,156831744,miopenConvolutionFwdAlgoImplicitGEMM;GemmFwdRest:2.89341,1319804928,miopenConvolutionFwdAlgoGEMM;ConvDirectNaiveConvFwd:553.09,0,miopenConvolutionFwdAlgoDirect
384-4-412-312-3x1x1-768-2-412-312-1-0x0x0-1x1x1-1x1x1-0-NCDHW-BF16-F=ConvHipImplicitGemm3DGroupFwdXdlops:1.01031,791543808,miopenConvolutionFwdAlgoImplicitGEMM;GemmFwdRest:1.61303,592330752,miopenConvolutionFwdAlgoGEMM;ConvDirectNaiveConvFwd:638.771,0,miopenConvolutionFwdAlgoDirect
384-205-157-3x3-384-102-78-1-0x0-2x2-1x1-0-NCHW-BF16-F=ConvHipImplicitGemmGroupFwdXdlops:0.0756326,33482496,miopenConvolutionFwdAlgoImplicitGEMM;ConvAsmImplicitGemmGTCDynamicFwdXdlopsNHWC:0.101794,45702912,miopenConvolutionFwdAlgoImplicitGEMM;GemmFwdRest:0.0788168,54991872,miopenConvolutionFwdAlgoGEMM;ConvDirectNaiveConvFwd:22.2364,0,miopenConvolutionFwdAlgoDirect
384-206-156-1x1-384-206-156-1-0x0-1x1-1x1-0-NCHW-BF16-F=ConvHipImplicitGemmGroupFwdXdlops:0.0808342,49655808,miopenConvolutionFwdAlgoImplicitGEMM;ConvAsmImplicitGemmGTCDynamicFwdXdlopsNHWC:0.0704067,98721792,miopenConvolutionFwdAlgoImplicitGEMM;GemmFwd1x1_0_1:0.0285337,0,miopenConvolutionFwdAlgoGEMM;ConvDirectNaiveConvFwd:19.7866,0,miopenConvolutionFwdAlgoDirect
384-412-312-3x3-192-412-312-1-1x1-1x1-1x1-0-NCHW-BF16-F=ConvHipImplicitGemmGroupFwdXdlops:0.413993,149409792,miopenConvolutionFwdAlgoImplicitGEMM;ConvAsmImplicitGemmGTCDynamicFwdXdlopsNHWC:0.513535,248131584,miopenConvolutionFwdAlgoImplicitGEMM;GemmFwdRest:0.730339,888496128,miopenConvolutionFwdAlgoGEMM;ConvDirectNaiveConvFwd:303.347,0,miopenConvolutionFwdAlgoDirect
384-824-624-3x3-192-824-624-1-1x1-1x1-1x1-0-NCHW-BF16-F=ConvHipImplicitGemmGroupFwdXdlops:1.31828,593657856,miopenConvolutionFwdAlgoImplicitGEMM;ConvAsmImplicitGemmGTCDynamicFwdXdlopsNHWC:1.64922,988545024,miopenConvolutionFwdAlgoImplicitGEMM;GemmFwdRest:2.6223,3553984512,miopenConvolutionFwdAlgoGEMM;ConvDirectNaiveConvFwd:1293.65,0,miopenConvolutionFwdAlgoDirect
96-3-1650-1250-3x3x3-96-1-1648-1248-1-0x0x0-1x1x1-1x1x1-0-NCDHW-BF16-F=ConvHipImplicitGemm3DGroupFwdXdlops:4.02271,1583384832,miopenConvolutionFwdAlgoImplicitGEMM;ConvDirectNaiveConvFwd:3865.94,0,miopenConvolutionFwdAlgoDirect
96-6-1106-834-3x3x3-3-4-1104-832-1-0x0x0-1x1x1-1x1x1-0-NCDHW-BF16-F=ConvHipImplicitGemm3DGroupFwdXdlops:5.15613,1084669696,miopenConvolutionFwdAlgoImplicitGEMM;ConvDirectNaiveConvFwd:8097.53,0,miopenConvolutionFwdAlgoDirect
96-6-554-418-3x3x3-192-4-552-416-1-0x0x0-1x1x1-1x1x1-0-NCDHW-BF16-F=ConvHipImplicitGemm3DGroupFwdXdlops:1.98711,620481024,miopenConvolutionFwdAlgoImplicitGEMM;GemmFwdRest:9.98076,4761649152,miopenConvolutionFwdAlgoGEMM;ConvDirectNaiveConvFwd:1623.42,0,miopenConvolutionFwdAlgoDirect
96-6-818-626-3x3x3-96-4-816-624-1-0x0x0-1x1x1-1x1x1-0-NCDHW-BF16-F=ConvHipImplicitGemm3DGroupFwdXdlops:2.80107,981453312,miopenConvolutionFwdAlgoImplicitGEMM;ConvDirectNaiveConvFwd:3806.06,0,miopenConvolutionFwdAlgoDirect
96-1105-833-3x3-96-552-416-1-0x0-2x2-1x1-0-NCHW-BF16-F=ConvHipImplicitGemmGroupFwdXdlops:0.31595,220984576,miopenConvolutionFwdAlgoImplicitGEMM;ConvAsmImplicitGemmGTCDynamicFwdXdlopsNHWC:0.331706,309163264,miopenConvolutionFwdAlgoImplicitGEMM;GemmFwdRest:0.390684,396804096,miopenConvolutionFwdAlgoGEMM;ConvDirectNaiveConvFwd:152.22,0,miopenConvolutionFwdAlgoDirect
96-1649-1249-3x3-96-824-624-1-0x0-2x2-1x1-0-NCHW-BF16-F=ConvHipImplicitGemmGroupFwdXdlops:0.655766,494331136,miopenConvolutionFwdAlgoImplicitGEMM;ConvAsmImplicitGemmGTCDynamicFwdXdlopsNHWC:0.699435,691774720,miopenConvolutionFwdAlgoImplicitGEMM;GemmFwdRest:0.874896,888496128,miopenConvolutionFwdAlgoGEMM;ConvDirectNaiveConvFwd:390.616,0,miopenConvolutionFwdAlgoDirect
96-817-625-3x3-96-408-312-1-0x0-2x2-1x1-0-NCHW-BF16-F=ConvHipImplicitGemmGroupFwdXdlops:0.157553,122646784,miopenConvolutionFwdAlgoImplicitGEMM;ConvAsmImplicitGemmGTCDynamicFwdXdlopsNHWC:0.171802,171528448,miopenConvolutionFwdAlgoImplicitGEMM;GemmFwdRest:0.212102,219967488,miopenConvolutionFwdAlgoGEMM;ConvDirectNaiveConvFwd:84.1744,0,miopenConvolutionFwdAlgoDirect
384-204-156-3x3-192-204-156-2-1x1-1x1-1x1-0-NCHW-BF16-F=ConvHipImplicitGemmGroupFwdXdlops:0.19415,74649600,miopenConvolutionFwdAlgoImplicitGEMM;ConvAsmImplicitGemmGTCDynamicFwdXdlopsNHWC:0.250013,123531264,miopenConvolutionFwdAlgoImplicitGEMM;GemmFwdRest:0.353937,219967488,miopenConvolutionFwdAlgoGEMM;ConvDirectNaiveConvFwd:78.0527,0,miopenConvolutionFwdAlgoDirect
384-205-157-3x3-384-102-78-2-0x0-2x2-1x1-0-NCHW-BF16-F=ConvHipImplicitGemmGroupFwdXdlops:0.118333,64310784,miopenConvolutionFwdAlgoImplicitGEMM;ConvAsmImplicitGemmGTCDynamicFwdXdlopsNHWC:0.155458,88751616,miopenConvolutionFwdAlgoImplicitGEMM;GemmFwdRest:0.161935,54991872,miopenConvolutionFwdAlgoGEMM;ConvDirectNaiveConvFwd:23.5338,0,miopenConvolutionFwdAlgoDirect
384-277-209-3x3-384-138-104-2-0x0-2x2-1x1-0-NCHW-BF16-F=ConvHipImplicitGemmGroupFwdXdlops:0.217026,113622528,miopenConvolutionFwdAlgoImplicitGEMM;ConvAsmImplicitGemmGTCDynamicFwdXdlopsNHWC:0.263123,157711872,miopenConvolutionFwdAlgoImplicitGEMM;GemmFwdRest:0.267903,99201024,miopenConvolutionFwdAlgoGEMM;ConvDirectNaiveConvFwd:42.7088,0,miopenConvolutionFwdAlgoDirect
192-1104-832-3x3-96-1104-832-4-1x1-1x1-1x1-0-NCHW-BF16-F=ConvHipImplicitGemmGroupFwdXdlops:3.31234,2116620288,miopenConvolutionFwdAlgoImplicitGEMM;ConvAsmImplicitGemmGTCDynamicFwdXdlopsNHWC:3.66743,3527479296,miopenConvolutionFwdAlgoImplicitGEMM;GemmFwdRest:9.60491,3174432768,miopenConvolutionFwdAlgoGEMM;ConvDirectNaiveConvFwd:1557.79,0,miopenConvolutionFwdAlgoDirect
384-824-624-3x3-192-824-624-4-1x1-1x1-1x1-0-NCHW-BF16-F=ConvHipImplicitGemmGroupFwdXdlops:5.18033,2370650112,miopenConvolutionFwdAlgoImplicitGEMM;ConvAsmImplicitGemmGTCDynamicFwdXdlopsNHWC:6.50144,3950198784,miopenConvolutionFwdAlgoImplicitGEMM;GemmFwdRest:9.49676,3553984512,miopenConvolutionFwdAlgoGEMM;ConvDirectNaiveConvFwd:2020.39,0,miopenConvolutionFwdAlgoDirect
128-11-162-194-3x3x3-3-9-160-192-1-0x0x0-1x1x1-1x1x1-0-NCDHW-FP16-F=ConvHipImplicitGemm3DGroupFwdXdlops:0.472813,90180864,miopenConvolutionFwdAlgoImplicitGEMM;GemmFwdRest:3.75701,1911029760,miopenConvolutionFwdAlgoGEMM;ConvDirectNaiveConvFwd:743.429,0,miopenConvolutionFwdAlgoDirect
128-11-258-258-3x3x3-128-9-256-256-1-0x0x0-1x1x1-1x1x1-0-NCDHW-FP16-F=ConvHipImplicitGemm3DGroupFwdXdlops:1.02274,339323904,miopenConvolutionFwdAlgoImplicitGEMM;GemmFwdRest:8.22243,4076863488,miopenConvolutionFwdAlgoGEMM;ConvDirectNaiveConvFwd:1481.54,0,miopenConvolutionFwdAlgoDirect
128-19-146-258-3x3x3-3-17-144-256-1-0x0x0-1x1x1-1x1x1-0-NCDHW-FP16-F=ConvHipImplicitGemm3DGroupFwdXdlops:0.884191,186998016,miopenConvolutionFwdAlgoImplicitGEMM;GemmFwdRest:8.52901,4331667456,miopenConvolutionFwdAlgoGEMM;ConvDirectNaiveConvFwd:1689.43,0,miopenConvolutionFwdAlgoDirect
128-19-258-258-3x3x3-3-17-256-256-1-0x0x0-1x1x1-1x1x1-0-NCDHW-FP16-F=ConvHipImplicitGemm3DGroupFwdXdlops:1.4825,330472704,miopenConvolutionFwdAlgoImplicitGEMM;ConvDirectNaiveConvFwd:3075.71,0,miopenConvolutionFwdAlgoDirect
256-11-146-130-3x3x3-128-9-144-128-1-0x0x0-1x1x1-1x1x1-0-NCDHW-FP16-F=ConvHipImplicitGemm3DGroupFwdXdlops:0.602026,151132160,miopenConvolutionFwdAlgoImplicitGEMM;GemmFwdRest:4.54572,2293235712,miopenConvolutionFwdAlgoGEMM;ConvDirectNaiveConvFwd:847.949,0,miopenConvolutionFwdAlgoDirect
256-11-162-258-3x3x3-128-9-160-256-1-0x0x0-1x1x1-1x1x1-0-NCDHW-FP16-F=ConvHipImplicitGemm3DGroupFwdXdlops:1.20524,331536384,miopenConvolutionFwdAlgoImplicitGEMM;GemmFwdRest:10.1919,5096079360,miopenConvolutionFwdAlgoGEMM;ConvDirectNaiveConvFwd:1861.76,0,miopenConvolutionFwdAlgoDirect
256-11-74-130-3x3x3-256-9-72-128-1-0x0x0-1x1x1-1x1x1-0-NCDHW-FP16-F=ConvHipImplicitGemm3DGroupFwdXdlops:0.515098,100186112,miopenConvolutionFwdAlgoImplicitGEMM;GemmFwdRest:2.42563,1146617856,miopenConvolutionFwdAlgoGEMM;ConvDirectNaiveConvFwd:421.92,0,miopenConvolutionFwdAlgoDirect
256-17-128-192-1x1x1-128-17-128-192-1-0x0x0-1x1x1-1x1x1-0-NCDHW-FP16-F=ConvHipImplicitGemm3DGroupFwdXdlops:0.243243,320929792,miopenConvolutionFwdAlgoImplicitGEMM;GemmFwd1x1_0_1:0.0748873,0,miopenConvolutionFwdAlgoGEMM;ConvDirectNaiveConvFwd:239.007,0,miopenConvolutionFwdAlgoDirect
256-17-160-192-1x1x1-128-17-160-192-1-0x0x0-1x1x1-1x1x1-0-NCDHW-FP16-F=ConvHipImplicitGemm3DGroupFwdXdlops:0.307255,401145856,miopenConvolutionFwdAlgoImplicitGEMM;GemmFwd1x1_0_1:0.102674,0,miopenConvolutionFwdAlgoGEMM;ConvDirectNaiveConvFwd:308.368,0,miopenConvolutionFwdAlgoDirect
256-19-130-194-3x3x3-128-17-128-192-1-0x0x0-1x1x1-1x1x1-0-NCDHW-FP16-F=ConvHipImplicitGemm3DGroupFwdXdlops:1.37671,354064384,miopenConvolutionFwdAlgoImplicitGEMM;GemmFwdRest:11.8842,5775556608,miopenConvolutionFwdAlgoGEMM;ConvDirectNaiveConvFwd:2149.9,0,miopenConvolutionFwdAlgoDirect
256-19-162-194-3x3x3-256-17-160-192-1-0x0x0-1x1x1-1x1x1-0-NCDHW-FP16-F=ConvHipImplicitGemm3DGroupFwdXdlops:2.92072,576657408,miopenConvolutionFwdAlgoImplicitGEMM;GemmFwdRest:15.9333,7219445760,miopenConvolutionFwdAlgoGEMM;ConvDirectNaiveConvFwd:2703.55,0,miopenConvolutionFwdAlgoDirect
256-19-258-258-3x3x3-256-17-256-256-1-0x0x0-1x1x1-1x1x1-0-NCDHW-FP16-F=ConvHipImplicitGemm3DGroupFwdXdlops:6.10126,1221498880,miopenConvolutionFwdAlgoImplicitGEMM;ConvDirectNaiveConvFwd:5617.62,0,miopenConvolutionFwdAlgoDirect
512-11-82-98-3x3x3-512-9-80-96-1-0x0x0-1x1x1-1x1x1-0-NCDHW-FP16-F=ConvHipImplicitGemm3DGroupFwdXdlops:1.49535,175452160,miopenConvolutionFwdAlgoImplicitGEMM;GemmFwdRest:4.6124,1911029760,miopenConvolutionFwdAlgoGEMM;ConvDirectNaiveConvFwd:902.376,0,miopenConvolutionFwdAlgoDirect
512-5-38-66-3x3x3-512-3-36-64-1-0x0x0-1x1x1-1x1x1-0-NCDHW-FP16-F=ConvHipImplicitGemm3DGroupFwdXdlops:0.191047,34074624,miopenConvolutionFwdAlgoImplicitGEMM;GemmFwdRest:0.556559,191102976,miopenConvolutionFwdAlgoGEMM;ConvDirectNaiveConvFwd:78.0284,0,miopenConvolutionFwdAlgoDirect
512-5-72-64-1x1x1-256-5-72-64-1-0x0x0-1x1x1-1x1x1-0-NCDHW-FP16-F=ConvHipImplicitGemm3DGroupFwdXdlops:0.0446337,35651584,miopenConvolutionFwdAlgoImplicitGEMM;GemmFwd1x1_0_1:0.0218324,0,miopenConvolutionFwdAlgoGEMM;ConvDirectNaiveConvFwd:21.6468,0,miopenConvolutionFwdAlgoDirect
512-7-130-98-3x3x3-256-5-128-96-1-0x0x0-1x1x1-1x1x1-0-NCDHW-FP16-F=ConvHipImplicitGemm3DGroupFwdXdlops:0.683467,129855488,miopenConvolutionFwdAlgoImplicitGEMM;GemmFwdRest:3.48217,1698693120,miopenConvolutionFwdAlgoGEMM;ConvDirectNaiveConvFwd:623.453,0,miopenConvolutionFwdAlgoDirect
512-7-34-66-3x3x3-512-5-32-64-1-0x0x0-1x1x1-1x1x1-0-NCDHW-FP16-F=ConvHipImplicitGemm3DGroupFwdXdlops:0.281747,40726528,miopenConvolutionFwdAlgoImplicitGEMM;GemmFwdRest:0.801255,283115520,miopenConvolutionFwdAlgoGEMM;ConvDirectNaiveConvFwd:114.195,0,miopenConvolutionFwdAlgoDirect
512-7-66-66-3x3x3-512-5-64-64-1-0x0x0-1x1x1-1x1x1-0-NCDHW-FP16-F=ConvHipImplicitGemm3DGroupFwdXdlops:0.495599,66351104,miopenConvolutionFwdAlgoImplicitGEMM;GemmFwdRest:1.32403,566231040,miopenConvolutionFwdAlgoGEMM;ConvDirectNaiveConvFwd:227.401,0,miopenConvolutionFwdAlgoDirect
512-7-74-66-3x3x3-512-5-72-64-1-0x0x0-1x1x1-1x1x1-0-NCDHW-FP16-F=ConvHipImplicitGemm3DGroupFwdXdlops:0.528038,72757248,miopenConvolutionFwdAlgoImplicitGEMM;GemmFwdRest:1.51234,637009920,miopenConvolutionFwdAlgoGEMM;ConvDirectNaiveConvFwd:268.583,0,miopenConvolutionFwdAlgoDirect
512-9-128-96-1x1x1-256-9-128-96-1-0x0x0-1x1x1-1x1x1-0-NCDHW-FP16-F=ConvHipImplicitGemm3DGroupFwdXdlops:0.138194,170131456,miopenConvolutionFwdAlgoImplicitGEMM;GemmFwd1x1_0_1:0.0500005,0,miopenConvolutionFwdAlgoGEMM;ConvDirectNaiveConvFwd:104.493,0,miopenConvolutionFwdAlgoDirect
512-9-80-96-1x1x1-256-9-80-96-1-0x0x0-1x1x1-1x1x1-0-NCDHW-FP16-F=ConvHipImplicitGemm3DGroupFwdXdlops:0.0885524,106430464,miopenConvolutionFwdAlgoImplicitGEMM;GemmFwd1x1_0_1:0.0369872,0,miopenConvolutionFwdAlgoGEMM;ConvDirectNaiveConvFwd:65.108,0,miopenConvolutionFwdAlgoDirect
16-21-90-160-1x2x2-5120-21-45-80-1-0x0x0-1x2x2-1x1x1-0-NCDHW-BF16-F=ConvHipImplicitGemm3DGroupFwdXdlops:1.11674,784476160,miopenConvolutionFwdAlgoImplicitGEMM;GemmFwdRest:0.378153,9676800,miopenConvolutionFwdAlgoGEMM
16-21-90-160-1x1x1-16-21-90-160-1-0x0x0-1x1x1-1x1x1-0-NCDHW-BF16-F=ConvHipImplicitGemm3DGroupFwdXdlops:0.0311305,19354112,miopenConvolutionFwdAlgoImplicitGEMM;GemmFwd1x1_0_1:0.0148602,0,miopenConvolutionFwdAlgoGEMM
16-3-92-162-3x3x3-384-1-90-160-1-0x0x0-1x1x1-1x1x1-0-NCDHW-BF16-F=ConvHipImplicitGemm3DGroupFwdXdlops:0.040927,12821760,miopenConvolutionFwdAlgoImplicitGEMM;GemmFwdRest:0.0532603,12441600,miopenConvolutionFwdAlgoGEMM
384-3-92-162-3x3x3-384-1-90-160-1-0x0x0-1x1x1-1x1x1-0-NCDHW-BF16-F=ConvHipImplicitGemm3DGroupFwdXdlops:0.208016,53360640,miopenConvolutionFwdAlgoImplicitGEMM;GemmFwdRest:0.739339,298598400,miopenConvolutionFwdAlgoGEMM
384-90-160-1x1-1152-90-160-1-0x0-1x1-1x1-0-NCHW-BF16-F=ConvHipImplicitGemmGroupFwdXdlops:0.0583407,45121536,miopenConvolutionFwdAlgoImplicitGEMM;ConvAsmImplicitGemmGTCDynamicFwdXdlopsNHWC:0.0674466,110592000,miopenConvolutionFwdAlgoImplicitGEMM;GemmFwd1x1_0_1:0.0334405,0,miopenConvolutionFwdAlgoGEMM
384-90-160-1x1-384-90-160-1-0x0-1x1-1x1-0-NCHW-BF16-F=ConvHipImplicitGemmGroupFwdXdlops:0.0393205,22413312,miopenConvolutionFwdAlgoImplicitGEMM;ConvAsmImplicitGemmGTCDynamicFwdXdlopsNHWC:0.0365766,44236800,miopenConvolutionFwdAlgoImplicitGEMM;GemmFwd1x1_0_1:0.0183733,0,miopenConvolutionFwdAlgoGEMM
384-180-320-3x3-192-180-320-1-1x1-1x1-1x1-0-NCHW-BF16-F=ConvHipImplicitGemmGroupFwdXdlops:0.137402,67682304,miopenConvolutionFwdAlgoImplicitGEMM;ConvAsmImplicitGemmGTCDynamicFwdXdlopsNHWC:0.22642,111919104,miopenConvolutionFwdAlgoImplicitGEMM;GemmFwdRest:0.321015,398131200,miopenConvolutionFwdAlgoGEMM
192-1-180-320-1x1x1-384-1-180-320-1-0x0x0-1x1x1-1x1x1-0-NCDHW-BF16-F=ConvHipImplicitGemm3DGroupFwdXdlops:0.0658275,66502656,miopenConvolutionFwdAlgoImplicitGEMM;GemmFwd1x1_0_1:0.0285468,0,miopenConvolutionFwdAlgoGEMM
192-3-182-322-3x3x3-384-1-180-320-1-0x0x0-1x1x1-1x1x1-0-NCDHW-BF16-F=ConvHipImplicitGemm3DGroupFwdXdlops:0.357581,115729920,miopenConvolutionFwdAlgoImplicitGEMM;GemmFwdRest:1.31999,597196800,miopenConvolutionFwdAlgoGEMM
384-3-182-322-3x3x3-384-1-180-320-1-0x0x0-1x1x1-1x1x1-0-NCDHW-BF16-F=ConvHipImplicitGemm3DGroupFwdXdlops:0.65116,187223040,miopenConvolutionFwdAlgoImplicitGEMM;GemmFwdRest:2.52984,1194393600,miopenConvolutionFwdAlgoGEMM
384-360-640-3x3-192-360-640-1-1x1-1x1-1x1-0-NCHW-BF16-F=ConvHipImplicitGemmGroupFwdXdlops:0.520994,266747904,miopenConvolutionFwdAlgoImplicitGEMM;ConvAsmImplicitGemmGTCDynamicFwdXdlopsNHWC:0.798975,443695104,miopenConvolutionFwdAlgoImplicitGEMM;GemmFwdRest:1.15282,1592524800,miopenConvolutionFwdAlgoGEMM
192-3-362-642-3x3x3-192-1-360-640-1-0x0x0-1x1x1-1x1x1-0-NCDHW-BF16-F=ConvHipImplicitGemm3DGroupFwdXdlops:0.929833,358193664,miopenConvolutionFwdAlgoImplicitGEMM;GemmFwdRest:4.88079,2388787200,miopenConvolutionFwdAlgoGEMM
192-720-1280-3x3-96-720-1280-1-1x1-1x1-1x1-0-NCHW-BF16-F=ConvHipImplicitGemmGroupFwdXdlops:0.88229,531173376,miopenConvolutionFwdAlgoImplicitGEMM;ConvAsmImplicitGemmGTCDynamicFwdXdlopsNHWC:0.945102,885067776,miopenConvolutionFwdAlgoImplicitGEMM;GemmFwdRest:2.48418,3185049600,miopenConvolutionFwdAlgoGEMM
96-3-722-1282-3x3x3-96-1-720-1280-1-0x0x0-1x1x1-1x1x1-0-NCDHW-BF16-F=ConvHipImplicitGemm3DGroupFwdXdlops:1.48634,710592768,miopenConvolutionFwdAlgoImplicitGEMM;GemmFwdRest:9.87259,4777574400,miopenConvolutionFwdAlgoGEMM
96-3-722-1282-3x3x3-3-1-720-1280-1-0x0x0-1x1x1-1x1x1-0-NCDHW-BF16-F=ConvHipImplicitGemm3DGroupFwdXdlops:1.44606,538693120,miopenConvolutionFwdAlgoImplicitGEMM;GemmFwdRest:9.67585,4777574400,miopenConvolutionFwdAlgoGEMM
384-3-90-160-3x1x1-768-1-90-160-1-0x0x0-1x1x1-1x1x1-0-NCDHW-BF16-F=ConvHipImplicitGemm3DGroupFwdXdlops:0.0725342,57065472,miopenConvolutionFwdAlgoImplicitGEMM;GemmFwdRest:0.106661,33177600,miopenConvolutionFwdAlgoGEMM
384-180-320-3x3-192-180-320-2-1x1-1x1-1x1-0-NCHW-BF16-F=ConvHipImplicitGemmGroupFwdXdlops:0.262409,134037504,miopenConvolutionFwdAlgoImplicitGEMM;ConvAsmImplicitGemmGTCDynamicFwdXdlopsNHWC:0.412925,222511104,miopenConvolutionFwdAlgoImplicitGEMM;GemmFwdRest:0.631401,398131200,miopenConvolutionFwdAlgoGEMM
192-2-180-320-1x1x1-384-2-180-320-1-0x0x0-1x1x1-1x1x1-0-NCDHW-BF16-F=ConvHipImplicitGemm3DGroupFwdXdlops:0.114628,132857856,miopenConvolutionFwdAlgoImplicitGEMM;GemmFwd1x1_0_1:0.0561937,0,miopenConvolutionFwdAlgoGEMM
192-4-182-322-3x3x3-384-2-180-320-1-0x0x0-1x1x1-1x1x1-0-NCDHW-BF16-F=ConvHipImplicitGemm3DGroupFwdXdlops:0.712294,182470656,miopenConvolutionFwdAlgoImplicitGEMM;GemmFwdRest:2.52349,1194393600,miopenConvolutionFwdAlgoGEMM
384-4-182-322-3x3x3-384-2-180-320-1-0x0x0-1x1x1-1x1x1-0-NCDHW-BF16-F=ConvHipImplicitGemm3DGroupFwdXdlops:1.29937,276467712,miopenConvolutionFwdAlgoImplicitGEMM;GemmFwdRest:5.14964,2388787200,miopenConvolutionFwdAlgoGEMM
384-4-180-320-3x1x1-768-2-180-320-1-0x0x0-1x1x1-1x1x1-0-NCDHW-BF16-F=ConvHipImplicitGemm3DGroupFwdXdlops:0.446742,355663872,miopenConvolutionFwdAlgoImplicitGEMM;GemmFwdRest:0.739831,265420800,miopenConvolutionFwdAlgoGEMM
384-360-640-3x3-192-360-640-4-1x1-1x1-1x1-0-NCHW-BF16-F=ConvHipImplicitGemmGroupFwdXdlops:2.24396,1063010304,miopenConvolutionFwdAlgoImplicitGEMM;ConvAsmImplicitGemmGTCDynamicFwdXdlopsNHWC:2.95806,1770799104,miopenConvolutionFwdAlgoImplicitGEMM;GemmFwdRest:4.61877,1592524800,miopenConvolutionFwdAlgoGEMM
192-6-362-642-3x3x3-192-4-360-640-1-0x0x0-1x1x1-1x1x1-0-NCDHW-BF16-F=ConvHipImplicitGemm3DGroupFwdXdlops:2.9723,891343872,miopenConvolutionFwdAlgoImplicitGEMM
192-720-1280-3x3-96-720-1280-4-1x1-1x1-1x1-0-NCHW-BF16-F=ConvHipImplicitGemmGroupFwdXdlops:3.33463,2123698176,miopenConvolutionFwdAlgoImplicitGEMM;ConvAsmImplicitGemmGTCDynamicFwdXdlopsNHWC:3.56453,3539275776,miopenConvolutionFwdAlgoImplicitGEMM;GemmFwdRest:9.83332,3185049600,miopenConvolutionFwdAlgoGEMM
96-6-722-1282-3x3x3-96-4-720-1280-1-0x0x0-1x1x1-1x1x1-0-NCDHW-BF16-F=ConvHipImplicitGemm3DGroupFwdXdlops:5.29048,1774582272,miopenConvolutionFwdAlgoImplicitGEMM
96-6-722-1282-3x3x3-3-4-720-1280-1-0x0x0-1x1x1-1x1x1-0-NCDHW-BF16-F=ConvHipImplicitGemm3DGroupFwdXdlops:4.98753,1088429824,miopenConvolutionFwdAlgoImplicitGEMM
16-21-90-160-1x1x1-16-21-90-160-8-0x0x0-1x1x1-1x1x1-0-NCDHW-BF16-F=ConvHipImplicitGemm3DGroupFwdXdlops:0.13309,154829312,miopenConvolutionFwdAlgoImplicitGEMM;GemmFwd1x1_0_1:0.0472004,0,miopenConvolutionFwdAlgoGEMM
16-3-92-162-3x3x3-384-1-90-160-8-0x0x0-1x1x1-1x1x1-0-NCDHW-BF16-F=ConvHipImplicitGemm3DGroupFwdXdlops:0.127502,100251648,miopenConvolutionFwdAlgoImplicitGEMM;GemmFwdRest:0.438372,12441600,miopenConvolutionFwdAlgoGEMM
384-3-92-162-3x3x3-384-1-90-160-8-0x0x0-1x1x1-1x1x1-0-NCDHW-BF16-F=ConvHipImplicitGemm3DGroupFwdXdlops:1.26424,371146752,miopenConvolutionFwdAlgoImplicitGEMM;GemmFwdRest:5.76545,298598400,miopenConvolutionFwdAlgoGEMM
384-90-160-1x1-1152-90-160-8-0x0-1x1-1x1-0-NCHW-BF16-F=ConvHipImplicitGemmGroupFwdXdlops:0.404645,354779136,miopenConvolutionFwdAlgoImplicitGEMM;ConvAsmImplicitGemmGTCDynamicFwdXdlopsNHWC:0.386513,884736000,miopenConvolutionFwdAlgoImplicitGEMM;GemmFwd1x1_0_1:0.19229,0,miopenConvolutionFwdAlgoGEMM
384-90-160-1x1-384-90-160-8-0x0-1x1-1x1-0-NHWC-NHWC-NHWC-BF16-F=ConvHipImplicitGemmFwdXdlops:0.0689867,0,miopenConvolutionFwdAlgoImplicitGEMM;ConvHipImplicitGemmGroupFwdXdlops:0.0546966,0,miopenConvolutionFwdAlgoImplicitGEMM;ConvAsmImplicitGemmGTCDynamicFwdXdlopsNHWC:0.0926745,176947200,miopenConvolutionFwdAlgoImplicitGEMM
384-180-320-3x3-192-180-320-8-1x1-1x1-1x1-0-NCHW-BF16-F=ConvHipImplicitGemmGroupFwdXdlops:1.2602,532168704,miopenConvolutionFwdAlgoImplicitGEMM;ConvAsmImplicitGemmGTCDynamicFwdXdlopsNHWC:1.5018,886063104,miopenConvolutionFwdAlgoImplicitGEMM;GemmFwdRest:2.50383,398131200,miopenConvolutionFwdAlgoGEMM
192-1-180-320-1x1x1-384-1-180-320-8-0x0x0-1x1x1-1x1x1-0-NCDHW-BF16-F=ConvHipImplicitGemm3DGroupFwdXdlops:0.48168,530989056,miopenConvolutionFwdAlgoImplicitGEMM;GemmFwd1x1_0_1:0.15687,0,miopenConvolutionFwdAlgoGEMM
192-3-182-322-3x3x3-384-1-180-320-8-0x0x0-1x1x1-1x1x1-0-NCDHW-BF16-F=ConvHipImplicitGemm3DGroupFwdXdlops:2.64855,897970176,miopenConvolutionFwdAlgoImplicitGEMM;GemmFwdRest:10.5764,597196800,miopenConvolutionFwdAlgoGEMM
384-3-182-322-3x3x3-384-1-180-320-8-0x0x0-1x1x1-1x1x1-0-NCDHW-BF16-F=ConvHipImplicitGemm3DGroupFwdXdlops:5.20023,1442045952,miopenConvolutionFwdAlgoImplicitGEMM;GemmFwdRest:20.2655,1194393600,miopenConvolutionFwdAlgoGEMM
384-360-640-3x3-192-360-640-8-1x1-1x1-1x1-0-NCHW-BF16-F=ConvHipImplicitGemmGroupFwdXdlops:4.4735,2124693504,miopenConvolutionFwdAlgoImplicitGEMM;ConvAsmImplicitGemmGTCDynamicFwdXdlopsNHWC:5.93727,3540271104,miopenConvolutionFwdAlgoImplicitGEMM;GemmFwdRest:9.31892,1592524800,miopenConvolutionFwdAlgoGEMM
192-3-362-642-3x3x3-192-1-360-640-8-0x0x0-1x1x1-1x1x1-0-NCDHW-BF16-F=ConvHipImplicitGemm3DGroupFwdXdlops:6.65703,2851614720,miopenConvolutionFwdAlgoImplicitGEMM;GemmFwdRest:38.5968,2388787200,miopenConvolutionFwdAlgoGEMM
192-720-1280-3x3-96-720-1280-8-1x1-1x1-1x1-0-NCHW-BF16-F=ConvHipImplicitGemmGroupFwdXdlops:6.59307,4247064576,miopenConvolutionFwdAlgoImplicitGEMM;ConvAsmImplicitGemmGTCDynamicFwdXdlopsNHWC:7.36039,7078219776,miopenConvolutionFwdAlgoImplicitGEMM;GemmFwdRest:19.4644,3185049600,miopenConvolutionFwdAlgoGEMM
96-3-722-1282-3x3x3-96-1-720-1280-8-0x0x0-1x1x1-1x1x1-0-NCDHW-BF16-F=ConvHipImplicitGemm3DGroupFwdXdlops:12.4185,5681258496,miopenConvolutionFwdAlgoImplicitGEMM;GemmFwdRest:78.5719,4777574400,miopenConvolutionFwdAlgoGEMM
96-3-722-1282-3x3x3-3-1-720-1280-8-0x0x0-1x1x1-1x1x1-0-NCDHW-BF16-F=ConvHipImplicitGemm3DGroupFwdXdlops:11.5929,4309435648,miopenConvolutionFwdAlgoImplicitGEMM;GemmFwdRest:76.9744,4777574400,miopenConvolutionFwdAlgoGEMM
384-3-90-160-3x1x1-768-1-90-160-8-0x0x0-1x1x1-1x1x1-0-NCDHW-BF16-F=ConvHipImplicitGemm3DGroupFwdXdlops:0.474896,444137472,miopenConvolutionFwdAlgoImplicitGEMM;GemmFwdRest:0.858858,33177600,miopenConvolutionFwdAlgoGEMM
384-180-320-3x3-192-180-320-16-1x1-1x1-1x1-0-NCHW-BF16-F=ConvHipImplicitGemmGroupFwdXdlops:2.25737,1063010304,miopenConvolutionFwdAlgoImplicitGEMM;ConvAsmImplicitGemmGTCDynamicFwdXdlopsNHWC:2.96104,1770799104,miopenConvolutionFwdAlgoImplicitGEMM;GemmFwdRest:5.07288,398131200,miopenConvolutionFwdAlgoGEMM
192-2-180-320-1x1x1-384-2-180-320-8-0x0x0-1x1x1-1x1x1-0-NCDHW-BF16-F=ConvHipImplicitGemm3DGroupFwdXdlops:0.984383,1061830656,miopenConvolutionFwdAlgoImplicitGEMM;GemmFwd1x1_0_1:0.401869,0,miopenConvolutionFwdAlgoGEMM
192-4-182-322-3x3x3-384-2-180-320-8-0x0x0-1x1x1-1x1x1-0-NCDHW-BF16-F=ConvHipImplicitGemm3DGroupFwdXdlops:5.25185,1431896064,miopenConvolutionFwdAlgoImplicitGEMM;GemmFwdRest:20.2848,1194393600,miopenConvolutionFwdAlgoGEMM
384-4-182-322-3x3x3-384-2-180-320-8-0x0x0-1x1x1-1x1x1-0-NCDHW-BF16-F=ConvHipImplicitGemm3DGroupFwdXdlops:10.244,2156003328,miopenConvolutionFwdAlgoImplicitGEMM;GemmFwdRest:41.1764,2388787200,miopenConvolutionFwdAlgoGEMM
384-4-180-320-3x1x1-768-2-180-320-8-0x0x0-1x1x1-1x1x1-0-NCDHW-BF16-F=ConvHipImplicitGemm3DGroupFwdXdlops:3.42608,2832924672,miopenConvolutionFwdAlgoImplicitGEMM;GemmFwdRest:5.95726,265420800,miopenConvolutionFwdAlgoGEMM
384-360-640-3x3-192-360-640-3-1x1-1x1-1x1-0-NCHW-BF16-F=ConvHipImplicitGemmGroupFwdXdlops:1.73966,797589504,miopenConvolutionFwdAlgoImplicitGEMM;ConvAsmImplicitGemmGTCDynamicFwdXdlopsNHWC:2.2664,1328431104,miopenConvolutionFwdAlgoImplicitGEMM;GemmFwdRest:3.56903,1592524800,miopenConvolutionFwdAlgoGEMM
384-360-640-3x3-192-360-640-2-1x1-1x1-1x1-0-NCHW-BF16-F=ConvHipImplicitGemmGroupFwdXdlops:1.17987,532168704,miopenConvolutionFwdAlgoImplicitGEMM;ConvAsmImplicitGemmGTCDynamicFwdXdlopsNHWC:1.5594,886063104,miopenConvolutionFwdAlgoImplicitGEMM;GemmFwdRest:2.31627,1592524800,miopenConvolutionFwdAlgoGEMM
192-6-362-642-3x3x3-192-4-360-640-8-0x0x0-1x1x1-1x1x1-0-NCDHW-BF16-F=ConvHipImplicitGemm3DGroupFwdXdlops:27.9973,7116816384,miopenConvolutionFwdAlgoImplicitGEMM
16-21-90-160-1x1x1-16-21-90-160-16-0x0x0-1x1x1-1x1x1-0-NCDHW-BF16-F=ConvHipImplicitGemm3DGroupFwdXdlops:0.268736,309658112,miopenConvolutionFwdAlgoImplicitGEMM;GemmFwd1x1_0_1:0.087081,0,miopenConvolutionFwdAlgoGEMM
16-3-92-162-3x3x3-384-1-90-160-16-0x0x0-1x1x1-1x1x1-0-NCDHW-BF16-F=ConvHipImplicitGemm3DGroupFwdXdlops:0.251049,200171520,miopenConvolutionFwdAlgoImplicitGEMM;GemmFwdRest:0.86377,12441600,miopenConvolutionFwdAlgoGEMM
384-3-92-162-3x3x3-384-1-90-160-16-0x0x0-1x1x1-1x1x1-0-NCDHW-BF16-F=ConvHipImplicitGemm3DGroupFwdXdlops:2.44546,734330880,miopenConvolutionFwdAlgoImplicitGEMM;GemmFwdRest:11.4273,298598400,miopenConvolutionFwdAlgoGEMM
384-90-160-1x1-1152-90-160-16-0x0-1x1-1x1-0-NCHW-BF16-F=ConvHipImplicitGemmGroupFwdXdlops:0.771269,708673536,miopenConvolutionFwdAlgoImplicitGEMM;ConvAsmImplicitGemmGTCDynamicFwdXdlopsNHWC:0.803603,1769472000,miopenConvolutionFwdAlgoImplicitGEMM;GemmFwd1x1_0_1:0.417154,0,miopenConvolutionFwdAlgoGEMM
384-90-160-1x1-384-90-160-16-0x0-1x1-1x1-0-NHWC-NHWC-NHWC-BF16-F=ConvHipImplicitGemmFwdXdlops:0.148311,0,miopenConvolutionFwdAlgoImplicitGEMM;ConvHipImplicitGemmGroupFwdXdlops:0.130108,0,miopenConvolutionFwdAlgoImplicitGEMM;ConvAsmImplicitGemmGTCDynamicFwdXdlopsNHWC:0.191476,353894400,miopenConvolutionFwdAlgoImplicitGEMM
192-1-180-320-1x1x1-384-1-180-320-16-0x0x0-1x1x1-1x1x1-0-NCDHW-BF16-F=ConvHipImplicitGemm3DGroupFwdXdlops:0.939811,1061830656,miopenConvolutionFwdAlgoImplicitGEMM;GemmFwd1x1_0_1:0.389565,0,miopenConvolutionFwdAlgoGEMM
192-3-182-322-3x3x3-384-1-180-320-16-0x0x0-1x1x1-1x1x1-0-NCDHW-BF16-F=ConvHipImplicitGemm3DGroupFwdXdlops:5.24657,1791959040,miopenConvolutionFwdAlgoImplicitGEMM;GemmFwdRest:21.3613,597196800,miopenConvolutionFwdAlgoGEMM
384-3-182-322-3x3x3-384-1-180-320-16-0x0x0-1x1x1-1x1x1-0-NCDHW-BF16-F=ConvHipImplicitGemm3DGroupFwdXdlops:10.1634,2876129280,miopenConvolutionFwdAlgoImplicitGEMM;GemmFwdRest:40.2504,1194393600,miopenConvolutionFwdAlgoGEMM
384-360-640-3x3-192-360-640-16-1x1-1x1-1x1-0-NCHW-BF16-F=ConvHipImplicitGemmGroupFwdXdlops:9.2552,4248059904,miopenConvolutionFwdAlgoImplicitGEMM;ConvAsmImplicitGemmGTCDynamicFwdXdlopsNHWC:11.6514,7079215104,miopenConvolutionFwdAlgoImplicitGEMM;GemmFwdRest:18.9463,1592524800,miopenConvolutionFwdAlgoGEMM
192-3-362-642-3x3x3-192-1-360-640-16-0x0x0-1x1x1-1x1x1-0-NCDHW-BF16-F=ConvHipImplicitGemm3DGroupFwdXdlops:13.227,5701238784,miopenConvolutionFwdAlgoImplicitGEMM;GemmFwdRest:78.9391,2388787200,miopenConvolutionFwdAlgoGEMM
384-3-90-160-3x1x1-768-1-90-160-16-0x0x0-1x1x1-1x1x1-0-NCDHW-BF16-F=ConvHipImplicitGemm3DGroupFwdXdlops:0.911344,886505472,miopenConvolutionFwdAlgoImplicitGEMM;GemmFwdRest:1.71105,33177600,miopenConvolutionFwdAlgoGEMM
384-180-320-3x3-192-180-320-32-1x1-1x1-1x1-0-NCHW-BF16-F=ConvHipImplicitGemmGroupFwdXdlops:4.53488,2124693504,miopenConvolutionFwdAlgoImplicitGEMM;ConvAsmImplicitGemmGTCDynamicFwdXdlopsNHWC:5.77491,3540271104,miopenConvolutionFwdAlgoImplicitGEMM;GemmFwdRest:9.86081,398131200,miopenConvolutionFwdAlgoGEMM
192-2-180-320-1x1x1-384-2-180-320-16-0x0x0-1x1x1-1x1x1-0-NCDHW-BF16-F=ConvHipImplicitGemm3DGroupFwdXdlops:1.96107,2123513856,miopenConvolutionFwdAlgoImplicitGEMM;GemmFwd1x1_0_1:0.750995,0,miopenConvolutionFwdAlgoGEMM
192-4-182-322-3x3x3-384-2-180-320-16-0x0x0-1x1x1-1x1x1-0-NCDHW-BF16-F=ConvHipImplicitGemm3DGroupFwdXdlops:10.4752,2859810816,miopenConvolutionFwdAlgoImplicitGEMM;GemmFwdRest:40.1313,1194393600,miopenConvolutionFwdAlgoGEMM
384-4-182-322-3x3x3-384-2-180-320-16-0x0x0-1x1x1-1x1x1-0-NCDHW-BF16-F=ConvHipImplicitGemm3DGroupFwdXdlops:22.2425,4304044032,miopenConvolutionFwdAlgoImplicitGEMM;GemmFwdRest:81.567,2388787200,miopenConvolutionFwdAlgoGEMM
384-4-180-320-3x1x1-768-2-180-320-16-0x0x0-1x1x1-1x1x1-0-NCDHW-BF16-F=ConvHipImplicitGemm3DGroupFwdXdlops:6.87749,5664079872,miopenConvolutionFwdAlgoImplicitGEMM;GemmFwdRest:11.8302,265420800,miopenConvolutionFwdAlgoGEMM
