closed/AMD/src/wan-2.2-t2v-a14b/miopen/gfx942130.HIP.3_5_1_fc29218849.ufdb.txt
16-21-102-78-1x1x1-16-21-102-78-1-0x0x0-1x1x1-1x1x1-0-NCDHW-FP32-F=ConvHipImplicitGemm3DGroupFwdXdlops:0.048673,21386752,miopenConvolutionFwdAlgoImplicitGEMM;GemmFwd1x1_0_1:0.0484392,0,miopenConvolutionFwdAlgoGEMM;ConvDirectNaiveConvFwd:5.42389,0,miopenConvolutionFwdAlgoDirect
16-3-140-106-3x3x3-384-1-138-104-1-0x0x0-1x1x1-1x1x1-0-NCDHW-FP32-F=ConvHipImplicitGemm3DGroupFwdXdlops:0.107978,25557504,miopenConvolutionFwdAlgoImplicitGEMM;GemmFwdRest:0.12199,24800256,miopenConvolutionFwdAlgoGEMM;ConvDirectNaiveConvFwd:4.95535,0,miopenConvolutionFwdAlgoDirect
192-1-412-312-1x1x1-384-1-412-312-1-0x0x0-1x1x1-1x1x1-0-NCDHW-FP32-F=ConvHipImplicitGemm3DGroupFwdXdlops:0.497752,296460288,miopenConvolutionFwdAlgoImplicitGEMM;GemmFwd1x1_0_1:0.284768,0,miopenConvolutionFwdAlgoGEMM;ConvDirectNaiveConvFwd:50.6068,0,miopenConvolutionFwdAlgoDirect
192-3-278-210-3x3x3-384-1-276-208-1-0x0x0-1x1x1-1x1x1-0-NCDHW-FP32-F=ConvHipImplicitGemm3DGroupFwdXdlops:2.67335,230648832,miopenConvolutionFwdAlgoImplicitGEMM;GemmFwdRest:4.0385,1190412288,miopenConvolutionFwdAlgoGEMM;ConvDirectNaiveConvFwd:239.422,0,miopenConvolutionFwdAlgoDirect
192-3-826-626-3x3x3-192-1-824-624-1-0x0x0-1x1x1-1x1x1-0-NCDHW-FP32-F=ConvHipImplicitGemm3DGroupFwdXdlops:13.1576,1590211584,miopenConvolutionFwdAlgoImplicitGEMM;GemmFwdRest:26.3973,10661953536,miopenConvolutionFwdAlgoGEMM;ConvDirectNaiveConvFwd:2387.41,0,miopenConvolutionFwdAlgoDirect
192-1104-832-3x3-96-1104-832-1-1x1-1x1-1x1-0-NCHW-FP32-F=ConvBinWinogradRxSf2x3g1:3.49976,0,miopenConvolutionFwdAlgoWinograd;ConvBinWinogradRxSf3x2:5.56536,0,miopenConvolutionFwdAlgoWinograd;ConvHipImplicitGemmGroupFwdXdlops:5.09901,1058807808,miopenConvolutionFwdAlgoImplicitGEMM;ConvAsmImplicitGemmGTCDynamicFwdXdlopsNHWC:4.87812,1058807808,miopenConvolutionFwdAlgoImplicitGEMM;GemmFwdRest:6.78696,6348865536,miopenConvolutionFwdAlgoGEMM;ConvDirectNaiveConvFwd:1389.33,0,miopenConvolutionFwdAlgoDirect
192-409-313-3x3-192-204-156-1-0x0-2x2-1x1-0-NCHW-FP32-F=ConvBinWinogradRxSf2x3g1:0.93373,0,miopenConvolutionFwdAlgoWinograd;ConvBinWinogradRxSf3x2:0.519655,0,miopenConvolutionFwdAlgoWinograd;ConvHipImplicitGemmGroupFwdXdlops:0.368764,124084992,miopenConvolutionFwdAlgoImplicitGEMM;ConvAsmImplicitGemmGTCDynamicFwdXdlopsNHWC:0.339146,124084992,miopenConvolutionFwdAlgoImplicitGEMM;GemmFwdRest:0.434339,219967488,miopenConvolutionFwdAlgoGEMM;ConvDirectNaiveConvFwd:44.3986,0,miopenConvolutionFwdAlgoDirect
192-816-624-3x3-96-816-624-1-1x1-1x1-1x1-0-NCHW-FP32-F=ConvBinWinogradRxSf2x3g1:1.8532,0,miopenConvolutionFwdAlgoWinograd;ConvBinWinogradRxSf3x2:3.12807,0,miopenConvolutionFwdAlgoWinograd;ConvHipImplicitGemmGroupFwdXdlops:2.90818,587243520,miopenConvolutionFwdAlgoImplicitGEMM;ConvAsmImplicitGemmGTCDynamicFwdXdlopsNHWC:2.7976,587243520,miopenConvolutionFwdAlgoImplicitGEMM;GemmFwdRest:3.82491,3519479808,miopenConvolutionFwdAlgoGEMM;ConvDirectNaiveConvFwd:658.712,0,miopenConvolutionFwdAlgoDirect
3-3-1650-1250-3x3x3-96-1-1648-1248-1-0x0x0-1x1x1-1x1x1-0-NCDHW-FP32-F=ConvHipImplicitGemm3DGroupFwdXdlops:1.65564,864055808,miopenConvolutionFwdAlgoImplicitGEMM;GemmFwdRest:2.04052,666372096,miopenConvolutionFwdAlgoGEMM;ConvDirectNaiveConvFwd:135.149,0,miopenConvolutionFwdAlgoDirect
3-6-1650-1250-3x3x3-96-4-1648-1248-1-0x0x0-1x1x1-1x1x1-0-NCDHW-FP32-F=ConvHipImplicitGemm3DGroupFwdXdlops:8.26104,3307628800,miopenConvolutionFwdAlgoImplicitGEMM;GemmFwdRest:7.91667,2665488384,miopenConvolutionFwdAlgoGEMM;ConvDirectNaiveConvFwd:538.762,0,miopenConvolutionFwdAlgoDirect
32-21-206-156-1x1x1-32-21-206-156-1-0x0x0-1x1x1-1x1x1-0-NCDHW-FP32-F=ConvHipImplicitGemm3DGroupFwdXdlops:0.252343,172767232,miopenConvolutionFwdAlgoImplicitGEMM;GemmFwd1x1_0_1:0.180029,0,miopenConvolutionFwdAlgoGEMM;ConvDirectNaiveConvFwd:46.8726,0,miopenConvolutionFwdAlgoDirect
384-3-102-78-3x1x1-768-1-102-78-1-0x0x0-1x1x1-1x1x1-0-NCDHW-FP32-F=ConvHipImplicitGemm3DGroupFwdXdlops:0.274662,64641024,miopenConvolutionFwdAlgoImplicitGEMM;GemmFwdRest:0.23459,36661248,miopenConvolutionFwdAlgoGEMM;ConvDirectNaiveConvFwd:17.5011,0,miopenConvolutionFwdAlgoDirect
384-3-104-80-3x3x3-384-1-102-78-1-0x0x0-1x1x1-1x1x1-0-NCDHW-FP32-F=ConvHipImplicitGemm3DGroupFwdXdlops:1.00543,66484224,miopenConvolutionFwdAlgoImplicitGEMM;GemmFwdRest:1.20376,329951232,miopenConvolutionFwdAlgoGEMM;ConvDirectNaiveConvFwd:71.485,0,miopenConvolutionFwdAlgoDirect
384-3-140-106-3x3x3-384-1-138-104-1-0x0x0-1x1x1-1x1x1-0-NCDHW-FP32-F=ConvHipImplicitGemm3DGroupFwdXdlops:1.63771,106352640,miopenConvolutionFwdAlgoImplicitGEMM;GemmFwdRest:2.20249,595206144,miopenConvolutionFwdAlgoGEMM;ConvDirectNaiveConvFwd:126.789,0,miopenConvolutionFwdAlgoDirect
384-3-208-158-3x3x3-384-1-206-156-1-0x0x0-1x1x1-1x1x1-0-NCDHW-FP32-F=ConvHipImplicitGemm3DGroupFwdXdlops:3.18481,216723456,miopenConvolutionFwdAlgoImplicitGEMM;GemmFwdRest:4.59371,1332744192,miopenConvolutionFwdAlgoGEMM;ConvDirectNaiveConvFwd:288.283,0,miopenConvolutionFwdAlgoDirect
384-4-206-158-3x3x3-384-2-204-156-1-0x0x0-1x1x1-1x1x1-0-NCDHW-FP32-F=ConvHipImplicitGemm3DGroupFwdXdlops:5.88651,313663488,miopenConvolutionFwdAlgoImplicitGEMM;GemmFwdRest:8.88533,2639609856,miopenConvolutionFwdAlgoGEMM;ConvDirectNaiveConvFwd:570.038,0,miopenConvolutionFwdAlgoDirect
384-4-412-312-3x1x1-768-2-412-312-1-0x0x0-1x1x1-1x1x1-0-NCDHW-FP32-F=ConvHipImplicitGemm3DGroupFwdXdlops:6.41482,1583087616,miopenConvolutionFwdAlgoImplicitGEMM;GemmFwdRest:6.69484,1184661504,miopenConvolutionFwdAlgoGEMM;ConvDirectNaiveConvFwd:660.583,0,miopenConvolutionFwdAlgoDirect
384-138-104-1x1-1152-138-104-1-0x0-1x1-1x1-0-NCHW-FP32-F=ConvBinWinogradRxSf2x3g1:1.22574,0,miopenConvolutionFwdAlgoWinograd;ConvBinWinogradRxSf3x2:0.589279,0,miopenConvolutionFwdAlgoWinograd;ConvHipImplicitGemmGroupFwdXdlops:0.246868,89948160,miopenConvolutionFwdAlgoImplicitGEMM;ConvAsmImplicitGemmGTCDynamicFwdXdlopsNHWC:0.213072,88178688,miopenConvolutionFwdAlgoImplicitGEMM;GemmFwd1x1_0_1:0.177505,0,miopenConvolutionFwdAlgoGEMM;ConvDirectNaiveConvFwd:9.15681,0,miopenConvolutionFwdAlgoDirect
384-205-157-3x3-384-102-78-1-0x0-2x2-1x1-0-NCHW-FP32-F=ConvBinWinogradRxSf2x3g1:1.03687,0,miopenConvolutionFwdAlgoWinograd;ConvBinWinogradRxSf3x2:0.598327,0,miopenConvolutionFwdAlgoWinograd;ConvHipImplicitGemmGroupFwdXdlops:0.398114,66964992,miopenConvolutionFwdAlgoImplicitGEMM;ConvAsmImplicitGemmGTCDynamicFwdXdlopsNHWC:0.304663,66964992,miopenConvolutionFwdAlgoImplicitGEMM;GemmFwdRest:0.347333,109983744,miopenConvolutionFwdAlgoGEMM;ConvDirectNaiveConvFwd:23.6432,0,miopenConvolutionFwdAlgoDirect
384-276-208-3x3-192-276-208-1-1x1-1x1-1x1-0-NCHW-FP32-F=ConvBinWinogradRxSf2x3g1:0.771683,0,miopenConvolutionFwdAlgoWinograd;ConvBinWinogradRxSf3x2:1.30151,0,miopenConvolutionFwdAlgoWinograd;ConvHipImplicitGemmGroupFwdXdlops:1.04491,134922240,miopenConvolutionFwdAlgoImplicitGEMM;ConvAsmImplicitGemmGTCDynamicFwdXdlopsNHWC:0.945382,134922240,miopenConvolutionFwdAlgoImplicitGEMM;GemmFwdRest:1.41331,793608192,miopenConvolutionFwdAlgoGEMM;ConvDirectNaiveConvFwd:139.944,0,miopenConvolutionFwdAlgoDirect
384-413-313-3x3-384-206-156-1-0x0-2x2-1x1-0-NCHW-FP32-F=ConvBinWinogradRxSf2x3g1:3.52295,0,miopenConvolutionFwdAlgoWinograd;ConvBinWinogradRxSf3x2:1.77801,0,miopenConvolutionFwdAlgoWinograd;ConvHipImplicitGemmGroupFwdXdlops:1.17807,253226496,miopenConvolutionFwdAlgoImplicitGEMM;ConvAsmImplicitGemmGTCDynamicFwdXdlopsNHWC:1.1313,253226496,miopenConvolutionFwdAlgoImplicitGEMM;GemmFwdRest:1.25914,444248064,miopenConvolutionFwdAlgoGEMM;ConvDirectNaiveConvFwd:93.0344,0,miopenConvolutionFwdAlgoDirect
96-1-408-312-1x1x1-192-1-408-312-1-0x0x0-1x1x1-1x1x1-0-NCDHW-FP32-F=ConvHipImplicitGemm3DGroupFwdXdlops:0.195646,146718720,miopenConvolutionFwdAlgoImplicitGEMM;GemmFwd1x1_0_1:0.124933,0,miopenConvolutionFwdAlgoGEMM;ConvDirectNaiveConvFwd:24.598,0,miopenConvolutionFwdAlgoDirect
96-1-824-624-1x1x1-192-1-824-624-1-0x0x0-1x1x1-1x1x1-0-NCDHW-FP32-F=ConvHipImplicitGemm3DGroupFwdXdlops:0.824883,592404480,miopenConvolutionFwdAlgoImplicitGEMM;GemmFwd1x1_0_1:0.519008,0,miopenConvolutionFwdAlgoGEMM;ConvDirectNaiveConvFwd:119.236,0,miopenConvolutionFwdAlgoDirect
96-3-1106-834-3x3x3-96-1-1104-832-1-0x0x0-1x1x1-1x1x1-0-NCDHW-FP32-F=ConvHipImplicitGemm3DGroupFwdXdlops:7.63767,1416319488,miopenConvolutionFwdAlgoImplicitGEMM;GemmFwdRest:17.5457,9523298304,miopenConvolutionFwdAlgoGEMM;ConvDirectNaiveConvFwd:1944.29,0,miopenConvolutionFwdAlgoDirect
96-3-410-314-3x3x3-192-1-408-312-1-0x0x0-1x1x1-1x1x1-0-NCDHW-FP32-F=ConvHipImplicitGemm3DGroupFwdXdlops:1.74821,248062464,miopenConvolutionFwdAlgoImplicitGEMM;GemmFwdRest:3.24001,1319804928,miopenConvolutionFwdAlgoGEMM;ConvDirectNaiveConvFwd:250.716,0,miopenConvolutionFwdAlgoDirect
96-3-554-418-3x3x3-192-1-552-416-1-0x0x0-1x1x1-1x1x1-0-NCDHW-FP32-F=ConvHipImplicitGemm3DGroupFwdXdlops:2.8282,445118976,miopenConvolutionFwdAlgoImplicitGEMM;GemmFwdRest:6.05627,2380824576,miopenConvolutionFwdAlgoGEMM;ConvDirectNaiveConvFwd:478.597,0,miopenConvolutionFwdAlgoDirect
96-3-818-626-3x3x3-3-1-816-624-1-0x0x0-1x1x1-1x1x1-0-NCDHW-FP32-F=ConvHipImplicitGemm3DGroupFwdXdlops:1.90051,596043776,miopenConvolutionFwdAlgoImplicitGEMM;GemmFwdRest:9.12331,5279219712,miopenConvolutionFwdAlgoGEMM;ConvDirectNaiveConvFwd:1085.82,0,miopenConvolutionFwdAlgoDirect
96-3-826-626-3x3x3-192-1-824-624-1-0x0x0-1x1x1-1x1x1-0-NCDHW-FP32-F=ConvHipImplicitGemm3DGroupFwdXdlops:6.52494,992549376,miopenConvolutionFwdAlgoImplicitGEMM;GemmFwdRest:13.521,5330976768,miopenConvolutionFwdAlgoGEMM;ConvDirectNaiveConvFwd:1090.84,0,miopenConvolutionFwdAlgoDirect
96-6-1106-834-3x3x3-96-4-1104-832-1-0x0x0-1x1x1-1x1x1-0-NCDHW-FP32-F=ConvHipImplicitGemm3DGroupFwdXdlops:29.1436,3537073152,miopenConvolutionFwdAlgoImplicitGEMM;ConvDirectNaiveConvFwd:7775.22,0,miopenConvolutionFwdAlgoDirect
96-6-554-418-3x3x3-192-4-552-416-1-0x0x0-1x1x1-1x1x1-0-NCDHW-FP32-F=ConvHipImplicitGemm3DGroupFwdXdlops:10.8577,1240962048,miopenConvolutionFwdAlgoImplicitGEMM;GemmFwdRest:23.061,9523298304,miopenConvolutionFwdAlgoGEMM;ConvDirectNaiveConvFwd:1918.12,0,miopenConvolutionFwdAlgoDirect
96-6-818-626-3x3x3-96-4-816-624-1-0x0x0-1x1x1-1x1x1-0-NCDHW-FP32-F=ConvHipImplicitGemm3DGroupFwdXdlops:16.5771,1962906624,miopenConvolutionFwdAlgoImplicitGEMM;ConvDirectNaiveConvFwd:4286.07,0,miopenConvolutionFwdAlgoDirect
96-1105-833-3x3-96-552-416-1-0x0-2x2-1x1-0-NCHW-FP32-F=ConvBinWinogradRxSf2x3g1:1.70635,0,miopenConvolutionFwdAlgoWinograd;ConvBinWinogradRxSf3x2:0.829346,0,miopenConvolutionFwdAlgoWinograd;ConvHipImplicitGemmGroupFwdXdlops:0.903996,441969152,miopenConvolutionFwdAlgoImplicitGEMM;ConvAsmImplicitGemmGTCDynamicFwdXdlopsNHWC:0.903662,441969152,miopenConvolutionFwdAlgoImplicitGEMM;GemmFwdRest:1.01217,793608192,miopenConvolutionFwdAlgoGEMM;ConvDirectNaiveConvFwd:173.044,0,miopenConvolutionFwdAlgoDirect
96-1649-1249-3x3-96-824-624-1-0x0-2x2-1x1-0-NCHW-FP32-F=ConvBinWinogradRxSf2x3g1:3.8089,0,miopenConvolutionFwdAlgoWinograd;ConvBinWinogradRxSf3x2:1.88402,0,miopenConvolutionFwdAlgoWinograd;ConvHipImplicitGemmGroupFwdXdlops:2.03948,988662272,miopenConvolutionFwdAlgoImplicitGEMM;ConvAsmImplicitGemmGTCDynamicFwdXdlopsNHWC:1.97,988662272,miopenConvolutionFwdAlgoImplicitGEMM;GemmFwdRest:2.3095,1776992256,miopenConvolutionFwdAlgoGEMM;ConvDirectNaiveConvFwd:389.387,0,miopenConvolutionFwdAlgoDirect
96-817-625-3x3-96-408-312-1-0x0-2x2-1x1-0-NCHW-FP32-F=ConvBinWinogradRxSf2x3g1:0.924932,0,miopenConvolutionFwdAlgoWinograd;ConvBinWinogradRxSf3x2:0.460287,0,miopenConvolutionFwdAlgoWinograd;ConvHipImplicitGemmGroupFwdXdlops:0.544556,245293568,miopenConvolutionFwdAlgoImplicitGEMM;ConvAsmImplicitGemmGTCDynamicFwdXdlopsNHWC:0.523811,245293568,miopenConvolutionFwdAlgoImplicitGEMM;GemmFwdRest:0.597532,439934976,miopenConvolutionFwdAlgoGEMM;ConvDirectNaiveConvFwd:87.8279,0,miopenConvolutionFwdAlgoDirect
384-276-208-3x3-192-276-208-2-1x1-1x1-1x1-0-NCHW-FP32-F=ConvBinWinogradRxSf2x3g1:1.54375,0,miopenConvolutionFwdAlgoWinograd;ConvBinWinogradRxSf3x2:2.63078,0,miopenConvolutionFwdAlgoWinograd;ConvHipImplicitGemmGroupFwdXdlops:1.82943,267190272,miopenConvolutionFwdAlgoImplicitGEMM;ConvAsmImplicitGemmGTCDynamicFwdXdlopsNHWC:1.88017,267190272,miopenConvolutionFwdAlgoImplicitGEMM;GemmFwdRest:2.75275,793608192,miopenConvolutionFwdAlgoGEMM;ConvDirectNaiveConvFwd:163.309,0,miopenConvolutionFwdAlgoDirect
192-1648-1248-3x3-96-1648-1248-4-1x1-1x1-1x1-0-NCHW-FP32-F=ConvBinWinogradRxSf2x3g1:34.9025,0,miopenConvolutionFwdAlgoWinograd;ConvBinWinogradRxSf3x2:50.6149,0,miopenConvolutionFwdAlgoWinograd;ConvHipImplicitGemmGroupFwdXdlops:45.3439,9477955584,miopenConvolutionFwdAlgoImplicitGEMM;ConvAsmImplicitGemmGTCDynamicFwdXdlopsNHWC:43.3653,9477955584,miopenConvolutionFwdAlgoImplicitGEMM;GemmFwdRest:62.1547,14215938048,miopenConvolutionFwdAlgoGEMM;ConvDirectNaiveConvFwd:3854.74,0,miopenConvolutionFwdAlgoDirect
192-3-826-626-3x3x3-192-1-824-624-1-0x0x0-1x1x1-1x1x1-0-NCDHW-BF16-F=ConvHipImplicitGemm3DGroupFwdXdlops:3.7273,795105792,miopenConvolutionFwdAlgoImplicitGEMM;GemmFwdRest:14.521,5330976768,miopenConvolutionFwdAlgoGEMM;ConvDirectNaiveConvFwd:2062.91,0,miopenConvolutionFwdAlgoDirect
192-6-410-314-3x3x3-192-4-408-312-1-0x0x0-1x1x1-1x1x1-0-NCDHW-BF16-F=ConvHipImplicitGemm3DGroupFwdXdlops:3.49876,494134272,miopenConvolutionFwdAlgoImplicitGEMM;GemmFwdRest:14.2207,5279219712,miopenConvolutionFwdAlgoGEMM;ConvDirectNaiveConvFwd:1944.74,0,miopenConvolutionFwdAlgoDirect
192-1104-832-3x3-96-1104-832-1-1x1-1x1-1x1-0-NCHW-BF16-F=ConvHipImplicitGemmGroupFwdXdlops:1.52854,529403904,miopenConvolutionFwdAlgoImplicitGEMM;ConvAsmImplicitGemmGTCDynamicFwdXdlopsNHWC:1.4585,882118656,miopenConvolutionFwdAlgoImplicitGEMM;GemmFwdRest:3.5035,3174432768,miopenConvolutionFwdAlgoGEMM;ConvDirectNaiveConvFwd:1395.11,0,miopenConvolutionFwdAlgoDirect
192-1648-1248-3x3-96-1648-1248-1-1x1-1x1-1x1-0-NCHW-BF16-F=ConvHipImplicitGemmGroupFwdXdlops:3.30516,1184993280,miopenConvolutionFwdAlgoImplicitGEMM;ConvAsmImplicitGemmGTCDynamicFwdXdlopsNHWC:3.27088,1974767616,miopenConvolutionFwdAlgoImplicitGEMM;GemmFwdRest:7.99148,7107969024,miopenConvolutionFwdAlgoGEMM;ConvDirectNaiveConvFwd:2797.89,0,miopenConvolutionFwdAlgoDirect
32-21-102-78-1x1x1-32-21-102-78-1-0x0x0-1x1x1-1x1x1-0-NCDHW-BF16-F=ConvHipImplicitGemm3DGroupFwdXdlops:0.0634317,21387776,miopenConvolutionFwdAlgoImplicitGEMM;GemmFwd1x1_0_1:0.07512,0,miopenConvolutionFwdAlgoGEMM;ConvDirectNaiveConvFwd:10.4187,0,miopenConvolutionFwdAlgoDirect
32-21-138-104-1x1x1-32-21-138-104-1-0x0x0-1x1x1-1x1x1-0-NCDHW-BF16-F=ConvHipImplicitGemm3DGroupFwdXdlops:0.0811008,38580224,miopenConvolutionFwdAlgoImplicitGEMM;GemmFwd1x1_0_1:0.0970892,0,miopenConvolutionFwdAlgoGEMM;ConvDirectNaiveConvFwd:18.8529,0,miopenConvolutionFwdAlgoDirect
36-21-102-78-1x2x2-5120-21-51-39-1-0x0x0-1x2x2-1x1x1-0-NCDHW-BF16-F=ConvHipImplicitGemm3DGroupFwdXdlops:1.28706,441218816,miopenConvolutionFwdAlgoImplicitGEMM;GemmFwdRest:0.513419,12029472,miopenConvolutionFwdAlgoGEMM;ConvDirectNaiveConvFwd:27.3465,0,miopenConvolutionFwdAlgoDirect
384-3-102-78-3x1x1-384-1-102-78-1-0x0x0-2x1x1-1x1x1-0-NCDHW-BF16-F=ConvHipImplicitGemm3DGroupFwdXdlops:0.0669793,25325568,miopenConvolutionFwdAlgoImplicitGEMM;GemmFwdRest:0.096087,18330624,miopenConvolutionFwdAlgoGEMM;ConvDirectNaiveConvFwd:16.4232,0,miopenConvolutionFwdAlgoDirect
384-3-102-78-3x1x1-768-1-102-78-1-0x0x0-1x1x1-1x1x1-0-NCDHW-BF16-F=ConvHipImplicitGemm3DGroupFwdXdlops:0.0944812,32320512,miopenConvolutionFwdAlgoImplicitGEMM;GemmFwdRest:0.150305,18330624,miopenConvolutionFwdAlgoGEMM;ConvDirectNaiveConvFwd:16.6468,0,miopenConvolutionFwdAlgoDirect
384-3-138-104-3x1x1-384-1-138-104-1-0x0x0-2x1x1-1x1x1-0-NCDHW-BF16-F=ConvHipImplicitGemm3DGroupFwdXdlops:0.1114,44974080,miopenConvolutionFwdAlgoImplicitGEMM;GemmFwdRest:0.153195,33067008,miopenConvolutionFwdAlgoGEMM;ConvDirectNaiveConvFwd:29.3529,0,miopenConvolutionFwdAlgoDirect
384-3-140-106-3x3x3-32-1-138-104-1-0x0x0-1x1x1-1x1x1-0-NCDHW-BF16-F=ConvHipImplicitGemm3DGroupFwdXdlops:0.142725,35773440,miopenConvolutionFwdAlgoImplicitGEMM;GemmFwdRest:0.687343,297603072,miopenConvolutionFwdAlgoGEMM;ConvDirectNaiveConvFwd:122.216,0,miopenConvolutionFwdAlgoDirect
384-3-206-158-3x3x3-384-1-204-156-1-0x0x0-1x1x1-1x1x1-0-NCDHW-BF16-F=ConvHipImplicitGemm3DGroupFwdXdlops:0.758171,107394048,miopenConvolutionFwdAlgoImplicitGEMM;GemmFwdRest:2.19733,659902464,miopenConvolutionFwdAlgoGEMM;ConvDirectNaiveConvFwd:244.406,0,miopenConvolutionFwdAlgoDirect
384-4-204-156-3x1x1-768-2-204-156-1-0x0x0-1x1x1-1x1x1-0-NCDHW-BF16-F=ConvHipImplicitGemm3DGroupFwdXdlops:0.45617,197296128,miopenConvolutionFwdAlgoImplicitGEMM;GemmFwdRest:0.624383,146644992,miopenConvolutionFwdAlgoGEMM;ConvDirectNaiveConvFwd:129.937,0,miopenConvolutionFwdAlgoDirect
384-4-278-210-3x3x3-384-2-276-208-1-0x0x0-1x1x1-1x1x1-0-NCDHW-BF16-F=ConvHipImplicitGemm3DGroupFwdXdlops:2.31408,275484672,miopenConvolutionFwdAlgoImplicitGEMM;GemmFwdRest:7.53455,2380824576,miopenConvolutionFwdAlgoGEMM;ConvDirectNaiveConvFwd:893.072,0,miopenConvolutionFwdAlgoDirect
384-102-78-1x1-384-102-78-1-0x0-1x1-1x1-0-NCHW-BF16-F=ConvHipImplicitGemmGroupFwdXdlops:0.0457199,12515328,miopenConvolutionFwdAlgoImplicitGEMM;ConvAsmImplicitGemmGTCDynamicFwdXdlopsNHWC:0.040872,24440832,miopenConvolutionFwdAlgoImplicitGEMM;GemmFwd1x1_0_1:0.0266332,0,miopenConvolutionFwdAlgoGEMM;ConvDirectNaiveConvFwd:5.12986,0,miopenConvolutionFwdAlgoDirect
384-138-104-1x1-384-138-104-1-0x0-1x1-1x1-0-NCHW-BF16-F=ConvHipImplicitGemmGroupFwdXdlops:0.0648892,22339584,miopenConvolutionFwdAlgoImplicitGEMM;ConvAsmImplicitGemmGTCDynamicFwdXdlopsNHWC:0.0631286,44089344,miopenConvolutionFwdAlgoImplicitGEMM;GemmFwd1x1_0_1:0.0388902,0,miopenConvolutionFwdAlgoGEMM;ConvDirectNaiveConvFwd:9.13563,0,miopenConvolutionFwdAlgoDirect
384-206-156-1x1-1152-206-156-1-0x0-1x1-1x1-0-NCHW-BF16-F=ConvHipImplicitGemmGroupFwdXdlops:0.263445,99606528,miopenConvolutionFwdAlgoImplicitGEMM;ConvAsmImplicitGemmGTCDynamicFwdXdlopsNHWC:0.22173,246804480,miopenConvolutionFwdAlgoImplicitGEMM;GemmFwd1x1_0_1:0.119639,0,miopenConvolutionFwdAlgoGEMM;ConvDirectNaiveConvFwd:21.2066,0,miopenConvolutionFwdAlgoDirect
384-277-209-3x3-384-138-104-1-0x0-2x2-1x1-0-NCHW-BF16-F=ConvHipImplicitGemmGroupFwdXdlops:0.206889,58138368,miopenConvolutionFwdAlgoImplicitGEMM;ConvAsmImplicitGemmGTCDynamicFwdXdlopsNHWC:0.243216,80183040,miopenConvolutionFwdAlgoImplicitGEMM;GemmFwdRest:0.327883,99201024,miopenConvolutionFwdAlgoGEMM;ConvDirectNaiveConvFwd:42.6302,0,miopenConvolutionFwdAlgoDirect
384-552-416-3x3-192-552-416-1-1x1-1x1-1x1-0-NCHW-BF16-F=ConvHipImplicitGemmGroupFwdXdlops:1.00526,265863168,miopenConvolutionFwdAlgoImplicitGEMM;ConvAsmImplicitGemmGTCDynamicFwdXdlopsNHWC:1.0393,442220544,miopenConvolutionFwdAlgoImplicitGEMM;GemmFwdRest:1.68679,1587216384,miopenConvolutionFwdAlgoGEMM;ConvDirectNaiveConvFwd:598.075,0,miopenConvolutionFwdAlgoDirect
96-3-1106-834-3x3x3-96-1-1104-832-1-0x0x0-1x1x1-1x1x1-0-NCDHW-BF16-F=ConvHipImplicitGemm3DGroupFwdXdlops:2.18692,708159744,miopenConvolutionFwdAlgoImplicitGEMM;GemmFwdRest:12.4416,4761649152,miopenConvolutionFwdAlgoGEMM;ConvDirectNaiveConvFwd:1836.55,0,miopenConvolutionFwdAlgoDirect
96-3-554-418-3x3x3-192-1-552-416-1-0x0x0-1x1x1-1x1x1-0-NCDHW-BF16-F=ConvHipImplicitGemm3DGroupFwdXdlops:0.914228,222559488,miopenConvolutionFwdAlgoImplicitGEMM;GemmFwdRest:3.07855,1190412288,miopenConvolutionFwdAlgoGEMM;ConvDirectNaiveConvFwd:432.672,0,miopenConvolutionFwdAlgoDirect
96-3-818-626-3x3x3-96-1-816-624-1-0x0x0-1x1x1-1x1x1-0-NCDHW-BF16-F=ConvHipImplicitGemm3DGroupFwdXdlops:1.25253,393212160,miopenConvolutionFwdAlgoImplicitGEMM;GemmFwdRest:7.06947,2639609856,miopenConvolutionFwdAlgoGEMM;ConvDirectNaiveConvFwd:1014.5,0,miopenConvolutionFwdAlgoDirect
96-4-408-312-1x1x1-192-4-408-312-1-0x0x0-1x1x1-1x1x1-0-NCDHW-BF16-F=ConvHipImplicitGemm3DGroupFwdXdlops:0.572826,293326848,miopenConvolutionFwdAlgoImplicitGEMM;GemmFwd1x1_0_1:0.270661,0,miopenConvolutionFwdAlgoGEMM;ConvDirectNaiveConvFwd:98.0627,0,miopenConvolutionFwdAlgoDirect
96-6-1106-834-3x3x3-3-4-1104-832-1-0x0x0-1x1x1-1x1x1-0-NCDHW-BF16-F=ConvHipImplicitGemm3DGroupFwdXdlops:4.07183,1084669696,miopenConvolutionFwdAlgoImplicitGEMM;ConvDirectNaiveConvFwd:7477.93,0,miopenConvolutionFwdAlgoDirect
96-6-410-314-3x3x3-192-4-408-312-1-0x0x0-1x1x1-1x1x1-0-NCDHW-BF16-F=ConvHipImplicitGemm3DGroupFwdXdlops:1.8322,344830464,miopenConvolutionFwdAlgoImplicitGEMM;GemmFwdRest:7.16684,2639609856,miopenConvolutionFwdAlgoGEMM;ConvDirectNaiveConvFwd:957.001,0,miopenConvolutionFwdAlgoDirect
96-6-554-418-3x3x3-192-4-552-416-1-0x0x0-1x1x1-1x1x1-0-NCDHW-BF16-F=ConvHipImplicitGemm3DGroupFwdXdlops:3.24777,620481024,miopenConvolutionFwdAlgoImplicitGEMM;GemmFwdRest:12.8825,4761649152,miopenConvolutionFwdAlgoGEMM;ConvDirectNaiveConvFwd:1765.67,0,miopenConvolutionFwdAlgoDirect
96-6-818-626-3x3x3-96-4-816-624-1-0x0x0-1x1x1-1x1x1-0-NCDHW-BF16-F=ConvHipImplicitGemm3DGroupFwdXdlops:4.02167,981453312,miopenConvolutionFwdAlgoImplicitGEMM;ConvDirectNaiveConvFwd:4064.05,0,miopenConvolutionFwdAlgoDirect
96-1105-833-3x3-96-552-416-1-0x0-2x2-1x1-0-NCHW-BF16-F=ConvHipImplicitGemmGroupFwdXdlops:0.422058,220984576,miopenConvolutionFwdAlgoImplicitGEMM;ConvAsmImplicitGemmGTCDynamicFwdXdlopsNHWC:0.398829,309163264,miopenConvolutionFwdAlgoImplicitGEMM;GemmFwdRest:0.569523,396804096,miopenConvolutionFwdAlgoGEMM;ConvDirectNaiveConvFwd:165.443,0,miopenConvolutionFwdAlgoDirect
96-1649-1249-3x3-96-824-624-1-0x0-2x2-1x1-0-NCHW-BF16-F=ConvHipImplicitGemmGroupFwdXdlops:0.930955,494331136,miopenConvolutionFwdAlgoImplicitGEMM;ConvAsmImplicitGemmGTCDynamicFwdXdlopsNHWC:0.900608,691774720,miopenConvolutionFwdAlgoImplicitGEMM;GemmFwdRest:1.36013,888496128,miopenConvolutionFwdAlgoGEMM;ConvDirectNaiveConvFwd:404.124,0,miopenConvolutionFwdAlgoDirect
96-817-625-3x3-96-408-312-1-0x0-2x2-1x1-0-NCHW-BF16-F=ConvHipImplicitGemmGroupFwdXdlops:0.250042,122646784,miopenConvolutionFwdAlgoImplicitGEMM;ConvAsmImplicitGemmGTCDynamicFwdXdlopsNHWC:0.245025,171528448,miopenConvolutionFwdAlgoImplicitGEMM;GemmFwdRest:0.332483,219967488,miopenConvolutionFwdAlgoGEMM;ConvDirectNaiveConvFwd:90.897,0,miopenConvolutionFwdAlgoDirect
384-205-157-3x3-384-102-78-2-0x0-2x2-1x1-0-NCHW-BF16-F=ConvHipImplicitGemmGroupFwdXdlops:0.200788,64310784,miopenConvolutionFwdAlgoImplicitGEMM;ConvAsmImplicitGemmGTCDynamicFwdXdlopsNHWC:0.24207,88751616,miopenConvolutionFwdAlgoImplicitGEMM;GemmFwdRest:0.402875,54991872,miopenConvolutionFwdAlgoGEMM;ConvDirectNaiveConvFwd:24.8858,0,miopenConvolutionFwdAlgoDirect
384-412-312-3x3-192-412-312-2-1x1-1x1-1x1-0-NCHW-BF16-F=ConvHipImplicitGemmGroupFwdXdlops:1.09101,297492480,miopenConvolutionFwdAlgoImplicitGEMM;ConvAsmImplicitGemmGTCDynamicFwdXdlopsNHWC:1.19462,494936064,miopenConvolutionFwdAlgoImplicitGEMM;GemmFwdRest:2.26925,888496128,miopenConvolutionFwdAlgoGEMM;ConvDirectNaiveConvFwd:336.992,0,miopenConvolutionFwdAlgoDirect
192-409-313-3x3-192-204-156-4-0x0-2x2-1x1-0-NCHW-BF16-F=ConvHipImplicitGemmGroupFwdXdlops:0.569236,246179328,miopenConvolutionFwdAlgoImplicitGEMM;ConvAsmImplicitGemmGTCDynamicFwdXdlopsNHWC:0.563418,343942656,miopenConvolutionFwdAlgoImplicitGEMM;GemmFwdRest:0.758516,109983744,miopenConvolutionFwdAlgoGEMM;ConvDirectNaiveConvFwd:48.9979,0,miopenConvolutionFwdAlgoDirect
192-816-624-3x3-96-816-624-4-1x1-1x1-1x1-0-NCHW-BF16-F=ConvHipImplicitGemmGroupFwdXdlops:3.67474,1173491712,miopenConvolutionFwdAlgoImplicitGEMM;ConvAsmImplicitGemmGTCDynamicFwdXdlopsNHWC:3.42321,1955598336,miopenConvolutionFwdAlgoImplicitGEMM;GemmFwdRest:8.48293,1759739904,miopenConvolutionFwdAlgoGEMM;ConvDirectNaiveConvFwd:768.738,0,miopenConvolutionFwdAlgoDirect
384-552-416-3x3-192-552-416-4-1x1-1x1-1x1-0-NCHW-BF16-F=ConvHipImplicitGemmGroupFwdXdlops:4.56477,1059471360,miopenConvolutionFwdAlgoImplicitGEMM;ConvAsmImplicitGemmGTCDynamicFwdXdlopsNHWC:4.27713,1764900864,miopenConvolutionFwdAlgoImplicitGEMM;GemmFwdRest:6.46004,1587216384,miopenConvolutionFwdAlgoGEMM;ConvDirectNaiveConvFwd:874.906,0,miopenConvolutionFwdAlgoDirect
96-1649-1249-3x3-96-824-624-4-0x0-2x2-1x1-0-NCHW-BF16-F=ConvHipImplicitGemmGroupFwdXdlops:3.73287,1976826624,miopenConvolutionFwdAlgoImplicitGEMM;ConvAsmImplicitGemmGTCDynamicFwdXdlopsNHWC:3.47784,2766600960,miopenConvolutionFwdAlgoImplicitGEMM;GemmFwdRest:5.31072,888496128,miopenConvolutionFwdAlgoGEMM;ConvDirectNaiveConvFwd:419.996,0,miopenConvolutionFwdAlgoDirect
128-11-130-258-3x3x3-128-9-128-256-1-0x0x0-1x1x1-1x1x1-0-NCDHW-FP16-F=ConvHipImplicitGemm3DGroupFwdXdlops:0.88564,170830848,miopenConvolutionFwdAlgoImplicitGEMM;GemmFwdRest:5.27362,2038431744,miopenConvolutionFwdAlgoGEMM;ConvDirectNaiveConvFwd:803.573,0,miopenConvolutionFwdAlgoDirect
128-11-258-130-3x3x3-3-9-256-128-1-0x0x0-1x1x1-1x1x1-0-NCDHW-FP16-F=ConvHipImplicitGemm3DGroupFwdXdlops:0.570033,96238848,miopenConvolutionFwdAlgoImplicitGEMM;GemmFwdRest:5.10197,2038431744,miopenConvolutionFwdAlgoGEMM;ConvDirectNaiveConvFwd:857.939,0,miopenConvolutionFwdAlgoDirect
128-19-130-258-3x3x3-128-17-128-256-1-0x0x0-1x1x1-1x1x1-0-NCDHW-FP16-F=ConvHipImplicitGemm3DGroupFwdXdlops:1.61404,306629632,miopenConvolutionFwdAlgoImplicitGEMM;GemmFwdRest:10.1942,3850371072,miopenConvolutionFwdAlgoGEMM;ConvDirectNaiveConvFwd:1515.94,0,miopenConvolutionFwdAlgoDirect
128-19-162-258-3x3x3-3-17-160-256-1-0x0x0-1x1x1-1x1x1-0-NCDHW-FP16-F=ConvHipImplicitGemm3DGroupFwdXdlops:1.52473,207494400,miopenConvolutionFwdAlgoImplicitGEMM;GemmFwdRest:12.0871,4812963840,miopenConvolutionFwdAlgoGEMM;ConvDirectNaiveConvFwd:1912.5,0,miopenConvolutionFwdAlgoDirect
16-3-16-24-1x1x1-16-3-16-24-1-0x0x0-1x1x1-1x1x1-0-NCDHW-FP16-F=ConvHipImplicitGemm3DGroupFwdXdlops:0.0235954,74240,miopenConvolutionFwdAlgoImplicitGEMM;GemmFwd1x1_0_1:0.00731783,0,miopenConvolutionFwdAlgoGEMM;ConvDirectNaiveConvFwd:0.0352869,0,miopenConvolutionFwdAlgoDirect
16-3-18-16-1x1x1-16-3-18-16-1-0x0x0-1x1x1-1x1x1-0-NCDHW-FP16-F=ConvHipImplicitGemm3DGroupFwdXdlops:0.0235868,55808,miopenConvolutionFwdAlgoImplicitGEMM;GemmFwd1x1_0_1:0.0070986,0,miopenConvolutionFwdAlgoGEMM;ConvDirectNaiveConvFwd:0.0283621,0,miopenConvolutionFwdAlgoDirect
16-3-32-16-1x1x1-16-3-32-16-1-0x0x0-1x1x1-1x1x1-0-NCDHW-FP16-F=ConvHipImplicitGemm3DGroupFwdXdlops:0.028941,98816,miopenConvolutionFwdAlgoImplicitGEMM;GemmFwd1x1_0_1:0.0082926,0,miopenConvolutionFwdAlgoGEMM;ConvDirectNaiveConvFwd:0.0417424,0,miopenConvolutionFwdAlgoDirect
16-5-16-24-1x1x1-16-5-16-24-1-0x0x0-1x1x1-1x1x1-0-NCDHW-FP16-F=ConvHipImplicitGemm3DGroupFwdXdlops:0.0264332,123392,miopenConvolutionFwdAlgoImplicitGEMM;GemmFwd1x1_0_1:0.008781,0,miopenConvolutionFwdAlgoGEMM;ConvDirectNaiveConvFwd:0.0551622,0,miopenConvolutionFwdAlgoDirect
16-5-18-32-1x1x1-16-5-18-32-1-0x0x0-1x1x1-1x1x1-0-NCDHW-FP16-F=ConvHipImplicitGemm3DGroupFwdXdlops:0.0238104,184832,miopenConvolutionFwdAlgoImplicitGEMM;GemmFwd1x1_0_1:0.0086206,0,miopenConvolutionFwdAlgoGEMM;ConvDirectNaiveConvFwd:0.081782,0,miopenConvolutionFwdAlgoDirect
16-5-20-32-1x1x1-16-5-20-32-1-0x0x0-1x1x1-1x1x1-0-NCDHW-FP16-F=ConvHipImplicitGemm3DGroupFwdXdlops:0.023468,205312,miopenConvolutionFwdAlgoImplicitGEMM;GemmFwd1x1_0_1:0.008204,0,miopenConvolutionFwdAlgoGEMM;ConvDirectNaiveConvFwd:0.0880114,0,miopenConvolutionFwdAlgoDirect
16-5-32-16-1x1x1-16-5-32-16-1-0x0x0-1x1x1-1x1x1-0-NCDHW-FP16-F=ConvHipImplicitGemm3DGroupFwdXdlops:0.0241827,164352,miopenConvolutionFwdAlgoImplicitGEMM;GemmFwd1x1_0_1:0.008413,0,miopenConvolutionFwdAlgoGEMM;ConvDirectNaiveConvFwd:0.0682536,0,miopenConvolutionFwdAlgoDirect
16-5-34-26-3x3x3-512-3-32-24-1-0x0x0-1x1x1-1x1x1-0-NCDHW-FP16-F=ConvHipImplicitGemm3DGroupFwdXdlops:0.0352257,2943232,miopenConvolutionFwdAlgoImplicitGEMM;GemmFwdRest:0.0296042,1990656,miopenConvolutionFwdAlgoGEMM;ConvDirectNaiveConvFwd:0.729888,0,miopenConvolutionFwdAlgoDirect
16-7-20-34-3x3x3-512-5-18-32-1-0x0x0-1x1x1-1x1x1-0-NCDHW-FP16-F=ConvHipImplicitGemm3DGroupFwdXdlops:0.038524,3543808,miopenConvolutionFwdAlgoImplicitGEMM;GemmFwdRest:0.0542477,2488320,miopenConvolutionFwdAlgoGEMM;ConvDirectNaiveConvFwd:0.97605,0,miopenConvolutionFwdAlgoDirect
16-7-34-26-3x3x3-512-5-32-24-1-0x0x0-1x1x1-1x1x1-0-NCDHW-FP16-F=ConvHipImplicitGemm3DGroupFwdXdlops:0.0462282,4572672,miopenConvolutionFwdAlgoImplicitGEMM;GemmFwdRest:0.0436518,3317760,miopenConvolutionFwdAlgoGEMM;ConvDirectNaiveConvFwd:1.21497,0,miopenConvolutionFwdAlgoDirect
256-11-130-194-3x3x3-256-9-128-192-1-0x0x0-1x1x1-1x1x1-0-NCDHW-FP16-F=ConvHipImplicitGemm3DGroupFwdXdlops:2.07249,258824192,miopenConvolutionFwdAlgoImplicitGEMM;GemmFwdRest:9.0505,3057647616,miopenConvolutionFwdAlgoGEMM;ConvDirectNaiveConvFwd:1244.33,0,miopenConvolutionFwdAlgoDirect
256-11-162-194-3x3x3-128-9-160-192-1-0x0x0-1x1x1-1x1x1-0-NCDHW-FP16-F=ConvHipImplicitGemm3DGroupFwdXdlops:1.56063,249550848,miopenConvolutionFwdAlgoImplicitGEMM;GemmFwdRest:10.0127,3822059520,miopenConvolutionFwdAlgoGEMM;ConvDirectNaiveConvFwd:1569.75,0,miopenConvolutionFwdAlgoDirect
256-11-258-194-3x3x3-256-9-256-192-1-0x0x0-1x1x1-1x1x1-0-NCDHW-FP16-F=ConvHipImplicitGemm3DGroupFwdXdlops:4.12255,511924224,miopenConvolutionFwdAlgoImplicitGEMM;GemmFwdRest:16.698,6115295232,miopenConvolutionFwdAlgoGEMM;ConvDirectNaiveConvFwd:2537.68,0,miopenConvolutionFwdAlgoDirect
256-19-130-194-3x3x3-256-17-128-192-1-0x0x0-1x1x1-1x1x1-0-NCDHW-FP16-F=ConvHipImplicitGemm3DGroupFwdXdlops:3.83109,462788608,miopenConvolutionFwdAlgoImplicitGEMM;GemmFwdRest:15.9095,5775556608,miopenConvolutionFwdAlgoGEMM;ConvDirectNaiveConvFwd:2380.26,0,miopenConvolutionFwdAlgoDirect
256-19-162-258-3x3x3-256-17-160-256-1-0x0x0-1x1x1-1x1x1-0-NCDHW-FP16-F=ConvHipImplicitGemm3DGroupFwdXdlops:6.19088,766646272,miopenConvolutionFwdAlgoImplicitGEMM;ConvDirectNaiveConvFwd:3828.64,0,miopenConvolutionFwdAlgoDirect
256-7-130-98-3x3x3-256-5-128-96-1-0x0x0-1x1x1-1x1x1-0-NCDHW-FP16-F=ConvHipImplicitGemm3DGroupFwdXdlops:0.605677,80656384,miopenConvolutionFwdAlgoImplicitGEMM;GemmFwdRest:2.53226,849346560,miopenConvolutionFwdAlgoGEMM;ConvDirectNaiveConvFwd:354.664,0,miopenConvolutionFwdAlgoDirect
256-7-74-66-3x3x3-256-5-72-64-1-0x0x0-1x1x1-1x1x1-0-NCDHW-FP16-F=ConvHipImplicitGemm3DGroupFwdXdlops:0.306028,32839680,miopenConvolutionFwdAlgoImplicitGEMM;GemmFwdRest:0.96805,318504960,miopenConvolutionFwdAlgoGEMM;ConvDirectNaiveConvFwd:136.924,0,miopenConvolutionFwdAlgoDirect
256-9-128-192-1x1x1-128-9-128-192-1-0x0x0-1x1x1-1x1x1-0-NCDHW-FP16-F=ConvHipImplicitGemm3DGroupFwdXdlops:0.274056,169934848,miopenConvolutionFwdAlgoImplicitGEMM;GemmFwd1x1_0_1:0.111847,0,miopenConvolutionFwdAlgoGEMM;ConvDirectNaiveConvFwd:111.834,0,miopenConvolutionFwdAlgoDirect
256-9-160-192-1x1x1-128-9-160-192-1-0x0x0-1x1x1-1x1x1-0-NCDHW-FP16-F=ConvHipImplicitGemm3DGroupFwdXdlops:0.34464,212402176,miopenConvolutionFwdAlgoImplicitGEMM;GemmFwd1x1_0_1:0.153563,0,miopenConvolutionFwdAlgoGEMM;ConvDirectNaiveConvFwd:140.315,0,miopenConvolutionFwdAlgoDirect
256-9-256-256-1x1x1-128-9-256-256-1-0x0x0-1x1x1-1x1x1-0-NCDHW-FP16-F=ConvHipImplicitGemm3DGroupFwdXdlops:0.740201,453050368,miopenConvolutionFwdAlgoImplicitGEMM;GemmFwd1x1_0_1:0.354169,0,miopenConvolutionFwdAlgoGEMM;ConvDirectNaiveConvFwd:368.468,0,miopenConvolutionFwdAlgoDirect
512-11-130-66-3x3x3-512-9-128-64-1-0x0x0-1x1x1-1x1x1-0-NCDHW-FP16-F=ConvHipImplicitGemm3DGroupFwdXdlops:2.55292,186298368,miopenConvolutionFwdAlgoImplicitGEMM;GemmFwdRest:7.60276,2038431744,miopenConvolutionFwdAlgoGEMM;ConvDirectNaiveConvFwd:880.566,0,miopenConvolutionFwdAlgoDirect
512-11-66-130-3x3x3-512-9-64-128-1-0x0x0-1x1x1-1x1x1-0-NCDHW-FP16-F=ConvHipImplicitGemm3DGroupFwdXdlops:2.29335,186298368,miopenConvolutionFwdAlgoImplicitGEMM;GemmFwdRest:7.72712,2038431744,miopenConvolutionFwdAlgoGEMM;ConvDirectNaiveConvFwd:851.474,0,miopenConvolutionFwdAlgoDirect
512-11-74-66-3x3x3-256-9-72-64-1-0x0x0-1x1x1-1x1x1-0-NCDHW-FP16-F=ConvHipImplicitGemm3DGroupFwdXdlops:1.0171,83324928,miopenConvolutionFwdAlgoImplicitGEMM;GemmFwdRest:3.55585,1146617856,miopenConvolutionFwdAlgoGEMM;ConvDirectNaiveConvFwd:494.495,0,miopenConvolutionFwdAlgoDirect
512-11-82-98-3x3x3-512-9-80-96-1-0x0x0-1x1x1-1x1x1-0-NCDHW-FP16-F=ConvHipImplicitGemm3DGroupFwdXdlops:2.50532,175452160,miopenConvolutionFwdAlgoImplicitGEMM;GemmFwdRest:7.47097,1911029760,miopenConvolutionFwdAlgoGEMM;ConvDirectNaiveConvFwd:882.179,0,miopenConvolutionFwdAlgoDirect
512-5-64-128-1x1x1-256-5-64-128-1-0x0x0-1x1x1-1x1x1-0-NCDHW-FP16-F=ConvHipImplicitGemm3DGroupFwdXdlops:0.119458,63176704,miopenConvolutionFwdAlgoImplicitGEMM;GemmFwd1x1_0_1:0.0503217,0,miopenConvolutionFwdAlgoGEMM;ConvDirectNaiveConvFwd:40.7955,0,miopenConvolutionFwdAlgoDirect
512-5-72-64-1x1x1-256-5-72-64-1-0x0x0-1x1x1-1x1x1-0-NCDHW-FP16-F=ConvHipImplicitGemm3DGroupFwdXdlops:0.0801993,35651584,miopenConvolutionFwdAlgoImplicitGEMM;GemmFwd1x1_0_1:0.0330628,0,miopenConvolutionFwdAlgoGEMM;ConvDirectNaiveConvFwd:23.0176,0,miopenConvolutionFwdAlgoDirect
512-7-130-98-3x3x3-256-5-128-96-1-0x0x0-1x1x1-1x1x1-0-NCDHW-FP16-F=ConvHipImplicitGemm3DGroupFwdXdlops:1.234,129855488,miopenConvolutionFwdAlgoImplicitGEMM;GemmFwdRest:5.24914,1698693120,miopenConvolutionFwdAlgoGEMM;ConvDirectNaiveConvFwd:698.99,0,miopenConvolutionFwdAlgoDirect
512-7-42-50-3x3x3-512-5-40-48-1-0x0x0-1x1x1-1x1x1-0-NCDHW-FP16-F=ConvHipImplicitGemm3DGroupFwdXdlops:0.468081,39038976,miopenConvolutionFwdAlgoImplicitGEMM;GemmFwdRest:1.03933,265420800,miopenConvolutionFwdAlgoGEMM;ConvDirectNaiveConvFwd:109.864,0,miopenConvolutionFwdAlgoDirect
512-7-66-98-3x3x3-512-5-64-96-1-0x0x0-1x1x1-1x1x1-0-NCDHW-FP16-F=ConvHipImplicitGemm3DGroupFwdXdlops:1.01415,91975680,miopenConvolutionFwdAlgoImplicitGEMM;GemmFwdRest:2.85665,849346560,miopenConvolutionFwdAlgoGEMM;ConvDirectNaiveConvFwd:352.556,0,miopenConvolutionFwdAlgoDirect
512-7-82-98-3x3x3-512-5-80-96-1-0x0x0-1x1x1-1x1x1-0-NCDHW-FP16-F=ConvHipImplicitGemm3DGroupFwdXdlops:1.4278,111079424,miopenConvolutionFwdAlgoImplicitGEMM;GemmFwdRest:3.77158,1061683200,miopenConvolutionFwdAlgoGEMM;ConvDirectNaiveConvFwd:463.752,0,miopenConvolutionFwdAlgoDirect
512-9-80-96-1x1x1-256-9-80-96-1-0x0x0-1x1x1-1x1x1-0-NCDHW-FP16-F=ConvHipImplicitGemm3DGroupFwdXdlops:0.166312,106430464,miopenConvolutionFwdAlgoImplicitGEMM;GemmFwd1x1_0_1:0.0751988,0,miopenConvolutionFwdAlgoGEMM;ConvDirectNaiveConvFwd:69.7902,0,miopenConvolutionFwdAlgoDirect
16-21-102-78-1x1x1-16-21-102-78-1-0x0x0-1x1x1-1x1x1-0-NCDHW-FP32-F=ConvHipImplicitGemm3DGroupFwdXdlops:0.0489598,21386752,miopenConvolutionFwdAlgoImplicitGEMM;GemmFwd1x1_0_1:0.0485523,0,miopenConvolutionFwdAlgoGEMM;ConvDirectNaiveConvFwd:5.4599,0,miopenConvolutionFwdAlgoDirect
192-1-204-156-1x1x1-384-1-204-156-1-0x0x0-1x1x1-1x1x1-0-NCDHW-FP32-F=ConvHipImplicitGemm3DGroupFwdXdlops:0.147243,73617408,miopenConvolutionFwdAlgoImplicitGEMM;GemmFwd1x1_0_1:0.0763056,0,miopenConvolutionFwdAlgoGEMM;ConvDirectNaiveConvFwd:12.2454,0,miopenConvolutionFwdAlgoDirect
192-2-276-208-1x1x1-384-2-276-208-1-0x0x0-1x1x1-1x1x1-0-NCDHW-FP32-F=ConvHipImplicitGemm3DGroupFwdXdlops:0.477426,264830976,miopenConvolutionFwdAlgoImplicitGEMM;GemmFwd1x1_0_1:0.245887,0,miopenConvolutionFwdAlgoGEMM;ConvDirectNaiveConvFwd:45.9149,0,miopenConvolutionFwdAlgoDirect
192-3-410-314-3x3x3-192-1-408-312-1-0x0x0-1x1x1-1x1x1-0-NCDHW-FP32-F=ConvHipImplicitGemm3DGroupFwdXdlops:3.44313,398361600,miopenConvolutionFwdAlgoImplicitGEMM;GemmFwdRest:6.53184,2639609856,miopenConvolutionFwdAlgoGEMM;ConvDirectNaiveConvFwd:535.222,0,miopenConvolutionFwdAlgoDirect
192-4-206-158-3x3x3-384-2-204-156-1-0x0x0-1x1x1-1x1x1-0-NCDHW-FP32-F=ConvHipImplicitGemm3DGroupFwdXdlops:2.93554,205713408,miopenConvolutionFwdAlgoImplicitGEMM;GemmFwdRest:4.51566,1319804928,miopenConvolutionFwdAlgoGEMM;ConvDirectNaiveConvFwd:273.266,0,miopenConvolutionFwdAlgoDirect
192-4-414-314-3x3x3-384-2-412-312-1-0x0x0-1x1x1-1x1x1-0-NCDHW-FP32-F=ConvHipImplicitGemm3DGroupFwdXdlops:11.3832,802197504,miopenConvolutionFwdAlgoImplicitGEMM;GemmFwdRest:18.423,5330976768,miopenConvolutionFwdAlgoGEMM;ConvDirectNaiveConvFwd:1127.01,0,miopenConvolutionFwdAlgoDirect
192-6-826-626-3x3x3-192-4-824-624-1-0x0x0-1x1x1-1x1x1-0-NCDHW-FP32-F=ConvHipImplicitGemm3DGroupFwdXdlops:57.8615,3966216192,miopenConvolutionFwdAlgoImplicitGEMM;ConvDirectNaiveConvFwd:9482.95,0,miopenConvolutionFwdAlgoDirect
32-21-138-104-1x1x1-32-21-138-104-1-0x0x0-1x1x1-1x1x1-0-NCDHW-FP32-F=ConvHipImplicitGemm3DGroupFwdXdlops:0.11172,77160448,miopenConvolutionFwdAlgoImplicitGEMM;GemmFwd1x1_0_1:0.0872498,0,miopenConvolutionFwdAlgoGEMM;ConvDirectNaiveConvFwd:19.1986,0,miopenConvolutionFwdAlgoDirect
36-21-206-156-1x2x2-5120-21-103-78-1-0x0x0-1x2x2-1x1x1-0-NCDHW-FP32-F=ConvHipImplicitGemm3DGroupFwdXdlops:9.56557,3555391232,miopenConvolutionFwdAlgoImplicitGEMM;GemmFwdRest:4.10866,97179264,miopenConvolutionFwdAlgoGEMM;ConvDirectNaiveConvFwd:128.523,0,miopenConvolutionFwdAlgoDirect
384-3-208-158-3x3x3-384-1-206-156-1-0x0x0-1x1x1-1x1x1-0-NCDHW-FP32-F=ConvHipImplicitGemm3DGroupFwdXdlops:3.23363,216723456,miopenConvolutionFwdAlgoImplicitGEMM;GemmFwdRest:4.67293,1332744192,miopenConvolutionFwdAlgoGEMM;ConvDirectNaiveConvFwd:285.163,0,miopenConvolutionFwdAlgoDirect
384-4-206-158-3x3x3-384-2-204-156-1-0x0x0-1x1x1-1x1x1-0-NCDHW-FP32-F=ConvHipImplicitGemm3DGroupFwdXdlops:5.95006,313663488,miopenConvolutionFwdAlgoImplicitGEMM;GemmFwdRest:9.03892,2639609856,miopenConvolutionFwdAlgoGEMM;ConvDirectNaiveConvFwd:570.462,0,miopenConvolutionFwdAlgoDirect
384-4-412-312-3x1x1-768-2-412-312-1-0x0x0-1x1x1-1x1x1-0-NCDHW-FP32-F=ConvHipImplicitGemm3DGroupFwdXdlops:6.43862,1583087616,miopenConvolutionFwdAlgoImplicitGEMM;GemmFwdRest:7.01896,1184661504,miopenConvolutionFwdAlgoGEMM;ConvDirectNaiveConvFwd:664.739,0,miopenConvolutionFwdAlgoDirect
384-138-104-1x1-384-138-104-1-0x0-1x1-1x1-0-NCHW-FP32-F=ConvBinWinogradRxSf2x3g1:0.43696,0,miopenConvolutionFwdAlgoWinograd;ConvBinWinogradRxSf3x2:0.235082,0,miopenConvolutionFwdAlgoWinograd;ConvHipImplicitGemmGroupFwdXdlops:0.112841,44679168,miopenConvolutionFwdAlgoImplicitGEMM;ConvAsmImplicitGemmGTCDynamicFwdXdlopsNHWC:0.110702,44089344,miopenConvolutionFwdAlgoImplicitGEMM;GemmFwd1x1_0_1:0.0804602,0,miopenConvolutionFwdAlgoGEMM;ConvDirectNaiveConvFwd:9.07256,0,miopenConvolutionFwdAlgoDirect
384-206-156-1x1-1152-206-156-1-0x0-1x1-1x1-0-NCHW-FP32-F=ConvBinWinogradRxSf2x3g1:2.62,0,miopenConvolutionFwdAlgoWinograd;ConvBinWinogradRxSf3x2:1.23195,0,miopenConvolutionFwdAlgoWinograd;ConvHipImplicitGemmGroupFwdXdlops:0.525087,199213056,miopenConvolutionFwdAlgoImplicitGEMM;ConvAsmImplicitGemmGTCDynamicFwdXdlopsNHWC:0.497652,197443584,miopenConvolutionFwdAlgoImplicitGEMM;GemmFwd1x1_0_1:0.371646,0,miopenConvolutionFwdAlgoGEMM;ConvDirectNaiveConvFwd:20.342,0,miopenConvolutionFwdAlgoDirect
384-408-312-3x3-192-408-312-1-1x1-1x1-1x1-0-NCHW-FP32-F=ConvBinWinogradRxSf2x3g1:1.70755,0,miopenConvolutionFwdAlgoWinograd;ConvBinWinogradRxSf3x2:2.92657,0,miopenConvolutionFwdAlgoWinograd;ConvHipImplicitGemmGroupFwdXdlops:2.24935,295944192,miopenConvolutionFwdAlgoImplicitGEMM;ConvAsmImplicitGemmGTCDynamicFwdXdlopsNHWC:2.07318,295944192,miopenConvolutionFwdAlgoImplicitGEMM;GemmFwdRest:3.14667,1759739904,miopenConvolutionFwdAlgoGEMM;ConvDirectNaiveConvFwd:312.256,0,miopenConvolutionFwdAlgoDirect
384-824-624-3x3-192-824-624-1-1x1-1x1-1x1-0-NCHW-FP32-F=ConvBinWinogradRxSf2x3g1:7.65751,0,miopenConvolutionFwdAlgoWinograd;ConvBinWinogradRxSf3x2:11.8712,0,miopenConvolutionFwdAlgoWinograd;ConvHipImplicitGemmGroupFwdXdlops:8.60312,1187315712,miopenConvolutionFwdAlgoImplicitGEMM;ConvAsmImplicitGemmGTCDynamicFwdXdlopsNHWC:8.45738,1187315712,miopenConvolutionFwdAlgoImplicitGEMM;GemmFwdRest:12.1918,7107969024,miopenConvolutionFwdAlgoGEMM;ConvDirectNaiveConvFwd:1324.33,0,miopenConvolutionFwdAlgoDirect
96-3-818-626-3x3x3-96-1-816-624-1-0x0x0-1x1x1-1x1x1-0-NCDHW-FP32-F=ConvHipImplicitGemm3DGroupFwdXdlops:4.32323,786424320,miopenConvolutionFwdAlgoImplicitGEMM;GemmFwdRest:10.0562,5279219712,miopenConvolutionFwdAlgoGEMM;ConvDirectNaiveConvFwd:1077.21,0,miopenConvolutionFwdAlgoDirect
96-4-552-416-1x1x1-192-4-552-416-1-0x0x0-1x1x1-1x1x1-0-NCDHW-FP32-F=ConvHipImplicitGemm3DGroupFwdXdlops:1.46593,1058217984,miopenConvolutionFwdAlgoImplicitGEMM;GemmFwd1x1_0_1:0.892839,0,miopenConvolutionFwdAlgoGEMM;ConvDirectNaiveConvFwd:225.26,0,miopenConvolutionFwdAlgoDirect
96-6-1650-1250-3x3x3-3-4-1648-1248-1-0x0x0-1x1x1-1x1x1-0-NCDHW-FP32-F=ConvHipImplicitGemm3DGroupFwdXdlops:54.7641,4850753024,miopenConvolutionFwdAlgoImplicitGEMM;ConvDirectNaiveConvFwd:18850.9,0,miopenConvolutionFwdAlgoDirect
384-204-156-3x3-192-204-156-2-1x1-1x1-1x1-0-NCHW-FP32-F=ConvBinWinogradRxSf2x3g1:0.820604,0,miopenConvolutionFwdAlgoWinograd;ConvBinWinogradRxSf3x2:1.56545,0,miopenConvolutionFwdAlgoWinograd;ConvHipImplicitGemmGroupFwdXdlops:1.10108,149299200,miopenConvolutionFwdAlgoImplicitGEMM;ConvAsmImplicitGemmGTCDynamicFwdXdlopsNHWC:1.02869,149299200,miopenConvolutionFwdAlgoImplicitGEMM;GemmFwdRest:1.73153,439934976,miopenConvolutionFwdAlgoGEMM;ConvDirectNaiveConvFwd:79.7293,0,miopenConvolutionFwdAlgoDirect
384-412-312-3x3-192-412-312-2-1x1-1x1-1x1-0-NCHW-FP32-F=ConvBinWinogradRxSf2x3g1:3.56225,0,miopenConvolutionFwdAlgoWinograd;ConvBinWinogradRxSf3x2:5.88991,0,miopenConvolutionFwdAlgoWinograd;ConvHipImplicitGemmGroupFwdXdlops:4.21588,594984960,miopenConvolutionFwdAlgoImplicitGEMM;ConvAsmImplicitGemmGTCDynamicFwdXdlopsNHWC:4.2247,594984960,miopenConvolutionFwdAlgoImplicitGEMM;GemmFwdRest:6.27928,1776992256,miopenConvolutionFwdAlgoGEMM;ConvDirectNaiveConvFwd:375.647,0,miopenConvolutionFwdAlgoDirect
192-553-417-3x3-192-276-208-4-0x0-2x2-1x1-0-NCHW-FP32-F=ConvBinWinogradRxSf2x3g1:6.78646,0,miopenConvolutionFwdAlgoWinograd;ConvBinWinogradRxSf3x2:3.35257,0,miopenConvolutionFwdAlgoWinograd;ConvHipImplicitGemmGroupFwdXdlops:2.40415,886090752,miopenConvolutionFwdAlgoImplicitGEMM;ConvAsmImplicitGemmGTCDynamicFwdXdlopsNHWC:2.4951,886090752,miopenConvolutionFwdAlgoImplicitGEMM;GemmFwdRest:2.93301,396804096,miopenConvolutionFwdAlgoGEMM;ConvDirectNaiveConvFwd:94.5582,0,miopenConvolutionFwdAlgoDirect
192-825-625-3x3-192-412-312-4-0x0-2x2-1x1-0-NCHW-FP32-F=ConvBinWinogradRxSf2x3g1:14.0235,0,miopenConvolutionFwdAlgoWinograd;ConvBinWinogradRxSf3x2:7.8002,0,miopenConvolutionFwdAlgoWinograd;ConvHipImplicitGemmGroupFwdXdlops:5.60448,1980214272,miopenConvolutionFwdAlgoImplicitGEMM;ConvAsmImplicitGemmGTCDynamicFwdXdlopsNHWC:5.63581,1980214272,miopenConvolutionFwdAlgoImplicitGEMM;GemmFwdRest:6.71308,888496128,miopenConvolutionFwdAlgoGEMM;ConvDirectNaiveConvFwd:223.878,0,miopenConvolutionFwdAlgoDirect
384-408-312-3x3-192-408-312-4-1x1-1x1-1x1-0-NCHW-FP32-F=ConvBinWinogradRxSf2x3g1:7.1759,0,miopenConvolutionFwdAlgoWinograd;ConvBinWinogradRxSf3x2:11.6852,0,miopenConvolutionFwdAlgoWinograd;ConvHipImplicitGemmGroupFwdXdlops:8.59641,1175814144,miopenConvolutionFwdAlgoImplicitGEMM;ConvAsmImplicitGemmGTCDynamicFwdXdlopsNHWC:8.44526,1175814144,miopenConvolutionFwdAlgoImplicitGEMM;GemmFwdRest:12.443,1759739904,miopenConvolutionFwdAlgoGEMM;ConvDirectNaiveConvFwd:456.168,0,miopenConvolutionFwdAlgoDirect
96-1105-833-3x3-96-552-416-4-0x0-2x2-1x1-0-NCHW-FP32-F=ConvBinWinogradRxSf2x3g1:6.39191,0,miopenConvolutionFwdAlgoWinograd;ConvBinWinogradRxSf3x2:3.48095,0,miopenConvolutionFwdAlgoWinograd;ConvHipImplicitGemmGroupFwdXdlops:3.71715,1766880768,miopenConvolutionFwdAlgoImplicitGEMM;ConvAsmImplicitGemmGTCDynamicFwdXdlopsNHWC:3.54557,1766880768,miopenConvolutionFwdAlgoImplicitGEMM;GemmFwdRest:3.93254,793608192,miopenConvolutionFwdAlgoGEMM;ConvDirectNaiveConvFwd:183.839,0,miopenConvolutionFwdAlgoDirect
96-1649-1249-3x3-96-824-624-4-0x0-2x2-1x1-0-NCHW-FP32-F=ConvBinWinogradRxSf2x3g1:14.3912,0,miopenConvolutionFwdAlgoWinograd;ConvBinWinogradRxSf3x2:7.93035,0,miopenConvolutionFwdAlgoWinograd;ConvHipImplicitGemmGroupFwdXdlops:8.22086,3953653248,miopenConvolutionFwdAlgoImplicitGEMM;ConvAsmImplicitGemmGTCDynamicFwdXdlopsNHWC:7.84005,3953653248,miopenConvolutionFwdAlgoImplicitGEMM;GemmFwdRest:8.89439,1776992256,miopenConvolutionFwdAlgoGEMM;ConvDirectNaiveConvFwd:415.207,0,miopenConvolutionFwdAlgoDirect
16-21-102-78-1x1x1-16-21-102-78-1-0x0x0-1x1x1-1x1x1-0-NCDHW-BF16-F=ConvHipImplicitGemm3DGroupFwdXdlops:0.038257,10693632,miopenConvolutionFwdAlgoImplicitGEMM;GemmFwd1x1_0_1:0.0797592,0,miopenConvolutionFwdAlgoGEMM;ConvDirectNaiveConvFwd:5.38794,0,miopenConvolutionFwdAlgoDirect
16-21-138-104-1x1x1-16-21-138-104-1-0x0x0-1x1x1-1x1x1-0-NCDHW-BF16-F=ConvHipImplicitGemm3DGroupFwdXdlops:0.0471264,19289600,miopenConvolutionFwdAlgoImplicitGEMM;GemmFwd1x1_0_1:0.105687,0,miopenConvolutionFwdAlgoGEMM;ConvDirectNaiveConvFwd:9.75018,0,miopenConvolutionFwdAlgoDirect
16-3-104-80-3x3x3-384-1-102-78-1-0x0x0-1x1x1-1x1x1-0-NCDHW-BF16-F=ConvHipImplicitGemm3DGroupFwdXdlops:0.052783,7240704,miopenConvolutionFwdAlgoImplicitGEMM;GemmFwdRest:0.0689093,6873984,miopenConvolutionFwdAlgoGEMM;ConvDirectNaiveConvFwd:2.44434,0,miopenConvolutionFwdAlgoDirect
16-3-208-158-3x3x3-384-1-206-156-1-0x0x0-1x1x1-1x1x1-0-NCDHW-BF16-F=ConvHipImplicitGemm3DGroupFwdXdlops:0.104202,28167168,miopenConvolutionFwdAlgoImplicitGEMM;GemmFwdRest:0.123324,27765504,miopenConvolutionFwdAlgoGEMM;ConvDirectNaiveConvFwd:10.1778,0,miopenConvolutionFwdAlgoDirect
192-1-204-156-1x1x1-384-1-204-156-1-0x0x0-1x1x1-1x1x1-0-NCDHW-BF16-F=ConvHipImplicitGemm3DGroupFwdXdlops:0.090487,36808704,miopenConvolutionFwdAlgoImplicitGEMM;GemmFwd1x1_0_1:0.0380432,0,miopenConvolutionFwdAlgoGEMM;ConvDirectNaiveConvFwd:11.7876,0,miopenConvolutionFwdAlgoDirect
192-1-276-208-1x1x1-384-1-276-208-1-0x0x0-1x1x1-1x1x1-0-NCDHW-BF16-F=ConvHipImplicitGemm3DGroupFwdXdlops:0.122108,66281472,miopenConvolutionFwdAlgoImplicitGEMM;GemmFwd1x1_0_1:0.0501706,0,miopenConvolutionFwdAlgoGEMM;ConvDirectNaiveConvFwd:21.1956,0,miopenConvolutionFwdAlgoDirect
192-2-204-156-1x1x1-384-2-204-156-1-0x0x0-1x1x1-1x1x1-0-NCDHW-BF16-F=ConvHipImplicitGemm3DGroupFwdXdlops:0.134861,73469952,miopenConvolutionFwdAlgoImplicitGEMM;GemmFwd1x1_0_1:0.0546815,0,miopenConvolutionFwdAlgoGEMM;ConvDirectNaiveConvFwd:23.3832,0,miopenConvolutionFwdAlgoDirect
192-2-412-312-1x1x1-384-2-412-312-1-0x0x0-1x1x1-1x1x1-0-NCDHW-BF16-F=ConvHipImplicitGemm3DGroupFwdXdlops:0.465026,296312832,miopenConvolutionFwdAlgoImplicitGEMM;GemmFwd1x1_0_1:0.259961,0,miopenConvolutionFwdAlgoGEMM;ConvDirectNaiveConvFwd:96.4133,0,miopenConvolutionFwdAlgoDirect
192-3-278-210-3x3x3-384-1-276-208-1-0x0x0-1x1x1-1x1x1-0-NCDHW-BF16-F=ConvHipImplicitGemm3DGroupFwdXdlops:0.661592,115324416,miopenConvolutionFwdAlgoImplicitGEMM;GemmFwdRest:1.88129,595206144,miopenConvolutionFwdAlgoGEMM;ConvDirectNaiveConvFwd:218.306,0,miopenConvolutionFwdAlgoDirect
192-3-414-314-3x3x3-384-1-412-312-1-0x0x0-1x1x1-1x1x1-0-NCDHW-BF16-F=ConvHipImplicitGemm3DGroupFwdXdlops:1.26327,252458496,miopenConvolutionFwdAlgoImplicitGEMM;GemmFwdRest:4.20316,1332744192,miopenConvolutionFwdAlgoGEMM;ConvDirectNaiveConvFwd:489.694,0,miopenConvolutionFwdAlgoDirect
192-3-826-626-3x3x3-192-1-824-624-1-0x0x0-1x1x1-1x1x1-0-NCDHW-BF16-F=ConvHipImplicitGemm3DGroupFwdXdlops:3.71901,795105792,miopenConvolutionFwdAlgoImplicitGEMM;GemmFwdRest:14.4884,5330976768,miopenConvolutionFwdAlgoGEMM;ConvDirectNaiveConvFwd:2066,0,miopenConvolutionFwdAlgoDirect
192-6-410-314-3x3x3-192-4-408-312-1-0x0x0-1x1x1-1x1x1-0-NCDHW-BF16-F=ConvHipImplicitGemm3DGroupFwdXdlops:3.50665,494134272,miopenConvolutionFwdAlgoImplicitGEMM;GemmFwdRest:14.1788,5279219712,miopenConvolutionFwdAlgoGEMM;ConvDirectNaiveConvFwd:1948.28,0,miopenConvolutionFwdAlgoDirect
192-1104-832-3x3-96-1104-832-1-1x1-1x1-1x1-0-NCHW-BF16-F=ConvHipImplicitGemmGroupFwdXdlops:1.53665,529403904,miopenConvolutionFwdAlgoImplicitGEMM;ConvAsmImplicitGemmGTCDynamicFwdXdlopsNHWC:1.46184,882118656,miopenConvolutionFwdAlgoImplicitGEMM;GemmFwdRest:3.62918,3174432768,miopenConvolutionFwdAlgoGEMM;ConvDirectNaiveConvFwd:1401.53,0,miopenConvolutionFwdAlgoDirect
192-409-313-3x3-192-204-156-1-0x0-2x2-1x1-0-NCHW-BF16-F=ConvHipImplicitGemmGroupFwdXdlops:0.157389,62042624,miopenConvolutionFwdAlgoImplicitGEMM;ConvAsmImplicitGemmGTCDynamicFwdXdlopsNHWC:0.14782,86483456,miopenConvolutionFwdAlgoImplicitGEMM;GemmFwdRest:0.190417,109983744,miopenConvolutionFwdAlgoGEMM;ConvDirectNaiveConvFwd:46.4734,0,miopenConvolutionFwdAlgoDirect
192-553-417-3x3-192-276-208-1-0x0-2x2-1x1-0-NCHW-BF16-F=ConvHipImplicitGemmGroupFwdXdlops:0.26808,111259136,miopenConvolutionFwdAlgoImplicitGEMM;ConvAsmImplicitGemmGTCDynamicFwdXdlopsNHWC:0.279971,155348480,miopenConvolutionFwdAlgoImplicitGEMM;GemmFwdRest:0.325944,198402048,miopenConvolutionFwdAlgoGEMM;ConvDirectNaiveConvFwd:82.564,0,miopenConvolutionFwdAlgoDirect
192-825-625-3x3-192-412-312-1-0x0-2x2-1x1-0-NCHW-BF16-F=ConvHipImplicitGemmGroupFwdXdlops:0.545804,248024576,miopenConvolutionFwdAlgoImplicitGEMM;ConvAsmImplicitGemmGTCDynamicFwdXdlopsNHWC:0.582202,346746368,miopenConvolutionFwdAlgoImplicitGEMM;GemmFwdRest:0.634882,444248064,miopenConvolutionFwdAlgoGEMM;ConvDirectNaiveConvFwd:183.542,0,miopenConvolutionFwdAlgoDirect
3-3-1106-834-3x3x3-96-1-1104-832-1-0x0x0-1x1x1-1x1x1-0-NCDHW-BF16-F=ConvHipImplicitGemm3DGroupFwdXdlops:0.52132,192976384,miopenConvolutionFwdAlgoImplicitGEMM;GemmFwdRest:0.730072,148801536,miopenConvolutionFwdAlgoGEMM;ConvDirectNaiveConvFwd:54.7932,0,miopenConvolutionFwdAlgoDirect
3-3-818-626-3x3x3-96-1-816-624-1-0x0x0-1x1x1-1x1x1-0-NCDHW-BF16-F=ConvHipImplicitGemm3DGroupFwdXdlops:0.287486,106996224,miopenConvolutionFwdAlgoImplicitGEMM;GemmFwdRest:0.400578,82487808,miopenConvolutionFwdAlgoGEMM;ConvDirectNaiveConvFwd:29.8991,0,miopenConvolutionFwdAlgoDirect
3-6-1106-834-3x3x3-96-4-1104-832-1-0x0x0-1x1x1-1x1x1-0-NCDHW-BF16-F=ConvHipImplicitGemm3DGroupFwdXdlops:2.04888,738651904,miopenConvolutionFwdAlgoImplicitGEMM;GemmFwdRest:2.88761,595206144,miopenConvolutionFwdAlgoGEMM;ConvDirectNaiveConvFwd:221.167,0,miopenConvolutionFwdAlgoDirect
3-6-818-626-3x3x3-96-4-816-624-1-0x0x0-1x1x1-1x1x1-0-NCDHW-BF16-F=ConvHipImplicitGemm3DGroupFwdXdlops:1.12307,409503488,miopenConvolutionFwdAlgoImplicitGEMM;GemmFwdRest:1.64628,329951232,miopenConvolutionFwdAlgoGEMM;ConvDirectNaiveConvFwd:119.987,0,miopenConvolutionFwdAlgoDirect
32-21-206-156-1x1x1-32-21-206-156-1-0x0x0-1x1x1-1x1x1-0-NCDHW-BF16-F=ConvHipImplicitGemm3DGroupFwdXdlops:0.172056,86383616,miopenConvolutionFwdAlgoImplicitGEMM;GemmFwd1x1_0_1:0.213899,0,miopenConvolutionFwdAlgoGEMM;ConvDirectNaiveConvFwd:42.0399,0,miopenConvolutionFwdAlgoDirect
36-21-138-104-1x2x2-5120-21-69-52-1-0x0x0-1x2x2-1x1x1-0-NCDHW-BF16-F=ConvHipImplicitGemm3DGroupFwdXdlops:2.07025,794738432,miopenConvolutionFwdAlgoImplicitGEMM;GemmFwdRest:0.84953,21700224,miopenConvolutionFwdAlgoGEMM;ConvDirectNaiveConvFwd:50.1972,0,miopenConvolutionFwdAlgoDirect
384-3-104-80-3x3x3-32-1-102-78-1-0x0x0-1x1x1-1x1x1-0-NCDHW-BF16-F=ConvHipImplicitGemm3DGroupFwdXdlops:0.0971111,20342016,miopenConvolutionFwdAlgoImplicitGEMM;GemmFwdRest:0.626014,164975616,miopenConvolutionFwdAlgoGEMM;ConvDirectNaiveConvFwd:69.6334,0,miopenConvolutionFwdAlgoDirect
384-3-138-104-3x1x1-768-1-138-104-1-0x0x0-1x1x1-1x1x1-0-NCDHW-BF16-F=ConvHipImplicitGemm3DGroupFwdXdlops:0.159038,56881152,miopenConvolutionFwdAlgoImplicitGEMM;GemmFwdRest:0.228274,33067008,miopenConvolutionFwdAlgoGEMM;ConvDirectNaiveConvFwd:29.3878,0,miopenConvolutionFwdAlgoDirect
384-3-206-156-3x1x1-384-1-206-156-1-0x0x0-2x1x1-1x1x1-0-NCDHW-BF16-F=ConvHipImplicitGemm3DGroupFwdXdlops:0.209827,99606528,miopenConvolutionFwdAlgoImplicitGEMM;GemmFwdRest:0.241625,74041344,miopenConvolutionFwdAlgoGEMM;ConvDirectNaiveConvFwd:65.4919,0,miopenConvolutionFwdAlgoDirect
384-3-208-158-3x3x3-32-1-206-156-1-0x0x0-1x1x1-1x1x1-0-NCDHW-BF16-F=ConvHipImplicitGemm3DGroupFwdXdlops:0.218366,78438912,miopenConvolutionFwdAlgoImplicitGEMM;GemmFwdRest:1.58579,666372096,miopenConvolutionFwdAlgoGEMM;ConvDirectNaiveConvFwd:258.224,0,miopenConvolutionFwdAlgoDirect
384-4-204-156-3x1x1-768-2-204-156-1-0x0x0-1x1x1-1x1x1-0-NCDHW-BF16-F=ConvHipImplicitGemm3DGroupFwdXdlops:0.456303,197296128,miopenConvolutionFwdAlgoImplicitGEMM;GemmFwdRest:0.608262,146644992,miopenConvolutionFwdAlgoGEMM;ConvDirectNaiveConvFwd:129.984,0,miopenConvolutionFwdAlgoDirect
384-4-278-210-3x3x3-384-2-276-208-1-0x0x0-1x1x1-1x1x1-0-NCDHW-BF16-F=ConvHipImplicitGemm3DGroupFwdXdlops:2.30991,275484672,miopenConvolutionFwdAlgoImplicitGEMM;GemmFwdRest:7.4548,2380824576,miopenConvolutionFwdAlgoGEMM;ConvDirectNaiveConvFwd:888.984,0,miopenConvolutionFwdAlgoDirect
384-102-78-1x1-384-102-78-1-0x0-1x1-1x1-0-NCHW-BF16-F=ConvHipImplicitGemmGroupFwdXdlops:0.046256,12515328,miopenConvolutionFwdAlgoImplicitGEMM;ConvAsmImplicitGemmGTCDynamicFwdXdlopsNHWC:0.0408008,24440832,miopenConvolutionFwdAlgoImplicitGEMM;GemmFwd1x1_0_1:0.025446,0,miopenConvolutionFwdAlgoGEMM;ConvDirectNaiveConvFwd:5.11617,0,miopenConvolutionFwdAlgoDirect
384-138-104-1x1-384-138-104-1-0x0-1x1-1x1-0-NCHW-BF16-F=ConvHipImplicitGemmGroupFwdXdlops:0.0638952,22339584,miopenConvolutionFwdAlgoImplicitGEMM;ConvAsmImplicitGemmGTCDynamicFwdXdlopsNHWC:0.0616464,44089344,miopenConvolutionFwdAlgoImplicitGEMM;GemmFwd1x1_0_1:0.0378644,0,miopenConvolutionFwdAlgoGEMM;ConvDirectNaiveConvFwd:9.10273,0,miopenConvolutionFwdAlgoDirect
384-206-156-1x1-1152-206-156-1-0x0-1x1-1x1-0-NCHW-BF16-F=ConvHipImplicitGemmGroupFwdXdlops:0.268293,99606528,miopenConvolutionFwdAlgoImplicitGEMM;ConvAsmImplicitGemmGTCDynamicFwdXdlopsNHWC:0.221353,246804480,miopenConvolutionFwdAlgoImplicitGEMM;GemmFwd1x1_0_1:0.122189,0,miopenConvolutionFwdAlgoGEMM;ConvDirectNaiveConvFwd:21.6357,0,miopenConvolutionFwdAlgoDirect
384-277-209-3x3-384-138-104-1-0x0-2x2-1x1-0-NCHW-BF16-F=ConvHipImplicitGemmGroupFwdXdlops:0.211464,58138368,miopenConvolutionFwdAlgoImplicitGEMM;ConvAsmImplicitGemmGTCDynamicFwdXdlopsNHWC:0.25301,80183040,miopenConvolutionFwdAlgoImplicitGEMM;GemmFwdRest:0.309842,99201024,miopenConvolutionFwdAlgoGEMM;ConvDirectNaiveConvFwd:42.3472,0,miopenConvolutionFwdAlgoDirect
384-552-416-3x3-192-552-416-1-1x1-1x1-1x1-0-NCHW-BF16-F=ConvHipImplicitGemmGroupFwdXdlops:1.03314,265863168,miopenConvolutionFwdAlgoImplicitGEMM;ConvAsmImplicitGemmGTCDynamicFwdXdlopsNHWC:1.10785,442220544,miopenConvolutionFwdAlgoImplicitGEMM;GemmFwdRest:1.72589,1587216384,miopenConvolutionFwdAlgoGEMM;ConvDirectNaiveConvFwd:596.509,0,miopenConvolutionFwdAlgoDirect
96-3-1106-834-3x3x3-96-1-1104-832-1-0x0x0-1x1x1-1x1x1-0-NCDHW-BF16-F=ConvHipImplicitGemm3DGroupFwdXdlops:2.12058,708159744,miopenConvolutionFwdAlgoImplicitGEMM;GemmFwdRest:12.3249,4761649152,miopenConvolutionFwdAlgoGEMM;ConvDirectNaiveConvFwd:1838.6,0,miopenConvolutionFwdAlgoDirect
96-3-818-626-3x3x3-3-1-816-624-1-0x0x0-1x1x1-1x1x1-0-NCDHW-BF16-F=ConvHipImplicitGemm3DGroupFwdXdlops:0.773143,298021888,miopenConvolutionFwdAlgoImplicitGEMM;GemmFwdRest:6.77282,2639609856,miopenConvolutionFwdAlgoGEMM;ConvDirectNaiveConvFwd:1027.36,0,miopenConvolutionFwdAlgoDirect
96-3-826-626-3x3x3-192-1-824-624-1-0x0x0-1x1x1-1x1x1-0-NCDHW-BF16-F=ConvHipImplicitGemm3DGroupFwdXdlops:1.92541,496274688,miopenConvolutionFwdAlgoImplicitGEMM;GemmFwdRest:7.45325,2665488384,miopenConvolutionFwdAlgoGEMM;ConvDirectNaiveConvFwd:1028.11,0,miopenConvolutionFwdAlgoDirect
96-4-824-624-1x1x1-192-4-824-624-1-0x0x0-1x1x1-1x1x1-0-NCDHW-BF16-F=ConvHipImplicitGemm3DGroupFwdXdlops:2.05335,1184698368,miopenConvolutionFwdAlgoImplicitGEMM;GemmFwd1x1_0_1:1.15266,0,miopenConvolutionFwdAlgoGEMM;ConvDirectNaiveConvFwd:471.01,0,miopenConvolutionFwdAlgoDirect
96-6-1650-1250-3x3x3-96-4-1648-1248-1-0x0x0-1x1x1-1x1x1-0-NCDHW-BF16-F=ConvHipImplicitGemm3DGroupFwdXdlops:17.7272,3956046336,miopenConvolutionFwdAlgoImplicitGEMM;ConvDirectNaiveConvFwd:16602.9,0,miopenConvolutionFwdAlgoDirect
192-553-417-3x3-192-276-208-4-0x0-2x2-1x1-0-NCHW-BF16-F=ConvHipImplicitGemmGroupFwdXdlops:0.924197,443045376,miopenConvolutionFwdAlgoImplicitGEMM;ConvAsmImplicitGemmGTCDynamicFwdXdlopsNHWC:0.925195,619402752,miopenConvolutionFwdAlgoImplicitGEMM;GemmFwdRest:1.23114,198402048,miopenConvolutionFwdAlgoGEMM;ConvDirectNaiveConvFwd:93.738,0,miopenConvolutionFwdAlgoDirect
192-825-625-3x3-192-412-312-4-0x0-2x2-1x1-0-NCHW-BF16-F=ConvHipImplicitGemmGroupFwdXdlops:2.11686,990107136,miopenConvolutionFwdAlgoImplicitGEMM;ConvAsmImplicitGemmGTCDynamicFwdXdlopsNHWC:2.13127,1384994304,miopenConvolutionFwdAlgoImplicitGEMM;GemmFwdRest:2.67574,444248064,miopenConvolutionFwdAlgoGEMM;ConvDirectNaiveConvFwd:220.164,0,miopenConvolutionFwdAlgoDirect
384-408-312-3x3-192-408-312-4-1x1-1x1-1x1-0-NCHW-BF16-F=ConvHipImplicitGemmGroupFwdXdlops:2.40112,587907072,miopenConvolutionFwdAlgoImplicitGEMM;ConvAsmImplicitGemmGTCDynamicFwdXdlopsNHWC:2.39312,978960384,miopenConvolutionFwdAlgoImplicitGEMM;GemmFwdRest:4.48762,879869952,miopenConvolutionFwdAlgoGEMM;ConvDirectNaiveConvFwd:428.594,0,miopenConvolutionFwdAlgoDirect
96-1105-833-3x3-96-552-416-4-0x0-2x2-1x1-0-NCHW-BF16-F=ConvHipImplicitGemmGroupFwdXdlops:1.62881,883440384,miopenConvolutionFwdAlgoImplicitGEMM;ConvAsmImplicitGemmGTCDynamicFwdXdlopsNHWC:1.5332,1236155136,miopenConvolutionFwdAlgoImplicitGEMM;GemmFwdRest:2.26526,396804096,miopenConvolutionFwdAlgoGEMM;ConvDirectNaiveConvFwd:181.168,0,miopenConvolutionFwdAlgoDirect
96-1649-1249-3x3-96-824-624-4-0x0-2x2-1x1-0-NCHW-BF16-F=ConvHipImplicitGemmGroupFwdXdlops:3.62121,1976826624,miopenConvolutionFwdAlgoImplicitGEMM;ConvAsmImplicitGemmGTCDynamicFwdXdlopsNHWC:3.4691,2766600960,miopenConvolutionFwdAlgoImplicitGEMM;GemmFwdRest:5.30319,888496128,miopenConvolutionFwdAlgoGEMM;ConvDirectNaiveConvFwd:419.762,0,miopenConvolutionFwdAlgoDirect
128-11-130-258-3x3x3-3-9-128-256-1-0x0x0-1x1x1-1x1x1-0-NCDHW-FP16-F=ConvHipImplicitGemm3DGroupFwdXdlops:0.774075,96238848,miopenConvolutionFwdAlgoImplicitGEMM;GemmFwdRest:5.00322,2038431744,miopenConvolutionFwdAlgoGEMM;ConvDirectNaiveConvFwd:812.786,0,miopenConvolutionFwdAlgoDirect
128-11-258-130-3x3x3-128-9-256-128-1-0x0x0-1x1x1-1x1x1-0-NCDHW-FP16-F=ConvHipImplicitGemm3DGroupFwdXdlops:0.829282,170830848,miopenConvolutionFwdAlgoImplicitGEMM;GemmFwdRest:5.32941,2038431744,miopenConvolutionFwdAlgoGEMM;ConvDirectNaiveConvFwd:837.927,0,miopenConvolutionFwdAlgoDirect
128-19-130-258-3x3x3-3-17-128-256-1-0x0x0-1x1x1-1x1x1-0-NCDHW-FP16-F=ConvHipImplicitGemm3DGroupFwdXdlops:1.40783,166501632,miopenConvolutionFwdAlgoImplicitGEMM;GemmFwdRest:9.65299,3850371072,miopenConvolutionFwdAlgoGEMM;ConvDirectNaiveConvFwd:1534.83,0,miopenConvolutionFwdAlgoDirect
128-19-162-258-3x3x3-128-17-160-256-1-0x0x0-1x1x1-1x1x1-0-NCDHW-FP16-F=ConvHipImplicitGemm3DGroupFwdXdlops:1.89106,382438400,miopenConvolutionFwdAlgoImplicitGEMM;GemmFwdRest:12.6266,4812963840,miopenConvolutionFwdAlgoGEMM;ConvDirectNaiveConvFwd:1903.92,0,miopenConvolutionFwdAlgoDirect
16-3-16-32-1x1x1-16-3-16-32-1-0x0x0-1x1x1-1x1x1-0-NCDHW-FP16-F=ConvHipImplicitGemm3DGroupFwdXdlops:0.0229143,98816,miopenConvolutionFwdAlgoImplicitGEMM;GemmFwd1x1_0_1:0.0084604,0,miopenConvolutionFwdAlgoGEMM;ConvDirectNaiveConvFwd:0.041874,0,miopenConvolutionFwdAlgoDirect
16-3-20-32-1x1x1-16-3-20-32-1-0x0x0-1x1x1-1x1x1-0-NCDHW-FP16-F=ConvHipImplicitGemm3DGroupFwdXdlops:0.0227745,123392,miopenConvolutionFwdAlgoImplicitGEMM;GemmFwd1x1_0_1:0.0101083,0,miopenConvolutionFwdAlgoGEMM;ConvDirectNaiveConvFwd:0.0550022,0,miopenConvolutionFwdAlgoDirect
16-5-16-32-1x1x1-16-5-16-32-1-0x0x0-1x1x1-1x1x1-0-NCDHW-FP16-F=ConvHipImplicitGemm3DGroupFwdXdlops:0.022507,164352,miopenConvolutionFwdAlgoImplicitGEMM;GemmFwd1x1_0_1:0.0088214,0,miopenConvolutionFwdAlgoGEMM;ConvDirectNaiveConvFwd:0.0681863,0,miopenConvolutionFwdAlgoDirect
16-5-18-34-3x3x3-512-3-16-32-1-0x0x0-1x1x1-1x1x1-0-NCDHW-FP16-F=ConvHipImplicitGemm3DGroupFwdXdlops:0.0336022,2113280,miopenConvolutionFwdAlgoImplicitGEMM;GemmFwdRest:0.039726,1327104,miopenConvolutionFwdAlgoGEMM;ConvDirectNaiveConvFwd:0.489267,0,miopenConvolutionFwdAlgoDirect
16-5-20-34-3x3x3-512-3-18-32-1-0x0x0-1x1x1-1x1x1-0-NCDHW-FP16-F=ConvHipImplicitGemm3DGroupFwdXdlops:0.0317087,2320640,miopenConvolutionFwdAlgoImplicitGEMM;GemmFwdRest:0.041646,1492992,miopenConvolutionFwdAlgoGEMM;ConvDirectNaiveConvFwd:0.569381,0,miopenConvolutionFwdAlgoDirect
16-5-32-24-1x1x1-16-5-32-24-1-0x0x0-1x1x1-1x1x1-0-NCDHW-FP16-F=ConvHipImplicitGemm3DGroupFwdXdlops:0.0223938,246272,miopenConvolutionFwdAlgoImplicitGEMM;GemmFwd1x1_0_1:0.0125688,0,miopenConvolutionFwdAlgoGEMM;ConvDirectNaiveConvFwd:0.101324,0,miopenConvolutionFwdAlgoDirect
16-7-18-26-3x3x3-512-5-16-24-1-0x0x0-1x1x1-1x1x1-0-NCDHW-FP16-F=ConvHipImplicitGemm3DGroupFwdXdlops:0.031727,2513408,miopenConvolutionFwdAlgoImplicitGEMM;GemmFwdRest:0.0331295,1658880,miopenConvolutionFwdAlgoGEMM;ConvDirectNaiveConvFwd:0.646335,0,miopenConvolutionFwdAlgoDirect
16-7-22-26-3x3x3-512-5-20-24-1-0x0x0-1x1x1-1x1x1-0-NCDHW-FP16-F=ConvHipImplicitGemm3DGroupFwdXdlops:0.0373622,3028224,miopenConvolutionFwdAlgoImplicitGEMM;GemmFwdRest:0.0476112,2073600,miopenConvolutionFwdAlgoGEMM;ConvDirectNaiveConvFwd:0.807209,0,miopenConvolutionFwdAlgoDirect
16-7-34-34-3x3x3-512-5-32-32-1-0x0x0-1x1x1-1x1x1-0-NCDHW-FP16-F=ConvHipImplicitGemm3DGroupFwdXdlops:0.0422563,5944320,miopenConvolutionFwdAlgoImplicitGEMM;GemmFwdRest:0.0544945,4423680,miopenConvolutionFwdAlgoGEMM;ConvDirectNaiveConvFwd:1.62763,0,miopenConvolutionFwdAlgoDirect
256-11-130-258-3x3x3-128-9-128-256-1-0x0x0-1x1x1-1x1x1-0-NCDHW-FP16-F=ConvHipImplicitGemm3DGroupFwdXdlops:1.67827,266164224,miopenConvolutionFwdAlgoImplicitGEMM;GemmFwdRest:10.7157,4076863488,miopenConvolutionFwdAlgoGEMM;ConvDirectNaiveConvFwd:1594.27,0,miopenConvolutionFwdAlgoDirect
256-11-162-258-3x3x3-128-9-160-256-1-0x0x0-1x1x1-1x1x1-0-NCDHW-FP16-F=ConvHipImplicitGemm3DGroupFwdXdlops:2.10023,331536384,miopenConvolutionFwdAlgoImplicitGEMM;GemmFwdRest:13.2777,5096079360,miopenConvolutionFwdAlgoGEMM;ConvDirectNaiveConvFwd:2008.83,0,miopenConvolutionFwdAlgoDirect
256-11-66-130-3x3x3-256-9-64-128-1-0x0x0-1x1x1-1x1x1-0-NCDHW-FP16-F=ConvHipImplicitGemm3DGroupFwdXdlops:0.631042,89610240,miopenConvolutionFwdAlgoImplicitGEMM;GemmFwdRest:2.94549,1019215872,miopenConvolutionFwdAlgoGEMM;ConvDirectNaiveConvFwd:418.562,0,miopenConvolutionFwdAlgoDirect
256-11-82-98-3x3x3-256-9-80-96-1-0x0x0-1x1x1-1x1x1-0-NCDHW-FP16-F=ConvHipImplicitGemm3DGroupFwdXdlops:0.592652,84187136,miopenConvolutionFwdAlgoImplicitGEMM;GemmFwdRest:2.79342,955514880,miopenConvolutionFwdAlgoGEMM;ConvDirectNaiveConvFwd:398.943,0,miopenConvolutionFwdAlgoDirect
256-17-144-128-1x1x1-128-17-144-128-1-0x0x0-1x1x1-1x1x1-0-NCDHW-FP16-F=ConvHipImplicitGemm3DGroupFwdXdlops:0.386954,240713728,miopenConvolutionFwdAlgoImplicitGEMM;GemmFwd1x1_0_1:0.191632,0,miopenConvolutionFwdAlgoGEMM;ConvDirectNaiveConvFwd:159.639,0,miopenConvolutionFwdAlgoDirect
256-17-256-128-1x1x1-128-17-256-128-1-0x0x0-1x1x1-1x1x1-0-NCDHW-FP16-F=ConvHipImplicitGemm3DGroupFwdXdlops:0.686555,427884544,miopenConvolutionFwdAlgoImplicitGEMM;GemmFwd1x1_0_1:0.349468,0,miopenConvolutionFwdAlgoGEMM;ConvDirectNaiveConvFwd:348.004,0,miopenConvolutionFwdAlgoDirect
256-19-130-258-3x3x3-128-17-128-256-1-0x0x0-1x1x1-1x1x1-0-NCDHW-FP16-F=ConvHipImplicitGemm3DGroupFwdXdlops:3.1919,470652928,miopenConvolutionFwdAlgoImplicitGEMM;ConvDirectNaiveConvFwd:3055.34,0,miopenConvolutionFwdAlgoDirect
256-19-258-130-3x3x3-128-17-256-128-1-0x0x0-1x1x1-1x1x1-0-NCDHW-FP16-F=ConvHipImplicitGemm3DGroupFwdXdlops:3.10383,470652928,miopenConvolutionFwdAlgoImplicitGEMM;ConvDirectNaiveConvFwd:3187.28,0,miopenConvolutionFwdAlgoDirect
256-7-130-66-3x3x3-256-5-128-64-1-0x0x0-1x1x1-1x1x1-0-NCDHW-FP16-F=ConvHipImplicitGemm3DGroupFwdXdlops:0.459072,55261184,miopenConvolutionFwdAlgoImplicitGEMM;GemmFwdRest:1.68583,566231040,miopenConvolutionFwdAlgoGEMM;ConvDirectNaiveConvFwd:243.923,0,miopenConvolutionFwdAlgoDirect
256-7-66-98-3x3x3-256-5-64-96-1-0x0x0-1x1x1-1x1x1-0-NCDHW-FP16-F=ConvHipImplicitGemm3DGroupFwdXdlops:0.357997,42448896,miopenConvolutionFwdAlgoImplicitGEMM;GemmFwdRest:1.21037,424673280,miopenConvolutionFwdAlgoGEMM;ConvDirectNaiveConvFwd:178.168,0,miopenConvolutionFwdAlgoDirect
256-7-82-130-3x3x3-256-5-80-128-1-0x0x0-1x1x1-1x1x1-0-NCDHW-FP16-F=ConvHipImplicitGemm3DGroupFwdXdlops:0.523684,67958784,miopenConvolutionFwdAlgoImplicitGEMM;GemmFwdRest:2.02226,707788800,miopenConvolutionFwdAlgoGEMM;ConvDirectNaiveConvFwd:290.191,0,miopenConvolutionFwdAlgoDirect
256-9-144-256-1x1x1-128-9-144-256-1-0x0x0-1x1x1-1x1x1-0-NCDHW-FP16-F=ConvHipImplicitGemm3DGroupFwdXdlops:0.408976,254869504,miopenConvolutionFwdAlgoImplicitGEMM;GemmFwd1x1_0_1:0.189676,0,miopenConvolutionFwdAlgoGEMM;ConvDirectNaiveConvFwd:169.347,0,miopenConvolutionFwdAlgoDirect
256-9-256-192-1x1x1-128-9-256-192-1-0x0x0-1x1x1-1x1x1-0-NCDHW-FP16-F=ConvHipImplicitGemm3DGroupFwdXdlops:0.553872,339804160,miopenConvolutionFwdAlgoImplicitGEMM;GemmFwd1x1_0_1:0.268167,0,miopenConvolutionFwdAlgoGEMM;ConvDirectNaiveConvFwd:272.542,0,miopenConvolutionFwdAlgoDirect
512-11-130-66-3x3x3-256-9-128-64-1-0x0x0-1x1x1-1x1x1-0-NCDHW-FP16-F=ConvHipImplicitGemm3DGroupFwdXdlops:1.3346,141471744,miopenConvolutionFwdAlgoImplicitGEMM;GemmFwdRest:6.17719,2038431744,miopenConvolutionFwdAlgoGEMM;ConvDirectNaiveConvFwd:877.103,0,miopenConvolutionFwdAlgoDirect
512-11-130-98-3x3x3-512-9-128-96-1-0x0x0-1x1x1-1x1x1-0-NCDHW-FP16-F=ConvHipImplicitGemm3DGroupFwdXdlops:3.90585,270905344,miopenConvolutionFwdAlgoImplicitGEMM;GemmFwdRest:9.85534,3057647616,miopenConvolutionFwdAlgoGEMM;ConvDirectNaiveConvFwd:1401.84,0,miopenConvolutionFwdAlgoDirect
512-11-82-130-3x3x3-256-9-80-128-1-0x0x0-1x1x1-1x1x1-0-NCDHW-FP16-F=ConvHipImplicitGemm3DGroupFwdXdlops:1.94652,174338048,miopenConvolutionFwdAlgoImplicitGEMM;GemmFwdRest:7.76116,2548039680,miopenConvolutionFwdAlgoGEMM;ConvDirectNaiveConvFwd:1045.83,0,miopenConvolutionFwdAlgoDirect
512-5-38-34-3x3x3-512-3-36-32-1-0x0x0-1x1x1-1x1x1-0-NCDHW-FP16-F=ConvHipImplicitGemm3DGroupFwdXdlops:0.292431,24309760,miopenConvolutionFwdAlgoImplicitGEMM;GemmFwdRest:0.590133,95551488,miopenConvolutionFwdAlgoGEMM;ConvDirectNaiveConvFwd:39.3344,0,miopenConvolutionFwdAlgoDirect
512-5-66-34-3x3x3-512-3-64-32-1-0x0x0-1x1x1-1x1x1-0-NCDHW-FP16-F=ConvHipImplicitGemm3DGroupFwdXdlops:0.415986,31936512,miopenConvolutionFwdAlgoImplicitGEMM;GemmFwdRest:0.748643,169869312,miopenConvolutionFwdAlgoGEMM;ConvDirectNaiveConvFwd:69.5738,0,miopenConvolutionFwdAlgoDirect
512-7-130-130-3x3x3-512-5-128-128-1-0x0x0-1x1x1-1x1x1-0-NCDHW-FP16-F=ConvHipImplicitGemm3DGroupFwdXdlops:3.17731,219181056,miopenConvolutionFwdAlgoImplicitGEMM;GemmFwdRest:9.1201,2264924160,miopenConvolutionFwdAlgoGEMM;ConvDirectNaiveConvFwd:946.612,0,miopenConvolutionFwdAlgoDirect
512-7-66-66-3x3x3-512-5-64-64-1-0x0x0-1x1x1-1x1x1-0-NCDHW-FP16-F=ConvHipImplicitGemm3DGroupFwdXdlops:1.23109,66351104,miopenConvolutionFwdAlgoImplicitGEMM;GemmFwdRest:1.74687,566231040,miopenConvolutionFwdAlgoGEMM;ConvDirectNaiveConvFwd:245.754,0,miopenConvolutionFwdAlgoDirect
512-7-74-66-3x3x3-512-5-72-64-1-0x0x0-1x1x1-1x1x1-0-NCDHW-FP16-F=ConvHipImplicitGemm3DGroupFwdXdlops:0.88821,72757248,miopenConvolutionFwdAlgoImplicitGEMM;GemmFwdRest:2.40364,637009920,miopenConvolutionFwdAlgoGEMM;ConvDirectNaiveConvFwd:274.704,0,miopenConvolutionFwdAlgoDirect
512-9-128-96-1x1x1-256-9-128-96-1-0x0x0-1x1x1-1x1x1-0-NCDHW-FP16-F=ConvHipImplicitGemm3DGroupFwdXdlops:0.294726,170131456,miopenConvolutionFwdAlgoImplicitGEMM;GemmFwd1x1_0_1:0.11861,0,miopenConvolutionFwdAlgoGEMM;ConvDirectNaiveConvFwd:111.344,0,miopenConvolutionFwdAlgoDirect
16-21-138-104-1x1x1-16-21-138-104-1-0x0x0-1x1x1-1x1x1-0-NCDHW-FP32-F=ConvHipImplicitGemm3DGroupFwdXdlops:0.0621923,38579200,miopenConvolutionFwdAlgoImplicitGEMM;GemmFwd1x1_0_1:0.075,0,miopenConvolutionFwdAlgoGEMM;ConvDirectNaiveConvFwd:9.79823,0,miopenConvolutionFwdAlgoDirect
192-1-204-156-1x1x1-384-1-204-156-1-0x0x0-1x1x1-1x1x1-0-NCDHW-FP32-F=ConvHipImplicitGemm3DGroupFwdXdlops:0.15188,73617408,miopenConvolutionFwdAlgoImplicitGEMM;GemmFwd1x1_0_1:0.0775827,0,miopenConvolutionFwdAlgoGEMM;ConvDirectNaiveConvFwd:12.2394,0,miopenConvolutionFwdAlgoDirect
192-2-276-208-1x1x1-384-2-276-208-1-0x0x0-1x1x1-1x1x1-0-NCDHW-FP32-F=ConvHipImplicitGemm3DGroupFwdXdlops:0.474158,264830976,miopenConvolutionFwdAlgoImplicitGEMM;GemmFwd1x1_0_1:0.256222,0,miopenConvolutionFwdAlgoGEMM;ConvDirectNaiveConvFwd:45.5234,0,miopenConvolutionFwdAlgoDirect
192-3-410-314-3x3x3-192-1-408-312-1-0x0x0-1x1x1-1x1x1-0-NCDHW-FP32-F=ConvHipImplicitGemm3DGroupFwdXdlops:3.5026,398361600,miopenConvolutionFwdAlgoImplicitGEMM;GemmFwdRest:6.65726,2639609856,miopenConvolutionFwdAlgoGEMM;ConvDirectNaiveConvFwd:534.917,0,miopenConvolutionFwdAlgoDirect
192-4-206-158-3x3x3-384-2-204-156-1-0x0x0-1x1x1-1x1x1-0-NCDHW-FP32-F=ConvHipImplicitGemm3DGroupFwdXdlops:2.85489,205713408,miopenConvolutionFwdAlgoImplicitGEMM;GemmFwdRest:4.38909,1319804928,miopenConvolutionFwdAlgoGEMM;ConvDirectNaiveConvFwd:272.427,0,miopenConvolutionFwdAlgoDirect
192-4-414-314-3x3x3-384-2-412-312-1-0x0x0-1x1x1-1x1x1-0-NCDHW-FP32-F=ConvHipImplicitGemm3DGroupFwdXdlops:11.4159,802197504,miopenConvolutionFwdAlgoImplicitGEMM;GemmFwdRest:18.6863,5330976768,miopenConvolutionFwdAlgoGEMM;ConvDirectNaiveConvFwd:1130.1,0,miopenConvolutionFwdAlgoDirect
192-6-826-626-3x3x3-192-4-824-624-1-0x0x0-1x1x1-1x1x1-0-NCDHW-FP32-F=ConvHipImplicitGemm3DGroupFwdXdlops:57.9022,3966216192,miopenConvolutionFwdAlgoImplicitGEMM;ConvDirectNaiveConvFwd:9476.52,0,miopenConvolutionFwdAlgoDirect
32-21-206-156-1x1x1-32-21-206-156-1-0x0x0-1x1x1-1x1x1-0-NCDHW-FP32-F=ConvHipImplicitGemm3DGroupFwdXdlops:0.244838,172767232,miopenConvolutionFwdAlgoImplicitGEMM;GemmFwd1x1_0_1:0.17866,0,miopenConvolutionFwdAlgoGEMM;ConvDirectNaiveConvFwd:47.1559,0,miopenConvolutionFwdAlgoDirect
384-3-102-78-3x1x1-384-1-102-78-1-0x0x0-2x1x1-1x1x1-0-NCDHW-FP32-F=ConvHipImplicitGemm3DGroupFwdXdlops:0.17172,50651136,miopenConvolutionFwdAlgoImplicitGEMM;GemmFwdRest:0.152796,36661248,miopenConvolutionFwdAlgoGEMM;ConvDirectNaiveConvFwd:17.2737,0,miopenConvolutionFwdAlgoDirect
384-3-104-80-3x3x3-384-1-102-78-1-0x0x0-1x1x1-1x1x1-0-NCDHW-FP32-F=ConvHipImplicitGemm3DGroupFwdXdlops:0.997,66484224,miopenConvolutionFwdAlgoImplicitGEMM;GemmFwdRest:1.26184,329951232,miopenConvolutionFwdAlgoGEMM;ConvDirectNaiveConvFwd:71.3419,0,miopenConvolutionFwdAlgoDirect
384-3-206-156-3x1x1-384-1-206-156-1-0x0x0-2x1x1-1x1x1-0-NCDHW-FP32-F=ConvHipImplicitGemm3DGroupFwdXdlops:0.532439,199213056,miopenConvolutionFwdAlgoImplicitGEMM;GemmFwdRest:0.527066,148082688,miopenConvolutionFwdAlgoGEMM;ConvDirectNaiveConvFwd:68.6596,0,miopenConvolutionFwdAlgoDirect
384-3-208-158-3x3x3-32-1-206-156-1-0x0x0-1x1x1-1x1x1-0-NCDHW-FP32-F=ConvHipImplicitGemm3DGroupFwdXdlops:0.658732,156877824,miopenConvolutionFwdAlgoImplicitGEMM;GemmFwdRest:2.385,1332744192,miopenConvolutionFwdAlgoGEMM;ConvDirectNaiveConvFwd:274.733,0,miopenConvolutionFwdAlgoDirect
384-3-414-314-3x3x3-384-1-412-312-1-0x0x0-1x1x1-1x1x1-0-NCDHW-FP32-F=ConvHipImplicitGemm3DGroupFwdXdlops:11.402,812390400,miopenConvolutionFwdAlgoImplicitGEMM;GemmFwdRest:18.7351,5330976768,miopenConvolutionFwdAlgoGEMM;ConvDirectNaiveConvFwd:1230.29,0,miopenConvolutionFwdAlgoDirect
384-102-78-1x1-1152-102-78-1-0x0-1x1-1x1-0-NCHW-FP32-F=ConvBinWinogradRxSf2x3g1:0.686031,0,miopenConvolutionFwdAlgoWinograd;ConvBinWinogradRxSf3x2:0.327669,0,miopenConvolutionFwdAlgoWinograd;ConvHipImplicitGemmGroupFwdXdlops:0.153937,50651136,miopenConvolutionFwdAlgoImplicitGEMM;ConvAsmImplicitGemmGTCDynamicFwdXdlopsNHWC:0.13565,48881664,miopenConvolutionFwdAlgoImplicitGEMM;GemmFwd1x1_0_1:0.119238,0,miopenConvolutionFwdAlgoGEMM;ConvDirectNaiveConvFwd:5.19624,0,miopenConvolutionFwdAlgoDirect
384-138-104-1x1-384-138-104-1-0x0-1x1-1x1-0-NCHW-FP32-F=ConvBinWinogradRxSf2x3g1:0.414362,0,miopenConvolutionFwdAlgoWinograd;ConvBinWinogradRxSf3x2:0.237521,0,miopenConvolutionFwdAlgoWinograd;ConvHipImplicitGemmGroupFwdXdlops:0.112955,44679168,miopenConvolutionFwdAlgoImplicitGEMM;ConvAsmImplicitGemmGTCDynamicFwdXdlopsNHWC:0.112494,44089344,miopenConvolutionFwdAlgoImplicitGEMM;GemmFwd1x1_0_1:0.0807872,0,miopenConvolutionFwdAlgoGEMM;ConvDirectNaiveConvFwd:9.04927,0,miopenConvolutionFwdAlgoDirect
384-205-157-3x3-384-102-78-1-0x0-2x2-1x1-0-NCHW-FP32-F=ConvBinWinogradRxSf2x3g1:1.06871,0,miopenConvolutionFwdAlgoWinograd;ConvBinWinogradRxSf3x2:0.595706,0,miopenConvolutionFwdAlgoWinograd;ConvHipImplicitGemmGroupFwdXdlops:0.386342,66964992,miopenConvolutionFwdAlgoImplicitGEMM;ConvAsmImplicitGemmGTCDynamicFwdXdlopsNHWC:0.283068,66964992,miopenConvolutionFwdAlgoImplicitGEMM;GemmFwdRest:0.356797,109983744,miopenConvolutionFwdAlgoGEMM;ConvDirectNaiveConvFwd:23.3085,0,miopenConvolutionFwdAlgoDirect
384-206-156-1x1-384-206-156-1-0x0-1x1-1x1-0-NCHW-FP32-F=ConvBinWinogradRxSf2x3g1:0.900103,0,miopenConvolutionFwdAlgoWinograd;ConvBinWinogradRxSf3x2:0.431684,0,miopenConvolutionFwdAlgoWinograd;ConvHipImplicitGemmGroupFwdXdlops:0.223807,99311616,miopenConvolutionFwdAlgoImplicitGEMM;ConvAsmImplicitGemmGTCDynamicFwdXdlopsNHWC:0.207029,98721792,miopenConvolutionFwdAlgoImplicitGEMM;GemmFwd1x1_0_1:0.140483,0,miopenConvolutionFwdAlgoGEMM;ConvDirectNaiveConvFwd:20.102,0,miopenConvolutionFwdAlgoDirect
384-412-312-3x3-192-412-312-1-1x1-1x1-1x1-0-NCHW-FP32-F=ConvBinWinogradRxSf2x3g1:1.80854,0,miopenConvolutionFwdAlgoWinograd;ConvBinWinogradRxSf3x2:2.97908,0,miopenConvolutionFwdAlgoWinograd;ConvHipImplicitGemmGroupFwdXdlops:2.26765,298819584,miopenConvolutionFwdAlgoImplicitGEMM;ConvAsmImplicitGemmGTCDynamicFwdXdlopsNHWC:2.13824,298819584,miopenConvolutionFwdAlgoImplicitGEMM;GemmFwdRest:3.20234,1776992256,miopenConvolutionFwdAlgoGEMM;ConvDirectNaiveConvFwd:316.566,0,miopenConvolutionFwdAlgoDirect
96-1-552-416-1x1x1-192-1-552-416-1-0x0x0-1x1x1-1x1x1-0-NCDHW-FP32-F=ConvHipImplicitGemm3DGroupFwdXdlops:0.379493,264609792,miopenConvolutionFwdAlgoImplicitGEMM;GemmFwd1x1_0_1:0.217278,0,miopenConvolutionFwdAlgoGEMM;ConvDirectNaiveConvFwd:45.5921,0,miopenConvolutionFwdAlgoDirect
96-3-1106-834-3x3x3-3-1-1104-832-1-0x0x0-1x1x1-1x1x1-0-NCDHW-FP32-F=ConvHipImplicitGemm3DGroupFwdXdlops:3.36849,1073662976,miopenConvolutionFwdAlgoImplicitGEMM;GemmFwdRest:16.2665,9523298304,miopenConvolutionFwdAlgoGEMM;ConvDirectNaiveConvFwd:1967.55,0,miopenConvolutionFwdAlgoDirect
96-3-1650-1250-3x3x3-96-1-1648-1248-1-0x0x0-1x1x1-1x1x1-0-NCDHW-FP32-F=ConvHipImplicitGemm3DGroupFwdXdlops:17.8077,3166769664,miopenConvolutionFwdAlgoImplicitGEMM;ConvDirectNaiveConvFwd:4683.35,0,miopenConvolutionFwdAlgoDirect
96-6-1106-834-3x3x3-3-4-1104-832-1-0x0x0-1x1x1-1x1x1-0-NCDHW-FP32-F=ConvHipImplicitGemm3DGroupFwdXdlops:11.564,2169339392,miopenConvolutionFwdAlgoImplicitGEMM;ConvDirectNaiveConvFwd:7903.78,0,miopenConvolutionFwdAlgoDirect
96-6-410-314-3x3x3-192-4-408-312-1-0x0x0-1x1x1-1x1x1-0-NCDHW-FP32-F=ConvHipImplicitGemm3DGroupFwdXdlops:6.37858,689660928,miopenConvolutionFwdAlgoImplicitGEMM;GemmFwdRest:13.3403,5279219712,miopenConvolutionFwdAlgoGEMM;ConvDirectNaiveConvFwd:1030.78,0,miopenConvolutionFwdAlgoDirect
96-6-818-626-3x3x3-3-4-816-624-1-0x0x0-1x1x1-1x1x1-0-NCDHW-FP32-F=ConvHipImplicitGemm3DGroupFwdXdlops:6.4202,1204276736,miopenConvolutionFwdAlgoImplicitGEMM;ConvDirectNaiveConvFwd:4354.41,0,miopenConvolutionFwdAlgoDirect
96-6-826-626-3x3x3-192-4-824-624-1-0x0x0-1x1x1-1x1x1-0-NCDHW-FP32-F=ConvHipImplicitGemm3DGroupFwdXdlops:24.8144,2772882432,miopenConvolutionFwdAlgoImplicitGEMM;ConvDirectNaiveConvFwd:4344.11,0,miopenConvolutionFwdAlgoDirect
384-204-156-3x3-192-204-156-2-1x1-1x1-1x1-0-NCHW-FP32-F=ConvBinWinogradRxSf2x3g1:0.839922,0,miopenConvolutionFwdAlgoWinograd;ConvBinWinogradRxSf3x2:1.58233,0,miopenConvolutionFwdAlgoWinograd;ConvHipImplicitGemmGroupFwdXdlops:1.11785,149299200,miopenConvolutionFwdAlgoImplicitGEMM;ConvAsmImplicitGemmGTCDynamicFwdXdlopsNHWC:1.03354,149299200,miopenConvolutionFwdAlgoImplicitGEMM;GemmFwdRest:1.76765,439934976,miopenConvolutionFwdAlgoGEMM;ConvDirectNaiveConvFwd:79.65,0,miopenConvolutionFwdAlgoDirect
384-412-312-3x3-192-412-312-2-1x1-1x1-1x1-0-NCHW-FP32-F=ConvBinWinogradRxSf2x3g1:3.42804,0,miopenConvolutionFwdAlgoWinograd;ConvBinWinogradRxSf3x2:5.92084,0,miopenConvolutionFwdAlgoWinograd;ConvHipImplicitGemmGroupFwdXdlops:4.2694,594984960,miopenConvolutionFwdAlgoImplicitGEMM;ConvAsmImplicitGemmGTCDynamicFwdXdlopsNHWC:4.31709,594984960,miopenConvolutionFwdAlgoImplicitGEMM;GemmFwdRest:6.4989,1776992256,miopenConvolutionFwdAlgoGEMM;ConvDirectNaiveConvFwd:377.32,0,miopenConvolutionFwdAlgoDirect
192-553-417-3x3-192-276-208-4-0x0-2x2-1x1-0-NCHW-FP32-F=ConvBinWinogradRxSf2x3g1:6.81169,0,miopenConvolutionFwdAlgoWinograd;ConvBinWinogradRxSf3x2:3.39123,0,miopenConvolutionFwdAlgoWinograd;ConvHipImplicitGemmGroupFwdXdlops:2.46756,886090752,miopenConvolutionFwdAlgoImplicitGEMM;ConvAsmImplicitGemmGTCDynamicFwdXdlopsNHWC:2.57549,886090752,miopenConvolutionFwdAlgoImplicitGEMM;GemmFwdRest:3.02619,396804096,miopenConvolutionFwdAlgoGEMM;ConvDirectNaiveConvFwd:94.5709,0,miopenConvolutionFwdAlgoDirect
192-825-625-3x3-192-412-312-4-0x0-2x2-1x1-0-NCHW-FP32-F=ConvBinWinogradRxSf2x3g1:13.9839,0,miopenConvolutionFwdAlgoWinograd;ConvBinWinogradRxSf3x2:7.94656,0,miopenConvolutionFwdAlgoWinograd;ConvHipImplicitGemmGroupFwdXdlops:5.72787,1980214272,miopenConvolutionFwdAlgoImplicitGEMM;ConvAsmImplicitGemmGTCDynamicFwdXdlopsNHWC:5.86066,1980214272,miopenConvolutionFwdAlgoImplicitGEMM;GemmFwdRest:6.92599,888496128,miopenConvolutionFwdAlgoGEMM;ConvDirectNaiveConvFwd:224.835,0,miopenConvolutionFwdAlgoDirect
384-408-312-3x3-192-408-312-4-1x1-1x1-1x1-0-NCHW-FP32-F=ConvBinWinogradRxSf2x3g1:7.25065,0,miopenConvolutionFwdAlgoWinograd;ConvBinWinogradRxSf3x2:11.5612,0,miopenConvolutionFwdAlgoWinograd;ConvHipImplicitGemmGroupFwdXdlops:8.59533,1175814144,miopenConvolutionFwdAlgoImplicitGEMM;ConvAsmImplicitGemmGTCDynamicFwdXdlopsNHWC:8.59881,1175814144,miopenConvolutionFwdAlgoImplicitGEMM;GemmFwdRest:12.8515,1759739904,miopenConvolutionFwdAlgoGEMM;ConvDirectNaiveConvFwd:460.092,0,miopenConvolutionFwdAlgoDirect
96-1105-833-3x3-96-552-416-4-0x0-2x2-1x1-0-NCHW-FP32-F=ConvBinWinogradRxSf2x3g1:6.33193,0,miopenConvolutionFwdAlgoWinograd;ConvBinWinogradRxSf3x2:3.58957,0,miopenConvolutionFwdAlgoWinograd;ConvHipImplicitGemmGroupFwdXdlops:3.81281,1766880768,miopenConvolutionFwdAlgoImplicitGEMM;ConvAsmImplicitGemmGTCDynamicFwdXdlopsNHWC:3.64523,1766880768,miopenConvolutionFwdAlgoImplicitGEMM;GemmFwdRest:4.01773,793608192,miopenConvolutionFwdAlgoGEMM;ConvDirectNaiveConvFwd:184.492,0,miopenConvolutionFwdAlgoDirect
96-1649-1249-3x3-96-824-624-4-0x0-2x2-1x1-0-NCHW-FP32-F=ConvBinWinogradRxSf2x3g1:14.3932,0,miopenConvolutionFwdAlgoWinograd;ConvBinWinogradRxSf3x2:7.92843,0,miopenConvolutionFwdAlgoWinograd;ConvHipImplicitGemmGroupFwdXdlops:8.45829,3953653248,miopenConvolutionFwdAlgoImplicitGEMM;ConvAsmImplicitGemmGTCDynamicFwdXdlopsNHWC:8.08364,3953653248,miopenConvolutionFwdAlgoImplicitGEMM;GemmFwdRest:9.0733,1776992256,miopenConvolutionFwdAlgoGEMM;ConvDirectNaiveConvFwd:415.155,0,miopenConvolutionFwdAlgoDirect
16-21-102-78-1x1x1-16-21-102-78-1-0x0x0-1x1x1-1x1x1-0-NCDHW-BF16-F=ConvHipImplicitGemm3DGroupFwdXdlops:0.0380965,10693632,miopenConvolutionFwdAlgoImplicitGEMM;GemmFwd1x1_0_1:0.0789738,0,miopenConvolutionFwdAlgoGEMM;ConvDirectNaiveConvFwd:5.3974,0,miopenConvolutionFwdAlgoDirect
16-21-206-156-1x1x1-16-21-206-156-1-0x0x0-1x1x1-1x1x1-0-NCDHW-BF16-F=ConvHipImplicitGemm3DGroupFwdXdlops:0.0843457,43191296,miopenConvolutionFwdAlgoImplicitGEMM;GemmFwd1x1_0_1:0.233772,0,miopenConvolutionFwdAlgoGEMM;ConvDirectNaiveConvFwd:21.7255,0,miopenConvolutionFwdAlgoDirect
16-3-140-106-3x3x3-384-1-138-104-1-0x0x0-1x1x1-1x1x1-0-NCDHW-BF16-F=ConvHipImplicitGemm3DGroupFwdXdlops:0.0603142,12778752,miopenConvolutionFwdAlgoImplicitGEMM;GemmFwdRest:0.090695,12400128,miopenConvolutionFwdAlgoGEMM;ConvDirectNaiveConvFwd:4.34175,0,miopenConvolutionFwdAlgoDirect
16-33-90-160-1x2x2-3072-33-45-80-1-0x0x0-1x2x2-1x1x1-0-NCDHW-BF16-F=ConvHipImplicitGemm3DGroupFwdXdlops:1.8335,745506816,miopenConvolutionFwdAlgoImplicitGEMM;GemmFwdRest:0.429013,15206400,miopenConvolutionFwdAlgoGEMM;ConvDirectNaiveConvFwd:23.4898,0,miopenConvolutionFwdAlgoDirect
192-1-412-312-1x1x1-384-1-412-312-1-0x0x0-1x1x1-1x1x1-0-NCDHW-BF16-F=ConvHipImplicitGemm3DGroupFwdXdlops:0.243889,148230144,miopenConvolutionFwdAlgoImplicitGEMM;GemmFwd1x1_0_1:0.143995,0,miopenConvolutionFwdAlgoGEMM;ConvDirectNaiveConvFwd:47.3434,0,miopenConvolutionFwdAlgoDirect
192-2-204-156-1x1x1-384-2-204-156-1-0x0x0-1x1x1-1x1x1-0-NCDHW-BF16-F=ConvHipImplicitGemm3DGroupFwdXdlops:0.134628,73469952,miopenConvolutionFwdAlgoImplicitGEMM;GemmFwd1x1_0_1:0.0557714,0,miopenConvolutionFwdAlgoGEMM;ConvDirectNaiveConvFwd:23.3693,0,miopenConvolutionFwdAlgoDirect
192-2-412-312-1x1x1-384-2-412-312-1-0x0x0-1x1x1-1x1x1-0-NCDHW-BF16-F=ConvHipImplicitGemm3DGroupFwdXdlops:0.473541,296312832,miopenConvolutionFwdAlgoImplicitGEMM;GemmFwd1x1_0_1:0.260916,0,miopenConvolutionFwdAlgoGEMM;ConvDirectNaiveConvFwd:96.735,0,miopenConvolutionFwdAlgoDirect
192-3-410-314-3x3x3-192-1-408-312-1-0x0x0-1x1x1-1x1x1-0-NCDHW-BF16-F=ConvHipImplicitGemm3DGroupFwdXdlops:0.89312,199180800,miopenConvolutionFwdAlgoImplicitGEMM;GemmFwdRest:3.40862,1319804928,miopenConvolutionFwdAlgoGEMM;ConvDirectNaiveConvFwd:479.004,0,miopenConvolutionFwdAlgoDirect
192-3-554-418-3x3x3-192-1-552-416-1-0x0x0-1x1x1-1x1x1-0-NCDHW-BF16-F=ConvHipImplicitGemm3DGroupFwdXdlops:1.6247,356940288,miopenConvolutionFwdAlgoImplicitGEMM;GemmFwdRest:6.27193,2380824576,miopenConvolutionFwdAlgoGEMM;ConvDirectNaiveConvFwd:915.54,0,miopenConvolutionFwdAlgoDirect
192-4-278-210-3x3x3-384-2-276-208-1-0x0x0-1x1x1-1x1x1-0-NCDHW-BF16-F=ConvHipImplicitGemm3DGroupFwdXdlops:1.09816,181831680,miopenConvolutionFwdAlgoImplicitGEMM;GemmFwdRest:3.62408,1190412288,miopenConvolutionFwdAlgoGEMM;ConvDirectNaiveConvFwd:439.06,0,miopenConvolutionFwdAlgoDirect
192-5-204-156-3x1x1-192-2-204-156-1-0x0x0-2x1x1-1x1x1-0-NCDHW-BF16-F=ConvHipImplicitGemm3DGroupFwdXdlops:0.166121,85764096,miopenConvolutionFwdAlgoImplicitGEMM;GemmFwdRest:0.221403,73322496,miopenConvolutionFwdAlgoGEMM;ConvDirectNaiveConvFwd:64.6301,0,miopenConvolutionFwdAlgoDirect
192-5-276-208-3x1x1-192-2-276-208-1-0x0x0-2x1x1-1x1x1-0-NCDHW-BF16-F=ConvHipImplicitGemm3DGroupFwdXdlops:0.225376,154533888,miopenConvolutionFwdAlgoImplicitGEMM;GemmFwdRest:0.393719,132268032,miopenConvolutionFwdAlgoGEMM;ConvDirectNaiveConvFwd:116.813,0,miopenConvolutionFwdAlgoDirect
192-5-412-312-3x1x1-192-2-412-312-1-0x0x0-2x1x1-1x1x1-0-NCDHW-BF16-F=ConvHipImplicitGemm3DGroupFwdXdlops:0.518507,345747456,miopenConvolutionFwdAlgoImplicitGEMM;GemmFwdRest:0.907342,296165376,miopenConvolutionFwdAlgoGEMM;ConvDirectNaiveConvFwd:298.612,0,miopenConvolutionFwdAlgoDirect
192-6-826-626-3x3x3-192-4-824-624-1-0x0x0-1x1x1-1x1x1-0-NCDHW-BF16-F=ConvHipImplicitGemm3DGroupFwdXdlops:13.6963,1983108096,miopenConvolutionFwdAlgoImplicitGEMM;ConvDirectNaiveConvFwd:8295.92,0,miopenConvolutionFwdAlgoDirect
384-3-104-80-3x3x3-384-1-102-78-1-0x0x0-1x1x1-1x1x1-0-NCDHW-BF16-F=ConvHipImplicitGemm3DGroupFwdXdlops:0.201533,33242112,miopenConvolutionFwdAlgoImplicitGEMM;GemmFwdRest:0.651972,164975616,miopenConvolutionFwdAlgoGEMM;ConvDirectNaiveConvFwd:66.1701,0,miopenConvolutionFwdAlgoDirect
384-3-140-106-3x3x3-32-1-138-104-1-0x0x0-1x1x1-1x1x1-0-NCDHW-BF16-F=ConvHipImplicitGemm3DGroupFwdXdlops:0.142733,35773440,miopenConvolutionFwdAlgoImplicitGEMM;GemmFwdRest:0.679574,297603072,miopenConvolutionFwdAlgoGEMM;ConvDirectNaiveConvFwd:122.291,0,miopenConvolutionFwdAlgoDirect
384-3-206-158-3x3x3-384-1-204-156-1-0x0x0-1x1x1-1x1x1-0-NCDHW-BF16-F=ConvHipImplicitGemm3DGroupFwdXdlops:0.74181,107394048,miopenConvolutionFwdAlgoImplicitGEMM;GemmFwdRest:2.19451,659902464,miopenConvolutionFwdAlgoGEMM;ConvDirectNaiveConvFwd:244.251,0,miopenConvolutionFwdAlgoDirect
384-3-414-314-3x3x3-384-1-412-312-1-0x0x0-1x1x1-1x1x1-0-NCDHW-BF16-F=ConvHipImplicitGemm3DGroupFwdXdlops:2.62965,406195200,miopenConvolutionFwdAlgoImplicitGEMM;GemmFwdRest:8.62845,2665488384,miopenConvolutionFwdAlgoGEMM;ConvDirectNaiveConvFwd:1058.72,0,miopenConvolutionFwdAlgoDirect
384-102-78-1x1-1152-102-78-1-0x0-1x1-1x1-0-NCHW-BF16-F=ConvHipImplicitGemmGroupFwdXdlops:0.0774438,25325568,miopenConvolutionFwdAlgoImplicitGEMM;ConvAsmImplicitGemmGTCDynamicFwdXdlopsNHWC:0.0760942,61102080,miopenConvolutionFwdAlgoImplicitGEMM;GemmFwd1x1_0_1:0.0649128,0,miopenConvolutionFwdAlgoGEMM;ConvDirectNaiveConvFwd:5.18998,0,miopenConvolutionFwdAlgoDirect
384-138-104-1x1-1152-138-104-1-0x0-1x1-1x1-0-NCHW-BF16-F=ConvHipImplicitGemmGroupFwdXdlops:0.125133,44974080,miopenConvolutionFwdAlgoImplicitGEMM;ConvAsmImplicitGemmGTCDynamicFwdXdlopsNHWC:0.109744,110223360,miopenConvolutionFwdAlgoImplicitGEMM;GemmFwd1x1_0_1:0.0930253,0,miopenConvolutionFwdAlgoGEMM;ConvDirectNaiveConvFwd:9.22531,0,miopenConvolutionFwdAlgoDirect
384-205-157-3x3-384-102-78-1-0x0-2x2-1x1-0-NCHW-BF16-F=ConvHipImplicitGemmGroupFwdXdlops:0.110952,33482496,miopenConvolutionFwdAlgoImplicitGEMM;ConvAsmImplicitGemmGTCDynamicFwdXdlopsNHWC:0.14275,45702912,miopenConvolutionFwdAlgoImplicitGEMM;GemmFwdRest:0.201367,54991872,miopenConvolutionFwdAlgoGEMM;ConvDirectNaiveConvFwd:24.2731,0,miopenConvolutionFwdAlgoDirect
384-206-156-1x1-384-206-156-1-0x0-1x1-1x1-0-NCHW-BF16-F=ConvHipImplicitGemmGroupFwdXdlops:0.124609,49655808,miopenConvolutionFwdAlgoImplicitGEMM;ConvAsmImplicitGemmGTCDynamicFwdXdlopsNHWC:0.112905,98721792,miopenConvolutionFwdAlgoImplicitGEMM;GemmFwd1x1_0_1:0.0506225,0,miopenConvolutionFwdAlgoGEMM;ConvDirectNaiveConvFwd:20.9515,0,miopenConvolutionFwdAlgoDirect
384-408-312-3x3-192-408-312-1-1x1-1x1-1x1-0-NCHW-BF16-F=ConvHipImplicitGemmGroupFwdXdlops:0.617695,147972096,miopenConvolutionFwdAlgoImplicitGEMM;ConvAsmImplicitGemmGTCDynamicFwdXdlopsNHWC:0.650659,245735424,miopenConvolutionFwdAlgoImplicitGEMM;GemmFwdRest:1.1458,879869952,miopenConvolutionFwdAlgoGEMM;ConvDirectNaiveConvFwd:333.726,0,miopenConvolutionFwdAlgoDirect
96-1-408-312-1x1x1-192-1-408-312-1-0x0x0-1x1x1-1x1x1-0-NCDHW-BF16-F=ConvHipImplicitGemm3DGroupFwdXdlops:0.124733,73359360,miopenConvolutionFwdAlgoImplicitGEMM;GemmFwd1x1_0_1:0.0674846,0,miopenConvolutionFwdAlgoGEMM;ConvDirectNaiveConvFwd:23.4351,0,miopenConvolutionFwdAlgoDirect
96-1-824-624-1x1x1-192-1-824-624-1-0x0x0-1x1x1-1x1x1-0-NCDHW-BF16-F=ConvHipImplicitGemm3DGroupFwdXdlops:0.527169,296202240,miopenConvolutionFwdAlgoImplicitGEMM;GemmFwd1x1_0_1:0.259087,0,miopenConvolutionFwdAlgoGEMM;ConvDirectNaiveConvFwd:98.7005,0,miopenConvolutionFwdAlgoDirect
96-3-1650-1250-3x3x3-3-1-1648-1248-1-0x0x0-1x1x1-1x1x1-0-NCDHW-BF16-F=ConvHipImplicitGemm3DGroupFwdXdlops:2.9713,1200355840,miopenConvolutionFwdAlgoImplicitGEMM;ConvDirectNaiveConvFwd:4202.62,0,miopenConvolutionFwdAlgoDirect
96-4-552-416-1x1x1-192-4-552-416-1-0x0x0-1x1x1-1x1x1-0-NCDHW-BF16-F=ConvHipImplicitGemm3DGroupFwdXdlops:1.0037,529108992,miopenConvolutionFwdAlgoImplicitGEMM;GemmFwd1x1_0_1:0.520199,0,miopenConvolutionFwdAlgoGEMM;ConvDirectNaiveConvFwd:218.073,0,miopenConvolutionFwdAlgoDirect
96-6-1106-834-3x3x3-96-4-1104-832-1-0x0x0-1x1x1-1x1x1-0-NCDHW-BF16-F=ConvHipImplicitGemm3DGroupFwdXdlops:7.92428,1768536576,miopenConvolutionFwdAlgoImplicitGEMM;ConvDirectNaiveConvFwd:7348.04,0,miopenConvolutionFwdAlgoDirect
96-6-554-418-3x3x3-192-4-552-416-1-0x0x0-1x1x1-1x1x1-0-NCDHW-BF16-F=ConvHipImplicitGemm3DGroupFwdXdlops:3.31068,620481024,miopenConvolutionFwdAlgoImplicitGEMM;GemmFwdRest:12.9718,4761649152,miopenConvolutionFwdAlgoGEMM;ConvDirectNaiveConvFwd:1766.96,0,miopenConvolutionFwdAlgoDirect
96-6-818-626-3x3x3-96-4-816-624-1-0x0x0-1x1x1-1x1x1-0-NCDHW-BF16-F=ConvHipImplicitGemm3DGroupFwdXdlops:4.1004,981453312,miopenConvolutionFwdAlgoImplicitGEMM;ConvDirectNaiveConvFwd:4073.52,0,miopenConvolutionFwdAlgoDirect
96-1105-833-3x3-96-552-416-1-0x0-2x2-1x1-0-NCHW-BF16-F=ConvHipImplicitGemmGroupFwdXdlops:0.423051,220984576,miopenConvolutionFwdAlgoImplicitGEMM;ConvAsmImplicitGemmGTCDynamicFwdXdlopsNHWC:0.399309,309163264,miopenConvolutionFwdAlgoImplicitGEMM;GemmFwdRest:0.568655,396804096,miopenConvolutionFwdAlgoGEMM;ConvDirectNaiveConvFwd:166.181,0,miopenConvolutionFwdAlgoDirect
96-1649-1249-3x3-96-824-624-1-0x0-2x2-1x1-0-NCHW-BF16-F=ConvHipImplicitGemmGroupFwdXdlops:0.928068,494331136,miopenConvolutionFwdAlgoImplicitGEMM;ConvAsmImplicitGemmGTCDynamicFwdXdlopsNHWC:0.906902,691774720,miopenConvolutionFwdAlgoImplicitGEMM;GemmFwdRest:1.37415,888496128,miopenConvolutionFwdAlgoGEMM;ConvDirectNaiveConvFwd:403.812,0,miopenConvolutionFwdAlgoDirect
96-817-625-3x3-96-408-312-1-0x0-2x2-1x1-0-NCHW-BF16-F=ConvHipImplicitGemmGroupFwdXdlops:0.255269,122646784,miopenConvolutionFwdAlgoImplicitGEMM;ConvAsmImplicitGemmGTCDynamicFwdXdlopsNHWC:0.250142,171528448,miopenConvolutionFwdAlgoImplicitGEMM;GemmFwdRest:0.338712,219967488,miopenConvolutionFwdAlgoGEMM;ConvDirectNaiveConvFwd:91.0211,0,miopenConvolutionFwdAlgoDirect
384-205-157-3x3-384-102-78-2-0x0-2x2-1x1-0-NCHW-BF16-F=ConvHipImplicitGemmGroupFwdXdlops:0.204044,64310784,miopenConvolutionFwdAlgoImplicitGEMM;ConvAsmImplicitGemmGTCDynamicFwdXdlopsNHWC:0.233122,88751616,miopenConvolutionFwdAlgoImplicitGEMM;GemmFwdRest:0.409443,54991872,miopenConvolutionFwdAlgoGEMM;ConvDirectNaiveConvFwd:24.7598,0,miopenConvolutionFwdAlgoDirect
384-412-312-3x3-192-412-312-2-1x1-1x1-1x1-0-NCHW-BF16-F=ConvHipImplicitGemmGroupFwdXdlops:1.0969,297492480,miopenConvolutionFwdAlgoImplicitGEMM;ConvAsmImplicitGemmGTCDynamicFwdXdlopsNHWC:1.18386,494936064,miopenConvolutionFwdAlgoImplicitGEMM;GemmFwdRest:2.2457,888496128,miopenConvolutionFwdAlgoGEMM;ConvDirectNaiveConvFwd:337.476,0,miopenConvolutionFwdAlgoDirect
192-553-417-3x3-192-276-208-4-0x0-2x2-1x1-0-NCHW-BF16-F=ConvHipImplicitGemmGroupFwdXdlops:0.936603,443045376,miopenConvolutionFwdAlgoImplicitGEMM;ConvAsmImplicitGemmGTCDynamicFwdXdlopsNHWC:0.947365,619402752,miopenConvolutionFwdAlgoImplicitGEMM;GemmFwdRest:1.23928,198402048,miopenConvolutionFwdAlgoGEMM;ConvDirectNaiveConvFwd:93.9115,0,miopenConvolutionFwdAlgoDirect
192-825-625-3x3-192-412-312-4-0x0-2x2-1x1-0-NCHW-BF16-F=ConvHipImplicitGemmGroupFwdXdlops:2.15041,990107136,miopenConvolutionFwdAlgoImplicitGEMM;ConvAsmImplicitGemmGTCDynamicFwdXdlopsNHWC:2.1697,1384994304,miopenConvolutionFwdAlgoImplicitGEMM;GemmFwdRest:2.72403,444248064,miopenConvolutionFwdAlgoGEMM;ConvDirectNaiveConvFwd:220.735,0,miopenConvolutionFwdAlgoDirect
384-408-312-3x3-192-408-312-4-1x1-1x1-1x1-0-NCHW-BF16-F=ConvHipImplicitGemmGroupFwdXdlops:2.34804,587907072,miopenConvolutionFwdAlgoImplicitGEMM;ConvAsmImplicitGemmGTCDynamicFwdXdlopsNHWC:2.44966,978960384,miopenConvolutionFwdAlgoImplicitGEMM;GemmFwdRest:4.58114,879869952,miopenConvolutionFwdAlgoGEMM;ConvDirectNaiveConvFwd:427.487,0,miopenConvolutionFwdAlgoDirect
96-1105-833-3x3-96-552-416-4-0x0-2x2-1x1-0-NCHW-BF16-F=ConvHipImplicitGemmGroupFwdXdlops:1.64493,883440384,miopenConvolutionFwdAlgoImplicitGEMM;ConvAsmImplicitGemmGTCDynamicFwdXdlopsNHWC:1.54114,1236155136,miopenConvolutionFwdAlgoImplicitGEMM;GemmFwdRest:2.26832,396804096,miopenConvolutionFwdAlgoGEMM;ConvDirectNaiveConvFwd:180.707,0,miopenConvolutionFwdAlgoDirect
96-817-625-3x3-96-408-312-4-0x0-2x2-1x1-0-NCHW-BF16-F=ConvHipImplicitGemmGroupFwdXdlops:0.901336,490089216,miopenConvolutionFwdAlgoImplicitGEMM;ConvAsmImplicitGemmGTCDynamicFwdXdlopsNHWC:0.891288,685615872,miopenConvolutionFwdAlgoImplicitGEMM;GemmFwdRest:1.30107,219967488,miopenConvolutionFwdAlgoGEMM;ConvDirectNaiveConvFwd:99.9698,0,miopenConvolutionFwdAlgoDirect
128-11-130-194-3x3x3-128-9-128-192-1-0x0x0-1x1x1-1x1x1-0-NCDHW-FP16-F=ConvHipImplicitGemm3DGroupFwdXdlops:0.625276,128527360,miopenConvolutionFwdAlgoImplicitGEMM;GemmFwdRest:3.84061,1528823808,miopenConvolutionFwdAlgoGEMM;ConvDirectNaiveConvFwd:623.79,0,miopenConvolutionFwdAlgoDirect
128-11-146-130-3x3x3-128-9-144-128-1-0x0x0-1x1x1-1x1x1-0-NCDHW-FP16-F=ConvHipImplicitGemm3DGroupFwdXdlops:0.54818,96799744,miopenConvolutionFwdAlgoImplicitGEMM;GemmFwdRest:2.9704,1146617856,miopenConvolutionFwdAlgoGEMM;ConvDirectNaiveConvFwd:472.204,0,miopenConvolutionFwdAlgoDirect
128-11-162-258-3x3x3-3-9-160-256-1-0x0x0-1x1x1-1x1x1-0-NCDHW-FP16-F=ConvHipImplicitGemm3DGroupFwdXdlops:1.07115,119930112,miopenConvolutionFwdAlgoImplicitGEMM;GemmFwdRest:6.42392,2548039680,miopenConvolutionFwdAlgoGEMM;ConvDirectNaiveConvFwd:1014.21,0,miopenConvolutionFwdAlgoDirect
128-19-130-194-3x3x3-128-17-128-192-1-0x0x0-1x1x1-1x1x1-0-NCDHW-FP16-F=ConvHipImplicitGemm3DGroupFwdXdlops:1.28114,230509568,miopenConvolutionFwdAlgoImplicitGEMM;GemmFwdRest:7.76317,2887778304,miopenConvolutionFwdAlgoGEMM;ConvDirectNaiveConvFwd:1180.86,0,miopenConvolutionFwdAlgoDirect
128-19-146-258-3x3x3-128-17-144-256-1-0x0x0-1x1x1-1x1x1-0-NCDHW-FP16-F=ConvHipImplicitGemm3DGroupFwdXdlops:1.79297,344534016,miopenConvolutionFwdAlgoImplicitGEMM;GemmFwdRest:11.5139,4331667456,miopenConvolutionFwdAlgoGEMM;ConvDirectNaiveConvFwd:1707.49,0,miopenConvolutionFwdAlgoDirect
128-19-258-258-3x3x3-3-17-256-256-1-0x0x0-1x1x1-1x1x1-0-NCDHW-FP16-F=ConvHipImplicitGemm3DGroupFwdXdlops:2.27483,330472704,miopenConvolutionFwdAlgoImplicitGEMM;ConvDirectNaiveConvFwd:3108.19,0,miopenConvolutionFwdAlgoDirect
256-11-146-130-3x3x3-128-9-144-128-1-0x0x0-1x1x1-1x1x1-0-NCDHW-FP16-F=ConvHipImplicitGemm3DGroupFwdXdlops:0.998498,151132160,miopenConvolutionFwdAlgoImplicitGEMM;GemmFwdRest:6.01705,2293235712,miopenConvolutionFwdAlgoGEMM;ConvDirectNaiveConvFwd:943.19,0,miopenConvolutionFwdAlgoDirect
256-11-162-258-3x3x3-256-9-160-256-1-0x0x0-1x1x1-1x1x1-0-NCDHW-FP16-F=ConvHipImplicitGemm3DGroupFwdXdlops:3.56984,427677696,miopenConvolutionFwdAlgoImplicitGEMM;GemmFwdRest:14.0872,5096079360,miopenConvolutionFwdAlgoGEMM;ConvDirectNaiveConvFwd:2023.87,0,miopenConvolutionFwdAlgoDirect
256-11-74-66-3x3x3-256-9-72-64-1-0x0x0-1x1x1-1x1x1-0-NCDHW-FP16-F=ConvHipImplicitGemm3DGroupFwdXdlops:0.427877,52279296,miopenConvolutionFwdAlgoImplicitGEMM;GemmFwdRest:1.74436,573308928,miopenConvolutionFwdAlgoGEMM;ConvDirectNaiveConvFwd:247.43,0,miopenConvolutionFwdAlgoDirect
256-17-128-192-1x1x1-128-17-128-192-1-0x0x0-1x1x1-1x1x1-0-NCDHW-FP16-F=ConvHipImplicitGemm3DGroupFwdXdlops:0.507861,320929792,miopenConvolutionFwdAlgoImplicitGEMM;GemmFwd1x1_0_1:0.253305,0,miopenConvolutionFwdAlgoGEMM;ConvDirectNaiveConvFwd:248.854,0,miopenConvolutionFwdAlgoDirect
256-17-160-192-1x1x1-128-17-160-192-1-0x0x0-1x1x1-1x1x1-0-NCDHW-FP16-F=ConvHipImplicitGemm3DGroupFwdXdlops:0.631919,401145856,miopenConvolutionFwdAlgoImplicitGEMM;GemmFwd1x1_0_1:0.316921,0,miopenConvolutionFwdAlgoGEMM;ConvDirectNaiveConvFwd:313.038,0,miopenConvolutionFwdAlgoDirect
256-17-256-256-1x1x1-128-17-256-256-1-0x0x0-1x1x1-1x1x1-0-NCDHW-FP16-F=ConvHipImplicitGemm3DGroupFwdXdlops:1.35693,855703552,miopenConvolutionFwdAlgoImplicitGEMM;GemmFwd1x1_0_1:0.722678,0,miopenConvolutionFwdAlgoGEMM;ConvDirectNaiveConvFwd:720.746,0,miopenConvolutionFwdAlgoDirect
256-19-146-258-3x3x3-256-17-144-256-1-0x0x0-1x1x1-1x1x1-0-NCDHW-FP16-F=ConvHipImplicitGemm3DGroupFwdXdlops:5.88096,690837504,miopenConvolutionFwdAlgoImplicitGEMM;ConvDirectNaiveConvFwd:3456.24,0,miopenConvolutionFwdAlgoDirect
256-19-258-194-3x3x3-256-17-256-192-1-0x0x0-1x1x1-1x1x1-0-NCDHW-FP16-F=ConvHipImplicitGemm3DGroupFwdXdlops:8.35384,918263808,miopenConvolutionFwdAlgoImplicitGEMM;ConvDirectNaiveConvFwd:4810.28,0,miopenConvolutionFwdAlgoDirect
512-11-66-130-3x3x3-256-9-64-128-1-0x0x0-1x1x1-1x1x1-0-NCDHW-FP16-F=ConvHipImplicitGemm3DGroupFwdXdlops:1.43263,141471744,miopenConvolutionFwdAlgoImplicitGEMM;GemmFwdRest:6.28842,2038431744,miopenConvolutionFwdAlgoGEMM;ConvDirectNaiveConvFwd:837.234,0,miopenConvolutionFwdAlgoDirect
512-11-74-130-3x3x3-256-9-72-128-1-0x0x0-1x1x1-1x1x1-0-NCDHW-FP16-F=ConvHipImplicitGemm3DGroupFwdXdlops:1.80144,157904896,miopenConvolutionFwdAlgoImplicitGEMM;GemmFwdRest:7.07141,2293235712,miopenConvolutionFwdAlgoGEMM;ConvDirectNaiveConvFwd:944.613,0,miopenConvolutionFwdAlgoDirect
512-5-128-64-1x1x1-256-5-128-64-1-0x0x0-1x1x1-1x1x1-0-NCDHW-FP16-F=ConvHipImplicitGemm3DGroupFwdXdlops:0.111143,63176704,miopenConvolutionFwdAlgoImplicitGEMM;GemmFwd1x1_0_1:0.0499784,0,miopenConvolutionFwdAlgoGEMM;ConvDirectNaiveConvFwd:40.6285,0,miopenConvolutionFwdAlgoDirect
512-5-18-34-3x3x3-512-3-16-32-1-0x0x0-1x1x1-1x1x1-0-NCDHW-FP16-F=ConvHipImplicitGemm3DGroupFwdXdlops:0.191666,18862080,miopenConvolutionFwdAlgoImplicitGEMM;GemmFwdRest:0.496254,42467328,miopenConvolutionFwdAlgoGEMM;ConvDirectNaiveConvFwd:15.9305,0,miopenConvolutionFwdAlgoDirect
512-5-22-26-3x3x3-512-3-20-24-1-0x0x0-1x1x1-1x1x1-0-NCDHW-FP16-F=ConvHipImplicitGemm3DGroupFwdXdlops:0.213779,18558976,miopenConvolutionFwdAlgoImplicitGEMM;GemmFwdRest:0.488349,39813120,miopenConvolutionFwdAlgoGEMM;ConvDirectNaiveConvFwd:15.829,0,miopenConvolutionFwdAlgoDirect
512-5-34-26-3x3x3-512-3-32-24-1-0x0x0-1x1x1-1x1x1-0-NCDHW-FP16-F=ConvHipImplicitGemm3DGroupFwdXdlops:0.258613,21041152,miopenConvolutionFwdAlgoImplicitGEMM;GemmFwdRest:0.533496,63700992,miopenConvolutionFwdAlgoGEMM;ConvDirectNaiveConvFwd:24.4661,0,miopenConvolutionFwdAlgoDirect
512-5-38-66-3x3x3-512-3-36-64-1-0x0x0-1x1x1-1x1x1-0-NCDHW-FP16-F=ConvHipImplicitGemm3DGroupFwdXdlops:0.44994,34074624,miopenConvolutionFwdAlgoImplicitGEMM;GemmFwdRest:0.826253,191102976,miopenConvolutionFwdAlgoGEMM;ConvDirectNaiveConvFwd:83.9588,0,miopenConvolutionFwdAlgoDirect
512-5-72-128-1x1x1-256-5-72-128-1-0x0x0-1x1x1-1x1x1-0-NCDHW-FP16-F=ConvHipImplicitGemm3DGroupFwdXdlops:0.120113,71041024,miopenConvolutionFwdAlgoImplicitGEMM;GemmFwd1x1_0_1:0.0517438,0,miopenConvolutionFwdAlgoGEMM;ConvDirectNaiveConvFwd:46.8159,0,miopenConvolutionFwdAlgoDirect
512-7-130-66-3x3x3-256-5-128-64-1-0x0x0-1x1x1-1x1x1-0-NCDHW-FP16-F=ConvHipImplicitGemm3DGroupFwdXdlops:1.23645,89550848,miopenConvolutionFwdAlgoImplicitGEMM;GemmFwdRest:3.53107,1132462080,miopenConvolutionFwdAlgoGEMM;ConvDirectNaiveConvFwd:489.6,0,miopenConvolutionFwdAlgoDirect
512-7-34-18-3x3x3-512-5-32-16-1-0x0x0-1x1x1-1x1x1-0-NCDHW-FP16-F=ConvHipImplicitGemm3DGroupFwdXdlops:0.262426,21164032,miopenConvolutionFwdAlgoImplicitGEMM;GemmFwdRest:0.544359,70778880,miopenConvolutionFwdAlgoGEMM;ConvDirectNaiveConvFwd:26.5041,0,miopenConvolutionFwdAlgoDirect
512-7-34-66-3x3x3-512-5-32-64-1-0x0x0-1x1x1-1x1x1-0-NCDHW-FP16-F=ConvHipImplicitGemm3DGroupFwdXdlops:0.594728,40726528,miopenConvolutionFwdAlgoImplicitGEMM;GemmFwdRest:1.07112,283115520,miopenConvolutionFwdAlgoGEMM;ConvDirectNaiveConvFwd:123.746,0,miopenConvolutionFwdAlgoDirect
512-7-66-50-3x3x3-512-5-64-48-1-0x0x0-1x1x1-1x1x1-0-NCDHW-FP16-F=ConvHipImplicitGemm3DGroupFwdXdlops:0.6437,53538816,miopenConvolutionFwdAlgoImplicitGEMM;GemmFwdRest:1.43989,424673280,miopenConvolutionFwdAlgoGEMM;ConvDirectNaiveConvFwd:177.421,0,miopenConvolutionFwdAlgoDirect
512-7-74-66-3x3x3-256-5-72-64-1-0x0x0-1x1x1-1x1x1-0-NCDHW-FP16-F=ConvHipImplicitGemm3DGroupFwdXdlops:0.623404,53882880,miopenConvolutionFwdAlgoImplicitGEMM;GemmFwdRest:1.98213,637009920,miopenConvolutionFwdAlgoGEMM;ConvDirectNaiveConvFwd:276.383,0,miopenConvolutionFwdAlgoDirect
512-9-128-128-1x1x1-256-9-128-128-1-0x0x0-1x1x1-1x1x1-0-NCDHW-FP16-F=ConvHipImplicitGemm3DGroupFwdXdlops:0.397647,226754560,miopenConvolutionFwdAlgoImplicitGEMM;GemmFwd1x1_0_1:0.107905,0,miopenConvolutionFwdAlgoGEMM;ConvDirectNaiveConvFwd:148.702,0,miopenConvolutionFwdAlgoDirect
512-9-72-128-1x1x1-256-9-72-128-1-0x0x0-1x1x1-1x1x1-0-NCDHW-FP16-F=ConvHipImplicitGemm3DGroupFwdXdlops:0.206884,127664128,miopenConvolutionFwdAlgoImplicitGEMM;GemmFwd1x1_0_1:0.091022,0,miopenConvolutionFwdAlgoGEMM;ConvDirectNaiveConvFwd:83.669,0,miopenConvolutionFwdAlgoDirect
16-21-138-104-1x1x1-16-21-138-104-1-0x0x0-1x1x1-1x1x1-0-NCDHW-FP32-F=ConvHipImplicitGemm3DGroupFwdXdlops:0.0597234,38579200,miopenConvolutionFwdAlgoImplicitGEMM;GemmFwd1x1_0_1:0.075526,0,miopenConvolutionFwdAlgoGEMM;ConvDirectNaiveConvFwd:9.78113,0,miopenConvolutionFwdAlgoDirect
16-3-208-158-3x3x3-384-1-206-156-1-0x0x0-1x1x1-1x1x1-0-NCDHW-FP32-F=ConvHipImplicitGemm3DGroupFwdXdlops:0.237374,56334336,miopenConvolutionFwdAlgoImplicitGEMM;GemmFwdRest:0.207636,55531008,miopenConvolutionFwdAlgoGEMM;ConvDirectNaiveConvFwd:10.8871,0,miopenConvolutionFwdAlgoDirect
192-2-204-156-1x1x1-384-2-204-156-1-0x0x0-1x1x1-1x1x1-0-NCDHW-FP32-F=ConvHipImplicitGemm3DGroupFwdXdlops:0.245302,146939904,miopenConvolutionFwdAlgoImplicitGEMM;GemmFwd1x1_0_1:0.140336,0,miopenConvolutionFwdAlgoGEMM;ConvDirectNaiveConvFwd:24.4306,0,miopenConvolutionFwdAlgoDirect
192-3-206-158-3x3x3-384-1-204-156-1-0x0x0-1x1x1-1x1x1-0-NCDHW-FP32-F=ConvHipImplicitGemm3DGroupFwdXdlops:1.59005,131834880,miopenConvolutionFwdAlgoImplicitGEMM;GemmFwdRest:2.20667,659902464,miopenConvolutionFwdAlgoGEMM;ConvDirectNaiveConvFwd:130.218,0,miopenConvolutionFwdAlgoDirect
192-3-554-418-3x3x3-192-1-552-416-1-0x0x0-1x1x1-1x1x1-0-NCDHW-FP32-F=ConvHipImplicitGemm3DGroupFwdXdlops:5.51208,713880576,miopenConvolutionFwdAlgoImplicitGEMM;GemmFwdRest:12.0123,4761649152,miopenConvolutionFwdAlgoGEMM;ConvDirectNaiveConvFwd:988.189,0,miopenConvolutionFwdAlgoDirect
192-5-204-156-3x1x1-192-2-204-156-1-0x0x0-2x1x1-1x1x1-0-NCDHW-FP32-F=ConvHipImplicitGemm3DGroupFwdXdlops:0.299647,171528192,miopenConvolutionFwdAlgoImplicitGEMM;GemmFwdRest:0.382244,146644992,miopenConvolutionFwdAlgoGEMM;ConvDirectNaiveConvFwd:67.559,0,miopenConvolutionFwdAlgoDirect
192-5-412-312-3x1x1-192-2-412-312-1-0x0x0-2x1x1-1x1x1-0-NCDHW-FP32-F=ConvHipImplicitGemm3DGroupFwdXdlops:1.1742,691494912,miopenConvolutionFwdAlgoImplicitGEMM;GemmFwdRest:1.58992,592330752,miopenConvolutionFwdAlgoGEMM;ConvDirectNaiveConvFwd:336.151,0,miopenConvolutionFwdAlgoDirect
192-6-554-418-3x3x3-192-4-552-416-1-0x0x0-1x1x1-1x1x1-0-NCDHW-FP32-F=ConvHipImplicitGemm3DGroupFwdXdlops:21.3698,1776494592,miopenConvolutionFwdAlgoImplicitGEMM;ConvDirectNaiveConvFwd:3943.97,0,miopenConvolutionFwdAlgoDirect
192-553-417-3x3-192-276-208-1-0x0-2x2-1x1-0-NCHW-FP32-F=ConvBinWinogradRxSf2x3g1:1.63202,0,miopenConvolutionFwdAlgoWinograd;ConvBinWinogradRxSf3x2:0.765565,0,miopenConvolutionFwdAlgoWinograd;ConvHipImplicitGemmGroupFwdXdlops:0.678245,222518016,miopenConvolutionFwdAlgoImplicitGEMM;ConvAsmImplicitGemmGTCDynamicFwdXdlopsNHWC:0.642632,222518016,miopenConvolutionFwdAlgoImplicitGEMM;GemmFwdRest:0.754165,396804096,miopenConvolutionFwdAlgoGEMM;ConvDirectNaiveConvFwd:79.4864,0,miopenConvolutionFwdAlgoDirect
192-825-625-3x3-192-412-312-1-0x0-2x2-1x1-0-NCHW-FP32-F=ConvBinWinogradRxSf2x3g1:3.68357,0,miopenConvolutionFwdAlgoWinograd;ConvBinWinogradRxSf3x2:1.80969,0,miopenConvolutionFwdAlgoWinograd;ConvHipImplicitGemmGroupFwdXdlops:1.46044,496048896,miopenConvolutionFwdAlgoImplicitGEMM;ConvAsmImplicitGemmGTCDynamicFwdXdlopsNHWC:1.34959,496048896,miopenConvolutionFwdAlgoImplicitGEMM;GemmFwdRest:1.72648,888496128,miopenConvolutionFwdAlgoGEMM;ConvDirectNaiveConvFwd:193.69,0,miopenConvolutionFwdAlgoDirect
3-3-1650-1250-3x3x3-96-1-1648-1248-1-0x0x0-1x1x1-1x1x1-0-NCDHW-FP32-F=ConvHipImplicitGemm3DGroupFwdXdlops:1.65952,864055808,miopenConvolutionFwdAlgoImplicitGEMM;GemmFwdRest:2.00286,666372096,miopenConvolutionFwdAlgoGEMM;ConvDirectNaiveConvFwd:135.194,0,miopenConvolutionFwdAlgoDirect
3-6-1106-834-3x3x3-96-4-1104-832-1-0x0x0-1x1x1-1x1x1-0-NCDHW-FP32-F=ConvHipImplicitGemm3DGroupFwdXdlops:2.987,1477303552,miopenConvolutionFwdAlgoImplicitGEMM;GemmFwdRest:3.47339,1190412288,miopenConvolutionFwdAlgoGEMM;ConvDirectNaiveConvFwd:236.687,0,miopenConvolutionFwdAlgoDirect
3-6-818-626-3x3x3-96-4-816-624-1-0x0x0-1x1x1-1x1x1-0-NCDHW-FP32-F=ConvHipImplicitGemm3DGroupFwdXdlops:1.64731,819006976,miopenConvolutionFwdAlgoImplicitGEMM;GemmFwdRest:1.99135,659902464,miopenConvolutionFwdAlgoGEMM;ConvDirectNaiveConvFwd:128.731,0,miopenConvolutionFwdAlgoDirect
32-21-102-78-1x1x1-32-21-102-78-1-0x0x0-1x1x1-1x1x1-0-NCDHW-FP32-F=ConvHipImplicitGemm3DGroupFwdXdlops:0.0809072,42775552,miopenConvolutionFwdAlgoImplicitGEMM;GemmFwd1x1_0_1:0.0568448,0,miopenConvolutionFwdAlgoGEMM;ConvDirectNaiveConvFwd:10.6623,0,miopenConvolutionFwdAlgoDirect
36-21-138-104-1x2x2-5120-21-69-52-1-0x0x0-1x2x2-1x1x1-0-NCDHW-FP32-F=ConvHipImplicitGemm3DGroupFwdXdlops:3.40623,1589476608,miopenConvolutionFwdAlgoImplicitGEMM;GemmFwdRest:1.63161,43400448,miopenConvolutionFwdAlgoGEMM;ConvDirectNaiveConvFwd:51.9391,0,miopenConvolutionFwdAlgoDirect
384-3-138-104-3x1x1-768-1-138-104-1-0x0x0-1x1x1-1x1x1-0-NCDHW-FP32-F=ConvHipImplicitGemm3DGroupFwdXdlops:0.426408,113762304,miopenConvolutionFwdAlgoImplicitGEMM;GemmFwdRest:0.392833,66134016,miopenConvolutionFwdAlgoGEMM;ConvDirectNaiveConvFwd:30.867,0,miopenConvolutionFwdAlgoDirect
384-3-206-156-3x1x1-768-1-206-156-1-0x0x0-1x1x1-1x1x1-0-NCDHW-FP32-F=ConvHipImplicitGemm3DGroupFwdXdlops:0.859059,250343424,miopenConvolutionFwdAlgoImplicitGEMM;GemmFwdRest:0.814558,148082688,miopenConvolutionFwdAlgoGEMM;ConvDirectNaiveConvFwd:68.6567,0,miopenConvolutionFwdAlgoDirect
384-3-278-210-3x3x3-384-1-276-208-1-0x0x0-1x1x1-1x1x1-0-NCDHW-FP32-F=ConvHipImplicitGemm3DGroupFwdXdlops:5.11873,373118976,miopenConvolutionFwdAlgoImplicitGEMM;GemmFwdRest:8.0401,2380824576,miopenConvolutionFwdAlgoGEMM;ConvDirectNaiveConvFwd:550.662,0,miopenConvolutionFwdAlgoDirect
384-4-278-210-3x3x3-384-2-276-208-1-0x0x0-1x1x1-1x1x1-0-NCDHW-FP32-F=ConvHipImplicitGemm3DGroupFwdXdlops:9.99311,550969344,miopenConvolutionFwdAlgoImplicitGEMM;GemmFwdRest:16.5151,4761649152,miopenConvolutionFwdAlgoGEMM;ConvDirectNaiveConvFwd:1100.39,0,miopenConvolutionFwdAlgoDirect
384-102-78-1x1-384-102-78-1-0x0-1x1-1x1-0-NCHW-FP32-F=ConvBinWinogradRxSf2x3g1:0.225747,0,miopenConvolutionFwdAlgoWinograd;ConvBinWinogradRxSf3x2:0.127058,0,miopenConvolutionFwdAlgoWinograd;ConvHipImplicitGemmGroupFwdXdlops:0.0711216,25030656,miopenConvolutionFwdAlgoImplicitGEMM;ConvAsmImplicitGemmGTCDynamicFwdXdlopsNHWC:0.0667602,24440832,miopenConvolutionFwdAlgoImplicitGEMM;GemmFwd1x1_0_1:0.0421908,0,miopenConvolutionFwdAlgoGEMM;ConvDirectNaiveConvFwd:5.14301,0,miopenConvolutionFwdAlgoDirect
384-204-156-3x3-192-204-156-1-1x1-1x1-1x1-0-NCHW-FP32-F=ConvBinWinogradRxSf2x3g1:0.422796,0,miopenConvolutionFwdAlgoWinograd;ConvBinWinogradRxSf3x2:0.8843,0,miopenConvolutionFwdAlgoWinograd;ConvHipImplicitGemmGroupFwdXdlops:0.580634,75976704,miopenConvolutionFwdAlgoImplicitGEMM;ConvAsmImplicitGemmGTCDynamicFwdXdlopsNHWC:0.52963,75976704,miopenConvolutionFwdAlgoImplicitGEMM;GemmFwdRest:0.856821,439934976,miopenConvolutionFwdAlgoGEMM;ConvDirectNaiveConvFwd:77.4364,0,miopenConvolutionFwdAlgoDirect
384-206-156-1x1-384-206-156-1-0x0-1x1-1x1-0-NCHW-FP32-F=ConvBinWinogradRxSf2x3g1:0.870241,0,miopenConvolutionFwdAlgoWinograd;ConvBinWinogradRxSf3x2:0.430562,0,miopenConvolutionFwdAlgoWinograd;ConvHipImplicitGemmGroupFwdXdlops:0.220729,99311616,miopenConvolutionFwdAlgoImplicitGEMM;ConvAsmImplicitGemmGTCDynamicFwdXdlopsNHWC:0.202909,98721792,miopenConvolutionFwdAlgoImplicitGEMM;GemmFwd1x1_0_1:0.136948,0,miopenConvolutionFwdAlgoGEMM;ConvDirectNaiveConvFwd:20.1388,0,miopenConvolutionFwdAlgoDirect
384-412-312-3x3-192-412-312-1-1x1-1x1-1x1-0-NCHW-FP32-F=ConvBinWinogradRxSf2x3g1:1.69995,0,miopenConvolutionFwdAlgoWinograd;ConvBinWinogradRxSf3x2:2.89177,0,miopenConvolutionFwdAlgoWinograd;ConvHipImplicitGemmGroupFwdXdlops:2.19078,298819584,miopenConvolutionFwdAlgoImplicitGEMM;ConvAsmImplicitGemmGTCDynamicFwdXdlopsNHWC:2.07641,298819584,miopenConvolutionFwdAlgoImplicitGEMM;GemmFwdRest:3.13996,1776992256,miopenConvolutionFwdAlgoGEMM;ConvDirectNaiveConvFwd:316.367,0,miopenConvolutionFwdAlgoDirect
96-1-408-312-1x1x1-192-1-408-312-1-0x0x0-1x1x1-1x1x1-0-NCDHW-FP32-F=ConvHipImplicitGemm3DGroupFwdXdlops:0.190719,146718720,miopenConvolutionFwdAlgoImplicitGEMM;GemmFwd1x1_0_1:0.124105,0,miopenConvolutionFwdAlgoGEMM;ConvDirectNaiveConvFwd:24.3786,0,miopenConvolutionFwdAlgoDirect
96-1-824-624-1x1x1-192-1-824-624-1-0x0x0-1x1x1-1x1x1-0-NCDHW-FP32-F=ConvHipImplicitGemm3DGroupFwdXdlops:0.827267,592404480,miopenConvolutionFwdAlgoImplicitGEMM;GemmFwd1x1_0_1:0.492947,0,miopenConvolutionFwdAlgoGEMM;ConvDirectNaiveConvFwd:118.982,0,miopenConvolutionFwdAlgoDirect
96-3-1106-834-3x3x3-96-1-1104-832-1-0x0x0-1x1x1-1x1x1-0-NCDHW-FP32-F=ConvHipImplicitGemm3DGroupFwdXdlops:7.56377,1416319488,miopenConvolutionFwdAlgoImplicitGEMM;GemmFwdRest:17.1026,9523298304,miopenConvolutionFwdAlgoGEMM;ConvDirectNaiveConvFwd:1946.15,0,miopenConvolutionFwdAlgoDirect
96-3-410-314-3x3x3-192-1-408-312-1-0x0x0-1x1x1-1x1x1-0-NCDHW-FP32-F=ConvHipImplicitGemm3DGroupFwdXdlops:1.70721,248062464,miopenConvolutionFwdAlgoImplicitGEMM;GemmFwdRest:3.15019,1319804928,miopenConvolutionFwdAlgoGEMM;ConvDirectNaiveConvFwd:250.235,0,miopenConvolutionFwdAlgoDirect
96-3-554-418-3x3x3-192-1-552-416-1-0x0x0-1x1x1-1x1x1-0-NCDHW-FP32-F=ConvHipImplicitGemm3DGroupFwdXdlops:2.83421,445118976,miopenConvolutionFwdAlgoImplicitGEMM;GemmFwdRest:5.90394,2380824576,miopenConvolutionFwdAlgoGEMM;ConvDirectNaiveConvFwd:478.733,0,miopenConvolutionFwdAlgoDirect
96-3-818-626-3x3x3-3-1-816-624-1-0x0x0-1x1x1-1x1x1-0-NCDHW-FP32-F=ConvHipImplicitGemm3DGroupFwdXdlops:1.84499,596043776,miopenConvolutionFwdAlgoImplicitGEMM;GemmFwdRest:8.89587,5279219712,miopenConvolutionFwdAlgoGEMM;ConvDirectNaiveConvFwd:1084.46,0,miopenConvolutionFwdAlgoDirect
96-3-826-626-3x3x3-192-1-824-624-1-0x0x0-1x1x1-1x1x1-0-NCDHW-FP32-F=ConvHipImplicitGemm3DGroupFwdXdlops:6.37823,992549376,miopenConvolutionFwdAlgoImplicitGEMM;GemmFwdRest:13.2438,5330976768,miopenConvolutionFwdAlgoGEMM;ConvDirectNaiveConvFwd:1091.24,0,miopenConvolutionFwdAlgoDirect
96-6-1106-834-3x3x3-3-4-1104-832-1-0x0x0-1x1x1-1x1x1-0-NCDHW-FP32-F=ConvHipImplicitGemm3DGroupFwdXdlops:11.0519,2169339392,miopenConvolutionFwdAlgoImplicitGEMM;ConvDirectNaiveConvFwd:7880.2,0,miopenConvolutionFwdAlgoDirect
96-6-410-314-3x3x3-192-4-408-312-1-0x0x0-1x1x1-1x1x1-0-NCDHW-FP32-F=ConvHipImplicitGemm3DGroupFwdXdlops:6.26537,689660928,miopenConvolutionFwdAlgoImplicitGEMM;GemmFwdRest:13.0747,5279219712,miopenConvolutionFwdAlgoGEMM;ConvDirectNaiveConvFwd:1030.17,0,miopenConvolutionFwdAlgoDirect
96-6-818-626-3x3x3-3-4-816-624-1-0x0x0-1x1x1-1x1x1-0-NCDHW-FP32-F=ConvHipImplicitGemm3DGroupFwdXdlops:6.16671,1204276736,miopenConvolutionFwdAlgoImplicitGEMM;ConvDirectNaiveConvFwd:4328.72,0,miopenConvolutionFwdAlgoDirect
96-6-826-626-3x3x3-192-4-824-624-1-0x0x0-1x1x1-1x1x1-0-NCDHW-FP32-F=ConvHipImplicitGemm3DGroupFwdXdlops:24.4585,2772882432,miopenConvolutionFwdAlgoImplicitGEMM;ConvDirectNaiveConvFwd:4341.74,0,miopenConvolutionFwdAlgoDirect
384-205-157-3x3-384-102-78-2-0x0-2x2-1x1-0-NCHW-FP32-F=ConvBinWinogradRxSf2x3g1:1.7458,0,miopenConvolutionFwdAlgoWinograd;ConvBinWinogradRxSf3x2:0.966335,0,miopenConvolutionFwdAlgoWinograd;ConvHipImplicitGemmGroupFwdXdlops:0.632717,128621568,miopenConvolutionFwdAlgoImplicitGEMM;ConvAsmImplicitGemmGTCDynamicFwdXdlopsNHWC:0.560977,128621568,miopenConvolutionFwdAlgoImplicitGEMM;GemmFwdRest:0.663277,109983744,miopenConvolutionFwdAlgoGEMM;ConvDirectNaiveConvFwd:24.0959,0,miopenConvolutionFwdAlgoDirect
384-277-209-3x3-384-138-104-2-0x0-2x2-1x1-0-NCHW-FP32-F=ConvBinWinogradRxSf2x3g1:3.12886,0,miopenConvolutionFwdAlgoWinograd;ConvBinWinogradRxSf3x2:1.46185,0,miopenConvolutionFwdAlgoWinograd;ConvHipImplicitGemmGroupFwdXdlops:1.13905,227245056,miopenConvolutionFwdAlgoImplicitGEMM;ConvAsmImplicitGemmGTCDynamicFwdXdlopsNHWC:1.01267,227245056,miopenConvolutionFwdAlgoImplicitGEMM;GemmFwdRest:1.38106,198402048,miopenConvolutionFwdAlgoGEMM;ConvDirectNaiveConvFwd:43.1373,0,miopenConvolutionFwdAlgoDirect
192-1104-832-3x3-96-1104-832-4-1x1-1x1-1x1-0-NCHW-FP32-F=ConvBinWinogradRxSf2x3g1:14.2374,0,miopenConvolutionFwdAlgoWinograd;ConvBinWinogradRxSf3x2:21.5833,0,miopenConvolutionFwdAlgoWinograd;ConvHipImplicitGemmGroupFwdXdlops:20.5955,4233240576,miopenConvolutionFwdAlgoImplicitGEMM;ConvAsmImplicitGemmGTCDynamicFwdXdlopsNHWC:19.6976,4233240576,miopenConvolutionFwdAlgoImplicitGEMM;GemmFwdRest:26.7764,6348865536,miopenConvolutionFwdAlgoGEMM;ConvDirectNaiveConvFwd:1662.63,0,miopenConvolutionFwdAlgoDirect
384-824-624-3x3-192-824-624-4-1x1-1x1-1x1-0-NCHW-FP32-F=ConvBinWinogradRxSf2x3g1:32.8698,0,miopenConvolutionFwdAlgoWinograd;ConvBinWinogradRxSf3x2:49.9706,0,miopenConvolutionFwdAlgoWinograd;ConvHipImplicitGemmGroupFwdXdlops:33.2366,4741300224,miopenConvolutionFwdAlgoImplicitGEMM;ConvAsmImplicitGemmGTCDynamicFwdXdlopsNHWC:34.3845,4741300224,miopenConvolutionFwdAlgoImplicitGEMM;GemmFwdRest:48.7116,7107969024,miopenConvolutionFwdAlgoGEMM;ConvDirectNaiveConvFwd:2186.99,0,miopenConvolutionFwdAlgoDirect
192-816-624-3x3-96-816-624-1-1x1-1x1-1x1-0-NCHW-BF16-F=ConvHipImplicitGemmGroupFwdXdlops:0.863382,293621760,miopenConvolutionFwdAlgoImplicitGEMM;ConvAsmImplicitGemmGTCDynamicFwdXdlopsNHWC:0.832666,489148416,miopenConvolutionFwdAlgoImplicitGEMM;GemmFwdRest:2.08954,1759739904,miopenConvolutionFwdAlgoGEMM;ConvDirectNaiveConvFwd:667.574,0,miopenConvolutionFwdAlgoDirect
3-3-818-626-3x3x3-96-1-816-624-1-0x0x0-1x1x1-1x1x1-0-NCDHW-BF16-F=ConvHipImplicitGemm3DGroupFwdXdlops:0.281687,106996224,miopenConvolutionFwdAlgoImplicitGEMM;GemmFwdRest:0.39981,82487808,miopenConvolutionFwdAlgoGEMM;ConvDirectNaiveConvFwd:29.8897,0,miopenConvolutionFwdAlgoDirect
3-6-1106-834-3x3x3-96-4-1104-832-1-0x0x0-1x1x1-1x1x1-0-NCDHW-BF16-F=ConvHipImplicitGemm3DGroupFwdXdlops:2.02602,738651904,miopenConvolutionFwdAlgoImplicitGEMM;GemmFwdRest:2.84989,595206144,miopenConvolutionFwdAlgoGEMM;ConvDirectNaiveConvFwd:221.441,0,miopenConvolutionFwdAlgoDirect
3-6-818-626-3x3x3-96-4-816-624-1-0x0x0-1x1x1-1x1x1-0-NCDHW-BF16-F=ConvHipImplicitGemm3DGroupFwdXdlops:1.09495,409503488,miopenConvolutionFwdAlgoImplicitGEMM;GemmFwdRest:1.62518,329951232,miopenConvolutionFwdAlgoGEMM;ConvDirectNaiveConvFwd:119.901,0,miopenConvolutionFwdAlgoDirect
32-21-206-156-1x1x1-32-21-206-156-1-0x0x0-1x1x1-1x1x1-0-NCDHW-BF16-F=ConvHipImplicitGemm3DGroupFwdXdlops:0.168392,86383616,miopenConvolutionFwdAlgoImplicitGEMM;GemmFwd1x1_0_1:0.214454,0,miopenConvolutionFwdAlgoGEMM;ConvDirectNaiveConvFwd:42.2036,0,miopenConvolutionFwdAlgoDirect
36-21-138-104-1x2x2-5120-21-69-52-1-0x0x0-1x2x2-1x1x1-0-NCDHW-BF16-F=ConvHipImplicitGemm3DGroupFwdXdlops:2.08866,794738432,miopenConvolutionFwdAlgoImplicitGEMM;GemmFwdRest:0.856775,21700224,miopenConvolutionFwdAlgoGEMM;ConvDirectNaiveConvFwd:49.6884,0,miopenConvolutionFwdAlgoDirect
384-3-104-80-3x3x3-32-1-102-78-1-0x0x0-1x1x1-1x1x1-0-NCDHW-BF16-F=ConvHipImplicitGemm3DGroupFwdXdlops:0.0961433,20342016,miopenConvolutionFwdAlgoImplicitGEMM;GemmFwdRest:0.609098,164975616,miopenConvolutionFwdAlgoGEMM;ConvDirectNaiveConvFwd:69.8974,0,miopenConvolutionFwdAlgoDirect
384-3-138-104-3x1x1-768-1-138-104-1-0x0x0-1x1x1-1x1x1-0-NCDHW-BF16-F=ConvHipImplicitGemm3DGroupFwdXdlops:0.173499,56881152,miopenConvolutionFwdAlgoImplicitGEMM;GemmFwdRest:0.260469,33067008,miopenConvolutionFwdAlgoGEMM;ConvDirectNaiveConvFwd:29.3807,0,miopenConvolutionFwdAlgoDirect
384-3-206-156-3x1x1-384-1-206-156-1-0x0x0-2x1x1-1x1x1-0-NCDHW-BF16-F=ConvHipImplicitGemm3DGroupFwdXdlops:0.208757,99606528,miopenConvolutionFwdAlgoImplicitGEMM;GemmFwdRest:0.237934,74041344,miopenConvolutionFwdAlgoGEMM;ConvDirectNaiveConvFwd:66.1756,0,miopenConvolutionFwdAlgoDirect
384-3-208-158-3x3x3-384-1-206-156-1-0x0x0-1x1x1-1x1x1-0-NCDHW-BF16-F=ConvHipImplicitGemm3DGroupFwdXdlops:0.686536,108361728,miopenConvolutionFwdAlgoImplicitGEMM;GemmFwdRest:2.16236,666372096,miopenConvolutionFwdAlgoGEMM;ConvDirectNaiveConvFwd:247.437,0,miopenConvolutionFwdAlgoDirect
384-4-206-158-3x3x3-384-2-204-156-1-0x0x0-1x1x1-1x1x1-0-NCDHW-BF16-F=ConvHipImplicitGemm3DGroupFwdXdlops:1.15063,156831744,miopenConvolutionFwdAlgoImplicitGEMM;GemmFwdRest:4.18831,1319804928,miopenConvolutionFwdAlgoGEMM;ConvDirectNaiveConvFwd:515.504,0,miopenConvolutionFwdAlgoDirect
384-4-412-312-3x1x1-768-2-412-312-1-0x0x0-1x1x1-1x1x1-0-NCDHW-BF16-F=ConvHipImplicitGemm3DGroupFwdXdlops:1.90798,791543808,miopenConvolutionFwdAlgoImplicitGEMM;GemmFwdRest:2.36542,592330752,miopenConvolutionFwdAlgoGEMM;ConvDirectNaiveConvFwd:637.517,0,miopenConvolutionFwdAlgoDirect
384-204-156-3x3-192-204-156-1-1x1-1x1-1x1-0-NCHW-BF16-F=ConvHipImplicitGemmGroupFwdXdlops:0.188309,37988352,miopenConvolutionFwdAlgoImplicitGEMM;ConvAsmImplicitGemmGTCDynamicFwdXdlopsNHWC:0.199068,62429184,miopenConvolutionFwdAlgoImplicitGEMM;GemmFwdRest:0.319041,219967488,miopenConvolutionFwdAlgoGEMM;ConvDirectNaiveConvFwd:82.7362,0,miopenConvolutionFwdAlgoDirect
384-206-156-1x1-384-206-156-1-0x0-1x1-1x1-0-NCHW-BF16-F=ConvHipImplicitGemmGroupFwdXdlops:0.12279,49655808,miopenConvolutionFwdAlgoImplicitGEMM;ConvAsmImplicitGemmGTCDynamicFwdXdlopsNHWC:0.110536,98721792,miopenConvolutionFwdAlgoImplicitGEMM;GemmFwd1x1_0_1:0.0498345,0,miopenConvolutionFwdAlgoGEMM;ConvDirectNaiveConvFwd:20.468,0,miopenConvolutionFwdAlgoDirect
384-408-312-3x3-192-408-312-1-1x1-1x1-1x1-0-NCHW-BF16-F=ConvHipImplicitGemmGroupFwdXdlops:0.556836,147972096,miopenConvolutionFwdAlgoImplicitGEMM;ConvAsmImplicitGemmGTCDynamicFwdXdlopsNHWC:0.629443,245735424,miopenConvolutionFwdAlgoImplicitGEMM;GemmFwdRest:1.15009,879869952,miopenConvolutionFwdAlgoGEMM;ConvDirectNaiveConvFwd:331.794,0,miopenConvolutionFwdAlgoDirect
384-824-624-3x3-192-824-624-1-1x1-1x1-1x1-0-NCHW-BF16-F=ConvHipImplicitGemmGroupFwdXdlops:2.53486,593657856,miopenConvolutionFwdAlgoImplicitGEMM;ConvAsmImplicitGemmGTCDynamicFwdXdlopsNHWC:2.49724,988545024,miopenConvolutionFwdAlgoImplicitGEMM;GemmFwdRest:4.23066,3553984512,miopenConvolutionFwdAlgoGEMM;ConvDirectNaiveConvFwd:1383.99,0,miopenConvolutionFwdAlgoDirect
96-3-1650-1250-3x3x3-96-1-1648-1248-1-0x0x0-1x1x1-1x1x1-0-NCDHW-BF16-F=ConvHipImplicitGemm3DGroupFwdXdlops:5.13931,1583384832,miopenConvolutionFwdAlgoImplicitGEMM;ConvDirectNaiveConvFwd:4160.88,0,miopenConvolutionFwdAlgoDirect
96-6-1650-1250-3x3x3-3-4-1648-1248-1-0x0x0-1x1x1-1x1x1-0-NCDHW-BF16-F=ConvHipImplicitGemm3DGroupFwdXdlops:47.1029,2425376512,miopenConvolutionFwdAlgoImplicitGEMM;ConvDirectNaiveConvFwd:16757.5,0,miopenConvolutionFwdAlgoDirect
384-204-156-3x3-192-204-156-2-1x1-1x1-1x1-0-NCHW-BF16-F=ConvHipImplicitGemmGroupFwdXdlops:0.343019,74649600,miopenConvolutionFwdAlgoImplicitGEMM;ConvAsmImplicitGemmGTCDynamicFwdXdlopsNHWC:0.354792,123531264,miopenConvolutionFwdAlgoImplicitGEMM;GemmFwdRest:0.627516,219967488,miopenConvolutionFwdAlgoGEMM;ConvDirectNaiveConvFwd:83.538,0,miopenConvolutionFwdAlgoDirect
384-277-209-3x3-384-138-104-2-0x0-2x2-1x1-0-NCHW-BF16-F=ConvHipImplicitGemmGroupFwdXdlops:0.343446,113622528,miopenConvolutionFwdAlgoImplicitGEMM;ConvAsmImplicitGemmGTCDynamicFwdXdlopsNHWC:0.393506,157711872,miopenConvolutionFwdAlgoImplicitGEMM;GemmFwdRest:0.581459,99201024,miopenConvolutionFwdAlgoGEMM;ConvDirectNaiveConvFwd:44.4814,0,miopenConvolutionFwdAlgoDirect
384-413-313-3x3-384-206-156-2-0x0-2x2-1x1-0-NCHW-BF16-F=ConvHipImplicitGemmGroupFwdXdlops:0.687263,250572288,miopenConvolutionFwdAlgoImplicitGEMM;ConvAsmImplicitGemmGTCDynamicFwdXdlopsNHWC:0.790986,349294080,miopenConvolutionFwdAlgoImplicitGEMM;GemmFwdRest:0.909237,222124032,miopenConvolutionFwdAlgoGEMM;ConvDirectNaiveConvFwd:99.0003,0,miopenConvolutionFwdAlgoDirect
192-1648-1248-3x3-96-1648-1248-4-1x1-1x1-1x1-0-NCHW-BF16-F=ConvHipImplicitGemmGroupFwdXdlops:14.0142,4738977792,miopenConvolutionFwdAlgoImplicitGEMM;ConvAsmImplicitGemmGTCDynamicFwdXdlopsNHWC:13.4198,7898075136,miopenConvolutionFwdAlgoImplicitGEMM;GemmFwdRest:31.8166,7107969024,miopenConvolutionFwdAlgoGEMM;ConvDirectNaiveConvFwd:3451.04,0,miopenConvolutionFwdAlgoDirect
128-11-162-258-3x3x3-128-9-160-256-1-0x0x0-1x1x1-1x1x1-0-NCDHW-FP16-F=ConvHipImplicitGemm3DGroupFwdXdlops:1.06086,212954112,miopenConvolutionFwdAlgoImplicitGEMM;GemmFwdRest:6.56009,2548039680,miopenConvolutionFwdAlgoGEMM;ConvDirectNaiveConvFwd:1003.01,0,miopenConvolutionFwdAlgoDirect
128-19-130-194-3x3x3-3-17-128-192-1-0x0x0-1x1x1-1x1x1-0-NCDHW-FP16-F=ConvHipImplicitGemm3DGroupFwdXdlops:0.726456,125197568,miopenConvolutionFwdAlgoImplicitGEMM;GemmFwdRest:7.15243,2887778304,miopenConvolutionFwdAlgoGEMM;ConvDirectNaiveConvFwd:1214.6,0,miopenConvolutionFwdAlgoDirect
128-19-146-258-3x3x3-3-17-144-256-1-0x0x0-1x1x1-1x1x1-0-NCDHW-FP16-F=ConvHipImplicitGemm3DGroupFwdXdlops:4.92076,186998016,miopenConvolutionFwdAlgoImplicitGEMM;GemmFwdRest:10.7148,4331667456,miopenConvolutionFwdAlgoGEMM;ConvDirectNaiveConvFwd:1728,0,miopenConvolutionFwdAlgoDirect
128-19-258-194-3x3x3-128-17-256-192-1-0x0x0-1x1x1-1x1x1-0-NCDHW-FP16-F=ConvHipImplicitGemm3DGroupFwdXdlops:2.28197,458247168,miopenConvolutionFwdAlgoImplicitGEMM;GemmFwdRest:15.4036,5775556608,miopenConvolutionFwdAlgoGEMM;ConvDirectNaiveConvFwd:2413.4,0,miopenConvolutionFwdAlgoDirect
256-11-130-66-3x3x3-256-9-128-64-1-0x0x0-1x1x1-1x1x1-0-NCDHW-FP16-F=ConvHipImplicitGemm3DGroupFwdXdlops:0.624832,89610240,miopenConvolutionFwdAlgoImplicitGEMM;GemmFwdRest:2.89604,1019215872,miopenConvolutionFwdAlgoGEMM;ConvDirectNaiveConvFwd:440.319,0,miopenConvolutionFwdAlgoDirect
256-11-146-130-3x3x3-256-9-144-128-1-0x0x0-1x1x1-1x1x1-0-NCDHW-FP16-F=ConvHipImplicitGemm3DGroupFwdXdlops:1.70129,195368960,miopenConvolutionFwdAlgoImplicitGEMM;GemmFwdRest:6.1212,2293235712,miopenConvolutionFwdAlgoGEMM;ConvDirectNaiveConvFwd:935.013,0,miopenConvolutionFwdAlgoDirect
256-11-258-130-3x3x3-128-9-256-128-1-0x0x0-1x1x1-1x1x1-0-NCDHW-FP16-F=ConvHipImplicitGemm3DGroupFwdXdlops:1.61456,266164224,miopenConvolutionFwdAlgoImplicitGEMM;GemmFwdRest:10.5182,4076863488,miopenConvolutionFwdAlgoGEMM;ConvDirectNaiveConvFwd:1683.47,0,miopenConvolutionFwdAlgoDirect
256-11-66-98-3x3x3-256-9-64-96-1-0x0x0-1x1x1-1x1x1-0-NCDHW-FP16-F=ConvHipImplicitGemm3DGroupFwdXdlops:0.518255,68278272,miopenConvolutionFwdAlgoImplicitGEMM;GemmFwdRest:2.11149,764411904,miopenConvolutionFwdAlgoGEMM;ConvDirectNaiveConvFwd:318.988,0,miopenConvolutionFwdAlgoDirect
256-11-82-130-3x3x3-256-9-80-128-1-0x0x0-1x1x1-1x1x1-0-NCDHW-FP16-F=ConvHipImplicitGemm3DGroupFwdXdlops:0.931736,110761984,miopenConvolutionFwdAlgoImplicitGEMM;GemmFwdRest:3.761,1274019840,miopenConvolutionFwdAlgoGEMM;ConvDirectNaiveConvFwd:520.192,0,miopenConvolutionFwdAlgoDirect
256-17-144-256-1x1x1-128-17-144-256-1-0x0x0-1x1x1-1x1x1-0-NCDHW-FP16-F=ConvHipImplicitGemm3DGroupFwdXdlops:0.772136,481361920,miopenConvolutionFwdAlgoImplicitGEMM;GemmFwd1x1_0_1:0.387818,0,miopenConvolutionFwdAlgoGEMM;ConvDirectNaiveConvFwd:389.748,0,miopenConvolutionFwdAlgoDirect
256-19-130-194-3x3x3-128-17-128-192-1-0x0x0-1x1x1-1x1x1-0-NCDHW-FP16-F=ConvHipImplicitGemm3DGroupFwdXdlops:2.30262,354064384,miopenConvolutionFwdAlgoImplicitGEMM;GemmFwdRest:14.9965,5775556608,miopenConvolutionFwdAlgoGEMM;ConvDirectNaiveConvFwd:2381.43,0,miopenConvolutionFwdAlgoDirect
256-19-162-194-3x3x3-128-17-160-192-1-0x0x0-1x1x1-1x1x1-0-NCDHW-FP16-F=ConvHipImplicitGemm3DGroupFwdXdlops:2.95797,441194496,miopenConvolutionFwdAlgoImplicitGEMM;GemmFwdRest:18.8171,7219445760,miopenConvolutionFwdAlgoGEMM;ConvDirectNaiveConvFwd:2988.42,0,miopenConvolutionFwdAlgoDirect
256-19-258-258-3x3x3-128-17-256-256-1-0x0x0-1x1x1-1x1x1-0-NCDHW-FP16-F=ConvHipImplicitGemm3DGroupFwdXdlops:6.24249,934516736,miopenConvolutionFwdAlgoImplicitGEMM;ConvDirectNaiveConvFwd:6122.06,0,miopenConvolutionFwdAlgoDirect
512-11-82-98-3x3x3-256-9-80-96-1-0x0x0-1x1x1-1x1x1-0-NCDHW-FP16-F=ConvHipImplicitGemm3DGroupFwdXdlops:1.22548,132984832,miopenConvolutionFwdAlgoImplicitGEMM;GemmFwdRest:5.68306,1911029760,miopenConvolutionFwdAlgoGEMM;ConvDirectNaiveConvFwd:788.423,0,miopenConvolutionFwdAlgoDirect
512-5-42-50-3x3x3-512-3-40-48-1-0x0x0-1x1x1-1x1x1-0-NCDHW-FP16-F=ConvHipImplicitGemm3DGroupFwdXdlops:0.409331,30806016,miopenConvolutionFwdAlgoImplicitGEMM;GemmFwdRest:0.740413,159252480,miopenConvolutionFwdAlgoGEMM;ConvDirectNaiveConvFwd:68.0346,0,miopenConvolutionFwdAlgoDirect
512-5-66-66-3x3x3-512-3-64-64-1-0x0x0-1x1x1-1x1x1-0-NCDHW-FP16-F=ConvHipImplicitGemm3DGroupFwdXdlops:0.533629,49041408,miopenConvolutionFwdAlgoImplicitGEMM;GemmFwdRest:1.21686,339738624,miopenConvolutionFwdAlgoGEMM;ConvDirectNaiveConvFwd:147.814,0,miopenConvolutionFwdAlgoDirect
512-7-130-98-3x3x3-512-5-128-96-1-0x0x0-1x1x1-1x1x1-0-NCDHW-FP16-F=ConvHipImplicitGemm3DGroupFwdXdlops:2.06271,168390656,miopenConvolutionFwdAlgoImplicitGEMM;GemmFwdRest:6.20417,1698693120,miopenConvolutionFwdAlgoGEMM;ConvDirectNaiveConvFwd:765.735,0,miopenConvolutionFwdAlgoDirect
512-7-66-130-3x3x3-256-5-64-128-1-0x0x0-1x1x1-1x1x1-0-NCDHW-FP16-F=ConvHipImplicitGemm3DGroupFwdXdlops:0.979314,89550848,miopenConvolutionFwdAlgoImplicitGEMM;GemmFwdRest:3.46536,1132462080,miopenConvolutionFwdAlgoGEMM;ConvDirectNaiveConvFwd:466.658,0,miopenConvolutionFwdAlgoDirect
512-7-82-130-3x3x3-256-5-80-128-1-0x0x0-1x1x1-1x1x1-0-NCDHW-FP16-F=ConvHipImplicitGemm3DGroupFwdXdlops:1.01746,109703168,miopenConvolutionFwdAlgoImplicitGEMM;GemmFwdRest:4.24049,1415577600,miopenConvolutionFwdAlgoGEMM;ConvDirectNaiveConvFwd:588.657,0,miopenConvolutionFwdAlgoDirect
16-21-206-156-1x1x1-16-21-206-156-1-0x0x0-1x1x1-1x1x1-0-NCDHW-FP32-F=ConvHipImplicitGemm3DGroupFwdXdlops:0.117669,86382592,miopenConvolutionFwdAlgoImplicitGEMM;GemmFwd1x1_0_1:0.162489,0,miopenConvolutionFwdAlgoGEMM;ConvDirectNaiveConvFwd:21.9142,0,miopenConvolutionFwdAlgoDirect
192-1-276-208-1x1x1-384-1-276-208-1-0x0x0-1x1x1-1x1x1-0-NCDHW-FP32-F=ConvHipImplicitGemm3DGroupFwdXdlops:0.212417,132562944,miopenConvolutionFwdAlgoImplicitGEMM;GemmFwd1x1_0_1:0.128412,0,miopenConvolutionFwdAlgoGEMM;ConvDirectNaiveConvFwd:22.5379,0,miopenConvolutionFwdAlgoDirect
192-2-412-312-1x1x1-384-2-412-312-1-0x0x0-1x1x1-1x1x1-0-NCDHW-FP32-F=ConvHipImplicitGemm3DGroupFwdXdlops:1.06296,592625664,miopenConvolutionFwdAlgoImplicitGEMM;GemmFwd1x1_0_1:0.58173,0,miopenConvolutionFwdAlgoGEMM;ConvDirectNaiveConvFwd:117.165,0,miopenConvolutionFwdAlgoDirect
192-3-554-418-3x3x3-192-1-552-416-1-0x0x0-1x1x1-1x1x1-0-NCDHW-FP32-F=ConvHipImplicitGemm3DGroupFwdXdlops:5.64737,713880576,miopenConvolutionFwdAlgoImplicitGEMM;GemmFwdRest:12.138,4761649152,miopenConvolutionFwdAlgoGEMM;ConvDirectNaiveConvFwd:990.614,0,miopenConvolutionFwdAlgoDirect
192-5-204-156-3x1x1-192-2-204-156-1-0x0x0-2x1x1-1x1x1-0-NCDHW-FP32-F=ConvHipImplicitGemm3DGroupFwdXdlops:0.305462,171528192,miopenConvolutionFwdAlgoImplicitGEMM;GemmFwdRest:0.395209,146644992,miopenConvolutionFwdAlgoGEMM;ConvDirectNaiveConvFwd:67.702,0,miopenConvolutionFwdAlgoDirect
192-5-276-208-3x1x1-192-2-276-208-1-0x0x0-2x1x1-1x1x1-0-NCDHW-FP32-F=ConvHipImplicitGemm3DGroupFwdXdlops:0.488552,309067776,miopenConvolutionFwdAlgoImplicitGEMM;GemmFwdRest:0.703946,264536064,miopenConvolutionFwdAlgoGEMM;ConvDirectNaiveConvFwd:135.023,0,miopenConvolutionFwdAlgoDirect
192-6-410-314-3x3x3-192-4-408-312-1-0x0x0-1x1x1-1x1x1-0-NCDHW-FP32-F=ConvHipImplicitGemm3DGroupFwdXdlops:12.8894,988268544,miopenConvolutionFwdAlgoImplicitGEMM;GemmFwdRest:25.8364,10558439424,miopenConvolutionFwdAlgoGEMM;ConvDirectNaiveConvFwd:2145.32,0,miopenConvolutionFwdAlgoDirect
192-1648-1248-3x3-96-1648-1248-1-1x1-1x1-1x1-0-NCHW-FP32-F=ConvBinWinogradRxSf2x3g1:7.96589,0,miopenConvolutionFwdAlgoWinograd;ConvBinWinogradRxSf3x2:12.0967,0,miopenConvolutionFwdAlgoWinograd;ConvHipImplicitGemmGroupFwdXdlops:11.5574,2369986560,miopenConvolutionFwdAlgoImplicitGEMM;ConvAsmImplicitGemmGTCDynamicFwdXdlopsNHWC:10.9705,2369986560,miopenConvolutionFwdAlgoImplicitGEMM;GemmFwdRest:15.4972,14215938048,miopenConvolutionFwdAlgoGEMM;ConvDirectNaiveConvFwd:3130.17,0,miopenConvolutionFwdAlgoDirect
384-3-104-80-3x3x3-32-1-102-78-1-0x0x0-1x1x1-1x1x1-0-NCDHW-FP32-F=ConvHipImplicitGemm3DGroupFwdXdlops:0.23475,40684032,miopenConvolutionFwdAlgoImplicitGEMM;GemmFwdRest:1.007,329951232,miopenConvolutionFwdAlgoGEMM;ConvDirectNaiveConvFwd:73.4314,0,miopenConvolutionFwdAlgoDirect
384-3-138-104-3x1x1-768-1-138-104-1-0x0x0-1x1x1-1x1x1-0-NCDHW-FP32-F=ConvHipImplicitGemm3DGroupFwdXdlops:0.438569,113762304,miopenConvolutionFwdAlgoImplicitGEMM;GemmFwdRest:0.407316,66134016,miopenConvolutionFwdAlgoGEMM;ConvDirectNaiveConvFwd:30.9185,0,miopenConvolutionFwdAlgoDirect
384-3-206-156-3x1x1-384-1-206-156-1-0x0x0-2x1x1-1x1x1-0-NCDHW-FP32-F=ConvHipImplicitGemm3DGroupFwdXdlops:0.527604,199213056,miopenConvolutionFwdAlgoImplicitGEMM;GemmFwdRest:0.524149,148082688,miopenConvolutionFwdAlgoGEMM;ConvDirectNaiveConvFwd:68.6917,0,miopenConvolutionFwdAlgoDirect
384-3-206-158-3x3x3-384-1-204-156-1-0x0x0-1x1x1-1x1x1-0-NCDHW-FP32-F=ConvHipImplicitGemm3DGroupFwdXdlops:3.2244,214788096,miopenConvolutionFwdAlgoImplicitGEMM;GemmFwdRest:4.55373,1319804928,miopenConvolutionFwdAlgoGEMM;ConvDirectNaiveConvFwd:286.55,0,miopenConvolutionFwdAlgoDirect
384-4-204-156-3x1x1-768-2-204-156-1-0x0x0-1x1x1-1x1x1-0-NCDHW-FP32-F=ConvHipImplicitGemm3DGroupFwdXdlops:1.51542,394592256,miopenConvolutionFwdAlgoImplicitGEMM;GemmFwdRest:1.6156,293289984,miopenConvolutionFwdAlgoGEMM;ConvDirectNaiveConvFwd:144.81,0,miopenConvolutionFwdAlgoDirect
384-4-276-208-3x1x1-768-2-276-208-1-0x0x0-1x1x1-1x1x1-0-NCDHW-FP32-F=ConvHipImplicitGemm3DGroupFwdXdlops:2.78686,708968448,miopenConvolutionFwdAlgoImplicitGEMM;GemmFwdRest:3.05268,529072128,miopenConvolutionFwdAlgoGEMM;ConvDirectNaiveConvFwd:287.88,0,miopenConvolutionFwdAlgoDirect
384-4-414-314-3x3x3-384-2-412-312-1-0x0x0-1x1x1-1x1x1-0-NCDHW-FP32-F=ConvHipImplicitGemm3DGroupFwdXdlops:23.2123,1209507840,miopenConvolutionFwdAlgoImplicitGEMM;GemmFwdRest:37.1149,10661953536,miopenConvolutionFwdAlgoGEMM;ConvDirectNaiveConvFwd:2445.71,0,miopenConvolutionFwdAlgoDirect
384-277-209-3x3-384-138-104-1-0x0-2x2-1x1-0-NCHW-FP32-F=ConvBinWinogradRxSf2x3g1:1.76997,0,miopenConvolutionFwdAlgoWinograd;ConvBinWinogradRxSf3x2:0.947707,0,miopenConvolutionFwdAlgoWinograd;ConvHipImplicitGemmGroupFwdXdlops:0.62216,116276736,miopenConvolutionFwdAlgoImplicitGEMM;ConvAsmImplicitGemmGTCDynamicFwdXdlopsNHWC:0.518707,116276736,miopenConvolutionFwdAlgoImplicitGEMM;GemmFwdRest:0.723113,198402048,miopenConvolutionFwdAlgoGEMM;ConvDirectNaiveConvFwd:41.3711,0,miopenConvolutionFwdAlgoDirect
384-552-416-3x3-192-552-416-1-1x1-1x1-1x1-0-NCHW-FP32-F=ConvBinWinogradRxSf2x3g1:3.27826,0,miopenConvolutionFwdAlgoWinograd;ConvBinWinogradRxSf3x2:5.33118,0,miopenConvolutionFwdAlgoWinograd;ConvHipImplicitGemmGroupFwdXdlops:3.79095,531726336,miopenConvolutionFwdAlgoImplicitGEMM;ConvAsmImplicitGemmGTCDynamicFwdXdlopsNHWC:3.8459,531726336,miopenConvolutionFwdAlgoImplicitGEMM;GemmFwdRest:5.50362,3174432768,miopenConvolutionFwdAlgoGEMM;ConvDirectNaiveConvFwd:684.987,0,miopenConvolutionFwdAlgoDirect
96-3-1650-1250-3x3x3-3-1-1648-1248-1-0x0x0-1x1x1-1x1x1-0-NCDHW-FP32-F=ConvHipImplicitGemm3DGroupFwdXdlops:14.9579,2400711680,miopenConvolutionFwdAlgoImplicitGEMM;ConvDirectNaiveConvFwd:4724.86,0,miopenConvolutionFwdAlgoDirect
96-4-408-312-1x1x1-192-4-408-312-1-0x0x0-1x1x1-1x1x1-0-NCDHW-FP32-F=ConvHipImplicitGemm3DGroupFwdXdlops:0.815813,586653696,miopenConvolutionFwdAlgoImplicitGEMM;GemmFwd1x1_0_1:0.5007,0,miopenConvolutionFwdAlgoGEMM;ConvDirectNaiveConvFwd:124.632,0,miopenConvolutionFwdAlgoDirect
96-4-552-416-1x1x1-192-4-552-416-1-0x0x0-1x1x1-1x1x1-0-NCDHW-FP32-F=ConvHipImplicitGemm3DGroupFwdXdlops:1.46072,1058217984,miopenConvolutionFwdAlgoImplicitGEMM;GemmFwd1x1_0_1:0.90033,0,miopenConvolutionFwdAlgoGEMM;ConvDirectNaiveConvFwd:225.223,0,miopenConvolutionFwdAlgoDirect
96-6-1650-1250-3x3x3-3-4-1648-1248-1-0x0x0-1x1x1-1x1x1-0-NCDHW-FP32-F=ConvHipImplicitGemm3DGroupFwdXdlops:54.8908,4850753024,miopenConvolutionFwdAlgoImplicitGEMM;ConvDirectNaiveConvFwd:18866.1,0,miopenConvolutionFwdAlgoDirect
384-205-157-3x3-384-102-78-2-0x0-2x2-1x1-0-NCHW-FP32-F=ConvBinWinogradRxSf2x3g1:1.86583,0,miopenConvolutionFwdAlgoWinograd;ConvBinWinogradRxSf3x2:0.971659,0,miopenConvolutionFwdAlgoWinograd;ConvHipImplicitGemmGroupFwdXdlops:0.635478,128621568,miopenConvolutionFwdAlgoImplicitGEMM;ConvAsmImplicitGemmGTCDynamicFwdXdlopsNHWC:0.558727,128621568,miopenConvolutionFwdAlgoImplicitGEMM;GemmFwdRest:0.678812,109983744,miopenConvolutionFwdAlgoGEMM;ConvDirectNaiveConvFwd:24.1118,0,miopenConvolutionFwdAlgoDirect
384-277-209-3x3-384-138-104-2-0x0-2x2-1x1-0-NCHW-FP32-F=ConvBinWinogradRxSf2x3g1:3.35342,0,miopenConvolutionFwdAlgoWinograd;ConvBinWinogradRxSf3x2:1.53916,0,miopenConvolutionFwdAlgoWinograd;ConvHipImplicitGemmGroupFwdXdlops:1.15254,227245056,miopenConvolutionFwdAlgoImplicitGEMM;ConvAsmImplicitGemmGTCDynamicFwdXdlopsNHWC:0.997374,227245056,miopenConvolutionFwdAlgoImplicitGEMM;GemmFwdRest:1.41629,198402048,miopenConvolutionFwdAlgoGEMM;ConvDirectNaiveConvFwd:43.1607,0,miopenConvolutionFwdAlgoDirect
192-1104-832-3x3-96-1104-832-4-1x1-1x1-1x1-0-NCHW-FP32-F=ConvBinWinogradRxSf2x3g1:14.4355,0,miopenConvolutionFwdAlgoWinograd;ConvBinWinogradRxSf3x2:21.5726,0,miopenConvolutionFwdAlgoWinograd;ConvHipImplicitGemmGroupFwdXdlops:20.756,4233240576,miopenConvolutionFwdAlgoImplicitGEMM;ConvAsmImplicitGemmGTCDynamicFwdXdlopsNHWC:19.9349,4233240576,miopenConvolutionFwdAlgoImplicitGEMM;GemmFwdRest:27.4141,6348865536,miopenConvolutionFwdAlgoGEMM;ConvDirectNaiveConvFwd:1663.96,0,miopenConvolutionFwdAlgoDirect
384-824-624-3x3-192-824-624-4-1x1-1x1-1x1-0-NCHW-FP32-F=ConvBinWinogradRxSf2x3g1:33.5182,0,miopenConvolutionFwdAlgoWinograd;ConvBinWinogradRxSf3x2:48.5826,0,miopenConvolutionFwdAlgoWinograd;ConvHipImplicitGemmGroupFwdXdlops:33.5551,4741300224,miopenConvolutionFwdAlgoImplicitGEMM;ConvAsmImplicitGemmGTCDynamicFwdXdlopsNHWC:34.6692,4741300224,miopenConvolutionFwdAlgoImplicitGEMM;GemmFwdRest:49.9898,7107969024,miopenConvolutionFwdAlgoGEMM;ConvDirectNaiveConvFwd:2220.16,0,miopenConvolutionFwdAlgoDirect
192-1648-1248-3x3-96-1648-1248-1-1x1-1x1-1x1-0-NCHW-BF16-F=ConvHipImplicitGemmGroupFwdXdlops:3.28791,1184993280,miopenConvolutionFwdAlgoImplicitGEMM;ConvAsmImplicitGemmGTCDynamicFwdXdlopsNHWC:3.28072,1974767616,miopenConvolutionFwdAlgoImplicitGEMM;GemmFwdRest:7.99979,7107969024,miopenConvolutionFwdAlgoGEMM;ConvDirectNaiveConvFwd:2801.06,0,miopenConvolutionFwdAlgoDirect
32-21-102-78-1x1x1-32-21-102-78-1-0x0x0-1x1x1-1x1x1-0-NCDHW-BF16-F=ConvHipImplicitGemm3DGroupFwdXdlops:0.0827507,21387776,miopenConvolutionFwdAlgoImplicitGEMM;GemmFwd1x1_0_1:0.0765408,0,miopenConvolutionFwdAlgoGEMM;ConvDirectNaiveConvFwd:10.4185,0,miopenConvolutionFwdAlgoDirect
32-21-138-104-1x1x1-32-21-138-104-1-0x0x0-1x1x1-1x1x1-0-NCDHW-BF16-F=ConvHipImplicitGemm3DGroupFwdXdlops:0.0815818,38580224,miopenConvolutionFwdAlgoImplicitGEMM;GemmFwd1x1_0_1:0.0980727,0,miopenConvolutionFwdAlgoGEMM;ConvDirectNaiveConvFwd:18.8503,0,miopenConvolutionFwdAlgoDirect
36-21-102-78-1x2x2-5120-21-51-39-1-0x0x0-1x2x2-1x1x1-0-NCDHW-BF16-F=ConvHipImplicitGemm3DGroupFwdXdlops:1.30709,441218816,miopenConvolutionFwdAlgoImplicitGEMM;GemmFwdRest:0.517446,12029472,miopenConvolutionFwdAlgoGEMM;ConvDirectNaiveConvFwd:27.3952,0,miopenConvolutionFwdAlgoDirect
384-3-102-78-3x1x1-384-1-102-78-1-0x0x0-2x1x1-1x1x1-0-NCDHW-BF16-F=ConvHipImplicitGemm3DGroupFwdXdlops:0.0673478,25325568,miopenConvolutionFwdAlgoImplicitGEMM;GemmFwdRest:0.0974014,18330624,miopenConvolutionFwdAlgoGEMM;ConvDirectNaiveConvFwd:16.42,0,miopenConvolutionFwdAlgoDirect
384-3-102-78-3x1x1-768-1-102-78-1-0x0x0-1x1x1-1x1x1-0-NCDHW-BF16-F=ConvHipImplicitGemm3DGroupFwdXdlops:0.0941804,32320512,miopenConvolutionFwdAlgoImplicitGEMM;GemmFwdRest:0.15024,18330624,miopenConvolutionFwdAlgoGEMM;ConvDirectNaiveConvFwd:16.8337,0,miopenConvolutionFwdAlgoDirect
384-3-138-104-3x1x1-384-1-138-104-1-0x0x0-2x1x1-1x1x1-0-NCDHW-BF16-F=ConvHipImplicitGemm3DGroupFwdXdlops:0.112957,44974080,miopenConvolutionFwdAlgoImplicitGEMM;GemmFwdRest:0.153413,33067008,miopenConvolutionFwdAlgoGEMM;ConvDirectNaiveConvFwd:29.8864,0,miopenConvolutionFwdAlgoDirect
384-3-140-106-3x3x3-384-1-138-104-1-0x0x0-1x1x1-1x1x1-0-NCDHW-BF16-F=ConvHipImplicitGemm3DGroupFwdXdlops:0.41584,53176320,miopenConvolutionFwdAlgoImplicitGEMM;GemmFwdRest:0.991873,297603072,miopenConvolutionFwdAlgoGEMM;ConvDirectNaiveConvFwd:115.537,0,miopenConvolutionFwdAlgoDirect
384-3-208-158-3x3x3-384-1-206-156-1-0x0x0-1x1x1-1x1x1-0-NCDHW-BF16-F=ConvHipImplicitGemm3DGroupFwdXdlops:0.723332,108361728,miopenConvolutionFwdAlgoImplicitGEMM;GemmFwdRest:2.22442,666372096,miopenConvolutionFwdAlgoGEMM;ConvDirectNaiveConvFwd:247.032,0,miopenConvolutionFwdAlgoDirect
384-4-206-158-3x3x3-384-2-204-156-1-0x0x0-1x1x1-1x1x1-0-NCDHW-BF16-F=ConvHipImplicitGemm3DGroupFwdXdlops:1.1409,156831744,miopenConvolutionFwdAlgoImplicitGEMM;GemmFwdRest:4.26297,1319804928,miopenConvolutionFwdAlgoGEMM;ConvDirectNaiveConvFwd:512.729,0,miopenConvolutionFwdAlgoDirect
384-4-412-312-3x1x1-768-2-412-312-1-0x0x0-1x1x1-1x1x1-0-NCDHW-BF16-F=ConvHipImplicitGemm3DGroupFwdXdlops:1.94936,791543808,miopenConvolutionFwdAlgoImplicitGEMM;GemmFwdRest:2.40235,592330752,miopenConvolutionFwdAlgoGEMM;ConvDirectNaiveConvFwd:638.082,0,miopenConvolutionFwdAlgoDirect
384-204-156-3x3-192-204-156-1-1x1-1x1-1x1-0-NCHW-BF16-F=ConvHipImplicitGemmGroupFwdXdlops:0.183995,37988352,miopenConvolutionFwdAlgoImplicitGEMM;ConvAsmImplicitGemmGTCDynamicFwdXdlopsNHWC:0.204513,62429184,miopenConvolutionFwdAlgoImplicitGEMM;GemmFwdRest:0.317928,219967488,miopenConvolutionFwdAlgoGEMM;ConvDirectNaiveConvFwd:82.1818,0,miopenConvolutionFwdAlgoDirect
384-276-208-3x3-192-276-208-1-1x1-1x1-1x1-0-NCHW-BF16-F=ConvHipImplicitGemmGroupFwdXdlops:0.282509,67461120,miopenConvolutionFwdAlgoImplicitGEMM;ConvAsmImplicitGemmGTCDynamicFwdXdlopsNHWC:0.32875,111550464,miopenConvolutionFwdAlgoImplicitGEMM;GemmFwdRest:0.555838,396804096,miopenConvolutionFwdAlgoGEMM;ConvDirectNaiveConvFwd:151.828,0,miopenConvolutionFwdAlgoDirect
384-412-312-3x3-192-412-312-1-1x1-1x1-1x1-0-NCHW-BF16-F=ConvHipImplicitGemmGroupFwdXdlops:0.59178,149409792,miopenConvolutionFwdAlgoImplicitGEMM;ConvAsmImplicitGemmGTCDynamicFwdXdlopsNHWC:0.648208,248131584,miopenConvolutionFwdAlgoImplicitGEMM;GemmFwdRest:1.15556,888496128,miopenConvolutionFwdAlgoGEMM;ConvDirectNaiveConvFwd:330.676,0,miopenConvolutionFwdAlgoDirect
96-1-552-416-1x1x1-192-1-552-416-1-0x0x0-1x1x1-1x1x1-0-NCDHW-BF16-F=ConvHipImplicitGemm3DGroupFwdXdlops:0.202496,132304896,miopenConvolutionFwdAlgoImplicitGEMM;GemmFwd1x1_0_1:0.124938,0,miopenConvolutionFwdAlgoGEMM;ConvDirectNaiveConvFwd:42.5976,0,miopenConvolutionFwdAlgoDirect
96-3-1106-834-3x3x3-3-1-1104-832-1-0x0x0-1x1x1-1x1x1-0-NCDHW-BF16-F=ConvHipImplicitGemm3DGroupFwdXdlops:1.33176,536831488,miopenConvolutionFwdAlgoImplicitGEMM;GemmFwdRest:12.0449,4761649152,miopenConvolutionFwdAlgoGEMM;ConvDirectNaiveConvFwd:1870.46,0,miopenConvolutionFwdAlgoDirect
96-3-410-314-3x3x3-192-1-408-312-1-0x0x0-1x1x1-1x1x1-0-NCDHW-BF16-F=ConvHipImplicitGemm3DGroupFwdXdlops:0.546127,124031232,miopenConvolutionFwdAlgoImplicitGEMM;GemmFwdRest:1.67119,659902464,miopenConvolutionFwdAlgoGEMM;ConvDirectNaiveConvFwd:239.63,0,miopenConvolutionFwdAlgoDirect
96-3-554-418-3x3x3-192-1-552-416-1-0x0x0-1x1x1-1x1x1-0-NCDHW-BF16-F=ConvHipImplicitGemm3DGroupFwdXdlops:0.917629,222559488,miopenConvolutionFwdAlgoImplicitGEMM;GemmFwdRest:3.07519,1190412288,miopenConvolutionFwdAlgoGEMM;ConvDirectNaiveConvFwd:435.867,0,miopenConvolutionFwdAlgoDirect
96-3-818-626-3x3x3-96-1-816-624-1-0x0x0-1x1x1-1x1x1-0-NCDHW-BF16-F=ConvHipImplicitGemm3DGroupFwdXdlops:1.26788,393212160,miopenConvolutionFwdAlgoImplicitGEMM;GemmFwdRest:7.03923,2639609856,miopenConvolutionFwdAlgoGEMM;ConvDirectNaiveConvFwd:1015.98,0,miopenConvolutionFwdAlgoDirect
96-4-408-312-1x1x1-192-4-408-312-1-0x0x0-1x1x1-1x1x1-0-NCDHW-BF16-F=ConvHipImplicitGemm3DGroupFwdXdlops:0.586292,293326848,miopenConvolutionFwdAlgoImplicitGEMM;GemmFwd1x1_0_1:0.259787,0,miopenConvolutionFwdAlgoGEMM;ConvDirectNaiveConvFwd:97.9049,0,miopenConvolutionFwdAlgoDirect
96-6-1106-834-3x3x3-3-4-1104-832-1-0x0x0-1x1x1-1x1x1-0-NCDHW-BF16-F=ConvHipImplicitGemm3DGroupFwdXdlops:4.15914,1084669696,miopenConvolutionFwdAlgoImplicitGEMM;ConvDirectNaiveConvFwd:7503.22,0,miopenConvolutionFwdAlgoDirect
96-6-410-314-3x3x3-192-4-408-312-1-0x0x0-1x1x1-1x1x1-0-NCDHW-BF16-F=ConvHipImplicitGemm3DGroupFwdXdlops:1.85387,344830464,miopenConvolutionFwdAlgoImplicitGEMM;GemmFwdRest:7.20719,2639609856,miopenConvolutionFwdAlgoGEMM;ConvDirectNaiveConvFwd:958.542,0,miopenConvolutionFwdAlgoDirect
96-6-818-626-3x3x3-3-4-816-624-1-0x0x0-1x1x1-1x1x1-0-NCDHW-BF16-F=ConvHipImplicitGemm3DGroupFwdXdlops:2.29244,602138368,miopenConvolutionFwdAlgoImplicitGEMM;ConvDirectNaiveConvFwd:4099.89,0,miopenConvolutionFwdAlgoDirect
96-6-826-626-3x3x3-192-4-824-624-1-0x0x0-1x1x1-1x1x1-0-NCDHW-BF16-F=ConvHipImplicitGemm3DGroupFwdXdlops:7.14978,1386441216,miopenConvolutionFwdAlgoImplicitGEMM;ConvDirectNaiveConvFwd:4130.68,0,miopenConvolutionFwdAlgoDirect
384-276-208-3x3-192-276-208-2-1x1-1x1-1x1-0-NCHW-BF16-F=ConvHipImplicitGemmGroupFwdXdlops:0.559159,133595136,miopenConvolutionFwdAlgoImplicitGEMM;ConvAsmImplicitGemmGTCDynamicFwdXdlopsNHWC:0.612854,221773824,miopenConvolutionFwdAlgoImplicitGEMM;GemmFwdRest:1.13894,396804096,miopenConvolutionFwdAlgoGEMM;ConvDirectNaiveConvFwd:151.006,0,miopenConvolutionFwdAlgoDirect
192-1104-832-3x3-96-1104-832-4-1x1-1x1-1x1-0-NCHW-BF16-F=ConvHipImplicitGemmGroupFwdXdlops:6.3422,2116620288,miopenConvolutionFwdAlgoImplicitGEMM;ConvAsmImplicitGemmGTCDynamicFwdXdlopsNHWC:6.08197,3527479296,miopenConvolutionFwdAlgoImplicitGEMM;GemmFwdRest:14.5116,3174432768,miopenConvolutionFwdAlgoGEMM;ConvDirectNaiveConvFwd:1623.02,0,miopenConvolutionFwdAlgoDirect
384-824-624-3x3-192-824-624-4-1x1-1x1-1x1-0-NCHW-BF16-F=ConvHipImplicitGemmGroupFwdXdlops:10.9262,2370650112,miopenConvolutionFwdAlgoImplicitGEMM;ConvAsmImplicitGemmGTCDynamicFwdXdlopsNHWC:10.1103,3950198784,miopenConvolutionFwdAlgoImplicitGEMM;GemmFwdRest:17.3932,3553984512,miopenConvolutionFwdAlgoGEMM;ConvDirectNaiveConvFwd:2049.47,0,miopenConvolutionFwdAlgoDirect
128-11-146-258-3x3x3-3-9-144-256-1-0x0x0-1x1x1-1x1x1-0-NCDHW-FP16-F=ConvHipImplicitGemm3DGroupFwdXdlops:2.43638,108084480,miopenConvolutionFwdAlgoImplicitGEMM;GemmFwdRest:5.70386,2293235712,miopenConvolutionFwdAlgoGEMM;ConvDirectNaiveConvFwd:911.592,0,miopenConvolutionFwdAlgoDirect
128-11-258-258-3x3x3-3-9-256-256-1-0x0x0-1x1x1-1x1x1-0-NCDHW-FP16-F=ConvHipImplicitGemm3DGroupFwdXdlops:4.21745,191003904,miopenConvolutionFwdAlgoImplicitGEMM;GemmFwdRest:10.1023,4076863488,miopenConvolutionFwdAlgoGEMM;ConvDirectNaiveConvFwd:1623.11,0,miopenConvolutionFwdAlgoDirect
128-19-162-194-3x3x3-128-17-160-192-1-0x0x0-1x1x1-1x1x1-0-NCDHW-FP16-F=ConvHipImplicitGemm3DGroupFwdXdlops:1.44313,287443968,miopenConvolutionFwdAlgoImplicitGEMM;GemmFwdRest:9.61191,3609722880,miopenConvolutionFwdAlgoGEMM;ConvDirectNaiveConvFwd:1492.07,0,miopenConvolutionFwdAlgoDirect
128-19-258-258-3x3x3-128-17-256-256-1-0x0x0-1x1x1-1x1x1-0-NCDHW-FP16-F=ConvHipImplicitGemm3DGroupFwdXdlops:3.09644,609864704,miopenConvolutionFwdAlgoImplicitGEMM;ConvDirectNaiveConvFwd:3071.53,0,miopenConvolutionFwdAlgoDirect
256-11-146-258-3x3x3-128-9-144-256-1-0x0x0-1x1x1-1x1x1-0-NCDHW-FP16-F=ConvHipImplicitGemm3DGroupFwdXdlops:1.90296,298850304,miopenConvolutionFwdAlgoImplicitGEMM;GemmFwdRest:11.9685,4586471424,miopenConvolutionFwdAlgoGEMM;ConvDirectNaiveConvFwd:1805.16,0,miopenConvolutionFwdAlgoDirect
256-11-258-194-3x3x3-128-9-256-192-1-0x0x0-1x1x1-1x1x1-0-NCDHW-FP16-F=ConvHipImplicitGemm3DGroupFwdXdlops:2.45619,396908544,miopenConvolutionFwdAlgoImplicitGEMM;GemmFwdRest:16.064,6115295232,miopenConvolutionFwdAlgoGEMM;ConvDirectNaiveConvFwd:2540.13,0,miopenConvolutionFwdAlgoDirect
256-17-256-192-1x1x1-128-17-256-192-1-0x0x0-1x1x1-1x1x1-0-NCDHW-FP16-F=ConvHipImplicitGemm3DGroupFwdXdlops:1.03449,641794048,miopenConvolutionFwdAlgoImplicitGEMM;GemmFwd1x1_0_1:0.521024,0,miopenConvolutionFwdAlgoGEMM;ConvDirectNaiveConvFwd:525.097,0,miopenConvolutionFwdAlgoDirect
256-19-146-130-3x3x3-128-17-144-128-1-0x0x0-1x1x1-1x1x1-0-NCDHW-FP16-F=ConvHipImplicitGemm3DGroupFwdXdlops:1.90795,266622976,miopenConvolutionFwdAlgoImplicitGEMM;GemmFwdRest:11.4533,4331667456,miopenConvolutionFwdAlgoGEMM;ConvDirectNaiveConvFwd:1784.71,0,miopenConvolutionFwdAlgoDirect
256-19-162-194-3x3x3-256-17-160-192-1-0x0x0-1x1x1-1x1x1-0-NCDHW-FP16-F=ConvHipImplicitGemm3DGroupFwdXdlops:5.00097,576657408,miopenConvolutionFwdAlgoImplicitGEMM;GemmFwdRest:19.7072,7219445760,miopenConvolutionFwdAlgoGEMM;ConvDirectNaiveConvFwd:2988.11,0,miopenConvolutionFwdAlgoDirect
256-19-258-258-3x3x3-256-17-256-256-1-0x0x0-1x1x1-1x1x1-0-NCDHW-FP16-F=ConvHipImplicitGemm3DGroupFwdXdlops:11.3329,1221498880,miopenConvolutionFwdAlgoImplicitGEMM;ConvDirectNaiveConvFwd:6143.03,0,miopenConvolutionFwdAlgoDirect
512-5-34-50-3x3x3-512-3-32-48-1-0x0x0-1x1x1-1x1x1-0-NCDHW-FP16-F=ConvHipImplicitGemm3DGroupFwdXdlops:0.328164,27578368,miopenConvolutionFwdAlgoImplicitGEMM;GemmFwdRest:0.655658,127401984,miopenConvolutionFwdAlgoGEMM;ConvDirectNaiveConvFwd:52.8913,0,miopenConvolutionFwdAlgoDirect
512-5-64-96-1x1x1-256-5-64-96-1-0x0x0-1x1x1-1x1x1-0-NCDHW-FP16-F=ConvHipImplicitGemm3DGroupFwdXdlops:0.0873076,47448064,miopenConvolutionFwdAlgoImplicitGEMM;GemmFwd1x1_0_1:0.0368015,0,miopenConvolutionFwdAlgoGEMM;ConvDirectNaiveConvFwd:30.4735,0,miopenConvolutionFwdAlgoDirect
512-5-80-128-1x1x1-256-5-80-128-1-0x0x0-1x1x1-1x1x1-0-NCDHW-FP16-F=ConvHipImplicitGemm3DGroupFwdXdlops:0.128843,78905344,miopenConvolutionFwdAlgoImplicitGEMM;GemmFwd1x1_0_1:0.0567583,0,miopenConvolutionFwdAlgoGEMM;ConvDirectNaiveConvFwd:50.9421,0,miopenConvolutionFwdAlgoDirect
512-7-18-34-3x3x3-512-5-16-32-1-0x0x0-1x1x1-1x1x1-0-NCDHW-FP16-F=ConvHipImplicitGemm3DGroupFwdXdlops:0.290999,21164032,miopenConvolutionFwdAlgoImplicitGEMM;GemmFwdRest:0.543344,70778880,miopenConvolutionFwdAlgoGEMM;ConvDirectNaiveConvFwd:27.2421,0,miopenConvolutionFwdAlgoDirect
512-7-20-34-3x3x3-512-5-18-32-1-0x0x0-1x1x1-1x1x1-0-NCDHW-FP16-F=ConvHipImplicitGemm3DGroupFwdXdlops:0.263079,21979136,miopenConvolutionFwdAlgoImplicitGEMM;GemmFwdRest:0.561431,79626240,miopenConvolutionFwdAlgoGEMM;ConvDirectNaiveConvFwd:32.4849,0,miopenConvolutionFwdAlgoDirect
512-7-22-34-3x3x3-512-5-20-32-1-0x0x0-1x1x1-1x1x1-0-NCDHW-FP16-F=ConvHipImplicitGemm3DGroupFwdXdlops:0.301575,22794240,miopenConvolutionFwdAlgoImplicitGEMM;GemmFwdRest:0.57666,88473600,miopenConvolutionFwdAlgoGEMM;ConvDirectNaiveConvFwd:35.7511,0,miopenConvolutionFwdAlgoDirect
512-7-34-50-3x3x3-512-5-32-48-1-0x0x0-1x1x1-1x1x1-0-NCDHW-FP16-F=ConvHipImplicitGemm3DGroupFwdXdlops:0.425294,34205696,miopenConvolutionFwdAlgoImplicitGEMM;GemmFwdRest:0.857419,212336640,miopenConvolutionFwdAlgoGEMM;ConvDirectNaiveConvFwd:88.5144,0,miopenConvolutionFwdAlgoDirect
512-7-42-66-3x3x3-512-5-40-64-1-0x0x0-1x1x1-1x1x1-0-NCDHW-FP16-F=ConvHipImplicitGemm3DGroupFwdXdlops:0.635228,47132672,miopenConvolutionFwdAlgoImplicitGEMM;GemmFwdRest:1.33293,353894400,miopenConvolutionFwdAlgoGEMM;ConvDirectNaiveConvFwd:154.886,0,miopenConvolutionFwdAlgoDirect
512-7-74-130-3x3x3-256-5-72-128-1-0x0x0-1x1x1-1x1x1-0-NCDHW-FP16-F=ConvHipImplicitGemm3DGroupFwdXdlops:0.922615,99627008,miopenConvolutionFwdAlgoImplicitGEMM;GemmFwdRest:3.86989,1274019840,miopenConvolutionFwdAlgoGEMM;ConvDirectNaiveConvFwd:525.665,0,miopenConvolutionFwdAlgoDirect
512-9-128-64-1x1x1-256-9-128-64-1-0x0x0-1x1x1-1x1x1-0-NCDHW-FP16-F=ConvHipImplicitGemm3DGroupFwdXdlops:0.174474,113508352,miopenConvolutionFwdAlgoImplicitGEMM;GemmFwd1x1_0_1:0.0793715,0,miopenConvolutionFwdAlgoGEMM;ConvDirectNaiveConvFwd:73.8711,0,miopenConvolutionFwdAlgoDirect
512-9-64-96-1x1x1-256-9-64-96-1-0x0x0-1x1x1-1x1x1-0-NCDHW-FP16-F=ConvHipImplicitGemm3DGroupFwdXdlops:0.135602,85196800,miopenConvolutionFwdAlgoImplicitGEMM;GemmFwd1x1_0_1:0.0603968,0,miopenConvolutionFwdAlgoGEMM;ConvDirectNaiveConvFwd:55.7505,0,miopenConvolutionFwdAlgoDirect
16-21-206-156-1x1x1-16-21-206-156-1-0x0x0-1x1x1-1x1x1-0-NCDHW-FP32-F=ConvHipImplicitGemm3DGroupFwdXdlops:0.118193,86382592,miopenConvolutionFwdAlgoImplicitGEMM;GemmFwd1x1_0_1:0.160429,0,miopenConvolutionFwdAlgoGEMM;ConvDirectNaiveConvFwd:21.9601,0,miopenConvolutionFwdAlgoDirect
192-1-276-208-1x1x1-384-1-276-208-1-0x0x0-1x1x1-1x1x1-0-NCDHW-FP32-F=ConvHipImplicitGemm3DGroupFwdXdlops:0.215138,132562944,miopenConvolutionFwdAlgoImplicitGEMM;GemmFwd1x1_0_1:0.126448,0,miopenConvolutionFwdAlgoGEMM;ConvDirectNaiveConvFwd:22.6476,0,miopenConvolutionFwdAlgoDirect
192-2-412-312-1x1x1-384-2-412-312-1-0x0x0-1x1x1-1x1x1-0-NCDHW-FP32-F=ConvHipImplicitGemm3DGroupFwdXdlops:1.07776,592625664,miopenConvolutionFwdAlgoImplicitGEMM;GemmFwd1x1_0_1:0.579218,0,miopenConvolutionFwdAlgoGEMM;ConvDirectNaiveConvFwd:117.378,0,miopenConvolutionFwdAlgoDirect
192-3-414-314-3x3x3-384-1-412-312-1-0x0x0-1x1x1-1x1x1-0-NCDHW-FP32-F=ConvHipImplicitGemm3DGroupFwdXdlops:5.80944,504916992,miopenConvolutionFwdAlgoImplicitGEMM;GemmFwdRest:9.0638,2665488384,miopenConvolutionFwdAlgoGEMM;ConvDirectNaiveConvFwd:559.215,0,miopenConvolutionFwdAlgoDirect
192-4-278-210-3x3x3-384-2-276-208-1-0x0x0-1x1x1-1x1x1-0-NCDHW-FP32-F=ConvHipImplicitGemm3DGroupFwdXdlops:5.03633,363663360,miopenConvolutionFwdAlgoImplicitGEMM;GemmFwdRest:8.05749,2380824576,miopenConvolutionFwdAlgoGEMM;ConvDirectNaiveConvFwd:496.783,0,miopenConvolutionFwdAlgoDirect
192-5-276-208-3x1x1-192-2-276-208-1-0x0x0-2x1x1-1x1x1-0-NCDHW-FP32-F=ConvHipImplicitGemm3DGroupFwdXdlops:0.491253,309067776,miopenConvolutionFwdAlgoImplicitGEMM;GemmFwdRest:0.704628,264536064,miopenConvolutionFwdAlgoGEMM;ConvDirectNaiveConvFwd:134.35,0,miopenConvolutionFwdAlgoDirect
192-6-410-314-3x3x3-192-4-408-312-1-0x0x0-1x1x1-1x1x1-0-NCDHW-FP32-F=ConvHipImplicitGemm3DGroupFwdXdlops:12.4961,988268544,miopenConvolutionFwdAlgoImplicitGEMM;GemmFwdRest:25.0626,10558439424,miopenConvolutionFwdAlgoGEMM;ConvDirectNaiveConvFwd:2144.03,0,miopenConvolutionFwdAlgoDirect
192-1648-1248-3x3-96-1648-1248-1-1x1-1x1-1x1-0-NCHW-FP32-F=ConvBinWinogradRxSf2x3g1:7.80893,0,miopenConvolutionFwdAlgoWinograd;ConvBinWinogradRxSf3x2:11.975,0,miopenConvolutionFwdAlgoWinograd;ConvHipImplicitGemmGroupFwdXdlops:11.2836,2369986560,miopenConvolutionFwdAlgoImplicitGEMM;ConvAsmImplicitGemmGTCDynamicFwdXdlopsNHWC:10.9059,2369986560,miopenConvolutionFwdAlgoImplicitGEMM;GemmFwdRest:15.0925,14215938048,miopenConvolutionFwdAlgoGEMM;ConvDirectNaiveConvFwd:3119.92,0,miopenConvolutionFwdAlgoDirect
384-3-102-78-3x1x1-768-1-102-78-1-0x0x0-1x1x1-1x1x1-0-NCDHW-FP32-F=ConvHipImplicitGemm3DGroupFwdXdlops:0.257195,64641024,miopenConvolutionFwdAlgoImplicitGEMM;GemmFwdRest:0.236239,36661248,miopenConvolutionFwdAlgoGEMM;ConvDirectNaiveConvFwd:17.4946,0,miopenConvolutionFwdAlgoDirect
384-3-138-104-3x1x1-384-1-138-104-1-0x0x0-2x1x1-1x1x1-0-NCDHW-FP32-F=ConvHipImplicitGemm3DGroupFwdXdlops:0.2553,89948160,miopenConvolutionFwdAlgoImplicitGEMM;GemmFwdRest:0.278041,66134016,miopenConvolutionFwdAlgoGEMM;ConvDirectNaiveConvFwd:30.8671,0,miopenConvolutionFwdAlgoDirect
384-3-140-106-3x3x3-384-1-138-104-1-0x0x0-1x1x1-1x1x1-0-NCDHW-FP32-F=ConvHipImplicitGemm3DGroupFwdXdlops:1.61867,106352640,miopenConvolutionFwdAlgoImplicitGEMM;GemmFwdRest:2.13999,595206144,miopenConvolutionFwdAlgoGEMM;ConvDirectNaiveConvFwd:126.863,0,miopenConvolutionFwdAlgoDirect
384-3-208-158-3x3x3-32-1-206-156-1-0x0x0-1x1x1-1x1x1-0-NCDHW-FP32-F=ConvHipImplicitGemm3DGroupFwdXdlops:0.676472,156877824,miopenConvolutionFwdAlgoImplicitGEMM;GemmFwdRest:2.29465,1332744192,miopenConvolutionFwdAlgoGEMM;ConvDirectNaiveConvFwd:273.853,0,miopenConvolutionFwdAlgoDirect
384-3-414-314-3x3x3-384-1-412-312-1-0x0x0-1x1x1-1x1x1-0-NCDHW-FP32-F=ConvHipImplicitGemm3DGroupFwdXdlops:11.5449,812390400,miopenConvolutionFwdAlgoImplicitGEMM;GemmFwdRest:18.6137,5330976768,miopenConvolutionFwdAlgoGEMM;ConvDirectNaiveConvFwd:1225.78,0,miopenConvolutionFwdAlgoDirect
384-102-78-1x1-1152-102-78-1-0x0-1x1-1x1-0-NCHW-FP32-F=ConvBinWinogradRxSf2x3g1:0.674974,0,miopenConvolutionFwdAlgoWinograd;ConvBinWinogradRxSf3x2:0.338579,0,miopenConvolutionFwdAlgoWinograd;ConvHipImplicitGemmGroupFwdXdlops:0.154704,50651136,miopenConvolutionFwdAlgoImplicitGEMM;ConvAsmImplicitGemmGTCDynamicFwdXdlopsNHWC:0.137557,48881664,miopenConvolutionFwdAlgoImplicitGEMM;GemmFwd1x1_0_1:0.115706,0,miopenConvolutionFwdAlgoGEMM;ConvDirectNaiveConvFwd:5.20048,0,miopenConvolutionFwdAlgoDirect
384-138-104-1x1-1152-138-104-1-0x0-1x1-1x1-0-NCHW-FP32-F=ConvBinWinogradRxSf2x3g1:1.19268,0,miopenConvolutionFwdAlgoWinograd;ConvBinWinogradRxSf3x2:0.573696,0,miopenConvolutionFwdAlgoWinograd;ConvHipImplicitGemmGroupFwdXdlops:0.240839,89948160,miopenConvolutionFwdAlgoImplicitGEMM;ConvAsmImplicitGemmGTCDynamicFwdXdlopsNHWC:0.210081,88178688,miopenConvolutionFwdAlgoImplicitGEMM;GemmFwd1x1_0_1:0.176808,0,miopenConvolutionFwdAlgoGEMM;ConvDirectNaiveConvFwd:9.1,0,miopenConvolutionFwdAlgoDirect
384-206-156-1x1-1152-206-156-1-0x0-1x1-1x1-0-NCHW-FP32-F=ConvBinWinogradRxSf2x3g1:2.58859,0,miopenConvolutionFwdAlgoWinograd;ConvBinWinogradRxSf3x2:1.24225,0,miopenConvolutionFwdAlgoWinograd;ConvHipImplicitGemmGroupFwdXdlops:0.537619,199213056,miopenConvolutionFwdAlgoImplicitGEMM;ConvAsmImplicitGemmGTCDynamicFwdXdlopsNHWC:0.482609,197443584,miopenConvolutionFwdAlgoImplicitGEMM;GemmFwd1x1_0_1:0.355719,0,miopenConvolutionFwdAlgoGEMM;ConvDirectNaiveConvFwd:20.3911,0,miopenConvolutionFwdAlgoDirect
384-408-312-3x3-192-408-312-1-1x1-1x1-1x1-0-NCHW-FP32-F=ConvBinWinogradRxSf2x3g1:1.70895,0,miopenConvolutionFwdAlgoWinograd;ConvBinWinogradRxSf3x2:2.91433,0,miopenConvolutionFwdAlgoWinograd;ConvHipImplicitGemmGroupFwdXdlops:2.22653,295944192,miopenConvolutionFwdAlgoImplicitGEMM;ConvAsmImplicitGemmGTCDynamicFwdXdlopsNHWC:2.04304,295944192,miopenConvolutionFwdAlgoImplicitGEMM;GemmFwdRest:3.17938,1759739904,miopenConvolutionFwdAlgoGEMM;ConvDirectNaiveConvFwd:312.118,0,miopenConvolutionFwdAlgoDirect
384-824-624-3x3-192-824-624-1-1x1-1x1-1x1-0-NCHW-FP32-F=ConvBinWinogradRxSf2x3g1:7.72172,0,miopenConvolutionFwdAlgoWinograd;ConvBinWinogradRxSf3x2:12.2183,0,miopenConvolutionFwdAlgoWinograd;ConvHipImplicitGemmGroupFwdXdlops:8.63238,1187315712,miopenConvolutionFwdAlgoImplicitGEMM;ConvAsmImplicitGemmGTCDynamicFwdXdlopsNHWC:8.43303,1187315712,miopenConvolutionFwdAlgoImplicitGEMM;GemmFwdRest:12.1229,7107969024,miopenConvolutionFwdAlgoGEMM;ConvDirectNaiveConvFwd:1328.48,0,miopenConvolutionFwdAlgoDirect
96-3-818-626-3x3x3-96-1-816-624-1-0x0x0-1x1x1-1x1x1-0-NCDHW-FP32-F=ConvHipImplicitGemm3DGroupFwdXdlops:4.28571,786424320,miopenConvolutionFwdAlgoImplicitGEMM;GemmFwdRest:9.9284,5279219712,miopenConvolutionFwdAlgoGEMM;ConvDirectNaiveConvFwd:1080.43,0,miopenConvolutionFwdAlgoDirect
96-4-824-624-1x1x1-192-4-824-624-1-0x0x0-1x1x1-1x1x1-0-NCDHW-FP32-F=ConvHipImplicitGemm3DGroupFwdXdlops:3.19445,2369396736,miopenConvolutionFwdAlgoImplicitGEMM;GemmFwd1x1_0_1:1.88878,0,miopenConvolutionFwdAlgoGEMM;ConvDirectNaiveConvFwd:495.763,0,miopenConvolutionFwdAlgoDirect
96-6-1650-1250-3x3x3-96-4-1648-1248-1-0x0x0-1x1x1-1x1x1-0-NCDHW-FP32-F=ConvHipImplicitGemm3DGroupFwdXdlops:62.6055,7912092672,miopenConvolutionFwdAlgoImplicitGEMM;ConvDirectNaiveConvFwd:18673.2,0,miopenConvolutionFwdAlgoDirect
384-413-313-3x3-384-206-156-2-0x0-2x2-1x1-0-NCHW-FP32-F=ConvBinWinogradRxSf2x3g1:7.33387,0,miopenConvolutionFwdAlgoWinograd;ConvBinWinogradRxSf3x2:3.77159,0,miopenConvolutionFwdAlgoWinograd;ConvHipImplicitGemmGroupFwdXdlops:2.25745,501144576,miopenConvolutionFwdAlgoImplicitGEMM;ConvAsmImplicitGemmGTCDynamicFwdXdlopsNHWC:2.25178,501144576,miopenConvolutionFwdAlgoImplicitGEMM;GemmFwdRest:2.66679,444248064,miopenConvolutionFwdAlgoGEMM;ConvDirectNaiveConvFwd:107.471,0,miopenConvolutionFwdAlgoDirect
192-409-313-3x3-192-204-156-4-0x0-2x2-1x1-0-NCHW-FP32-F=ConvBinWinogradRxSf2x3g1:3.69353,0,miopenConvolutionFwdAlgoWinograd;ConvBinWinogradRxSf3x2:1.76457,0,miopenConvolutionFwdAlgoWinograd;ConvHipImplicitGemmGroupFwdXdlops:1.38575,492358656,miopenConvolutionFwdAlgoImplicitGEMM;ConvAsmImplicitGemmGTCDynamicFwdXdlopsNHWC:1.30916,492358656,miopenConvolutionFwdAlgoImplicitGEMM;GemmFwdRest:1.70488,219967488,miopenConvolutionFwdAlgoGEMM;ConvDirectNaiveConvFwd:52.5951,0,miopenConvolutionFwdAlgoDirect
192-816-624-3x3-96-816-624-4-1x1-1x1-1x1-0-NCHW-FP32-F=ConvBinWinogradRxSf2x3g1:7.67207,0,miopenConvolutionFwdAlgoWinograd;ConvBinWinogradRxSf3x2:11.8272,0,miopenConvolutionFwdAlgoWinograd;ConvHipImplicitGemmGroupFwdXdlops:11.2926,2346983424,miopenConvolutionFwdAlgoImplicitGEMM;ConvAsmImplicitGemmGTCDynamicFwdXdlopsNHWC:10.7565,2346983424,miopenConvolutionFwdAlgoImplicitGEMM;GemmFwdRest:15.2781,3519479808,miopenConvolutionFwdAlgoGEMM;ConvDirectNaiveConvFwd:801.778,0,miopenConvolutionFwdAlgoDirect
384-552-416-3x3-192-552-416-4-1x1-1x1-1x1-0-NCHW-FP32-F=ConvBinWinogradRxSf2x3g1:13.0386,0,miopenConvolutionFwdAlgoWinograd;ConvBinWinogradRxSf3x2:21.1086,0,miopenConvolutionFwdAlgoWinograd;ConvHipImplicitGemmGroupFwdXdlops:15.2593,2118942720,miopenConvolutionFwdAlgoImplicitGEMM;ConvAsmImplicitGemmGTCDynamicFwdXdlopsNHWC:15.4222,2118942720,miopenConvolutionFwdAlgoImplicitGEMM;GemmFwdRest:21.2537,3174432768,miopenConvolutionFwdAlgoGEMM;ConvDirectNaiveConvFwd:870.094,0,miopenConvolutionFwdAlgoDirect
96-817-625-3x3-96-408-312-4-0x0-2x2-1x1-0-NCHW-FP32-F=ConvBinWinogradRxSf2x3g1:3.76695,0,miopenConvolutionFwdAlgoWinograd;ConvBinWinogradRxSf3x2:1.86149,0,miopenConvolutionFwdAlgoWinograd;ConvHipImplicitGemmGroupFwdXdlops:2.02733,980178432,miopenConvolutionFwdAlgoImplicitGEMM;ConvAsmImplicitGemmGTCDynamicFwdXdlopsNHWC:1.94266,980178432,miopenConvolutionFwdAlgoImplicitGEMM;GemmFwdRest:2.3548,439934976,miopenConvolutionFwdAlgoGEMM;ConvDirectNaiveConvFwd:98.0408,0,miopenConvolutionFwdAlgoDirect
16-21-206-156-1x1x1-16-21-206-156-1-0x0x0-1x1x1-1x1x1-0-NCDHW-BF16-F=ConvHipImplicitGemm3DGroupFwdXdlops:0.0828172,43191296,miopenConvolutionFwdAlgoImplicitGEMM;GemmFwd1x1_0_1:0.234039,0,miopenConvolutionFwdAlgoGEMM;ConvDirectNaiveConvFwd:21.8187,0,miopenConvolutionFwdAlgoDirect
16-3-140-106-3x3x3-384-1-138-104-1-0x0x0-1x1x1-1x1x1-0-NCDHW-BF16-F=ConvHipImplicitGemm3DGroupFwdXdlops:0.0601696,12778752,miopenConvolutionFwdAlgoImplicitGEMM;GemmFwdRest:0.0896802,12400128,miopenConvolutionFwdAlgoGEMM;ConvDirectNaiveConvFwd:4.34168,0,miopenConvolutionFwdAlgoDirect
16-33-136-240-1x2x2-3072-33-68-120-1-0x0x0-1x2x2-1x1x1-0-NCDHW-BF16-F=ConvHipImplicitGemm3DGroupFwdXdlops:3.57226,1689317376,miopenConvolutionFwdAlgoImplicitGEMM;GemmFwdRest:0.889985,34467840,miopenConvolutionFwdAlgoGEMM;ConvDirectNaiveConvFwd:55.2157,0,miopenConvolutionFwdAlgoDirect
192-2-276-208-1x1x1-384-2-276-208-1-0x0x0-1x1x1-1x1x1-0-NCDHW-BF16-F=ConvHipImplicitGemm3DGroupFwdXdlops:0.217511,132415488,miopenConvolutionFwdAlgoImplicitGEMM;GemmFwd1x1_0_1:0.0875373,0,miopenConvolutionFwdAlgoGEMM;ConvDirectNaiveConvFwd:42.6396,0,miopenConvolutionFwdAlgoDirect
192-3-206-158-3x3x3-384-1-204-156-1-0x0x0-1x1x1-1x1x1-0-NCDHW-BF16-F=ConvHipImplicitGemm3DGroupFwdXdlops:0.408437,65917440,miopenConvolutionFwdAlgoImplicitGEMM;GemmFwdRest:1.06817,329951232,miopenConvolutionFwdAlgoGEMM;ConvDirectNaiveConvFwd:122.256,0,miopenConvolutionFwdAlgoDirect
192-3-278-210-3x3x3-384-1-276-208-1-0x0x0-1x1x1-1x1x1-0-NCDHW-BF16-F=ConvHipImplicitGemm3DGroupFwdXdlops:0.68675,115324416,miopenConvolutionFwdAlgoImplicitGEMM;GemmFwdRest:1.8616,595206144,miopenConvolutionFwdAlgoGEMM;ConvDirectNaiveConvFwd:218.923,0,miopenConvolutionFwdAlgoDirect
192-3-414-314-3x3x3-384-1-412-312-1-0x0x0-1x1x1-1x1x1-0-NCDHW-BF16-F=ConvHipImplicitGemm3DGroupFwdXdlops:1.28965,252458496,miopenConvolutionFwdAlgoImplicitGEMM;GemmFwdRest:4.13665,1332744192,miopenConvolutionFwdAlgoGEMM;ConvDirectNaiveConvFwd:492.365,0,miopenConvolutionFwdAlgoDirect
192-4-206-158-3x3x3-384-2-204-156-1-0x0x0-1x1x1-1x1x1-0-NCDHW-BF16-F=ConvHipImplicitGemm3DGroupFwdXdlops:0.649595,102856704,miopenConvolutionFwdAlgoImplicitGEMM;GemmFwdRest:2.10256,659902464,miopenConvolutionFwdAlgoGEMM;ConvDirectNaiveConvFwd:245.059,0,miopenConvolutionFwdAlgoDirect
192-4-278-210-3x3x3-384-2-276-208-1-0x0x0-1x1x1-1x1x1-0-NCDHW-BF16-F=ConvHipImplicitGemm3DGroupFwdXdlops:1.09323,181831680,miopenConvolutionFwdAlgoImplicitGEMM;GemmFwdRest:3.61857,1190412288,miopenConvolutionFwdAlgoGEMM;ConvDirectNaiveConvFwd:437.241,0,miopenConvolutionFwdAlgoDirect
192-5-204-156-3x1x1-192-2-204-156-1-0x0x0-2x1x1-1x1x1-0-NCDHW-BF16-F=ConvHipImplicitGemm3DGroupFwdXdlops:0.164918,85764096,miopenConvolutionFwdAlgoImplicitGEMM;GemmFwdRest:0.215528,73322496,miopenConvolutionFwdAlgoGEMM;ConvDirectNaiveConvFwd:64.4619,0,miopenConvolutionFwdAlgoDirect
192-5-276-208-3x1x1-192-2-276-208-1-0x0x0-2x1x1-1x1x1-0-NCDHW-BF16-F=ConvHipImplicitGemm3DGroupFwdXdlops:0.224675,154533888,miopenConvolutionFwdAlgoImplicitGEMM;GemmFwdRest:0.392059,132268032,miopenConvolutionFwdAlgoGEMM;ConvDirectNaiveConvFwd:116.654,0,miopenConvolutionFwdAlgoDirect
192-5-412-312-3x1x1-192-2-412-312-1-0x0x0-2x1x1-1x1x1-0-NCDHW-BF16-F=ConvHipImplicitGemm3DGroupFwdXdlops:0.486748,345747456,miopenConvolutionFwdAlgoImplicitGEMM;GemmFwdRest:0.900626,296165376,miopenConvolutionFwdAlgoGEMM;ConvDirectNaiveConvFwd:298.592,0,miopenConvolutionFwdAlgoDirect
192-6-826-626-3x3x3-192-4-824-624-1-0x0x0-1x1x1-1x1x1-0-NCDHW-BF16-F=ConvHipImplicitGemm3DGroupFwdXdlops:13.271,1983108096,miopenConvolutionFwdAlgoImplicitGEMM;ConvDirectNaiveConvFwd:8281.96,0,miopenConvolutionFwdAlgoDirect
384-3-104-80-3x3x3-384-1-102-78-1-0x0x0-1x1x1-1x1x1-0-NCDHW-BF16-F=ConvHipImplicitGemm3DGroupFwdXdlops:0.218195,33242112,miopenConvolutionFwdAlgoImplicitGEMM;GemmFwdRest:0.649511,164975616,miopenConvolutionFwdAlgoGEMM;ConvDirectNaiveConvFwd:66.1966,0,miopenConvolutionFwdAlgoDirect
384-3-140-106-3x3x3-384-1-138-104-1-0x0x0-1x1x1-1x1x1-0-NCDHW-BF16-F=ConvHipImplicitGemm3DGroupFwdXdlops:0.411714,53176320,miopenConvolutionFwdAlgoImplicitGEMM;GemmFwdRest:0.982551,297603072,miopenConvolutionFwdAlgoGEMM;ConvDirectNaiveConvFwd:114.38,0,miopenConvolutionFwdAlgoDirect
384-3-208-158-3x3x3-32-1-206-156-1-0x0x0-1x1x1-1x1x1-0-NCDHW-BF16-F=ConvHipImplicitGemm3DGroupFwdXdlops:0.214814,78438912,miopenConvolutionFwdAlgoImplicitGEMM;GemmFwdRest:1.55969,666372096,miopenConvolutionFwdAlgoGEMM;ConvDirectNaiveConvFwd:258.102,0,miopenConvolutionFwdAlgoDirect
384-3-414-314-3x3x3-384-1-412-312-1-0x0x0-1x1x1-1x1x1-0-NCDHW-BF16-F=ConvHipImplicitGemm3DGroupFwdXdlops:2.64813,406195200,miopenConvolutionFwdAlgoImplicitGEMM;GemmFwdRest:8.44016,2665488384,miopenConvolutionFwdAlgoGEMM;ConvDirectNaiveConvFwd:1055.38,0,miopenConvolutionFwdAlgoDirect
384-102-78-1x1-1152-102-78-1-0x0-1x1-1x1-0-NCHW-BF16-F=ConvHipImplicitGemmGroupFwdXdlops:0.0770598,25325568,miopenConvolutionFwdAlgoImplicitGEMM;ConvAsmImplicitGemmGTCDynamicFwdXdlopsNHWC:0.0756729,61102080,miopenConvolutionFwdAlgoImplicitGEMM;GemmFwd1x1_0_1:0.0627002,0,miopenConvolutionFwdAlgoGEMM;ConvDirectNaiveConvFwd:5.22415,0,miopenConvolutionFwdAlgoDirect
384-138-104-1x1-1152-138-104-1-0x0-1x1-1x1-0-NCHW-BF16-F=ConvHipImplicitGemmGroupFwdXdlops:0.123925,44974080,miopenConvolutionFwdAlgoImplicitGEMM;ConvAsmImplicitGemmGTCDynamicFwdXdlopsNHWC:0.108268,110223360,miopenConvolutionFwdAlgoImplicitGEMM;GemmFwd1x1_0_1:0.0905912,0,miopenConvolutionFwdAlgoGEMM;ConvDirectNaiveConvFwd:9.18518,0,miopenConvolutionFwdAlgoDirect
384-205-157-3x3-384-102-78-1-0x0-2x2-1x1-0-NCHW-BF16-F=ConvHipImplicitGemmGroupFwdXdlops:0.112831,33482496,miopenConvolutionFwdAlgoImplicitGEMM;ConvAsmImplicitGemmGTCDynamicFwdXdlopsNHWC:0.139133,45702912,miopenConvolutionFwdAlgoImplicitGEMM;GemmFwdRest:0.19911,54991872,miopenConvolutionFwdAlgoGEMM;ConvDirectNaiveConvFwd:24.1082,0,miopenConvolutionFwdAlgoDirect
384-276-208-3x3-192-276-208-1-1x1-1x1-1x1-0-NCHW-BF16-F=ConvHipImplicitGemmGroupFwdXdlops:0.284171,67461120,miopenConvolutionFwdAlgoImplicitGEMM;ConvAsmImplicitGemmGTCDynamicFwdXdlopsNHWC:0.345816,111550464,miopenConvolutionFwdAlgoImplicitGEMM;GemmFwdRest:0.539244,396804096,miopenConvolutionFwdAlgoGEMM;ConvDirectNaiveConvFwd:150.335,0,miopenConvolutionFwdAlgoDirect
384-412-312-3x3-192-412-312-1-1x1-1x1-1x1-0-NCHW-BF16-F=ConvHipImplicitGemmGroupFwdXdlops:0.603368,149409792,miopenConvolutionFwdAlgoImplicitGEMM;ConvAsmImplicitGemmGTCDynamicFwdXdlopsNHWC:0.642906,248131584,miopenConvolutionFwdAlgoImplicitGEMM;GemmFwdRest:1.13476,888496128,miopenConvolutionFwdAlgoGEMM;ConvDirectNaiveConvFwd:327.237,0,miopenConvolutionFwdAlgoDirect
96-1-408-312-1x1x1-192-1-408-312-1-0x0x0-1x1x1-1x1x1-0-NCDHW-BF16-F=ConvHipImplicitGemm3DGroupFwdXdlops:0.124321,73359360,miopenConvolutionFwdAlgoImplicitGEMM;GemmFwd1x1_0_1:0.0672533,0,miopenConvolutionFwdAlgoGEMM;ConvDirectNaiveConvFwd:23.4478,0,miopenConvolutionFwdAlgoDirect
96-1-824-624-1x1x1-192-1-824-624-1-0x0x0-1x1x1-1x1x1-0-NCDHW-BF16-F=ConvHipImplicitGemm3DGroupFwdXdlops:0.515937,296202240,miopenConvolutionFwdAlgoImplicitGEMM;GemmFwd1x1_0_1:0.259956,0,miopenConvolutionFwdAlgoGEMM;ConvDirectNaiveConvFwd:98.6188,0,miopenConvolutionFwdAlgoDirect
96-3-1650-1250-3x3x3-3-1-1648-1248-1-0x0x0-1x1x1-1x1x1-0-NCDHW-BF16-F=ConvHipImplicitGemm3DGroupFwdXdlops:2.90902,1200355840,miopenConvolutionFwdAlgoImplicitGEMM;ConvDirectNaiveConvFwd:4215.58,0,miopenConvolutionFwdAlgoDirect
96-4-552-416-1x1x1-192-4-552-416-1-0x0x0-1x1x1-1x1x1-0-NCDHW-BF16-F=ConvHipImplicitGemm3DGroupFwdXdlops:0.947741,529108992,miopenConvolutionFwdAlgoImplicitGEMM;GemmFwd1x1_0_1:0.516164,0,miopenConvolutionFwdAlgoGEMM;ConvDirectNaiveConvFwd:217.771,0,miopenConvolutionFwdAlgoDirect
96-6-1106-834-3x3x3-96-4-1104-832-1-0x0x0-1x1x1-1x1x1-0-NCDHW-BF16-F=ConvHipImplicitGemm3DGroupFwdXdlops:7.85422,1768536576,miopenConvolutionFwdAlgoImplicitGEMM;ConvDirectNaiveConvFwd:7350.11,0,miopenConvolutionFwdAlgoDirect
96-6-818-626-3x3x3-3-4-816-624-1-0x0x0-1x1x1-1x1x1-0-NCDHW-BF16-F=ConvHipImplicitGemm3DGroupFwdXdlops:2.19713,602138368,miopenConvolutionFwdAlgoImplicitGEMM;ConvDirectNaiveConvFwd:4092.43,0,miopenConvolutionFwdAlgoDirect
96-6-826-626-3x3x3-192-4-824-624-1-0x0x0-1x1x1-1x1x1-0-NCDHW-BF16-F=ConvHipImplicitGemm3DGroupFwdXdlops:6.9399,1386441216,miopenConvolutionFwdAlgoImplicitGEMM;ConvDirectNaiveConvFwd:4120.13,0,miopenConvolutionFwdAlgoDirect
384-276-208-3x3-192-276-208-2-1x1-1x1-1x1-0-NCHW-BF16-F=ConvHipImplicitGemmGroupFwdXdlops:0.523681,133595136,miopenConvolutionFwdAlgoImplicitGEMM;ConvAsmImplicitGemmGTCDynamicFwdXdlopsNHWC:0.508705,221773824,miopenConvolutionFwdAlgoImplicitGEMM;GemmFwdRest:1.09783,396804096,miopenConvolutionFwdAlgoGEMM;ConvDirectNaiveConvFwd:150.691,0,miopenConvolutionFwdAlgoDirect
192-1104-832-3x3-96-1104-832-4-1x1-1x1-1x1-0-NCHW-BF16-F=ConvHipImplicitGemmGroupFwdXdlops:6.31238,2116620288,miopenConvolutionFwdAlgoImplicitGEMM;ConvAsmImplicitGemmGTCDynamicFwdXdlopsNHWC:5.87577,3527479296,miopenConvolutionFwdAlgoImplicitGEMM;GemmFwdRest:14.3529,3174432768,miopenConvolutionFwdAlgoGEMM;ConvDirectNaiveConvFwd:1653.7,0,miopenConvolutionFwdAlgoDirect
384-824-624-3x3-192-824-624-4-1x1-1x1-1x1-0-NCHW-BF16-F=ConvHipImplicitGemmGroupFwdXdlops:10.1909,2370650112,miopenConvolutionFwdAlgoImplicitGEMM;ConvAsmImplicitGemmGTCDynamicFwdXdlopsNHWC:9.8687,3950198784,miopenConvolutionFwdAlgoImplicitGEMM;GemmFwdRest:17.4317,3553984512,miopenConvolutionFwdAlgoGEMM;ConvDirectNaiveConvFwd:2045.71,0,miopenConvolutionFwdAlgoDirect
128-11-162-194-3x3x3-128-9-160-192-1-0x0x0-1x1x1-1x1x1-0-NCDHW-FP16-F=ConvHipImplicitGemm3DGroupFwdXdlops:0.801083,160164864,miopenConvolutionFwdAlgoImplicitGEMM;GemmFwdRest:4.98551,1911029760,miopenConvolutionFwdAlgoGEMM;ConvDirectNaiveConvFwd:786.617,0,miopenConvolutionFwdAlgoDirect
128-11-258-194-3x3x3-128-9-256-192-1-0x0x0-1x1x1-1x1x1-0-NCDHW-FP16-F=ConvHipImplicitGemm3DGroupFwdXdlops:1.26409,255077376,miopenConvolutionFwdAlgoImplicitGEMM;GemmFwdRest:8.04383,3057647616,miopenConvolutionFwdAlgoGEMM;ConvDirectNaiveConvFwd:1258.09,0,miopenConvolutionFwdAlgoDirect
128-19-146-130-3x3x3-3-17-144-128-1-0x0x0-1x1x1-1x1x1-0-NCDHW-FP16-F=ConvHipImplicitGemm3DGroupFwdXdlops:0.515191,94219520,miopenConvolutionFwdAlgoImplicitGEMM;GemmFwdRest:5.34261,2165833728,miopenConvolutionFwdAlgoGEMM;ConvDirectNaiveConvFwd:917.223,0,miopenConvolutionFwdAlgoDirect
128-19-258-130-3x3x3-128-17-256-128-1-0x0x0-1x1x1-1x1x1-0-NCDHW-FP16-F=ConvHipImplicitGemm3DGroupFwdXdlops:1.58544,306629632,miopenConvolutionFwdAlgoImplicitGEMM;GemmFwdRest:10.0038,3850371072,miopenConvolutionFwdAlgoGEMM;ConvDirectNaiveConvFwd:1575.27,0,miopenConvolutionFwdAlgoDirect
16-3-20-24-1x1x1-16-3-20-24-1-0x0x0-1x1x1-1x1x1-0-NCDHW-FP16-F=ConvHipImplicitGemm3DGroupFwdXdlops:0.0243722,92672,miopenConvolutionFwdAlgoImplicitGEMM;GemmFwd1x1_0_1:0.008741,0,miopenConvolutionFwdAlgoGEMM;ConvDirectNaiveConvFwd:0.0418624,0,miopenConvolutionFwdAlgoDirect
16-3-32-32-1x1x1-16-3-32-32-1-0x0x0-1x1x1-1x1x1-0-NCDHW-FP16-F=ConvHipImplicitGemm3DGroupFwdXdlops:0.0236914,197120,miopenConvolutionFwdAlgoImplicitGEMM;GemmFwd1x1_0_1:0.008633,0,miopenConvolutionFwdAlgoGEMM;ConvDirectNaiveConvFwd:0.0815018,0,miopenConvolutionFwdAlgoDirect
16-5-18-26-3x3x3-512-3-16-24-1-0x0x0-1x1x1-1x1x1-0-NCDHW-FP16-F=ConvHipImplicitGemm3DGroupFwdXdlops:0.028402,1697024,miopenConvolutionFwdAlgoImplicitGEMM;GemmFwdRest:0.0280952,995328,miopenConvolutionFwdAlgoGEMM;ConvDirectNaiveConvFwd:0.404695,0,miopenConvolutionFwdAlgoDirect
16-5-20-24-1x1x1-16-5-20-24-1-0x0x0-1x1x1-1x1x1-0-NCDHW-FP16-F=ConvHipImplicitGemm3DGroupFwdXdlops:0.0240442,154112,miopenConvolutionFwdAlgoImplicitGEMM;GemmFwd1x1_0_1:0.00915367,0,miopenConvolutionFwdAlgoGEMM;ConvDirectNaiveConvFwd:0.068508,0,miopenConvolutionFwdAlgoDirect
16-5-22-34-3x3x3-512-3-20-32-1-0x0x0-1x1x1-1x1x1-0-NCDHW-FP16-F=ConvHipImplicitGemm3DGroupFwdXdlops:0.0325353,2528256,miopenConvolutionFwdAlgoImplicitGEMM;GemmFwdRest:0.0310793,1658880,miopenConvolutionFwdAlgoGEMM;ConvDirectNaiveConvFwd:0.651485,0,miopenConvolutionFwdAlgoDirect
16-5-34-18-3x3x3-512-3-32-16-1-0x0x0-1x1x1-1x1x1-0-NCDHW-FP16-F=ConvHipImplicitGemm3DGroupFwdXdlops:0.0296642,2113280,miopenConvolutionFwdAlgoImplicitGEMM;GemmFwdRest:0.0378644,1327104,miopenConvolutionFwdAlgoGEMM;ConvDirectNaiveConvFwd:0.483094,0,miopenConvolutionFwdAlgoDirect
16-5-34-34-3x3x3-512-3-32-32-1-0x0x0-1x1x1-1x1x1-0-NCDHW-FP16-F=ConvHipImplicitGemm3DGroupFwdXdlops:0.0399878,3773184,miopenConvolutionFwdAlgoImplicitGEMM;GemmFwdRest:0.0381972,2654208,miopenConvolutionFwdAlgoGEMM;ConvDirectNaiveConvFwd:0.978001,0,miopenConvolutionFwdAlgoDirect
16-7-20-18-3x3x3-512-5-18-16-1-0x0x0-1x1x1-1x1x1-0-NCDHW-FP16-F=ConvHipImplicitGemm3DGroupFwdXdlops:0.0289635,1997568,miopenConvolutionFwdAlgoImplicitGEMM;GemmFwdRest:0.0379237,1244160,miopenConvolutionFwdAlgoGEMM;ConvDirectNaiveConvFwd:0.480998,0,miopenConvolutionFwdAlgoDirect
16-7-34-18-3x3x3-512-5-32-16-1-0x0x0-1x1x1-1x1x1-0-NCDHW-FP16-F=ConvHipImplicitGemm3DGroupFwdXdlops:0.0371018,3201024,miopenConvolutionFwdAlgoImplicitGEMM;GemmFwdRest:0.0345113,2211840,miopenConvolutionFwdAlgoGEMM;ConvDirectNaiveConvFwd:0.803982,0,miopenConvolutionFwdAlgoDirect
256-11-130-194-3x3x3-128-9-128-192-1-0x0x0-1x1x1-1x1x1-0-NCDHW-FP16-F=ConvHipImplicitGemm3DGroupFwdXdlops:1.35005,200431616,miopenConvolutionFwdAlgoImplicitGEMM;GemmFwdRest:7.64536,3057647616,miopenConvolutionFwdAlgoGEMM;ConvDirectNaiveConvFwd:1266.41,0,miopenConvolutionFwdAlgoDirect
256-11-146-258-3x3x3-256-9-144-256-1-0x0x0-1x1x1-1x1x1-0-NCDHW-FP16-F=ConvHipImplicitGemm3DGroupFwdXdlops:3.15882,385554432,miopenConvolutionFwdAlgoImplicitGEMM;GemmFwdRest:12.5047,4586471424,miopenConvolutionFwdAlgoGEMM;ConvDirectNaiveConvFwd:1817.94,0,miopenConvolutionFwdAlgoDirect
256-11-258-258-3x3x3-256-9-256-256-1-0x0x0-1x1x1-1x1x1-0-NCDHW-FP16-F=ConvHipImplicitGemm3DGroupFwdXdlops:5.89272,680417280,miopenConvolutionFwdAlgoImplicitGEMM;ConvDirectNaiveConvFwd:3239.16,0,miopenConvolutionFwdAlgoDirect
256-19-146-258-3x3x3-128-17-144-256-1-0x0x0-1x1x1-1x1x1-0-NCDHW-FP16-F=ConvHipImplicitGemm3DGroupFwdXdlops:3.22527,528635904,miopenConvolutionFwdAlgoImplicitGEMM;ConvDirectNaiveConvFwd:3442.62,0,miopenConvolutionFwdAlgoDirect
256-19-258-194-3x3x3-128-17-256-192-1-0x0x0-1x1x1-1x1x1-0-NCDHW-FP16-F=ConvHipImplicitGemm3DGroupFwdXdlops:4.65375,702584832,miopenConvolutionFwdAlgoImplicitGEMM;ConvDirectNaiveConvFwd:4795.55,0,miopenConvolutionFwdAlgoDirect
512-11-130-98-3x3x3-256-9-128-96-1-0x0x0-1x1x1-1x1x1-0-NCDHW-FP16-F=ConvHipImplicitGemm3DGroupFwdXdlops:2.09477,207204352,miopenConvolutionFwdAlgoImplicitGEMM;GemmFwdRest:8.38591,3057647616,miopenConvolutionFwdAlgoGEMM;ConvDirectNaiveConvFwd:1270.37,0,miopenConvolutionFwdAlgoDirect
512-11-74-130-3x3x3-512-9-72-128-1-0x0x0-1x1x1-1x1x1-0-NCDHW-FP16-F=ConvHipImplicitGemm3DGroupFwdXdlops:3.18457,207450112,miopenConvolutionFwdAlgoImplicitGEMM;GemmFwdRest:8.60339,2293235712,miopenConvolutionFwdAlgoGEMM;ConvDirectNaiveConvFwd:960.821,0,miopenConvolutionFwdAlgoDirect
512-5-128-96-1x1x1-256-5-128-96-1-0x0x0-1x1x1-1x1x1-0-NCDHW-FP16-F=ConvHipImplicitGemm3DGroupFwdXdlops:0.145482,94633984,miopenConvolutionFwdAlgoImplicitGEMM;GemmFwd1x1_0_1:0.0699577,0,miopenConvolutionFwdAlgoGEMM;ConvDirectNaiveConvFwd:62.0609,0,miopenConvolutionFwdAlgoDirect
512-5-20-18-3x3x3-512-3-18-16-1-0x0x0-1x1x1-1x1x1-0-NCDHW-FP16-F=ConvHipImplicitGemm3DGroupFwdXdlops:0.167062,16883712,miopenConvolutionFwdAlgoImplicitGEMM;GemmFwdRest:0.466529,23887872,miopenConvolutionFwdAlgoGEMM;ConvDirectNaiveConvFwd:10.4116,0,miopenConvolutionFwdAlgoDirect
512-5-22-34-3x3x3-512-3-20-32-1-0x0x0-1x1x1-1x1x1-0-NCDHW-FP16-F=ConvHipImplicitGemm3DGroupFwdXdlops:0.246419,19951616,miopenConvolutionFwdAlgoImplicitGEMM;GemmFwdRest:0.509032,53084160,miopenConvolutionFwdAlgoGEMM;ConvDirectNaiveConvFwd:21.6462,0,miopenConvolutionFwdAlgoDirect
512-5-34-34-3x3x3-512-3-32-32-1-0x0x0-1x1x1-1x1x1-0-NCDHW-FP16-F=ConvHipImplicitGemm3DGroupFwdXdlops:0.277042,23220224,miopenConvolutionFwdAlgoImplicitGEMM;GemmFwdRest:0.566225,84934656,miopenConvolutionFwdAlgoGEMM;ConvDirectNaiveConvFwd:33.8383,0,miopenConvolutionFwdAlgoDirect
512-5-42-66-3x3x3-512-3-40-64-1-0x0x0-1x1x1-1x1x1-0-NCDHW-FP16-F=ConvHipImplicitGemm3DGroupFwdXdlops:0.455481,36212736,miopenConvolutionFwdAlgoImplicitGEMM;GemmFwdRest:0.885796,212336640,miopenConvolutionFwdAlgoGEMM;ConvDirectNaiveConvFwd:91.5864,0,miopenConvolutionFwdAlgoDirect
512-5-80-96-1x1x1-256-5-80-96-1-0x0x0-1x1x1-1x1x1-0-NCDHW-FP16-F=ConvHipImplicitGemm3DGroupFwdXdlops:0.0997166,59244544,miopenConvolutionFwdAlgoImplicitGEMM;GemmFwd1x1_0_1:0.0428438,0,miopenConvolutionFwdAlgoGEMM;ConvDirectNaiveConvFwd:38.2253,0,miopenConvolutionFwdAlgoDirect
512-7-18-26-3x3x3-512-5-16-24-1-0x0x0-1x1x1-1x1x1-0-NCDHW-FP16-F=ConvHipImplicitGemm3DGroupFwdXdlops:0.233771,19476480,miopenConvolutionFwdAlgoImplicitGEMM;GemmFwdRest:0.512071,53084160,miopenConvolutionFwdAlgoGEMM;ConvDirectNaiveConvFwd:21.2109,0,miopenConvolutionFwdAlgoDirect
512-7-20-18-3x3x3-512-5-18-16-1-0x0x0-1x1x1-1x1x1-0-NCDHW-FP16-F=ConvHipImplicitGemm3DGroupFwdXdlops:0.202084,18210816,miopenConvolutionFwdAlgoImplicitGEMM;GemmFwdRest:0.488789,39813120,miopenConvolutionFwdAlgoGEMM;ConvDirectNaiveConvFwd:15.7496,0,miopenConvolutionFwdAlgoDirect
512-7-22-26-3x3x3-512-5-20-24-1-0x0x0-1x1x1-1x1x1-0-NCDHW-FP16-F=ConvHipImplicitGemm3DGroupFwdXdlops:0.220615,20713472,miopenConvolutionFwdAlgoImplicitGEMM;GemmFwdRest:0.535438,66355200,miopenConvolutionFwdAlgoGEMM;ConvDirectNaiveConvFwd:26.6342,0,miopenConvolutionFwdAlgoDirect
512-7-34-34-3x3x3-512-5-32-32-1-0x0x0-1x1x1-1x1x1-0-NCDHW-FP16-F=ConvHipImplicitGemm3DGroupFwdXdlops:0.398898,27684864,miopenConvolutionFwdAlgoImplicitGEMM;GemmFwdRest:0.685703,141557760,miopenConvolutionFwdAlgoGEMM;ConvDirectNaiveConvFwd:56.5838,0,miopenConvolutionFwdAlgoDirect
512-7-38-66-3x3x3-512-5-36-64-1-0x0x0-1x1x1-1x1x1-0-NCDHW-FP16-F=ConvHipImplicitGemm3DGroupFwdXdlops:0.587163,43929600,miopenConvolutionFwdAlgoImplicitGEMM;GemmFwdRest:1.1779,318504960,miopenConvolutionFwdAlgoGEMM;ConvDirectNaiveConvFwd:138.063,0,miopenConvolutionFwdAlgoDirect
512-7-66-98-3x3x3-256-5-64-96-1-0x0x0-1x1x1-1x1x1-0-NCDHW-FP16-F=ConvHipImplicitGemm3DGroupFwdXdlops:0.727265,69169152,miopenConvolutionFwdAlgoImplicitGEMM;GemmFwdRest:2.38368,849346560,miopenConvolutionFwdAlgoGEMM;ConvDirectNaiveConvFwd:357.747,0,miopenConvolutionFwdAlgoDirect
512-7-82-98-3x3x3-256-5-80-96-1-0x0x0-1x1x1-1x1x1-0-NCDHW-FP16-F=ConvHipImplicitGemm3DGroupFwdXdlops:0.732446,84340736,miopenConvolutionFwdAlgoImplicitGEMM;GemmFwdRest:3.05798,1061683200,miopenConvolutionFwdAlgoGEMM;ConvDirectNaiveConvFwd:443.697,0,miopenConvolutionFwdAlgoDirect
512-9-72-64-1x1x1-256-9-72-64-1-0x0x0-1x1x1-1x1x1-0-NCDHW-FP16-F=ConvHipImplicitGemm3DGroupFwdXdlops:0.109357,63963136,miopenConvolutionFwdAlgoImplicitGEMM;GemmFwd1x1_0_1:0.050015,0,miopenConvolutionFwdAlgoGEMM;ConvDirectNaiveConvFwd:41.2744,0,miopenConvolutionFwdAlgoDirect
16-3-104-80-3x3x3-384-1-102-78-1-0x0x0-1x1x1-1x1x1-0-NCDHW-FP32-F=ConvHipImplicitGemm3DGroupFwdXdlops:0.0787233,14481408,miopenConvolutionFwdAlgoImplicitGEMM;GemmFwdRest:0.0747448,13747968,miopenConvolutionFwdAlgoGEMM;ConvDirectNaiveConvFwd:2.56586,0,miopenConvolutionFwdAlgoDirect
16-3-208-158-3x3x3-384-1-206-156-1-0x0x0-1x1x1-1x1x1-0-NCDHW-FP32-F=ConvHipImplicitGemm3DGroupFwdXdlops:0.223627,56334336,miopenConvolutionFwdAlgoImplicitGEMM;GemmFwdRest:0.211395,55531008,miopenConvolutionFwdAlgoGEMM;ConvDirectNaiveConvFwd:10.8557,0,miopenConvolutionFwdAlgoDirect
192-2-204-156-1x1x1-384-2-204-156-1-0x0x0-1x1x1-1x1x1-0-NCDHW-FP32-F=ConvHipImplicitGemm3DGroupFwdXdlops:0.243192,146939904,miopenConvolutionFwdAlgoImplicitGEMM;GemmFwd1x1_0_1:0.138182,0,miopenConvolutionFwdAlgoGEMM;ConvDirectNaiveConvFwd:24.5301,0,miopenConvolutionFwdAlgoDirect
192-3-206-158-3x3x3-384-1-204-156-1-0x0x0-1x1x1-1x1x1-0-NCDHW-FP32-F=ConvHipImplicitGemm3DGroupFwdXdlops:1.60343,131834880,miopenConvolutionFwdAlgoImplicitGEMM;GemmFwdRest:2.29035,659902464,miopenConvolutionFwdAlgoGEMM;ConvDirectNaiveConvFwd:131.521,0,miopenConvolutionFwdAlgoDirect
192-3-414-314-3x3x3-384-1-412-312-1-0x0x0-1x1x1-1x1x1-0-NCDHW-FP32-F=ConvHipImplicitGemm3DGroupFwdXdlops:5.89152,504916992,miopenConvolutionFwdAlgoImplicitGEMM;GemmFwdRest:9.21034,2665488384,miopenConvolutionFwdAlgoGEMM;ConvDirectNaiveConvFwd:561.043,0,miopenConvolutionFwdAlgoDirect
192-4-278-210-3x3x3-384-2-276-208-1-0x0x0-1x1x1-1x1x1-0-NCDHW-FP32-F=ConvHipImplicitGemm3DGroupFwdXdlops:5.17456,363663360,miopenConvolutionFwdAlgoImplicitGEMM;GemmFwdRest:8.35597,2380824576,miopenConvolutionFwdAlgoGEMM;ConvDirectNaiveConvFwd:499.727,0,miopenConvolutionFwdAlgoDirect
192-5-412-312-3x1x1-192-2-412-312-1-0x0x0-2x1x1-1x1x1-0-NCDHW-FP32-F=ConvHipImplicitGemm3DGroupFwdXdlops:1.14028,691494912,miopenConvolutionFwdAlgoImplicitGEMM;GemmFwdRest:1.56194,592330752,miopenConvolutionFwdAlgoGEMM;ConvDirectNaiveConvFwd:335.957,0,miopenConvolutionFwdAlgoDirect
192-6-554-418-3x3x3-192-4-552-416-1-0x0x0-1x1x1-1x1x1-0-NCDHW-FP32-F=ConvHipImplicitGemm3DGroupFwdXdlops:21.7535,1776494592,miopenConvolutionFwdAlgoImplicitGEMM;ConvDirectNaiveConvFwd:3947.01,0,miopenConvolutionFwdAlgoDirect
192-553-417-3x3-192-276-208-1-0x0-2x2-1x1-0-NCHW-FP32-F=ConvBinWinogradRxSf2x3g1:1.66918,0,miopenConvolutionFwdAlgoWinograd;ConvBinWinogradRxSf3x2:0.784381,0,miopenConvolutionFwdAlgoWinograd;ConvHipImplicitGemmGroupFwdXdlops:0.689702,222518016,miopenConvolutionFwdAlgoImplicitGEMM;ConvAsmImplicitGemmGTCDynamicFwdXdlopsNHWC:0.628944,222518016,miopenConvolutionFwdAlgoImplicitGEMM;GemmFwdRest:0.757164,396804096,miopenConvolutionFwdAlgoGEMM;ConvDirectNaiveConvFwd:79.2504,0,miopenConvolutionFwdAlgoDirect
192-825-625-3x3-192-412-312-1-0x0-2x2-1x1-0-NCHW-FP32-F=ConvBinWinogradRxSf2x3g1:3.77375,0,miopenConvolutionFwdAlgoWinograd;ConvBinWinogradRxSf3x2:1.8752,0,miopenConvolutionFwdAlgoWinograd;ConvHipImplicitGemmGroupFwdXdlops:1.47304,496048896,miopenConvolutionFwdAlgoImplicitGEMM;ConvAsmImplicitGemmGTCDynamicFwdXdlopsNHWC:1.41111,496048896,miopenConvolutionFwdAlgoImplicitGEMM;GemmFwdRest:1.80239,888496128,miopenConvolutionFwdAlgoGEMM;ConvDirectNaiveConvFwd:193.534,0,miopenConvolutionFwdAlgoDirect
3-3-1106-834-3x3x3-96-1-1104-832-1-0x0x0-1x1x1-1x1x1-0-NCDHW-FP32-F=ConvHipImplicitGemm3DGroupFwdXdlops:0.800966,385952768,miopenConvolutionFwdAlgoImplicitGEMM;GemmFwdRest:0.935395,297603072,miopenConvolutionFwdAlgoGEMM;ConvDirectNaiveConvFwd:58.8963,0,miopenConvolutionFwdAlgoDirect
3-3-818-626-3x3x3-96-1-816-624-1-0x0x0-1x1x1-1x1x1-0-NCDHW-FP32-F=ConvHipImplicitGemm3DGroupFwdXdlops:0.409114,213992448,miopenConvolutionFwdAlgoImplicitGEMM;GemmFwdRest:0.517457,164975616,miopenConvolutionFwdAlgoGEMM;ConvDirectNaiveConvFwd:31.5904,0,miopenConvolutionFwdAlgoDirect
3-6-1650-1250-3x3x3-96-4-1648-1248-1-0x0x0-1x1x1-1x1x1-0-NCDHW-FP32-F=ConvHipImplicitGemm3DGroupFwdXdlops:8.29328,3307628800,miopenConvolutionFwdAlgoImplicitGEMM;GemmFwdRest:7.91163,2665488384,miopenConvolutionFwdAlgoGEMM;ConvDirectNaiveConvFwd:540.014,0,miopenConvolutionFwdAlgoDirect
32-21-138-104-1x1x1-32-21-138-104-1-0x0x0-1x1x1-1x1x1-0-NCDHW-FP32-F=ConvHipImplicitGemm3DGroupFwdXdlops:0.111458,77160448,miopenConvolutionFwdAlgoImplicitGEMM;GemmFwd1x1_0_1:0.0899408,0,miopenConvolutionFwdAlgoGEMM;ConvDirectNaiveConvFwd:19.206,0,miopenConvolutionFwdAlgoDirect
384-3-102-78-3x1x1-384-1-102-78-1-0x0x0-2x1x1-1x1x1-0-NCDHW-FP32-F=ConvHipImplicitGemm3DGroupFwdXdlops:0.168926,50651136,miopenConvolutionFwdAlgoImplicitGEMM;GemmFwdRest:0.146873,36661248,miopenConvolutionFwdAlgoGEMM;ConvDirectNaiveConvFwd:17.3376,0,miopenConvolutionFwdAlgoDirect
384-3-104-80-3x3x3-32-1-102-78-1-0x0x0-1x1x1-1x1x1-0-NCDHW-FP32-F=ConvHipImplicitGemm3DGroupFwdXdlops:0.236226,40684032,miopenConvolutionFwdAlgoImplicitGEMM;GemmFwdRest:1.00056,329951232,miopenConvolutionFwdAlgoGEMM;ConvDirectNaiveConvFwd:72.6567,0,miopenConvolutionFwdAlgoDirect
384-3-140-106-3x3x3-32-1-138-104-1-0x0x0-1x1x1-1x1x1-0-NCDHW-FP32-F=ConvHipImplicitGemm3DGroupFwdXdlops:0.310913,71546880,miopenConvolutionFwdAlgoImplicitGEMM;GemmFwdRest:0.906319,595206144,miopenConvolutionFwdAlgoGEMM;ConvDirectNaiveConvFwd:129.879,0,miopenConvolutionFwdAlgoDirect
384-3-206-158-3x3x3-384-1-204-156-1-0x0x0-1x1x1-1x1x1-0-NCDHW-FP32-F=ConvHipImplicitGemm3DGroupFwdXdlops:3.28816,214788096,miopenConvolutionFwdAlgoImplicitGEMM;GemmFwdRest:4.682,1319804928,miopenConvolutionFwdAlgoGEMM;ConvDirectNaiveConvFwd:286.953,0,miopenConvolutionFwdAlgoDirect
384-4-204-156-3x1x1-768-2-204-156-1-0x0x0-1x1x1-1x1x1-0-NCDHW-FP32-F=ConvHipImplicitGemm3DGroupFwdXdlops:1.54161,394592256,miopenConvolutionFwdAlgoImplicitGEMM;GemmFwdRest:1.63203,293289984,miopenConvolutionFwdAlgoGEMM;ConvDirectNaiveConvFwd:144.536,0,miopenConvolutionFwdAlgoDirect
384-4-276-208-3x1x1-768-2-276-208-1-0x0x0-1x1x1-1x1x1-0-NCDHW-FP32-F=ConvHipImplicitGemm3DGroupFwdXdlops:2.79333,708968448,miopenConvolutionFwdAlgoImplicitGEMM;GemmFwdRest:2.86849,529072128,miopenConvolutionFwdAlgoGEMM;ConvDirectNaiveConvFwd:287.745,0,miopenConvolutionFwdAlgoDirect
384-4-414-314-3x3x3-384-2-412-312-1-0x0x0-1x1x1-1x1x1-0-NCDHW-FP32-F=ConvHipImplicitGemm3DGroupFwdXdlops:23.4321,1209507840,miopenConvolutionFwdAlgoImplicitGEMM;GemmFwdRest:37.0152,10661953536,miopenConvolutionFwdAlgoGEMM;ConvDirectNaiveConvFwd:2446.57,0,miopenConvolutionFwdAlgoDirect
384-277-209-3x3-384-138-104-1-0x0-2x2-1x1-0-NCHW-FP32-F=ConvBinWinogradRxSf2x3g1:1.84146,0,miopenConvolutionFwdAlgoWinograd;ConvBinWinogradRxSf3x2:0.95475,0,miopenConvolutionFwdAlgoWinograd;ConvHipImplicitGemmGroupFwdXdlops:0.617154,116276736,miopenConvolutionFwdAlgoImplicitGEMM;ConvAsmImplicitGemmGTCDynamicFwdXdlopsNHWC:0.518894,116276736,miopenConvolutionFwdAlgoImplicitGEMM;GemmFwdRest:0.710532,198402048,miopenConvolutionFwdAlgoGEMM;ConvDirectNaiveConvFwd:41.6341,0,miopenConvolutionFwdAlgoDirect
384-552-416-3x3-192-552-416-1-1x1-1x1-1x1-0-NCHW-FP32-F=ConvBinWinogradRxSf2x3g1:3.27541,0,miopenConvolutionFwdAlgoWinograd;ConvBinWinogradRxSf3x2:5.29203,0,miopenConvolutionFwdAlgoWinograd;ConvHipImplicitGemmGroupFwdXdlops:3.73496,531726336,miopenConvolutionFwdAlgoImplicitGEMM;ConvAsmImplicitGemmGTCDynamicFwdXdlopsNHWC:3.87645,531726336,miopenConvolutionFwdAlgoImplicitGEMM;GemmFwdRest:5.46594,3174432768,miopenConvolutionFwdAlgoGEMM;ConvDirectNaiveConvFwd:687.07,0,miopenConvolutionFwdAlgoDirect
96-3-1650-1250-3x3x3-3-1-1648-1248-1-0x0x0-1x1x1-1x1x1-0-NCDHW-FP32-F=ConvHipImplicitGemm3DGroupFwdXdlops:14.9774,2400711680,miopenConvolutionFwdAlgoImplicitGEMM;ConvDirectNaiveConvFwd:4724.96,0,miopenConvolutionFwdAlgoDirect
96-4-408-312-1x1x1-192-4-408-312-1-0x0x0-1x1x1-1x1x1-0-NCDHW-FP32-F=ConvHipImplicitGemm3DGroupFwdXdlops:0.823651,586653696,miopenConvolutionFwdAlgoImplicitGEMM;GemmFwd1x1_0_1:0.49469,0,miopenConvolutionFwdAlgoGEMM;ConvDirectNaiveConvFwd:124.299,0,miopenConvolutionFwdAlgoDirect
96-4-824-624-1x1x1-192-4-824-624-1-0x0x0-1x1x1-1x1x1-0-NCDHW-FP32-F=ConvHipImplicitGemm3DGroupFwdXdlops:3.23476,2369396736,miopenConvolutionFwdAlgoImplicitGEMM;GemmFwd1x1_0_1:1.96004,0,miopenConvolutionFwdAlgoGEMM;ConvDirectNaiveConvFwd:494.558,0,miopenConvolutionFwdAlgoDirect
96-6-1650-1250-3x3x3-96-4-1648-1248-1-0x0x0-1x1x1-1x1x1-0-NCDHW-FP32-F=ConvHipImplicitGemm3DGroupFwdXdlops:63.5258,7912092672,miopenConvolutionFwdAlgoImplicitGEMM;ConvDirectNaiveConvFwd:18661.9,0,miopenConvolutionFwdAlgoDirect
384-413-313-3x3-384-206-156-2-0x0-2x2-1x1-0-NCHW-FP32-F=ConvBinWinogradRxSf2x3g1:6.98603,0,miopenConvolutionFwdAlgoWinograd;ConvBinWinogradRxSf3x2:3.48213,0,miopenConvolutionFwdAlgoWinograd;ConvHipImplicitGemmGroupFwdXdlops:2.26652,501144576,miopenConvolutionFwdAlgoImplicitGEMM;ConvAsmImplicitGemmGTCDynamicFwdXdlopsNHWC:2.26302,501144576,miopenConvolutionFwdAlgoImplicitGEMM;GemmFwdRest:2.50055,444248064,miopenConvolutionFwdAlgoGEMM;ConvDirectNaiveConvFwd:107.009,0,miopenConvolutionFwdAlgoDirect
192-409-313-3x3-192-204-156-4-0x0-2x2-1x1-0-NCHW-FP32-F=ConvBinWinogradRxSf2x3g1:3.77631,0,miopenConvolutionFwdAlgoWinograd;ConvBinWinogradRxSf3x2:1.83151,0,miopenConvolutionFwdAlgoWinograd;ConvHipImplicitGemmGroupFwdXdlops:1.42899,492358656,miopenConvolutionFwdAlgoImplicitGEMM;ConvAsmImplicitGemmGTCDynamicFwdXdlopsNHWC:1.34417,492358656,miopenConvolutionFwdAlgoImplicitGEMM;GemmFwdRest:1.7299,219967488,miopenConvolutionFwdAlgoGEMM;ConvDirectNaiveConvFwd:52.5818,0,miopenConvolutionFwdAlgoDirect
192-816-624-3x3-96-816-624-4-1x1-1x1-1x1-0-NCHW-FP32-F=ConvBinWinogradRxSf2x3g1:7.84281,0,miopenConvolutionFwdAlgoWinograd;ConvBinWinogradRxSf3x2:11.9651,0,miopenConvolutionFwdAlgoWinograd;ConvHipImplicitGemmGroupFwdXdlops:11.5616,2346983424,miopenConvolutionFwdAlgoImplicitGEMM;ConvAsmImplicitGemmGTCDynamicFwdXdlopsNHWC:10.9888,2346983424,miopenConvolutionFwdAlgoImplicitGEMM;GemmFwdRest:15.6412,3519479808,miopenConvolutionFwdAlgoGEMM;ConvDirectNaiveConvFwd:841.264,0,miopenConvolutionFwdAlgoDirect
384-552-416-3x3-192-552-416-4-1x1-1x1-1x1-0-NCHW-FP32-F=ConvBinWinogradRxSf2x3g1:13.3533,0,miopenConvolutionFwdAlgoWinograd;ConvBinWinogradRxSf3x2:21.2948,0,miopenConvolutionFwdAlgoWinograd;ConvHipImplicitGemmGroupFwdXdlops:15.4916,2118942720,miopenConvolutionFwdAlgoImplicitGEMM;ConvAsmImplicitGemmGTCDynamicFwdXdlopsNHWC:15.5976,2118942720,miopenConvolutionFwdAlgoImplicitGEMM;GemmFwdRest:21.901,3174432768,miopenConvolutionFwdAlgoGEMM;ConvDirectNaiveConvFwd:870.874,0,miopenConvolutionFwdAlgoDirect
96-817-625-3x3-96-408-312-4-0x0-2x2-1x1-0-NCHW-FP32-F=ConvBinWinogradRxSf2x3g1:3.77755,0,miopenConvolutionFwdAlgoWinograd;ConvBinWinogradRxSf3x2:1.91086,0,miopenConvolutionFwdAlgoWinograd;ConvHipImplicitGemmGroupFwdXdlops:2.09187,980178432,miopenConvolutionFwdAlgoImplicitGEMM;ConvAsmImplicitGemmGTCDynamicFwdXdlopsNHWC:1.99744,980178432,miopenConvolutionFwdAlgoImplicitGEMM;GemmFwdRest:2.41753,439934976,miopenConvolutionFwdAlgoGEMM;ConvDirectNaiveConvFwd:97.69,0,miopenConvolutionFwdAlgoDirect
16-21-138-104-1x1x1-16-21-138-104-1-0x0x0-1x1x1-1x1x1-0-NCDHW-BF16-F=ConvHipImplicitGemm3DGroupFwdXdlops:0.0484568,19289600,miopenConvolutionFwdAlgoImplicitGEMM;GemmFwd1x1_0_1:0.106135,0,miopenConvolutionFwdAlgoGEMM;ConvDirectNaiveConvFwd:9.73145,0,miopenConvolutionFwdAlgoDirect
16-3-104-80-3x3x3-384-1-102-78-1-0x0x0-1x1x1-1x1x1-0-NCDHW-BF16-F=ConvHipImplicitGemm3DGroupFwdXdlops:0.0539205,7240704,miopenConvolutionFwdAlgoImplicitGEMM;GemmFwdRest:0.0700313,6873984,miopenConvolutionFwdAlgoGEMM;ConvDirectNaiveConvFwd:2.4483,0,miopenConvolutionFwdAlgoDirect
16-3-208-158-3x3x3-384-1-206-156-1-0x0x0-1x1x1-1x1x1-0-NCDHW-BF16-F=ConvHipImplicitGemm3DGroupFwdXdlops:0.1053,28167168,miopenConvolutionFwdAlgoImplicitGEMM;GemmFwdRest:0.125307,27765504,miopenConvolutionFwdAlgoGEMM;ConvDirectNaiveConvFwd:10.1838,0,miopenConvolutionFwdAlgoDirect
16-33-68-120-1x2x2-3072-33-34-60-1-0x0x0-1x2x2-1x1x1-0-NCDHW-BF16-F=ConvHipImplicitGemm3DGroupFwdXdlops:0.89038,422624256,miopenConvolutionFwdAlgoImplicitGEMM;GemmFwdRest:0.251382,8616960,miopenConvolutionFwdAlgoGEMM;ConvDirectNaiveConvFwd:13.1055,0,miopenConvolutionFwdAlgoDirect
192-1-276-208-1x1x1-384-1-276-208-1-0x0x0-1x1x1-1x1x1-0-NCDHW-BF16-F=ConvHipImplicitGemm3DGroupFwdXdlops:0.121957,66281472,miopenConvolutionFwdAlgoImplicitGEMM;GemmFwd1x1_0_1:0.0534532,0,miopenConvolutionFwdAlgoGEMM;ConvDirectNaiveConvFwd:21.2808,0,miopenConvolutionFwdAlgoDirect
192-1-412-312-1x1x1-384-1-412-312-1-0x0x0-1x1x1-1x1x1-0-NCDHW-BF16-F=ConvHipImplicitGemm3DGroupFwdXdlops:0.246132,148230144,miopenConvolutionFwdAlgoImplicitGEMM;GemmFwd1x1_0_1:0.144642,0,miopenConvolutionFwdAlgoGEMM;ConvDirectNaiveConvFwd:47.5356,0,miopenConvolutionFwdAlgoDirect
192-2-276-208-1x1x1-384-2-276-208-1-0x0x0-1x1x1-1x1x1-0-NCDHW-BF16-F=ConvHipImplicitGemm3DGroupFwdXdlops:0.217067,132415488,miopenConvolutionFwdAlgoImplicitGEMM;GemmFwd1x1_0_1:0.0877173,0,miopenConvolutionFwdAlgoGEMM;ConvDirectNaiveConvFwd:42.5912,0,miopenConvolutionFwdAlgoDirect
192-3-206-158-3x3x3-384-1-204-156-1-0x0x0-1x1x1-1x1x1-0-NCDHW-BF16-F=ConvHipImplicitGemm3DGroupFwdXdlops:0.400437,65917440,miopenConvolutionFwdAlgoImplicitGEMM;GemmFwdRest:1.08701,329951232,miopenConvolutionFwdAlgoGEMM;ConvDirectNaiveConvFwd:122.763,0,miopenConvolutionFwdAlgoDirect
192-3-410-314-3x3x3-192-1-408-312-1-0x0x0-1x1x1-1x1x1-0-NCDHW-BF16-F=ConvHipImplicitGemm3DGroupFwdXdlops:0.994655,199180800,miopenConvolutionFwdAlgoImplicitGEMM;GemmFwdRest:3.45419,1319804928,miopenConvolutionFwdAlgoGEMM;ConvDirectNaiveConvFwd:476.16,0,miopenConvolutionFwdAlgoDirect
192-3-554-418-3x3x3-192-1-552-416-1-0x0x0-1x1x1-1x1x1-0-NCDHW-BF16-F=ConvHipImplicitGemm3DGroupFwdXdlops:1.598,356940288,miopenConvolutionFwdAlgoImplicitGEMM;GemmFwdRest:6.21583,2380824576,miopenConvolutionFwdAlgoGEMM;ConvDirectNaiveConvFwd:913.121,0,miopenConvolutionFwdAlgoDirect
192-4-206-158-3x3x3-384-2-204-156-1-0x0x0-1x1x1-1x1x1-0-NCDHW-BF16-F=ConvHipImplicitGemm3DGroupFwdXdlops:0.655857,102856704,miopenConvolutionFwdAlgoImplicitGEMM;GemmFwdRest:2.02581,659902464,miopenConvolutionFwdAlgoGEMM;ConvDirectNaiveConvFwd:243.8,0,miopenConvolutionFwdAlgoDirect
192-4-414-314-3x3x3-384-2-412-312-1-0x0x0-1x1x1-1x1x1-0-NCDHW-BF16-F=ConvHipImplicitGemm3DGroupFwdXdlops:2.58773,401098752,miopenConvolutionFwdAlgoImplicitGEMM;GemmFwdRest:8.62817,2665488384,miopenConvolutionFwdAlgoGEMM;ConvDirectNaiveConvFwd:995.43,0,miopenConvolutionFwdAlgoDirect
192-6-554-418-3x3x3-192-4-552-416-1-0x0x0-1x1x1-1x1x1-0-NCDHW-BF16-F=ConvHipImplicitGemm3DGroupFwdXdlops:5.85449,888247296,miopenConvolutionFwdAlgoImplicitGEMM;ConvDirectNaiveConvFwd:3626.03,0,miopenConvolutionFwdAlgoDirect
192-553-417-3x3-192-276-208-1-0x0-2x2-1x1-0-NCHW-BF16-F=ConvHipImplicitGemmGroupFwdXdlops:0.259845,111259136,miopenConvolutionFwdAlgoImplicitGEMM;ConvAsmImplicitGemmGTCDynamicFwdXdlopsNHWC:0.279886,155348480,miopenConvolutionFwdAlgoImplicitGEMM;GemmFwdRest:0.323476,198402048,miopenConvolutionFwdAlgoGEMM;ConvDirectNaiveConvFwd:82.8738,0,miopenConvolutionFwdAlgoDirect
192-825-625-3x3-192-412-312-1-0x0-2x2-1x1-0-NCHW-BF16-F=ConvHipImplicitGemmGroupFwdXdlops:0.54944,248024576,miopenConvolutionFwdAlgoImplicitGEMM;ConvAsmImplicitGemmGTCDynamicFwdXdlopsNHWC:0.587247,346746368,miopenConvolutionFwdAlgoImplicitGEMM;GemmFwdRest:0.662747,444248064,miopenConvolutionFwdAlgoGEMM;ConvDirectNaiveConvFwd:183.386,0,miopenConvolutionFwdAlgoDirect
3-3-1106-834-3x3x3-96-1-1104-832-1-0x0x0-1x1x1-1x1x1-0-NCDHW-BF16-F=ConvHipImplicitGemm3DGroupFwdXdlops:0.522837,192976384,miopenConvolutionFwdAlgoImplicitGEMM;GemmFwdRest:0.750354,148801536,miopenConvolutionFwdAlgoGEMM;ConvDirectNaiveConvFwd:54.8185,0,miopenConvolutionFwdAlgoDirect
3-3-1650-1250-3x3x3-96-1-1648-1248-1-0x0x0-1x1x1-1x1x1-0-NCDHW-BF16-F=ConvHipImplicitGemm3DGroupFwdXdlops:1.15321,432027904,miopenConvolutionFwdAlgoImplicitGEMM;GemmFwdRest:1.67204,333186048,miopenConvolutionFwdAlgoGEMM;ConvDirectNaiveConvFwd:129.416,0,miopenConvolutionFwdAlgoDirect
3-6-1650-1250-3x3x3-96-4-1648-1248-1-0x0x0-1x1x1-1x1x1-0-NCDHW-BF16-F=ConvHipImplicitGemm3DGroupFwdXdlops:4.55121,1653814528,miopenConvolutionFwdAlgoImplicitGEMM;GemmFwdRest:6.6234,1332744192,miopenConvolutionFwdAlgoGEMM;ConvDirectNaiveConvFwd:518.308,0,miopenConvolutionFwdAlgoDirect
36-21-206-156-1x2x2-5120-21-103-78-1-0x0x0-1x2x2-1x1x1-0-NCDHW-BF16-F=ConvHipImplicitGemm3DGroupFwdXdlops:5.66141,1777695744,miopenConvolutionFwdAlgoImplicitGEMM;GemmFwdRest:1.54536,48589632,miopenConvolutionFwdAlgoGEMM;ConvDirectNaiveConvFwd:119.19,0,miopenConvolutionFwdAlgoDirect
384-3-206-156-3x1x1-768-1-206-156-1-0x0x0-1x1x1-1x1x1-0-NCDHW-BF16-F=ConvHipImplicitGemm3DGroupFwdXdlops:0.307772,125171712,miopenConvolutionFwdAlgoImplicitGEMM;GemmFwdRest:0.31525,74041344,miopenConvolutionFwdAlgoGEMM;ConvDirectNaiveConvFwd:66.6773,0,miopenConvolutionFwdAlgoDirect
384-3-278-210-3x3x3-384-1-276-208-1-0x0x0-1x1x1-1x1x1-0-NCDHW-BF16-F=ConvHipImplicitGemm3DGroupFwdXdlops:1.16444,186559488,miopenConvolutionFwdAlgoImplicitGEMM;GemmFwdRest:3.82866,1190412288,miopenConvolutionFwdAlgoGEMM;ConvDirectNaiveConvFwd:447.365,0,miopenConvolutionFwdAlgoDirect
384-4-276-208-3x1x1-768-2-276-208-1-0x0x0-1x1x1-1x1x1-0-NCDHW-BF16-F=ConvHipImplicitGemm3DGroupFwdXdlops:0.974734,354484224,miopenConvolutionFwdAlgoImplicitGEMM;GemmFwdRest:1.02184,264536064,miopenConvolutionFwdAlgoGEMM;ConvDirectNaiveConvFwd:240.033,0,miopenConvolutionFwdAlgoDirect
384-4-414-314-3x3x3-384-2-412-312-1-0x0x0-1x1x1-1x1x1-0-NCDHW-BF16-F=ConvHipImplicitGemm3DGroupFwdXdlops:5.15298,604753920,miopenConvolutionFwdAlgoImplicitGEMM;GemmFwdRest:16.7811,5330976768,miopenConvolutionFwdAlgoGEMM;ConvDirectNaiveConvFwd:2120.97,0,miopenConvolutionFwdAlgoDirect
384-413-313-3x3-384-206-156-1-0x0-2x2-1x1-0-NCHW-BF16-F=ConvHipImplicitGemmGroupFwdXdlops:0.385655,126613248,miopenConvolutionFwdAlgoImplicitGEMM;ConvAsmImplicitGemmGTCDynamicFwdXdlopsNHWC:0.42991,175974144,miopenConvolutionFwdAlgoImplicitGEMM;GemmFwdRest:0.458411,222124032,miopenConvolutionFwdAlgoGEMM;ConvDirectNaiveConvFwd:95.0927,0,miopenConvolutionFwdAlgoDirect
384-824-624-3x3-192-824-624-1-1x1-1x1-1x1-0-NCHW-BF16-F=ConvHipImplicitGemmGroupFwdXdlops:2.59084,593657856,miopenConvolutionFwdAlgoImplicitGEMM;ConvAsmImplicitGemmGTCDynamicFwdXdlopsNHWC:2.50681,988545024,miopenConvolutionFwdAlgoImplicitGEMM;GemmFwdRest:4.25156,3553984512,miopenConvolutionFwdAlgoGEMM;ConvDirectNaiveConvFwd:1382.92,0,miopenConvolutionFwdAlgoDirect
96-3-1650-1250-3x3x3-96-1-1648-1248-1-0x0x0-1x1x1-1x1x1-0-NCDHW-BF16-F=ConvHipImplicitGemm3DGroupFwdXdlops:5.19012,1583384832,miopenConvolutionFwdAlgoImplicitGEMM;ConvDirectNaiveConvFwd:4159.53,0,miopenConvolutionFwdAlgoDirect
96-6-1650-1250-3x3x3-3-4-1648-1248-1-0x0x0-1x1x1-1x1x1-0-NCDHW-BF16-F=ConvHipImplicitGemm3DGroupFwdXdlops:47.3238,2425376512,miopenConvolutionFwdAlgoImplicitGEMM;ConvDirectNaiveConvFwd:16788.7,0,miopenConvolutionFwdAlgoDirect
384-204-156-3x3-192-204-156-2-1x1-1x1-1x1-0-NCHW-BF16-F=ConvHipImplicitGemmGroupFwdXdlops:0.322904,74649600,miopenConvolutionFwdAlgoImplicitGEMM;ConvAsmImplicitGemmGTCDynamicFwdXdlopsNHWC:0.34554,123531264,miopenConvolutionFwdAlgoImplicitGEMM;GemmFwdRest:0.629868,219967488,miopenConvolutionFwdAlgoGEMM;ConvDirectNaiveConvFwd:83.7375,0,miopenConvolutionFwdAlgoDirect
384-277-209-3x3-384-138-104-2-0x0-2x2-1x1-0-NCHW-BF16-F=ConvHipImplicitGemmGroupFwdXdlops:0.343726,113622528,miopenConvolutionFwdAlgoImplicitGEMM;ConvAsmImplicitGemmGTCDynamicFwdXdlopsNHWC:0.39545,157711872,miopenConvolutionFwdAlgoImplicitGEMM;GemmFwdRest:0.598867,99201024,miopenConvolutionFwdAlgoGEMM;ConvDirectNaiveConvFwd:44.6424,0,miopenConvolutionFwdAlgoDirect
384-413-313-3x3-384-206-156-2-0x0-2x2-1x1-0-NCHW-BF16-F=ConvHipImplicitGemmGroupFwdXdlops:0.693004,250572288,miopenConvolutionFwdAlgoImplicitGEMM;ConvAsmImplicitGemmGTCDynamicFwdXdlopsNHWC:0.797899,349294080,miopenConvolutionFwdAlgoImplicitGEMM;GemmFwdRest:0.969766,222124032,miopenConvolutionFwdAlgoGEMM;ConvDirectNaiveConvFwd:98.9322,0,miopenConvolutionFwdAlgoDirect
192-1648-1248-3x3-96-1648-1248-4-1x1-1x1-1x1-0-NCHW-BF16-F=ConvHipImplicitGemmGroupFwdXdlops:14.2341,4738977792,miopenConvolutionFwdAlgoImplicitGEMM;ConvAsmImplicitGemmGTCDynamicFwdXdlopsNHWC:13.5254,7898075136,miopenConvolutionFwdAlgoImplicitGEMM;GemmFwdRest:32.0051,7107969024,miopenConvolutionFwdAlgoGEMM;ConvDirectNaiveConvFwd:3509.35,0,miopenConvolutionFwdAlgoDirect
128-11-146-258-3x3x3-128-9-144-256-1-0x0x0-1x1x1-1x1x1-0-NCDHW-FP16-F=ConvHipImplicitGemm3DGroupFwdXdlops:0.977157,191892480,miopenConvolutionFwdAlgoImplicitGEMM;GemmFwdRest:6.04804,2293235712,miopenConvolutionFwdAlgoGEMM;ConvDirectNaiveConvFwd:905.372,0,miopenConvolutionFwdAlgoDirect
128-11-258-258-3x3x3-128-9-256-256-1-0x0x0-1x1x1-1x1x1-0-NCDHW-FP16-F=ConvHipImplicitGemm3DGroupFwdXdlops:1.72776,339323904,miopenConvolutionFwdAlgoImplicitGEMM;GemmFwdRest:10.506,4076863488,miopenConvolutionFwdAlgoGEMM;ConvDirectNaiveConvFwd:1611.32,0,miopenConvolutionFwdAlgoDirect
128-19-162-194-3x3x3-3-17-160-192-1-0x0x0-1x1x1-1x1x1-0-NCDHW-FP16-F=ConvHipImplicitGemm3DGroupFwdXdlops:0.882223,156019968,miopenConvolutionFwdAlgoImplicitGEMM;GemmFwdRest:9.15714,3609722880,miopenConvolutionFwdAlgoGEMM;ConvDirectNaiveConvFwd:1517.24,0,miopenConvolutionFwdAlgoDirect
128-19-258-194-3x3x3-3-17-256-192-1-0x0x0-1x1x1-1x1x1-0-NCDHW-FP16-F=ConvHipImplicitGemm3DGroupFwdXdlops:1.50269,248487168,miopenConvolutionFwdAlgoImplicitGEMM;GemmFwdRest:14.7993,5775556608,miopenConvolutionFwdAlgoGEMM;ConvDirectNaiveConvFwd:2436.74,0,miopenConvolutionFwdAlgoDirect
256-11-130-258-3x3x3-256-9-128-256-1-0x0x0-1x1x1-1x1x1-0-NCDHW-FP16-F=ConvHipImplicitGemm3DGroupFwdXdlops:2.74836,343431168,miopenConvolutionFwdAlgoImplicitGEMM;GemmFwdRest:11.2198,4076863488,miopenConvolutionFwdAlgoGEMM;ConvDirectNaiveConvFwd:1623.95,0,miopenConvolutionFwdAlgoDirect
256-11-258-130-3x3x3-256-9-256-128-1-0x0x0-1x1x1-1x1x1-0-NCDHW-FP16-F=ConvHipImplicitGemm3DGroupFwdXdlops:2.76798,343431168,miopenConvolutionFwdAlgoImplicitGEMM;GemmFwdRest:11.3609,4076863488,miopenConvolutionFwdAlgoGEMM;ConvDirectNaiveConvFwd:1677.08,0,miopenConvolutionFwdAlgoDirect
256-11-74-130-3x3x3-256-9-72-128-1-0x0x0-1x1x1-1x1x1-0-NCDHW-FP16-F=ConvHipImplicitGemm3DGroupFwdXdlops:0.868946,100186112,miopenConvolutionFwdAlgoImplicitGEMM;GemmFwdRest:3.45196,1146617856,miopenConvolutionFwdAlgoGEMM;ConvDirectNaiveConvFwd:471.253,0,miopenConvolutionFwdAlgoDirect
256-17-128-256-1x1x1-128-17-128-256-1-0x0x0-1x1x1-1x1x1-0-NCDHW-FP16-F=ConvHipImplicitGemm3DGroupFwdXdlops:0.684686,427884544,miopenConvolutionFwdAlgoImplicitGEMM;GemmFwd1x1_0_1:0.350924,0,miopenConvolutionFwdAlgoGEMM;ConvDirectNaiveConvFwd:347.516,0,miopenConvolutionFwdAlgoDirect
256-17-160-256-1x1x1-128-17-160-256-1-0x0x0-1x1x1-1x1x1-0-NCDHW-FP16-F=ConvHipImplicitGemm3DGroupFwdXdlops:0.856851,534839296,miopenConvolutionFwdAlgoImplicitGEMM;GemmFwd1x1_0_1:0.422217,0,miopenConvolutionFwdAlgoGEMM;ConvDirectNaiveConvFwd:431.612,0,miopenConvolutionFwdAlgoDirect
256-19-130-258-3x3x3-256-17-128-256-1-0x0x0-1x1x1-1x1x1-0-NCDHW-FP16-F=ConvHipImplicitGemm3DGroupFwdXdlops:5.28726,615028736,miopenConvolutionFwdAlgoImplicitGEMM;ConvDirectNaiveConvFwd:3057.66,0,miopenConvolutionFwdAlgoDirect
256-19-258-130-3x3x3-256-17-256-128-1-0x0x0-1x1x1-1x1x1-0-NCDHW-FP16-F=ConvHipImplicitGemm3DGroupFwdXdlops:5.24593,615028736,miopenConvolutionFwdAlgoImplicitGEMM;ConvDirectNaiveConvFwd:3164.9,0,miopenConvolutionFwdAlgoDirect
256-7-66-130-3x3x3-256-5-64-128-1-0x0x0-1x1x1-1x1x1-0-NCDHW-FP16-F=ConvHipImplicitGemm3DGroupFwdXdlops:0.519942,55261184,miopenConvolutionFwdAlgoImplicitGEMM;GemmFwdRest:1.71304,566231040,miopenConvolutionFwdAlgoGEMM;ConvDirectNaiveConvFwd:230.788,0,miopenConvolutionFwdAlgoDirect
256-7-82-98-3x3x3-256-5-80-96-1-0x0x0-1x1x1-1x1x1-0-NCDHW-FP16-F=ConvHipImplicitGemm3DGroupFwdXdlops:0.44543,52000768,miopenConvolutionFwdAlgoImplicitGEMM;GemmFwdRest:1.57029,530841600,miopenConvolutionFwdAlgoGEMM;ConvDirectNaiveConvFwd:222.633,0,miopenConvolutionFwdAlgoDirect
256-9-144-128-1x1x1-128-9-144-128-1-0x0x0-1x1x1-1x1x1-0-NCDHW-FP16-F=ConvHipImplicitGemm3DGroupFwdXdlops:0.18534,127467520,miopenConvolutionFwdAlgoImplicitGEMM;GemmFwd1x1_0_1:0.10941,0,miopenConvolutionFwdAlgoGEMM;ConvDirectNaiveConvFwd:83.8634,0,miopenConvolutionFwdAlgoDirect
256-9-160-256-1x1x1-128-9-160-256-1-0x0x0-1x1x1-1x1x1-0-NCDHW-FP16-F=ConvHipImplicitGemm3DGroupFwdXdlops:0.453345,283181056,miopenConvolutionFwdAlgoImplicitGEMM;GemmFwd1x1_0_1:0.205039,0,miopenConvolutionFwdAlgoGEMM;ConvDirectNaiveConvFwd:195.847,0,miopenConvolutionFwdAlgoDirect
512-11-130-130-3x3x3-256-9-128-128-1-0x0x0-1x1x1-1x1x1-0-NCDHW-FP16-F=ConvHipImplicitGemm3DGroupFwdXdlops:2.69474,272936960,miopenConvolutionFwdAlgoImplicitGEMM;GemmFwdRest:11.017,4076863488,miopenConvolutionFwdAlgoGEMM;ConvDirectNaiveConvFwd:1674.54,0,miopenConvolutionFwdAlgoDirect
512-11-66-98-3x3x3-256-9-64-96-1-0x0x0-1x1x1-1x1x1-0-NCDHW-FP16-F=ConvHipImplicitGemm3DGroupFwdXdlops:1.14682,108244992,miopenConvolutionFwdAlgoImplicitGEMM;GemmFwdRest:4.60201,1528823808,miopenConvolutionFwdAlgoGEMM;ConvDirectNaiveConvFwd:641.93,0,miopenConvolutionFwdAlgoDirect
512-11-74-66-3x3x3-512-9-72-64-1-0x0x0-1x1x1-1x1x1-0-NCDHW-FP16-F=ConvHipImplicitGemm3DGroupFwdXdlops:1.96745,111636480,miopenConvolutionFwdAlgoImplicitGEMM;GemmFwdRest:4.09857,1146617856,miopenConvolutionFwdAlgoGEMM;ConvDirectNaiveConvFwd:495.164,0,miopenConvolutionFwdAlgoDirect
512-5-128-128-1x1x1-256-5-128-128-1-0x0x0-1x1x1-1x1x1-0-NCDHW-FP16-F=ConvHipImplicitGemm3DGroupFwdXdlops:0.191731,126091264,miopenConvolutionFwdAlgoImplicitGEMM;GemmFwd1x1_0_1:0.0900343,0,miopenConvolutionFwdAlgoGEMM;ConvDirectNaiveConvFwd:82.277,0,miopenConvolutionFwdAlgoDirect
512-5-18-26-3x3x3-512-3-16-24-1-0x0x0-1x1x1-1x1x1-0-NCDHW-FP16-F=ConvHipImplicitGemm3DGroupFwdXdlops:0.159091,17731584,miopenConvolutionFwdAlgoImplicitGEMM;GemmFwdRest:0.478634,31850496,miopenConvolutionFwdAlgoGEMM;ConvDirectNaiveConvFwd:13.1763,0,miopenConvolutionFwdAlgoDirect
512-5-20-34-3x3x3-512-3-18-32-1-0x0x0-1x1x1-1x1x1-0-NCDHW-FP16-F=ConvHipImplicitGemm3DGroupFwdXdlops:0.214353,19406848,miopenConvolutionFwdAlgoImplicitGEMM;GemmFwdRest:0.506395,47775744,miopenConvolutionFwdAlgoGEMM;ConvDirectNaiveConvFwd:18.9376,0,miopenConvolutionFwdAlgoDirect
512-5-34-18-3x3x3-512-3-32-16-1-0x0x0-1x1x1-1x1x1-0-NCDHW-FP16-F=ConvHipImplicitGemm3DGroupFwdXdlops:0.201592,18862080,miopenConvolutionFwdAlgoImplicitGEMM;GemmFwdRest:0.493656,42467328,miopenConvolutionFwdAlgoGEMM;ConvDirectNaiveConvFwd:16.4931,0,miopenConvolutionFwdAlgoDirect
512-5-34-66-3x3x3-512-3-32-64-1-0x0x0-1x1x1-1x1x1-0-NCDHW-FP16-F=ConvHipImplicitGemm3DGroupFwdXdlops:0.442837,31936512,miopenConvolutionFwdAlgoImplicitGEMM;GemmFwdRest:0.765954,169869312,miopenConvolutionFwdAlgoGEMM;ConvDirectNaiveConvFwd:74.0806,0,miopenConvolutionFwdAlgoDirect
512-5-66-50-3x3x3-512-3-64-48-1-0x0x0-1x1x1-1x1x1-0-NCDHW-FP16-F=ConvHipImplicitGemm3DGroupFwdXdlops:0.502808,40488960,miopenConvolutionFwdAlgoImplicitGEMM;GemmFwdRest:0.981418,254803968,miopenConvolutionFwdAlgoGEMM;ConvDirectNaiveConvFwd:109.558,0,miopenConvolutionFwdAlgoDirect
512-7-130-66-3x3x3-512-5-128-64-1-0x0x0-1x1x1-1x1x1-0-NCDHW-FP16-F=ConvHipImplicitGemm3DGroupFwdXdlops:1.62967,117600256,miopenConvolutionFwdAlgoImplicitGEMM;GemmFwdRest:4.10269,1132462080,miopenConvolutionFwdAlgoGEMM;ConvDirectNaiveConvFwd:492.507,0,miopenConvolutionFwdAlgoDirect
512-7-34-26-3x3x3-512-5-32-24-1-0x0x0-1x1x1-1x1x1-0-NCDHW-FP16-F=ConvHipImplicitGemm3DGroupFwdXdlops:0.279057,24424448,miopenConvolutionFwdAlgoImplicitGEMM;GemmFwdRest:0.612207,106168320,miopenConvolutionFwdAlgoGEMM;ConvDirectNaiveConvFwd:41.4736,0,miopenConvolutionFwdAlgoDirect
512-7-38-34-3x3x3-512-5-36-32-1-0x0x0-1x1x1-1x1x1-0-NCDHW-FP16-F=ConvHipImplicitGemm3DGroupFwdXdlops:0.397925,29315072,miopenConvolutionFwdAlgoImplicitGEMM;GemmFwdRest:0.752626,159252480,miopenConvolutionFwdAlgoGEMM;ConvDirectNaiveConvFwd:66.1711,0,miopenConvolutionFwdAlgoDirect
512-7-66-34-3x3x3-512-5-64-32-1-0x0x0-1x1x1-1x1x1-0-NCDHW-FP16-F=ConvHipImplicitGemm3DGroupFwdXdlops:0.574096,40726528,miopenConvolutionFwdAlgoImplicitGEMM;GemmFwdRest:1.09037,283115520,miopenConvolutionFwdAlgoGEMM;ConvDirectNaiveConvFwd:114.835,0,miopenConvolutionFwdAlgoDirect
512-7-74-130-3x3x3-512-5-72-128-1-0x0x0-1x1x1-1x1x1-0-NCDHW-FP16-F=ConvHipImplicitGemm3DGroupFwdXdlops:1.87596,130297856,miopenConvolutionFwdAlgoImplicitGEMM;GemmFwdRest:4.67817,1274019840,miopenConvolutionFwdAlgoGEMM;ConvDirectNaiveConvFwd:539.037,0,miopenConvolutionFwdAlgoDirect
512-9-64-128-1x1x1-256-9-64-128-1-0x0x0-1x1x1-1x1x1-0-NCDHW-FP16-F=ConvHipImplicitGemm3DGroupFwdXdlops:0.173245,113508352,miopenConvolutionFwdAlgoImplicitGEMM;GemmFwd1x1_0_1:0.0780167,0,miopenConvolutionFwdAlgoGEMM;ConvDirectNaiveConvFwd:73.9678,0,miopenConvolutionFwdAlgoDirect
512-9-80-128-1x1x1-256-9-80-128-1-0x0x0-1x1x1-1x1x1-0-NCDHW-FP16-F=ConvHipImplicitGemm3DGroupFwdXdlops:0.249567,141819904,miopenConvolutionFwdAlgoImplicitGEMM;GemmFwd1x1_0_1:0.0975923,0,miopenConvolutionFwdAlgoGEMM;ConvDirectNaiveConvFwd:93.6204,0,miopenConvolutionFwdAlgoDirect
16-3-104-80-3x3x3-384-1-102-78-1-0x0x0-1x1x1-1x1x1-0-NCDHW-FP32-F=ConvHipImplicitGemm3DGroupFwdXdlops:0.0791014,14481408,miopenConvolutionFwdAlgoImplicitGEMM;GemmFwdRest:0.0735096,13747968,miopenConvolutionFwdAlgoGEMM;ConvDirectNaiveConvFwd:2.56679,0,miopenConvolutionFwdAlgoDirect
16-3-140-106-3x3x3-384-1-138-104-1-0x0x0-1x1x1-1x1x1-0-NCDHW-FP32-F=ConvHipImplicitGemm3DGroupFwdXdlops:0.108796,25557504,miopenConvolutionFwdAlgoImplicitGEMM;GemmFwdRest:0.120235,24800256,miopenConvolutionFwdAlgoGEMM;ConvDirectNaiveConvFwd:4.94553,0,miopenConvolutionFwdAlgoDirect
192-1-412-312-1x1x1-384-1-412-312-1-0x0x0-1x1x1-1x1x1-0-NCDHW-FP32-F=ConvHipImplicitGemm3DGroupFwdXdlops:0.509421,296460288,miopenConvolutionFwdAlgoImplicitGEMM;GemmFwd1x1_0_1:0.276432,0,miopenConvolutionFwdAlgoGEMM;ConvDirectNaiveConvFwd:50.3622,0,miopenConvolutionFwdAlgoDirect
192-3-278-210-3x3x3-384-1-276-208-1-0x0x0-1x1x1-1x1x1-0-NCDHW-FP32-F=ConvHipImplicitGemm3DGroupFwdXdlops:2.54823,230648832,miopenConvolutionFwdAlgoImplicitGEMM;GemmFwdRest:3.91713,1190412288,miopenConvolutionFwdAlgoGEMM;ConvDirectNaiveConvFwd:238.522,0,miopenConvolutionFwdAlgoDirect
192-3-826-626-3x3x3-192-1-824-624-1-0x0x0-1x1x1-1x1x1-0-NCDHW-FP32-F=ConvHipImplicitGemm3DGroupFwdXdlops:13.3516,1590211584,miopenConvolutionFwdAlgoImplicitGEMM;GemmFwdRest:26.7396,10661953536,miopenConvolutionFwdAlgoGEMM;ConvDirectNaiveConvFwd:2388.06,0,miopenConvolutionFwdAlgoDirect
192-1104-832-3x3-96-1104-832-1-1x1-1x1-1x1-0-NCHW-FP32-F=ConvBinWinogradRxSf2x3g1:3.49316,0,miopenConvolutionFwdAlgoWinograd;ConvBinWinogradRxSf3x2:5.40658,0,miopenConvolutionFwdAlgoWinograd;ConvHipImplicitGemmGroupFwdXdlops:5.14328,1058807808,miopenConvolutionFwdAlgoImplicitGEMM;ConvAsmImplicitGemmGTCDynamicFwdXdlopsNHWC:4.91424,1058807808,miopenConvolutionFwdAlgoImplicitGEMM;GemmFwdRest:6.81622,6348865536,miopenConvolutionFwdAlgoGEMM;ConvDirectNaiveConvFwd:1388.17,0,miopenConvolutionFwdAlgoDirect
192-409-313-3x3-192-204-156-1-0x0-2x2-1x1-0-NCHW-FP32-F=ConvBinWinogradRxSf2x3g1:0.93515,0,miopenConvolutionFwdAlgoWinograd;ConvBinWinogradRxSf3x2:0.498001,0,miopenConvolutionFwdAlgoWinograd;ConvHipImplicitGemmGroupFwdXdlops:0.387848,124084992,miopenConvolutionFwdAlgoImplicitGEMM;ConvAsmImplicitGemmGTCDynamicFwdXdlopsNHWC:0.33558,124084992,miopenConvolutionFwdAlgoImplicitGEMM;GemmFwdRest:0.430309,219967488,miopenConvolutionFwdAlgoGEMM;ConvDirectNaiveConvFwd:44.3372,0,miopenConvolutionFwdAlgoDirect
192-816-624-3x3-96-816-624-1-1x1-1x1-1x1-0-NCHW-FP32-F=ConvBinWinogradRxSf2x3g1:1.8641,0,miopenConvolutionFwdAlgoWinograd;ConvBinWinogradRxSf3x2:3.17385,0,miopenConvolutionFwdAlgoWinograd;ConvHipImplicitGemmGroupFwdXdlops:2.89145,587243520,miopenConvolutionFwdAlgoImplicitGEMM;ConvAsmImplicitGemmGTCDynamicFwdXdlopsNHWC:2.78858,587243520,miopenConvolutionFwdAlgoImplicitGEMM;GemmFwdRest:3.99433,3519479808,miopenConvolutionFwdAlgoGEMM;ConvDirectNaiveConvFwd:661.741,0,miopenConvolutionFwdAlgoDirect
3-3-818-626-3x3x3-96-1-816-624-1-0x0x0-1x1x1-1x1x1-0-NCDHW-FP32-F=ConvHipImplicitGemm3DGroupFwdXdlops:0.410515,213992448,miopenConvolutionFwdAlgoImplicitGEMM;GemmFwdRest:0.503023,164975616,miopenConvolutionFwdAlgoGEMM;ConvDirectNaiveConvFwd:31.5012,0,miopenConvolutionFwdAlgoDirect
3-6-1106-834-3x3x3-96-4-1104-832-1-0x0x0-1x1x1-1x1x1-0-NCDHW-FP32-F=ConvHipImplicitGemm3DGroupFwdXdlops:3.03114,1477303552,miopenConvolutionFwdAlgoImplicitGEMM;GemmFwdRest:3.49084,1190412288,miopenConvolutionFwdAlgoGEMM;ConvDirectNaiveConvFwd:237.107,0,miopenConvolutionFwdAlgoDirect
3-6-818-626-3x3x3-96-4-816-624-1-0x0x0-1x1x1-1x1x1-0-NCDHW-FP32-F=ConvHipImplicitGemm3DGroupFwdXdlops:1.64729,819006976,miopenConvolutionFwdAlgoImplicitGEMM;GemmFwdRest:2.02711,659902464,miopenConvolutionFwdAlgoGEMM;ConvDirectNaiveConvFwd:128.804,0,miopenConvolutionFwdAlgoDirect
32-21-102-78-1x1x1-32-21-102-78-1-0x0x0-1x1x1-1x1x1-0-NCDHW-FP32-F=ConvHipImplicitGemm3DGroupFwdXdlops:0.0802796,42775552,miopenConvolutionFwdAlgoImplicitGEMM;GemmFwd1x1_0_1:0.0562973,0,miopenConvolutionFwdAlgoGEMM;ConvDirectNaiveConvFwd:10.6617,0,miopenConvolutionFwdAlgoDirect
36-21-102-78-1x2x2-5120-21-51-39-1-0x0x0-1x2x2-1x1x1-0-NCDHW-FP32-F=ConvHipImplicitGemm3DGroupFwdXdlops:1.99819,882437376,miopenConvolutionFwdAlgoImplicitGEMM;GemmFwdRest:0.952148,24058944,miopenConvolutionFwdAlgoGEMM;ConvDirectNaiveConvFwd:26.8011,0,miopenConvolutionFwdAlgoDirect
384-3-138-104-3x1x1-384-1-138-104-1-0x0x0-2x1x1-1x1x1-0-NCDHW-FP32-F=ConvHipImplicitGemm3DGroupFwdXdlops:0.262765,89948160,miopenConvolutionFwdAlgoImplicitGEMM;GemmFwdRest:0.276779,66134016,miopenConvolutionFwdAlgoGEMM;ConvDirectNaiveConvFwd:30.8132,0,miopenConvolutionFwdAlgoDirect
384-3-140-106-3x3x3-32-1-138-104-1-0x0x0-1x1x1-1x1x1-0-NCDHW-FP32-F=ConvHipImplicitGemm3DGroupFwdXdlops:0.32007,71546880,miopenConvolutionFwdAlgoImplicitGEMM;GemmFwdRest:0.95297,595206144,miopenConvolutionFwdAlgoGEMM;ConvDirectNaiveConvFwd:130.155,0,miopenConvolutionFwdAlgoDirect
384-3-206-156-3x1x1-768-1-206-156-1-0x0x0-1x1x1-1x1x1-0-NCDHW-FP32-F=ConvHipImplicitGemm3DGroupFwdXdlops:0.865125,250343424,miopenConvolutionFwdAlgoImplicitGEMM;GemmFwdRest:0.830573,148082688,miopenConvolutionFwdAlgoGEMM;ConvDirectNaiveConvFwd:68.7681,0,miopenConvolutionFwdAlgoDirect
384-3-278-210-3x3x3-384-1-276-208-1-0x0x0-1x1x1-1x1x1-0-NCDHW-FP32-F=ConvHipImplicitGemm3DGroupFwdXdlops:5.1238,373118976,miopenConvolutionFwdAlgoImplicitGEMM;GemmFwdRest:8.43625,2380824576,miopenConvolutionFwdAlgoGEMM;ConvDirectNaiveConvFwd:551.569,0,miopenConvolutionFwdAlgoDirect
384-4-278-210-3x3x3-384-2-276-208-1-0x0x0-1x1x1-1x1x1-0-NCDHW-FP32-F=ConvHipImplicitGemm3DGroupFwdXdlops:10.3706,550969344,miopenConvolutionFwdAlgoImplicitGEMM;GemmFwdRest:16.6612,4761649152,miopenConvolutionFwdAlgoGEMM;ConvDirectNaiveConvFwd:1093.65,0,miopenConvolutionFwdAlgoDirect
384-102-78-1x1-384-102-78-1-0x0-1x1-1x1-0-NCHW-FP32-F=ConvBinWinogradRxSf2x3g1:0.251909,0,miopenConvolutionFwdAlgoWinograd;ConvBinWinogradRxSf3x2:0.130457,0,miopenConvolutionFwdAlgoWinograd;ConvHipImplicitGemmGroupFwdXdlops:0.0721162,25030656,miopenConvolutionFwdAlgoImplicitGEMM;ConvAsmImplicitGemmGTCDynamicFwdXdlopsNHWC:0.0675137,24440832,miopenConvolutionFwdAlgoImplicitGEMM;GemmFwd1x1_0_1:0.042151,0,miopenConvolutionFwdAlgoGEMM;ConvDirectNaiveConvFwd:5.14241,0,miopenConvolutionFwdAlgoDirect
384-204-156-3x3-192-204-156-1-1x1-1x1-1x1-0-NCHW-FP32-F=ConvBinWinogradRxSf2x3g1:0.428159,0,miopenConvolutionFwdAlgoWinograd;ConvBinWinogradRxSf3x2:0.845862,0,miopenConvolutionFwdAlgoWinograd;ConvHipImplicitGemmGroupFwdXdlops:0.602871,75976704,miopenConvolutionFwdAlgoImplicitGEMM;ConvAsmImplicitGemmGTCDynamicFwdXdlopsNHWC:0.505475,75976704,miopenConvolutionFwdAlgoImplicitGEMM;GemmFwdRest:0.891513,439934976,miopenConvolutionFwdAlgoGEMM;ConvDirectNaiveConvFwd:76.9778,0,miopenConvolutionFwdAlgoDirect
384-276-208-3x3-192-276-208-1-1x1-1x1-1x1-0-NCHW-FP32-F=ConvBinWinogradRxSf2x3g1:0.745488,0,miopenConvolutionFwdAlgoWinograd;ConvBinWinogradRxSf3x2:1.27768,0,miopenConvolutionFwdAlgoWinograd;ConvHipImplicitGemmGroupFwdXdlops:1.02354,134922240,miopenConvolutionFwdAlgoImplicitGEMM;ConvAsmImplicitGemmGTCDynamicFwdXdlopsNHWC:0.901642,134922240,miopenConvolutionFwdAlgoImplicitGEMM;GemmFwdRest:1.42285,793608192,miopenConvolutionFwdAlgoGEMM;ConvDirectNaiveConvFwd:138.816,0,miopenConvolutionFwdAlgoDirect
384-413-313-3x3-384-206-156-1-0x0-2x2-1x1-0-NCHW-FP32-F=ConvBinWinogradRxSf2x3g1:3.41492,0,miopenConvolutionFwdAlgoWinograd;ConvBinWinogradRxSf3x2:1.7258,0,miopenConvolutionFwdAlgoWinograd;ConvHipImplicitGemmGroupFwdXdlops:1.18394,253226496,miopenConvolutionFwdAlgoImplicitGEMM;ConvAsmImplicitGemmGTCDynamicFwdXdlopsNHWC:1.12221,253226496,miopenConvolutionFwdAlgoImplicitGEMM;GemmFwdRest:1.23906,444248064,miopenConvolutionFwdAlgoGEMM;ConvDirectNaiveConvFwd:91.4619,0,miopenConvolutionFwdAlgoDirect
96-1-552-416-1x1x1-192-1-552-416-1-0x0x0-1x1x1-1x1x1-0-NCDHW-FP32-F=ConvHipImplicitGemm3DGroupFwdXdlops:0.376701,264609792,miopenConvolutionFwdAlgoImplicitGEMM;GemmFwd1x1_0_1:0.214787,0,miopenConvolutionFwdAlgoGEMM;ConvDirectNaiveConvFwd:45.5821,0,miopenConvolutionFwdAlgoDirect
96-3-1106-834-3x3x3-3-1-1104-832-1-0x0x0-1x1x1-1x1x1-0-NCDHW-FP32-F=ConvHipImplicitGemm3DGroupFwdXdlops:3.3253,1073662976,miopenConvolutionFwdAlgoImplicitGEMM;GemmFwdRest:16.0212,9523298304,miopenConvolutionFwdAlgoGEMM;ConvDirectNaiveConvFwd:1969.8,0,miopenConvolutionFwdAlgoDirect
96-3-1650-1250-3x3x3-96-1-1648-1248-1-0x0x0-1x1x1-1x1x1-0-NCDHW-FP32-F=ConvHipImplicitGemm3DGroupFwdXdlops:17.6947,3166769664,miopenConvolutionFwdAlgoImplicitGEMM;ConvDirectNaiveConvFwd:4679.01,0,miopenConvolutionFwdAlgoDirect
96-6-1106-834-3x3x3-96-4-1104-832-1-0x0x0-1x1x1-1x1x1-0-NCDHW-FP32-F=ConvHipImplicitGemm3DGroupFwdXdlops:29.1482,3537073152,miopenConvolutionFwdAlgoImplicitGEMM;ConvDirectNaiveConvFwd:7785.92,0,miopenConvolutionFwdAlgoDirect
96-6-554-418-3x3x3-192-4-552-416-1-0x0x0-1x1x1-1x1x1-0-NCDHW-FP32-F=ConvHipImplicitGemm3DGroupFwdXdlops:10.8984,1240962048,miopenConvolutionFwdAlgoImplicitGEMM;GemmFwdRest:23.3874,9523298304,miopenConvolutionFwdAlgoGEMM;ConvDirectNaiveConvFwd:1921.88,0,miopenConvolutionFwdAlgoDirect
96-6-818-626-3x3x3-96-4-816-624-1-0x0x0-1x1x1-1x1x1-0-NCDHW-FP32-F=ConvHipImplicitGemm3DGroupFwdXdlops:16.4598,1962906624,miopenConvolutionFwdAlgoImplicitGEMM;ConvDirectNaiveConvFwd:4294.56,0,miopenConvolutionFwdAlgoDirect
96-1105-833-3x3-96-552-416-1-0x0-2x2-1x1-0-NCHW-FP32-F=ConvBinWinogradRxSf2x3g1:1.70871,0,miopenConvolutionFwdAlgoWinograd;ConvBinWinogradRxSf3x2:0.842394,0,miopenConvolutionFwdAlgoWinograd;ConvHipImplicitGemmGroupFwdXdlops:0.930159,441969152,miopenConvolutionFwdAlgoImplicitGEMM;ConvAsmImplicitGemmGTCDynamicFwdXdlopsNHWC:0.880233,441969152,miopenConvolutionFwdAlgoImplicitGEMM;GemmFwdRest:1.02918,793608192,miopenConvolutionFwdAlgoGEMM;ConvDirectNaiveConvFwd:173.584,0,miopenConvolutionFwdAlgoDirect
96-1649-1249-3x3-96-824-624-1-0x0-2x2-1x1-0-NCHW-FP32-F=ConvBinWinogradRxSf2x3g1:3.74661,0,miopenConvolutionFwdAlgoWinograd;ConvBinWinogradRxSf3x2:1.92488,0,miopenConvolutionFwdAlgoWinograd;ConvHipImplicitGemmGroupFwdXdlops:2.04999,988662272,miopenConvolutionFwdAlgoImplicitGEMM;ConvAsmImplicitGemmGTCDynamicFwdXdlopsNHWC:1.98948,988662272,miopenConvolutionFwdAlgoImplicitGEMM;GemmFwdRest:2.30678,1776992256,miopenConvolutionFwdAlgoGEMM;ConvDirectNaiveConvFwd:387.903,0,miopenConvolutionFwdAlgoDirect
96-817-625-3x3-96-408-312-1-0x0-2x2-1x1-0-NCHW-FP32-F=ConvBinWinogradRxSf2x3g1:0.942986,0,miopenConvolutionFwdAlgoWinograd;ConvBinWinogradRxSf3x2:0.463778,0,miopenConvolutionFwdAlgoWinograd;ConvHipImplicitGemmGroupFwdXdlops:0.562347,245293568,miopenConvolutionFwdAlgoImplicitGEMM;ConvAsmImplicitGemmGTCDynamicFwdXdlopsNHWC:0.516463,245293568,miopenConvolutionFwdAlgoImplicitGEMM;GemmFwdRest:0.601785,439934976,miopenConvolutionFwdAlgoGEMM;ConvDirectNaiveConvFwd:87.8128,0,miopenConvolutionFwdAlgoDirect
384-276-208-3x3-192-276-208-2-1x1-1x1-1x1-0-NCHW-FP32-F=ConvBinWinogradRxSf2x3g1:1.59114,0,miopenConvolutionFwdAlgoWinograd;ConvBinWinogradRxSf3x2:2.62872,0,miopenConvolutionFwdAlgoWinograd;ConvHipImplicitGemmGroupFwdXdlops:1.84377,267190272,miopenConvolutionFwdAlgoImplicitGEMM;ConvAsmImplicitGemmGTCDynamicFwdXdlopsNHWC:1.88763,267190272,miopenConvolutionFwdAlgoImplicitGEMM;GemmFwdRest:2.81071,793608192,miopenConvolutionFwdAlgoGEMM;ConvDirectNaiveConvFwd:156.828,0,miopenConvolutionFwdAlgoDirect
192-1648-1248-3x3-96-1648-1248-4-1x1-1x1-1x1-0-NCHW-FP32-F=ConvBinWinogradRxSf2x3g1:34.3758,0,miopenConvolutionFwdAlgoWinograd;ConvBinWinogradRxSf3x2:51.1424,0,miopenConvolutionFwdAlgoWinograd;ConvHipImplicitGemmGroupFwdXdlops:45.7748,9477955584,miopenConvolutionFwdAlgoImplicitGEMM;ConvAsmImplicitGemmGTCDynamicFwdXdlopsNHWC:43.769,9477955584,miopenConvolutionFwdAlgoImplicitGEMM;GemmFwdRest:63.3433,14215938048,miopenConvolutionFwdAlgoGEMM;ConvDirectNaiveConvFwd:3846.23,0,miopenConvolutionFwdAlgoDirect
192-4-414-314-3x3x3-384-2-412-312-1-0x0x0-1x1x1-1x1x1-0-NCDHW-BF16-F=ConvHipImplicitGemm3DGroupFwdXdlops:2.58822,401098752,miopenConvolutionFwdAlgoImplicitGEMM;GemmFwdRest:8.67731,2665488384,miopenConvolutionFwdAlgoGEMM;ConvDirectNaiveConvFwd:991.982,0,miopenConvolutionFwdAlgoDirect
192-6-554-418-3x3x3-192-4-552-416-1-0x0x0-1x1x1-1x1x1-0-NCDHW-BF16-F=ConvHipImplicitGemm3DGroupFwdXdlops:5.90566,888247296,miopenConvolutionFwdAlgoImplicitGEMM;ConvDirectNaiveConvFwd:3623.62,0,miopenConvolutionFwdAlgoDirect
192-409-313-3x3-192-204-156-1-0x0-2x2-1x1-0-NCHW-BF16-F=ConvHipImplicitGemmGroupFwdXdlops:0.161378,62042624,miopenConvolutionFwdAlgoImplicitGEMM;ConvAsmImplicitGemmGTCDynamicFwdXdlopsNHWC:0.148566,86483456,miopenConvolutionFwdAlgoImplicitGEMM;GemmFwdRest:0.193615,109983744,miopenConvolutionFwdAlgoGEMM;ConvDirectNaiveConvFwd:46.709,0,miopenConvolutionFwdAlgoDirect
192-816-624-3x3-96-816-624-1-1x1-1x1-1x1-0-NCHW-BF16-F=ConvHipImplicitGemmGroupFwdXdlops:0.846655,293621760,miopenConvolutionFwdAlgoImplicitGEMM;ConvAsmImplicitGemmGTCDynamicFwdXdlopsNHWC:0.851608,489148416,miopenConvolutionFwdAlgoImplicitGEMM;GemmFwdRest:2.17175,1759739904,miopenConvolutionFwdAlgoGEMM;ConvDirectNaiveConvFwd:674.513,0,miopenConvolutionFwdAlgoDirect
3-3-1650-1250-3x3x3-96-1-1648-1248-1-0x0x0-1x1x1-1x1x1-0-NCDHW-BF16-F=ConvHipImplicitGemm3DGroupFwdXdlops:1.14472,432027904,miopenConvolutionFwdAlgoImplicitGEMM;GemmFwdRest:1.66388,333186048,miopenConvolutionFwdAlgoGEMM;ConvDirectNaiveConvFwd:129.568,0,miopenConvolutionFwdAlgoDirect
3-6-1650-1250-3x3x3-96-4-1648-1248-1-0x0x0-1x1x1-1x1x1-0-NCDHW-BF16-F=ConvHipImplicitGemm3DGroupFwdXdlops:4.64153,1653814528,miopenConvolutionFwdAlgoImplicitGEMM;GemmFwdRest:6.64025,1332744192,miopenConvolutionFwdAlgoGEMM;ConvDirectNaiveConvFwd:514.425,0,miopenConvolutionFwdAlgoDirect
36-21-206-156-1x2x2-5120-21-103-78-1-0x0x0-1x2x2-1x1x1-0-NCDHW-BF16-F=ConvHipImplicitGemm3DGroupFwdXdlops:5.74562,1777695744,miopenConvolutionFwdAlgoImplicitGEMM;GemmFwdRest:1.59819,48589632,miopenConvolutionFwdAlgoGEMM;ConvDirectNaiveConvFwd:118.686,0,miopenConvolutionFwdAlgoDirect
384-3-206-156-3x1x1-768-1-206-156-1-0x0x0-1x1x1-1x1x1-0-NCDHW-BF16-F=ConvHipImplicitGemm3DGroupFwdXdlops:0.313452,125171712,miopenConvolutionFwdAlgoImplicitGEMM;GemmFwdRest:0.315206,74041344,miopenConvolutionFwdAlgoGEMM;ConvDirectNaiveConvFwd:66.055,0,miopenConvolutionFwdAlgoDirect
384-3-278-210-3x3x3-384-1-276-208-1-0x0x0-1x1x1-1x1x1-0-NCDHW-BF16-F=ConvHipImplicitGemm3DGroupFwdXdlops:1.18859,186559488,miopenConvolutionFwdAlgoImplicitGEMM;GemmFwdRest:3.80392,1190412288,miopenConvolutionFwdAlgoGEMM;ConvDirectNaiveConvFwd:441.704,0,miopenConvolutionFwdAlgoDirect
384-4-276-208-3x1x1-768-2-276-208-1-0x0x0-1x1x1-1x1x1-0-NCDHW-BF16-F=ConvHipImplicitGemm3DGroupFwdXdlops:0.90692,354484224,miopenConvolutionFwdAlgoImplicitGEMM;GemmFwdRest:1.04489,264536064,miopenConvolutionFwdAlgoGEMM;ConvDirectNaiveConvFwd:241.859,0,miopenConvolutionFwdAlgoDirect
384-4-414-314-3x3x3-384-2-412-312-1-0x0x0-1x1x1-1x1x1-0-NCDHW-BF16-F=ConvHipImplicitGemm3DGroupFwdXdlops:5.07812,604753920,miopenConvolutionFwdAlgoImplicitGEMM;GemmFwdRest:17.2551,5330976768,miopenConvolutionFwdAlgoGEMM;ConvDirectNaiveConvFwd:2121.62,0,miopenConvolutionFwdAlgoDirect
384-413-313-3x3-384-206-156-1-0x0-2x2-1x1-0-NCHW-BF16-F=ConvHipImplicitGemmGroupFwdXdlops:0.384495,126613248,miopenConvolutionFwdAlgoImplicitGEMM;ConvAsmImplicitGemmGTCDynamicFwdXdlopsNHWC:0.431466,175974144,miopenConvolutionFwdAlgoImplicitGEMM;GemmFwdRest:0.454471,222124032,miopenConvolutionFwdAlgoGEMM;ConvDirectNaiveConvFwd:94.4054,0,miopenConvolutionFwdAlgoDirect
96-1-552-416-1x1x1-192-1-552-416-1-0x0x0-1x1x1-1x1x1-0-NCDHW-BF16-F=ConvHipImplicitGemm3DGroupFwdXdlops:0.207595,132304896,miopenConvolutionFwdAlgoImplicitGEMM;GemmFwd1x1_0_1:0.123961,0,miopenConvolutionFwdAlgoGEMM;ConvDirectNaiveConvFwd:43.0319,0,miopenConvolutionFwdAlgoDirect
96-3-1106-834-3x3x3-3-1-1104-832-1-0x0x0-1x1x1-1x1x1-0-NCDHW-BF16-F=ConvHipImplicitGemm3DGroupFwdXdlops:1.33183,536831488,miopenConvolutionFwdAlgoImplicitGEMM;GemmFwdRest:11.9747,4761649152,miopenConvolutionFwdAlgoGEMM;ConvDirectNaiveConvFwd:1872.48,0,miopenConvolutionFwdAlgoDirect
96-3-410-314-3x3x3-192-1-408-312-1-0x0x0-1x1x1-1x1x1-0-NCDHW-BF16-F=ConvHipImplicitGemm3DGroupFwdXdlops:0.539685,124031232,miopenConvolutionFwdAlgoImplicitGEMM;GemmFwdRest:1.68779,659902464,miopenConvolutionFwdAlgoGEMM;ConvDirectNaiveConvFwd:237.488,0,miopenConvolutionFwdAlgoDirect
96-3-818-626-3x3x3-3-1-816-624-1-0x0x0-1x1x1-1x1x1-0-NCDHW-BF16-F=ConvHipImplicitGemm3DGroupFwdXdlops:0.759754,298021888,miopenConvolutionFwdAlgoImplicitGEMM;GemmFwdRest:6.91975,2639609856,miopenConvolutionFwdAlgoGEMM;ConvDirectNaiveConvFwd:1029.51,0,miopenConvolutionFwdAlgoDirect
96-3-826-626-3x3x3-192-1-824-624-1-0x0x0-1x1x1-1x1x1-0-NCDHW-BF16-F=ConvHipImplicitGemm3DGroupFwdXdlops:1.95679,496274688,miopenConvolutionFwdAlgoImplicitGEMM;GemmFwdRest:7.39247,2665488384,miopenConvolutionFwdAlgoGEMM;ConvDirectNaiveConvFwd:1028.06,0,miopenConvolutionFwdAlgoDirect
96-4-824-624-1x1x1-192-4-824-624-1-0x0x0-1x1x1-1x1x1-0-NCDHW-BF16-F=ConvHipImplicitGemm3DGroupFwdXdlops:2.06826,1184698368,miopenConvolutionFwdAlgoImplicitGEMM;GemmFwd1x1_0_1:1.16134,0,miopenConvolutionFwdAlgoGEMM;ConvDirectNaiveConvFwd:470.957,0,miopenConvolutionFwdAlgoDirect
96-6-1650-1250-3x3x3-96-4-1648-1248-1-0x0x0-1x1x1-1x1x1-0-NCDHW-BF16-F=ConvHipImplicitGemm3DGroupFwdXdlops:17.906,3956046336,miopenConvolutionFwdAlgoImplicitGEMM;ConvDirectNaiveConvFwd:16585.6,0,miopenConvolutionFwdAlgoDirect
192-409-313-3x3-192-204-156-4-0x0-2x2-1x1-0-NCHW-BF16-F=ConvHipImplicitGemmGroupFwdXdlops:0.576233,246179328,miopenConvolutionFwdAlgoImplicitGEMM;ConvAsmImplicitGemmGTCDynamicFwdXdlopsNHWC:0.564402,343942656,miopenConvolutionFwdAlgoImplicitGEMM;GemmFwdRest:0.757771,109983744,miopenConvolutionFwdAlgoGEMM;ConvDirectNaiveConvFwd:48.6933,0,miopenConvolutionFwdAlgoDirect
192-816-624-3x3-96-816-624-4-1x1-1x1-1x1-0-NCHW-BF16-F=ConvHipImplicitGemmGroupFwdXdlops:3.46585,1173491712,miopenConvolutionFwdAlgoImplicitGEMM;ConvAsmImplicitGemmGTCDynamicFwdXdlopsNHWC:3.43561,1955598336,miopenConvolutionFwdAlgoImplicitGEMM;GemmFwdRest:8.77973,1759739904,miopenConvolutionFwdAlgoGEMM;ConvDirectNaiveConvFwd:768.451,0,miopenConvolutionFwdAlgoDirect
384-552-416-3x3-192-552-416-4-1x1-1x1-1x1-0-NCHW-BF16-F=ConvHipImplicitGemmGroupFwdXdlops:4.49909,1059471360,miopenConvolutionFwdAlgoImplicitGEMM;ConvAsmImplicitGemmGTCDynamicFwdXdlopsNHWC:4.26039,1764900864,miopenConvolutionFwdAlgoImplicitGEMM;GemmFwdRest:6.47589,1587216384,miopenConvolutionFwdAlgoGEMM;ConvDirectNaiveConvFwd:874.593,0,miopenConvolutionFwdAlgoDirect
96-817-625-3x3-96-408-312-4-0x0-2x2-1x1-0-NCHW-BF16-F=ConvHipImplicitGemmGroupFwdXdlops:0.898997,490089216,miopenConvolutionFwdAlgoImplicitGEMM;ConvAsmImplicitGemmGTCDynamicFwdXdlopsNHWC:0.880519,685615872,miopenConvolutionFwdAlgoImplicitGEMM;GemmFwdRest:1.27147,219967488,miopenConvolutionFwdAlgoGEMM;ConvDirectNaiveConvFwd:99.6508,0,miopenConvolutionFwdAlgoDirect
128-11-130-194-3x3x3-3-9-128-192-1-0x0x0-1x1x1-1x1x1-0-NCDHW-FP16-F=ConvHipImplicitGemm3DGroupFwdXdlops:2.09197,72367360,miopenConvolutionFwdAlgoImplicitGEMM;GemmFwdRest:3.63645,1528823808,miopenConvolutionFwdAlgoGEMM;ConvDirectNaiveConvFwd:643.882,0,miopenConvolutionFwdAlgoDirect
128-11-146-130-3x3x3-3-9-144-128-1-0x0x0-1x1x1-1x1x1-0-NCDHW-FP16-F=ConvHipImplicitGemm3DGroupFwdXdlops:1.24443,54463744,miopenConvolutionFwdAlgoImplicitGEMM;GemmFwdRest:2.80261,1146617856,miopenConvolutionFwdAlgoGEMM;ConvDirectNaiveConvFwd:482.827,0,miopenConvolutionFwdAlgoDirect
128-11-162-194-3x3x3-3-9-160-192-1-0x0x0-1x1x1-1x1x1-0-NCDHW-FP16-F=ConvHipImplicitGemm3DGroupFwdXdlops:0.518785,90180864,miopenConvolutionFwdAlgoImplicitGEMM;GemmFwdRest:4.78557,1911029760,miopenConvolutionFwdAlgoGEMM;ConvDirectNaiveConvFwd:800.997,0,miopenConvolutionFwdAlgoDirect
128-11-258-194-3x3x3-3-9-256-192-1-0x0x0-1x1x1-1x1x1-0-NCDHW-FP16-F=ConvHipImplicitGemm3DGroupFwdXdlops:3.6617,143621376,miopenConvolutionFwdAlgoImplicitGEMM;GemmFwdRest:7.56439,3057647616,miopenConvolutionFwdAlgoGEMM;ConvDirectNaiveConvFwd:1282.18,0,miopenConvolutionFwdAlgoDirect
128-19-146-130-3x3x3-128-17-144-128-1-0x0x0-1x1x1-1x1x1-0-NCDHW-FP16-F=ConvHipImplicitGemm3DGroupFwdXdlops:0.946819,173419520,miopenConvolutionFwdAlgoImplicitGEMM;GemmFwdRest:5.66178,2165833728,miopenConvolutionFwdAlgoGEMM;ConvDirectNaiveConvFwd:890.265,0,miopenConvolutionFwdAlgoDirect
128-19-258-130-3x3x3-3-17-256-128-1-0x0x0-1x1x1-1x1x1-0-NCDHW-FP16-F=ConvHipImplicitGemm3DGroupFwdXdlops:1.04472,166501632,miopenConvolutionFwdAlgoImplicitGEMM;GemmFwdRest:9.70752,3850371072,miopenConvolutionFwdAlgoGEMM;ConvDirectNaiveConvFwd:1617.06,0,miopenConvolutionFwdAlgoDirect
16-3-18-32-1x1x1-16-3-18-32-1-0x0x0-1x1x1-1x1x1-0-NCDHW-FP16-F=ConvHipImplicitGemm3DGroupFwdXdlops:0.0235145,111104,miopenConvolutionFwdAlgoImplicitGEMM;GemmFwd1x1_0_1:0.0084604,0,miopenConvolutionFwdAlgoGEMM;ConvDirectNaiveConvFwd:0.0485123,0,miopenConvolutionFwdAlgoDirect
16-3-32-24-1x1x1-16-3-32-24-1-0x0x0-1x1x1-1x1x1-0-NCDHW-FP16-F=ConvHipImplicitGemm3DGroupFwdXdlops:0.023386,147968,miopenConvolutionFwdAlgoImplicitGEMM;GemmFwd1x1_0_1:0.0081562,0,miopenConvolutionFwdAlgoGEMM;ConvDirectNaiveConvFwd:0.0614252,0,miopenConvolutionFwdAlgoDirect
16-5-18-16-1x1x1-16-5-18-16-1-0x0x0-1x1x1-1x1x1-0-NCDHW-FP16-F=ConvHipImplicitGemm3DGroupFwdXdlops:0.0234346,92672,miopenConvolutionFwdAlgoImplicitGEMM;GemmFwd1x1_0_1:0.00794,0,miopenConvolutionFwdAlgoGEMM;ConvDirectNaiveConvFwd:0.0418341,0,miopenConvolutionFwdAlgoDirect
16-5-20-18-3x3x3-512-3-18-16-1-0x0x0-1x1x1-1x1x1-0-NCDHW-FP16-F=ConvHipImplicitGemm3DGroupFwdXdlops:0.0270408,1384704,miopenConvolutionFwdAlgoImplicitGEMM;GemmFwdRest:0.0251847,746496,miopenConvolutionFwdAlgoGEMM;ConvDirectNaiveConvFwd:0.319957,0,miopenConvolutionFwdAlgoDirect
16-5-22-26-3x3x3-512-3-20-24-1-0x0x0-1x1x1-1x1x1-0-NCDHW-FP16-F=ConvHipImplicitGemm3DGroupFwdXdlops:0.0306218,2008576,miopenConvolutionFwdAlgoImplicitGEMM;GemmFwdRest:0.0409143,1244160,miopenConvolutionFwdAlgoGEMM;ConvDirectNaiveConvFwd:0.483956,0,miopenConvolutionFwdAlgoDirect
16-5-32-32-1x1x1-16-5-32-32-1-0x0x0-1x1x1-1x1x1-0-NCDHW-FP16-F=ConvHipImplicitGemm3DGroupFwdXdlops:0.0234622,328192,miopenConvolutionFwdAlgoImplicitGEMM;GemmFwd1x1_0_1:0.0082522,0,miopenConvolutionFwdAlgoGEMM;ConvDirectNaiveConvFwd:0.134007,0,miopenConvolutionFwdAlgoDirect
16-7-18-34-3x3x3-512-5-16-32-1-0x0x0-1x1x1-1x1x1-0-NCDHW-FP16-F=ConvHipImplicitGemm3DGroupFwdXdlops:0.0378635,3201024,miopenConvolutionFwdAlgoImplicitGEMM;GemmFwdRest:0.034836,2211840,miopenConvolutionFwdAlgoGEMM;ConvDirectNaiveConvFwd:0.812825,0,miopenConvolutionFwdAlgoDirect
16-7-22-34-3x3x3-512-5-20-32-1-0x0x0-1x1x1-1x1x1-0-NCDHW-FP16-F=ConvHipImplicitGemm3DGroupFwdXdlops:0.0411007,3886848,miopenConvolutionFwdAlgoImplicitGEMM;GemmFwdRest:0.045428,2764800,miopenConvolutionFwdAlgoGEMM;ConvDirectNaiveConvFwd:1.05461,0,miopenConvolutionFwdAlgoDirect
256-11-130-130-3x3x3-256-9-128-128-1-0x0x0-1x1x1-1x1x1-0-NCDHW-FP16-F=ConvHipImplicitGemm3DGroupFwdXdlops:1.30146,174217216,miopenConvolutionFwdAlgoImplicitGEMM;GemmFwdRest:5.58127,2038431744,miopenConvolutionFwdAlgoGEMM;ConvDirectNaiveConvFwd:833.492,0,miopenConvolutionFwdAlgoDirect
256-11-130-98-3x3x3-256-9-128-96-1-0x0x0-1x1x1-1x1x1-0-NCDHW-FP16-F=ConvHipImplicitGemm3DGroupFwdXdlops:1.07729,131913728,miopenConvolutionFwdAlgoImplicitGEMM;GemmFwdRest:3.98983,1528823808,miopenConvolutionFwdAlgoGEMM;ConvDirectNaiveConvFwd:639.484,0,miopenConvolutionFwdAlgoDirect
256-11-162-194-3x3x3-256-9-160-192-1-0x0x0-1x1x1-1x1x1-0-NCDHW-FP16-F=ConvHipImplicitGemm3DGroupFwdXdlops:2.69117,322099200,miopenConvolutionFwdAlgoImplicitGEMM;GemmFwdRest:10.7032,3822059520,miopenConvolutionFwdAlgoGEMM;ConvDirectNaiveConvFwd:1565.54,0,miopenConvolutionFwdAlgoDirect
256-11-258-258-3x3x3-128-9-256-256-1-0x0x0-1x1x1-1x1x1-0-NCDHW-FP16-F=ConvHipImplicitGemm3DGroupFwdXdlops:3.29782,527652864,miopenConvolutionFwdAlgoImplicitGEMM;ConvDirectNaiveConvFwd:3240.22,0,miopenConvolutionFwdAlgoDirect
256-19-146-130-3x3x3-256-17-144-128-1-0x0x0-1x1x1-1x1x1-0-NCDHW-FP16-F=ConvHipImplicitGemm3DGroupFwdXdlops:3.06968,348608512,miopenConvolutionFwdAlgoImplicitGEMM;GemmFwdRest:12.1536,4331667456,miopenConvolutionFwdAlgoGEMM;ConvDirectNaiveConvFwd:1772.84,0,miopenConvolutionFwdAlgoDirect
256-19-162-258-3x3x3-128-17-160-256-1-0x0x0-1x1x1-1x1x1-0-NCDHW-FP16-F=ConvHipImplicitGemm3DGroupFwdXdlops:3.63805,586618880,miopenConvolutionFwdAlgoImplicitGEMM;ConvDirectNaiveConvFwd:3822.2,0,miopenConvolutionFwdAlgoDirect
256-7-130-130-3x3x3-256-5-128-128-1-0x0x0-1x1x1-1x1x1-0-NCDHW-FP16-F=ConvHipImplicitGemm3DGroupFwdXdlops:1.12164,106051584,miopenConvolutionFwdAlgoImplicitGEMM;GemmFwdRest:3.40533,1132462080,miopenConvolutionFwdAlgoGEMM;ConvDirectNaiveConvFwd:464.016,0,miopenConvolutionFwdAlgoDirect
256-7-74-130-3x3x3-256-5-72-128-1-0x0x0-1x1x1-1x1x1-0-NCDHW-FP16-F=ConvHipImplicitGemm3DGroupFwdXdlops:0.550206,61609984,miopenConvolutionFwdAlgoImplicitGEMM;GemmFwdRest:1.88364,637009920,miopenConvolutionFwdAlgoGEMM;ConvDirectNaiveConvFwd:260.442,0,miopenConvolutionFwdAlgoDirect
256-9-128-256-1x1x1-128-9-128-256-1-0x0x0-1x1x1-1x1x1-0-NCDHW-FP16-F=ConvHipImplicitGemm3DGroupFwdXdlops:0.363589,226557952,miopenConvolutionFwdAlgoImplicitGEMM;GemmFwd1x1_0_1:0.160455,0,miopenConvolutionFwdAlgoGEMM;ConvDirectNaiveConvFwd:149.83,0,miopenConvolutionFwdAlgoDirect
256-9-256-128-1x1x1-128-9-256-128-1-0x0x0-1x1x1-1x1x1-0-NCDHW-FP16-F=ConvHipImplicitGemm3DGroupFwdXdlops:0.365609,226557952,miopenConvolutionFwdAlgoImplicitGEMM;GemmFwd1x1_0_1:0.159045,0,miopenConvolutionFwdAlgoGEMM;ConvDirectNaiveConvFwd:149.763,0,miopenConvolutionFwdAlgoDirect
3-224-224-14x14-1280-16-16-1-0x0-14x14-1x1-0-NCHW-FP16-F=ConvHipImplicitGemmGroupFwdXdlops:0.0824996,2461696,miopenConvolutionFwdAlgoImplicitGEMM;ConvAsmImplicitGemmGTCDynamicFwdXdlopsNHWC:0.042003,3772416,miopenConvolutionFwdAlgoImplicitGEMM;GemmFwdRest:0.0439774,301056,miopenConvolutionFwdAlgoGEMM;ConvDirectNaiveConvFwd:0.127724,0,miopenConvolutionFwdAlgoDirect
512-11-130-130-3x3x3-512-9-128-128-1-0x0x0-1x1x1-1x1x1-0-NCDHW-FP16-F=ConvHipImplicitGemm3DGroupFwdXdlops:5.34772,355512320,miopenConvolutionFwdAlgoImplicitGEMM;GemmFwdRest:13.2298,4076863488,miopenConvolutionFwdAlgoGEMM;ConvDirectNaiveConvFwd:1704.05,0,miopenConvolutionFwdAlgoDirect
512-11-66-98-3x3x3-512-9-64-96-1-0x0x0-1x1x1-1x1x1-0-NCDHW-FP16-F=ConvHipImplicitGemm3DGroupFwdXdlops:2.03506,143634432,miopenConvolutionFwdAlgoImplicitGEMM;GemmFwdRest:5.56397,1528823808,miopenConvolutionFwdAlgoGEMM;ConvDirectNaiveConvFwd:674.84,0,miopenConvolutionFwdAlgoDirect
512-11-82-130-3x3x3-512-9-80-128-1-0x0x0-1x1x1-1x1x1-0-NCDHW-FP16-F=ConvHipImplicitGemm3DGroupFwdXdlops:3.34703,228601856,miopenConvolutionFwdAlgoImplicitGEMM;GemmFwdRest:9.68308,2548039680,miopenConvolutionFwdAlgoGEMM;ConvDirectNaiveConvFwd:1074.57,0,miopenConvolutionFwdAlgoDirect
512-7-130-130-3x3x3-256-5-128-128-1-0x0x0-1x1x1-1x1x1-0-NCDHW-FP16-F=ConvHipImplicitGemm3DGroupFwdXdlops:1.75851,170160128,miopenConvolutionFwdAlgoImplicitGEMM;GemmFwdRest:7.00926,2264924160,miopenConvolutionFwdAlgoGEMM;ConvDirectNaiveConvFwd:934.801,0,miopenConvolutionFwdAlgoDirect
512-7-66-130-3x3x3-512-5-64-128-1-0x0x0-1x1x1-1x1x1-0-NCDHW-FP16-F=ConvHipImplicitGemm3DGroupFwdXdlops:1.73053,117600256,miopenConvolutionFwdAlgoImplicitGEMM;GemmFwdRest:4.08388,1132462080,miopenConvolutionFwdAlgoGEMM;ConvDirectNaiveConvFwd:470.378,0,miopenConvolutionFwdAlgoDirect
512-7-82-130-3x3x3-512-5-80-128-1-0x0x0-1x1x1-1x1x1-0-NCDHW-FP16-F=ConvHipImplicitGemm3DGroupFwdXdlops:2.12049,142995456,miopenConvolutionFwdAlgoImplicitGEMM;GemmFwdRest:5.1728,1415577600,miopenConvolutionFwdAlgoGEMM;ConvDirectNaiveConvFwd:599.545,0,miopenConvolutionFwdAlgoDirect
